,headline,description,url,byline,premium,image_url,article type
0,The Trump administration seeks to turn the government  shutdown against the Democrats,no description,https://www.lemonde.fr/en/international/article/2025/10/19/the-trump-administration-seeks-to-turn-the-government-shutdown-against-the-democrats_6746581_4.html,,True,,
1,"Tommy Robinson, a racist hooligan turned mass mobilizer",no description,https://www.lemonde.fr/en/international/article/2025/10/19/tommy-robinson-a-racist-hooligan-turned-mass-mobilizer_6746571_4.html,,True,,
2,Moscow's mix of relief and renewed charm toward Washington,no description,https://www.lemonde.fr/en/international/article/2025/10/19/moscow-s-mix-of-relief-and-renewed-charm-toward-washington_6746570_4.html,,True,,
3,Joyful and massive 'No Kings' protests against Trump reveal a sense of powerlessness,no description,https://www.lemonde.fr/en/international/article/2025/10/19/joyful-and-massive-no-kings-protests-against-trump-reveal-a-sense-of-powerlessness_6746569_4.html,,True,,
4,Sanctions against Russia spark rift between US and Europe over China,no description,https://www.lemonde.fr/en/international/article/2025/09/15/sanctions-against-russia-spark-rift-between-us-and-europe-over-china_6745411_4.html,,True,,
5,France's political instability puts Franco-German alliance to the test,no description,https://www.lemonde.fr/en/opinion/article/2025/08/30/france-s-political-instability-puts-franco-german-alliance-to-the-test_6744873_23.html,,False,,
6,France faces prospect of paying higher borrowing costs than Italy,no description,https://www.lemonde.fr/en/economy/article/2025/08/19/france-faces-prospect-of-paying-higher-borrowing-costs-than-italy_6744519_19.html,,True,,
7,French man arrested in Slovenia for crimes committed in Croatia during 1991 war,no description,https://www.lemonde.fr/en/international/article/2025/08/06/french-man-arrested-in-slovenia-for-crimes-committed-in-croatia-during-1991-war_6744113_4.html,,True,,
8,Louvre closes after thieves steal 'priceless' jewels in daytime heist,no description,https://www.lemonde.fr/en/france/article/2025/10/19/louvre-closed-for-the-day-after-a-robbery-according-to-culture-minister_6746572_7.html,,False,,
9,"At Cédric Jubillar's trial, the court and jury stand firm",no description,https://www.lemonde.fr/en/france/article/2025/10/18/at-cedric-jubillar-s-trial-the-court-and-jury-stand-firm_6746559_7.html,,True,,
10,Woman on trial in Paris over murder of 12-year-old girl,no description,https://www.lemonde.fr/en/france/article/2025/10/17/woman-on-trial-in-paris-for-murdering-12-year-old-girl_6746523_7.html,,True,,
11,Cédric Jubillar's defense delivers remarkable closing argument,no description,https://www.lemonde.fr/en/france/article/2025/10/17/cedric-jubillar-s-defense-delivers-remarkable-closing-argument_6746517_7.html,,True,,
12,Afghanistan: Relentless repression continues over four years into Taliban's rule,no description,https://www.lemonde.fr/en/videos/video/2025/10/04/afghanistan-relentless-repression-continues-over-four-years-into-taliban-s-rule_6746092_108.html,,False,,
13,Watch: Hundreds of thousands march in France against budget cuts,no description,https://www.lemonde.fr/en/videos/video/2025/09/19/french-strikes-watch-what-happened-as-hundreds-of-thousands-marched-against-budget-cuts_6745548_108.html,,False,,
14,Emmys 2025: 'Adolescence' star Owen Cooper becomes youngest winner for best supporting actor,no description,https://www.lemonde.fr/en/videos/video/2025/09/15/emmys-2025-adolescence-star-owen-cooper-becomes-youngest-winner-for-best-supporting-actor_6745427_108.html,,False,,
15,"From 'influence peddling' to 'corruption,' what is French Culture Minister Rachida Dati accused of?",no description,https://www.lemonde.fr/en/videos/video/2025/09/06/from-influence-peddling-to-corruption-what-is-french-culture-minister-rachida-dati-accused-of_6745094_108.html,,False,,
16,Five scenarios for the future of Israel and Palestine,no description,https://www.lemonde.fr/en/opinion/article/2025/10/19/five-scenarios-for-the-future-of-israel-and-palestine_6746567_23.html,,True,,
17,Abdel Latif Rachid: 'The al-Hol crisis is a global problem',no description,https://www.lemonde.fr/en/opinion/article/2025/10/19/abdel-latif-rachid-the-al-hol-crisis-is-a-global-problem_6746565_23.html,,True,,
18,Trump's exasperating inconsistency over the war in Ukraine,no description,https://www.lemonde.fr/en/opinion/article/2025/10/18/trump-s-exasperating-inconsistency-over-the-war-in-ukraine_6746556_23.html,,False,,
19,A historian's takeaways from Trump's Gaza summit in Egypt,no description,https://www.lemonde.fr/en/opinion/article/2025/10/17/a-historian-s-takeaways-from-trump-s-gaza-summit-in-egypt_6746532_23.html,,True,,
20,The wild Albanian island where the Trumps want to build a luxury hotel,no description,https://www.lemonde.fr/en/m-le-mag/article/2025/10/19/the-wild-albanian-island-where-the-trumps-want-bid-to-build-a-luxury-hotel_6746568_117.html,,True,,
21,"France's last military pigeons, custodians of a fading tradition",no description,https://www.lemonde.fr/en/m-le-mag/article/2025/10/17/france-s-last-military-pigeons-custodians-of-a-fading-tradition_6746510_117.html,,True,,
22,"Rabbi, drag queen and gay: Amichai Lau-Lavie, a Jewish trailblazer",no description,https://www.lemonde.fr/en/m-le-mag/article/2025/10/11/rabbi-drag-queen-and-gay-amichai-lau-lavie-a-jewish-trailblazer_6746337_117.html,,True,,
23,Matthieu Blazy: 'Just because Karl was a legend does not mean that everyone who designs for Chanel has to be one too',no description,https://www.lemonde.fr/en/m-le-mag/article/2025/10/08/chanel-s-new-face-matthieu-blazy-just-because-karl-was-a-legend-does-not-mean-that-everyone-who-designs-for-chanel-has-to-be-one-too_6746228_117.html,,True,,
24,"Jean-François Piège, guardian of Paris's bistro heritage",no description,https://www.lemonde.fr/en/lifestyle/article/2025/10/18/jean-francois-piege-guardian-of-paris-s-bistro-heritage_6746545_37.html,,True,,
25,Five places in and near Paris to savor choux à la crème,no description,https://www.lemonde.fr/en/lifestyle/article/2025/10/15/five-places-in-the-paris-region-to-savor-choux-a-la-creme_6746447_37.html,,True,,
26,"Berthe Weill at the Musée de l'Orangerie, the treasures of an eclectic gallerist",no description,https://www.lemonde.fr/en/culture/article/2025/10/14/the-treasures-of-berthe-weill-the-eclectic-gallerist-at-the-paris-musee-de-l-orangerie_6746402_30.html,,True,,
27,Five fun ways to discover Paris and its surroundings with your family,no description,https://www.lemonde.fr/en/intimacy/article/2025/10/02/five-fun-ways-to-discover-paris-and-its-surroundings-with-your-family_6745998_310.html,,True,,
28,The Trump administration seeks to turn the government  shutdown against the Democrats,"Of the $28 billion in funds frozen during the first 15 days of the federal government shutdown, $27 billion were tied to projects in districts governed by the opposition.",https://www.lemonde.fr/en/international/article/2025/10/19/the-trump-administration-seeks-to-turn-the-government-shutdown-against-the-democrats_6746581_4.html,,True,https://img.lemde.fr/2025/10/17/0/0/3883/2588/400/266/75/0/f363d8d_upload-1-nhatirw42ft1-274112.jpg,
29,Louvre closes after thieves steal 'priceless' jewels in daytime heist,no description,https://www.lemonde.fr/en/france/article/2025/10/19/louvre-closed-for-the-day-after-a-robbery-according-to-culture-minister_6746572_7.html,,False,https://img.lemde.fr/2025/10/19/0/0/3937/2624/398/265/75/0/6840502_ftp-import-images-1-oq01nczc5dwf-5207708-01-06.jpg,
30,Joyful and massive 'No Kings' protests against Trump reveal a sense of powerlessness,no description,https://www.lemonde.fr/en/international/article/2025/10/19/joyful-and-massive-no-kings-protests-against-trump-reveal-a-sense-of-powerlessness_6746569_4.html,,True,https://img.lemde.fr/2025/10/18/0/0/3900/2600/398/265/75/0/963b88f_ftp-import-images-1-og1hwvulovaw-5202805-01-06.jpg,
31,Moscow's mix of relief and renewed charm toward Washington,"Since Donald Trump and Vladimir Putin spoke by phone on Thursday and agreed to meet soon in Budapest, the prevailing sentiment has been that the White House is once again opening its doors to the Kremlin.",https://www.lemonde.fr/en/international/article/2025/10/19/moscow-s-mix-of-relief-and-renewed-charm-toward-washington_6746570_4.html,,True,https://img.lemde.fr/2025/10/17/0/0/6916/4610/398/265/75/0/c647110_ftp-import-images-1-1rjhfrofxhta-06d8d10b96dc449795407e8673af8411-0-e0658dca91b9403385ca383a3946ecff.jpg,
32,Colombia's president accuses US of violating sovereignty and committing 'murder',President Gustavo Petro condemned the killing of a Colombian fisherman during a US operation hailed by Donald Trump as a blow to 'narcoterrorists.',https://www.lemonde.fr/en/international/article/2025/10/19/colombia-s-president-accuses-us-of-violating-sovereignty-and-committing-murder_6746574_4.html,,False,https://img.lemde.fr/2025/10/15/0/34/3865/2577/398/265/75/0/bd7a86d_ftp-import-images-1-2gwqqd9nabhl-5176684-01-06.jpg,
33,Madagascar's coup leader Michael Randrianirina seeks legitimacy,"The head of the Capsat, the unit that overthrew Andry Rajoelina, was inaugurated as president on Friday and has reassured the international community that his country won't be sanctioned.",https://www.lemonde.fr/en/le-monde-africa/article/2025/10/19/madagascar-s-coup-leader-michael-randrianirina-seeks-legitimacy_6746579_124.html,,True,https://img.lemde.fr/2025/10/17/0/0/4000/2666/398/265/75/0/a84928b_ftp-import-images-1-q2lobpxawa5y-5188346-01-06.jpg,
34,"Zaho de Sagazan: 'Without others, without friendship, you can't achieve much'","'I wouldn't be where I am today if...' In this series, Le Monde interviews a personality about a decisive moment in their life. The singer-songwriter highlights the people who have shaped her journey and continue to support her.",https://www.lemonde.fr/en/culture/article/2025/10/19/zaho-de-sagazan-without-others-without-friendship-you-can-t-achieve-much_6746582_30.html,Vanessa Schneider,True,https://img.lemde.fr/2025/09/26/172/0/2625/1750/664/442/75/0/6ae9359_upload-1-jjxn85a2hfym-dea0231853.jpg,Interview
35,"Israel launches air strikes in Gaza, accusing Hamas of breaking ceasefire",no description,https://www.lemonde.fr/en/international/article/2025/10/19/israel-launches-air-strikes-in-gaza-accusing-hamas-of-breaking-ceasefire_6746580_4.html,,False,https://img.lemde.fr/2025/10/19/0/0/4392/2928/198/132/95/0/4a38ea6_ftp-import-images-1-2qitfwhmxrdg-5208103-01-06.jpg,
36,French parliament prepares for budget showdown like no other,no description,https://www.lemonde.fr/en/politics/article/2025/10/18/french-parliament-prepares-for-budget-showdown-like-no-other_6746547_5.html,,True,https://img.lemde.fr/2025/10/15/0/0/5899/3933/198/132/95/0/2b19c34_upload-1-1qje76fuz4xy-jmug251014161.jpg,
37,The shock of Palestinian prisoners returning to Gaza: 'They were relentless',no description,https://www.lemonde.fr/en/international/article/2025/10/17/they-were-relentless-the-shock-of-palestinian-prisoners-returning-to-gaza_6746537_4.html,,True,https://img.lemde.fr/2025/10/16/1/0/8192/5461/198/132/95/0/58cc71d_upload-1-fkbpcs0gthwg-089-mei-palestine-ar-rohiky-20251013-0061.jpg,
38,"Sofia Corradi, founder of the Erasmus program, passes away at 91",no description,https://www.lemonde.fr/en/obituaries/article/2025/10/19/sofia-corradi-founder-of-the-erasmus-program-passes-away-at-91_6746575_15.html,,False,https://img.lemde.fr/2025/10/19/64/0/768/512/198/132/95/0/e3397be_upload-1-ntaxqrftvzme-sofiacorradi-768x661.jpg,
39,Quebec's Saint Lawrence River hits record low amid drought,no description,https://www.lemonde.fr/en/environment/article/2025/10/18/quebec-s-saint-lawrence-river-hits-record-low-amid-drought_6746557_114.html,,True,,
40,S&P's downgrade of France's credit rating highlights growing political instability,no description,https://www.lemonde.fr/en/economy/article/2025/10/18/s-p-downgrade-of-france-s-credit-rating-highlights-growing-political-instability_6746553_19.html,,True,,
41,Northern Ireland finally reaps 'peace dividends',no description,https://www.lemonde.fr/en/economy/article/2025/10/19/northern-ireland-finally-reaps-peace-dividends_6746561_19.html,,True,,
42,George Santos released from prison after Trump commutes his sentence,no description,https://www.lemonde.fr/en/international/article/2025/10/18/george-santos-released-from-prison-after-trump-commutes-his-sentence_6746551_4.html,,False,,
43,Iran announces the official end of landmark nuclear program,no description,https://www.lemonde.fr/en/energies/article/2025/10/18/iran-announces-the-official-end-of-landmark-nuclear-program_6746554_98.html,,False,,
44,"In Romania, the war next door seeps into the Danube Delta",no description,https://www.lemonde.fr/en/international/article/2025/10/18/in-romania-the-war-next-door-seeps-into-the-danube-delta_6746558_4.html,,True,,
45,Pakistan and Afghanistan agree to 'immediate ceasefire',no description,https://www.lemonde.fr/en/international/article/2025/10/19/pakistan-and-afghanistan-agree-to-immediate-ceasefire_6746573_4.html,,False,,
46,"'Deaths of despair' on the rise among young adults in North America, as global life expectancy improves",no description,https://www.lemonde.fr/en/environment/article/2025/10/19/deaths-of-despair-on-the-rise-among-young-adults-in-north-america-as-global-life-expectancy-improves_6746562_114.html,,True,,
47,"Tommy Robinson, a racist hooligan turned mass mobilizer","'The new faces of the far right' (1/5). Stephen Yaxley-Lennon, known as Tommy Robinson, has seen his following surge in the UK since Elon Musk reinstated his X account. His ability to mobilize tens of thousands has placed him at the center of British politics.",https://www.lemonde.fr/en/international/article/2025/10/19/tommy-robinson-a-racist-hooligan-turned-mass-mobilizer_6746571_4.html,Cécile Ducourtieux,True,https://img.lemde.fr/2025/10/14/0/0/6192/4128/664/442/75/0/0388d82_upload-1-opkvrpjnjpew-262635.jpg,Profile
48,Gerhard Richter on display at the Fondation Louis Vuitton,"With 271 works − including rare loans − on display, this is the largest retrospective ever devoted to the German artist. It opens in Paris on October 17.",https://www.lemonde.fr/en/culture/article/2025/10/18/gerhard-richter-on-display-at-the-fondation-louis-vuitton_6746546_30.html,Harry Bellet,True,https://img.lemde.fr/2025/10/15/992/0/5898/3932/664/442/75/0/332a43f_upload-1-th4h6pupshnj-240258flv.jpg,Review
49,"Olivier Burtin, historian: 'Trump presents himself as war leader of a domestic conflict'","In an op-ed, the US specialist revisits the long history of far-right rhetoric about the 'enemy within.' According to Burtin, President Trump has turned this narrative into a genuine mode of governance, one capable of justifying authoritarian policies and increasing militarization, to the point of redefining American territory as a battlefield.",https://www.lemonde.fr/en/opinion/article/2025/10/17/olivier-burtin-historian-trump-presents-himself-as-war-leader-of-a-domestic-conflict-and-envisions-deploying-military-on-us-soil_6746505_23.html,Olivier Burtin,True,https://img.lemde.fr/2025/06/13/0/0/3000/2000/664/442/75/0/91aa791_upload-1-voro8yttjgp8-frame-1192.jpg,Op-Ed
50,Abdel Latif Rachid: 'The al-Hol crisis is a global problem',no description,https://www.lemonde.fr/en/opinion/article/2025/10/19/abdel-latif-rachid-the-al-hol-crisis-is-a-global-problem_6746565_23.html,Abdel Latif Jamal Rachid,,,Op-Ed
51,Trump's exasperating inconsistency over the war in Ukraine,no description,https://www.lemonde.fr/en/opinion/article/2025/10/18/trump-s-exasperating-inconsistency-over-the-war-in-ukraine_6746556_23.html,Le Monde,False,,Editorial
52,US aggressiveness against Venezuela is worrying,no description,https://www.lemonde.fr/en/opinion/article/2025/10/17/us-aggressiveness-against-venezuela-is-worrying_6746527_23.html,Le Monde,False,,Editorial
