,headline,description,url,byline,premium,image_url,article type
0,The American GBU-57 bomb is the only weapon capable of reaching Iran's Fordo nuclear site,no description,https://www.lemonde.fr/en/international/article/2025/06/20/the-american-gbu-57-bomb-is-the-only-weapon-capable-of-reaching-iran-s-fordo-nuclear-site_6742529_4.html,,False,,
1,Sweden sounds the alarm on loneliness,no description,https://www.lemonde.fr/en/international/article/2025/06/19/sweden-sounds-the-alarm-on-loneliness_6742520_4.html,,True,,
2,"At the heart of the Arctic, the 'Noah's Ark for plants' welcomes new seeds",no description,https://www.lemonde.fr/en/international/article/2025/06/19/at-the-heart-of-the-arctic-the-noah-s-ark-for-plants-welcomes-new-seeds_6742517_4.html,,True,,
3,"Despite the killing of top brass, Iran's military is still operational",no description,https://www.lemonde.fr/en/international/article/2025/06/19/israel-iran-despite-the-assassination-of-top-brass-tehran-s-military-is-still-operational_6742515_4.html,,True,,
4,EU lawmakers seek to end statute of limitations for child sex abuse cases,no description,https://www.lemonde.fr/en/europe/article/2025/06/17/eu-lawmakers-seek-to-end-statute-of-limitations-for-child-sex-abuse-cases_6742434_143.html,,False,,
5,"Criticism is mounting in the Netherlands against Geert Wilders, who brought down the government",no description,https://www.lemonde.fr/en/international/article/2025/06/04/in-the-netherlands-criticism-is-mounting-against-geert-wilders-who-triggered-the-fall-of-the-government_6741987_4.html,,True,,
6,"Five years after Brexit, UK and EU aim for a fresh start",no description,https://www.lemonde.fr/en/international/article/2025/05/19/five-years-after-brexit-uk-and-eu-aim-for-a-fresh-start_6741415_4.html,,True,,
7,"In Lithuania, the fear of war with Russia lurks just around the corner",no description,https://www.lemonde.fr/en/international/article/2025/05/18/in-lithuania-the-fear-of-war-with-russia-lurks-just-around-the-corner_6741400_4.html,,True,,
8,French police launch nationwide crackdown on undocumented migrants,no description,https://www.lemonde.fr/en/france/article/2025/06/20/french-police-launch-nationwide-crackdown-on-undocumented-migrants_6742532_7.html,,True,,
9,The dashed hopes of France's left-wing alliance,no description,https://www.lemonde.fr/en/france/article/2025/06/20/the-dashed-hopes-of-france-s-left-wing-alliance_6742534_7.html,,True,,
10,"Tolerance holding up in France despite hate speech, report on racism finds",no description,https://www.lemonde.fr/en/france/article/2025/06/19/tolerance-holding-up-in-france-despite-hate-speech-finds-report-on-racism_6742488_7.html,,True,,
11,"From Chenonceau to the Acropolis, heritage sites face the impacts of climate change",no description,https://www.lemonde.fr/en/culture/article/2025/06/18/from-chenonceau-to-the-acropolis-heritage-sites-face-the-impacts-of-climate-change_6742474_30.html,,True,,
12,What is France's 'Black code' and why hasn't it been repealed?,no description,https://www.lemonde.fr/en/videos/video/2025/05/31/what-is-france-s-black-code-and-why-hasn-t-it-been-repealed_6741860_108.html,,False,,
13,How was the European Union created?,no description,https://www.lemonde.fr/en/videos/video/2025/05/29/how-was-the-european-union-created_6741795_108.html,,False,,
14,Glide bombs: Russia's secret to making cheap weapons,no description,https://www.lemonde.fr/en/videos/video/2025/05/25/glide-bombs-russia-s-secret-to-making-cheap-weapons_6741646_108.html,,True,,
15,How does the conclave pick the new pope?,no description,https://www.lemonde.fr/en/videos/video/2025/05/07/how-does-the-conclave-pick-the-new-pope_6741005_108.html,,False,,
16,"'Iran's nuclear obsession could lead to endless, if not fatal, weakening of the Islamic Republic'",no description,https://www.lemonde.fr/en/opinion/article/2025/06/20/iran-s-nuclear-obsession-could-lead-to-endless-if-not-fatal-weakening-of-the-islamic-republic_6742526_23.html,,True,,
17,Age-based employment discrimination must end,no description,https://www.lemonde.fr/en/opinion/article/2025/06/19/age-based-employment-discrimination-must-end_6742498_23.html,,False,,
18,"Why Paris's Centre Pompidou, not even 50 years old, must close for five years",no description,https://www.lemonde.fr/en/opinion/article/2025/06/19/why-the-centre-pompidou-not-even-50-years-old-must-close-for-five-years_6742490_23.html,,True,,
19,"'For the Iranian that I am, nothing justifies violating my country's territorial integrity'",no description,https://www.lemonde.fr/en/opinion/article/2025/06/19/for-the-iranian-that-i-am-nothing-justifies-violating-my-country-s-territorial-integrity_6742483_23.html,,True,,
20,Wolfgang Tillmans' photography in action,no description,https://www.lemonde.fr/en/m-le-mag/article/2025/06/20/wolfgang-tillmans-photography-in-action_6742521_117.html,,True,,
21,"On the Canadian side of lake Ontario, a new identity emerges in the shadow of Trump",no description,https://www.lemonde.fr/en/m-le-mag/article/2025/06/15/on-the-canadian-side-of-lake-ontario-a-new-identity-emerges-in-the-shadow-of-trump_6742361_117.html,,True,,
22,"Kazakhstan families search for clues about the 270,000 'missing soldiers' of the World War II Soviet Army",no description,https://www.lemonde.fr/en/m-le-mag/article/2025/06/15/kazakhstan-families-search-for-clues-about-the-270-000-missing-soldiers-of-the-world-war-ii-soviet-army_6742352_117.html,,True,,
23,Maria Grazia Chiuri's final bow at home in Rome,no description,https://www.lemonde.fr/en/m-le-mag/article/2025/06/13/in-rome-maria-grazia-chiuri-s-final-bow_6742321_117.html,,True,,
24,"Why Paris's Centre Pompidou, not even 50 years old, must close for five years",no description,https://www.lemonde.fr/en/opinion/article/2025/06/19/why-the-centre-pompidou-not-even-50-years-old-must-close-for-five-years_6742490_23.html,,True,,
25,Paris exhibition tries to answer the mystery of Cleopatra,no description,https://www.lemonde.fr/en/culture/article/2025/06/12/paris-exhibition-tries-to-answer-the-mystery-of-cleopatra_6742287_30.html,,True,,
26,"Forget the jambon-beurre, try these five delicious banh mi sandwiches in Paris",no description,https://www.lemonde.fr/en/lifestyle/article/2025/06/06/forget-the-jambon-beurre-try-these-five-delicious-banh-mi-sandwiches-in-paris_6742068_37.html,,True,,
27,"Gabriele Münter, a framing prodigy, emerges from the shadows in new Paris show",no description,https://www.lemonde.fr/en/culture/article/2025/06/04/at-the-musee-d-art-moderne-de-paris-gabriele-munter-a-framing-prodigy-has-emerged-from-the-shadows_6741982_30.html,,True,,
28,"Europe to offer Iran 'diplomatic solution' to conflict, Macron says","French President Emmanuel Macron said that France, Germany and the UK would present a diplomatic offer to Iran in an attempt to halt the escalating conflict between Tehran and Tel Aviv.",https://www.lemonde.fr/en/international/article/2025/06/20/europe-to-offer-iran-diplomatic-solution-to-conflict_6742533_4.html,,True,https://img.lemde.fr/2025/06/20/0/0/5629/3752/400/266/75/0/f5c170e_ftp-import-images-1-ewu0ljnvixcb-2025-06-20t094208z-983420696-rc296fakj5yv-rtrmadp-3-france-airshow-macron.JPG,
29,Sweden sounds the alarm on loneliness,no description,https://www.lemonde.fr/en/international/article/2025/06/19/sweden-sounds-the-alarm-on-loneliness_6742520_4.html,,True,https://img.lemde.fr/2025/06/17/0/0/3499/2333/398/265/75/0/0a45d1b_upload-1-z3dke3ynnzpn-2012-11-27t120000z-1014311128-gm1e8br177j01-rtrmadp-3-environment-seas.JPG,
30,French police launch nationwide crackdown on undocumented migrants,no description,https://www.lemonde.fr/en/france/article/2025/06/20/french-police-launch-nationwide-crackdown-on-undocumented-migrants_6742532_7.html,,True,https://img.lemde.fr/2025/06/19/0/0/7942/5294/398/265/75/0/5be7bcc_upload-1-3grq1vtawtwm-000-62yb7uw.jpg,
31,The American GBU-57 bomb is the only weapon capable of reaching Iran's Fordo nuclear site,"The Israeli military does not possess the necessary means to destroy the uranium enrichment facilities at the underground Fordo site. The American GBU-57, a highly powerful bunker-busting bomb, was specifically designed for that purpose.",https://www.lemonde.fr/en/international/article/2025/06/20/the-american-gbu-57-bomb-is-the-only-weapon-capable-of-reaching-iran-s-fordo-nuclear-site_6742529_4.html,,False,https://img.lemde.fr/2025/06/17/0/219/1609/1073/398/265/75/0/d235ab2_upload-1-tpgnkpr18naq-ap23138330231870.jpg,
32,Chinese cities are facing the financial abyss of their subway systems,"After high-speed rail, subway lines are now dragging the cities they serve into huge levels of debt. This is due to colossal construction and operating costs, minimal revenues and a toxic relationship with real estate developers.",https://www.lemonde.fr/en/economy/article/2025/06/20/chinese-cities-are-facing-the-financial-abyss-of-their-subway-systems_6742523_19.html,,True,https://img.lemde.fr/2025/06/09/0/0/6000/4000/398/265/75/0/b1a67a5_sirius-fs-upload-1-grznxogsb04v-1749475762920-ibpremiumthree251894.jpg,
33,How Trump broke with his strategic allies to side with Russia over Ukraine,"'The Transatlantic Divorce' (5/5). After Barack Obama stepped back during the 2014 annexation of Crimea and Joe Biden hesitated, Donald Trump, now back in the White House, aligned himself with Russia at the UN and left his strategic allies alone to face Vladimir Putin.",https://www.lemonde.fr/en/history/article/2025/06/20/the-us-s-slow-abandonment-of-ukraine-since-2014_6742527_157.html,,True,https://img.lemde.fr/2025/06/19/64/0/5402/3601/398/265/75/0/391f03d_upload-1-mewnrhpwfqpz-000-468a8zr.jpg,
34,"'Iran's nuclear obsession could lead to endless, if not fatal, weakening of the Islamic Republic'","The war that Israel is waging in Iran is the culmination of a cycle that began nearly 40 years ago, during the early days of Iran's theocracy, writes Le Monde's columnist Alain Frachon.",https://www.lemonde.fr/en/opinion/article/2025/06/20/iran-s-nuclear-obsession-could-lead-to-endless-if-not-fatal-weakening-of-the-islamic-republic_6742526_23.html,Alain Frachon,True,https://img.lemde.fr/2025/06/17/0/0/2428/1618/664/442/75/0/8bfdff0_ftp-import-images-1-aefvhla17znk-2025-06-17t092416z-122871132-rc2opcavefvn-rtrmadp-3-iran-nuclear-khamenei-circle.JPG,Column
35,Second woman accuses French senator Guerriau of drugging her,no description,https://www.lemonde.fr/en/france/article/2025/06/20/second-woman-accuses-french-senator-guerriau-of-drugging-her_6742531_7.html,,False,https://img.lemde.fr/2025/06/20/1/0/8192/5461/198/132/95/0/9deaa62_upload-1-m3iuut6jyg1v-9deaa62-upload-1-ov0w21xxdmc4-000-33xb4ag.jpg,
36,Armenia PM arrives in Turkey for 'historic' visit in bid to mend ties,no description,https://www.lemonde.fr/en/international/article/2025/06/20/armenia-pm-arrives-in-turkey-for-historic-visit-in-bid-to-mend-ties_6742535_4.html,,False,https://img.lemde.fr/2025/06/20/0/0/2000/1333/198/132/95/0/4106ee2_ftp-import-images-1-noe487dlq3dn-86c50c564b3844cd9c07490fdc681de4-0-e9ede81ecb804127bd0983e9b48da9b7.jpg,
37,The dashed hopes of France's left-wing alliance,no description,https://www.lemonde.fr/en/france/article/2025/06/20/the-dashed-hopes-of-france-s-left-wing-alliance_6742534_7.html,,True,https://img.lemde.fr/2025/06/10/764/409/3530/2353/198/132/95/0/eab1f5b_sirius-fs-upload-1-jz1i9ar6dw0l-1749566937903-jmug240823020.jpg,
38,"Who is Gonjeshke Darande, the group behind the cyberattack targeting Sepah Bank in Iran?",no description,https://www.lemonde.fr/en/pixels/article/2025/06/20/who-is-gonjeshke-darande-the-group-behind-the-cyberattack-targeting-sepah-bank-in-iran_6742524_13.html,,True,https://img.lemde.fr/2025/06/17/0/441/1800/1200/198/132/95/0/39d35f8_ftp-import-images-1-wgsqj4mec4ap-2025-06-17t164517z-700261262-rc2f4faibk2i-rtrmadp-3-iran-nuclear-cyber-israel.JPG,
39,"Trump delays TikTok ban again, grants app 90-day extension to find US buyer",no description,https://www.lemonde.fr/en/pixels/article/2025/06/19/trump-delays-tiktok-ban-again-grants-app-90-day-extension-to-find-us-buyer_6742519_13.html,,False,,
40,"Violence against children in war zones hits record high in 2024, UN says",no description,https://www.lemonde.fr/en/global-issues/article/2025/06/20/un-violence-against-children-in-war-zones-hits-record-high-in-2024_6742525_199.html,,False,,
41,Free the knees! A plea for shorts at the office,no description,https://www.lemonde.fr/en/our-times/article/2025/06/19/free-the-knees-a-plea-for-shorts-at-the-office_6742513_39.html,,False,,
42,Wolfgang Tillmans' photography in action,no description,https://www.lemonde.fr/en/m-le-mag/article/2025/06/20/wolfgang-tillmans-photography-in-action_6742521_117.html,,True,,
43,Swiss police raid on financial blogger reignites criticism of 'gag law' restricting reporting on banks,no description,https://www.lemonde.fr/en/economy/article/2025/06/19/swiss-police-raid-on-financial-blogger-reignites-criticism-of-gag-law-restricting-reporting-on-banks_6742514_19.html,,True,,
44,"'Early' heatwave with temperatures reaching 38°C to sweep France, peaking Saturday",no description,https://www.lemonde.fr/en/environment/article/2025/06/19/early-heatwave-with-temperatures-reaching-38-c-to-sweep-france-peaking-saturday_6742495_114.html,,True,,
45,Outspoken Nicaraguan opposition figure Roberto Samcam shot dead at his home in Costa Rica,no description,https://www.lemonde.fr/en/international/article/2025/06/19/outspoken-nicaraguan-opposition-figure-roberto-samcam-shot-to-death-at-his-home-in-costa-rica_6742518_4.html,,False,,
46,French MP banned from entering the US,no description,https://www.lemonde.fr/en/international/article/2025/06/19/french-mp-banned-from-entering-the-us_6742506_4.html,,True,,
47,Limiting global warming to 1.5°C is now impossible,"According to a group of scientists, the target set by the 2015 Paris Agreement can no longer be met due to the inability of countries to reduce greenhouse gas emissions.",https://www.lemonde.fr/en/environment/article/2025/06/19/limiting-global-warming-to-1-5-c-is-now-impossible_6742504_114.html,Audrey Garric,True,https://img.lemde.fr/2025/06/18/0/0/3993/2662/664/442/75/0/9bb31fa_upload-1-55d38ix7j6nz-000-49nx3mx.jpg,In Depth
48,War in Ukraine has been a social elevator for part of the Russian population,"A study by the French Institute of International Relations (IFRI) examines the war in Ukraine's socio-economic impact, from the jobs created by the military-industrial complex to salaries and bonuses distributed to soldiers.",https://www.lemonde.fr/en/russia/article/2025/06/19/war-in-ukraine-has-been-a-social-elevator-for-part-of-the-russian-populations_6742516_140.html,Benjamin Quénelle,True,https://img.lemde.fr/2025/06/18/1667/0/4000/2666/664/442/75/0/a3bd969_upload-1-apqpvx2bnekt-dsc08239.jpg,News
49,"Why Paris's Centre Pompidou, not even 50 years old, must close for five years","The building designed by Renzo Piano and Richard Rogers is set to undergo major renovations until 2030 in order to reduce its energy consumption by 40%. Since its opening in 1977, the space has been in constant transformation.",https://www.lemonde.fr/en/opinion/article/2025/06/19/why-the-centre-pompidou-not-even-50-years-old-must-close-for-five-years_6742490_23.html,Isabelle Regnier,True,https://img.lemde.fr/2025/03/09/0/0/7801/5200/664/442/75/0/e6507e7_ftp-import-images-1-5vbpf72tjpyv-5266632-01-06.jpg,News analysis
50,"'Iran's nuclear obsession could lead to endless, if not fatal, weakening of the Islamic Republic'",no description,https://www.lemonde.fr/en/opinion/article/2025/06/20/iran-s-nuclear-obsession-could-lead-to-endless-if-not-fatal-weakening-of-the-islamic-republic_6742526_23.html,Alain Frachon,,https://img.lemde.fr/2025/02/13/0/0/0/0/100/100/60/0/012c520_sirius-fs-upload-1-siebgildln9p-1739442624103-capture-da-a-cran-2025-02-13-112806.png,Column
51,"'For the Iranian that I am, nothing justifies violating my country's territorial integrity'",no description,https://www.lemonde.fr/en/opinion/article/2025/06/19/for-the-iranian-that-i-am-nothing-justifies-violating-my-country-s-territorial-integrity_6742483_23.html,Anoush Ganjipour,,,Op-Ed
52,Age-based employment discrimination must end,no description,https://www.lemonde.fr/en/opinion/article/2025/06/19/age-based-employment-discrimination-must-end_6742498_23.html,Le Monde,False,,Editorial
