,headline,description,url,byline,premium,image_url,article type
0,The French love their public libraries. But lack of resources undermines the experience,"France's unique network of 15,500 local cultural spaces, which are open to all, free of charge, has seen visitor numbers steadily increase, leading to certain issues.",https://www.lemonde.fr/en/economy/article/2026/04/29/the-french-love-their-public-libraries-but-lack-of-resources-undermines-the-experience_6752948_19.html,,True,https://img.lemde.fr/2026/04/23/0/0/5176/3450/400/266/75/0/fb7389d_upload-1-jdyvytn9adqd-hl-cduong-2883858.jpg,
1,"King Charles III says UK-US alliance cannot rest on past achievements, notes 'times of great uncertainty'",no description,https://www.lemonde.fr/en/international/article/2026/04/28/trump-hails-british-friends-as-king-visits_6752942_4.html,,False,https://img.lemde.fr/2026/04/28/0/34/2640/1760/398/265/75/0/e91e28d_ftp-1-olce50qdenap-2026-04-28t193109z-335807170-rc2jykakb073-rtrmadp-3-usa-britain-king.JPG,
2,Ex-FBI chief Comey says he is 'innocent' and unafraid of new charges against him,no description,https://www.lemonde.fr/en/international/article/2026/04/28/former-fbi-director-james-comey-indicted-for-second-time_6752940_4.html,,False,https://img.lemde.fr/2025/09/25/0/0/6000/4000/398/265/75/0/e1c975a_ftp-import-images-1-yha8uwkwjdas-35c694cb674d4907beb43dabe4453660-0-2b0813c3cebf4e6ea40d2e349b52b0fa.jpg,
3,"As Mali's junta struggles, Algeria regains some of its influence in the Sahel",Setbacks suffered by the Bamako junta against insurgent groups have reestablished Algiers as a mediator after years of waning influence in the region.,https://www.lemonde.fr/en/international/article/2026/04/29/as-mali-s-junta-struggles-algeria-regains-some-of-its-influence-in-the-sahel_6752945_4.html,,True,https://img.lemde.fr/2026/04/26/0/0/4200/2800/398/265/75/0/79136fe_ftp-1-edkfn0cjreby-5875232-01-06.jpg,
4,Marlène Laruelle: 'Orban's defeat is a particularly strategic loss for Russia',"The setback for the former Hungarian prime minister, who fueled the Kremlin's narrative that Europe is reluctant to support Ukraine, weakens Vladimir Putin's plans, even though the battle against illiberalism is far from won, explains the historian and political scientist in an interview with Le Monde.",https://www.lemonde.fr/en/opinion/article/2026/04/29/marlene-laruelle-orban-s-defeat-is-a-particularly-strategic-loss-for-russia_6752946_23.html,,True,https://img.lemde.fr/2026/04/25/852/0/2761/1840/398/265/75/0/b08a1a4_upload-1-opdhwon6dadc-legendre-marle-ne-laruelle.jpg,
5,'Severance' star Adam Scott still feels he is 'scrounging for acceptance',"After breaking out with 'Parks and Recreation,' the 53-year-old American actor has established himself as a major figure on television. At Canneseries, where he gave a master class, he received the Canal+ Icon Award from the festival.",https://www.lemonde.fr/en/culture/article/2026/04/29/severance-star-adam-scott-still-feels-he-is-scrounging-for-acceptance_6752947_30.html,,True,https://img.lemde.fr/2026/04/27/0/0/3000/2000/398/265/75/0/2ade6fc_upload-1-vzaptuywzahy-gettyimages-2273258668.jpg,
6,"The Elysée's smoking room, a masterpiece of 1970s design, rises from the ashes","When then-president Georges Pompidou entered the Elysée Palace in 1969, he commissioned designer Pierre Paulin to furnish several of the palace's rooms, including a recently-restored smoking room, which is set to go on display soon.",https://www.lemonde.fr/en/lifestyle/article/2026/04/28/the-elysee-s-smoking-room-a-masterpiece-of-1970s-design-rises-from-the-ashes_6752941_37.html,Attila Barret de Lestang,True,https://img.lemde.fr/2026/04/14/0/0/1012/675/664/442/75/0/c07dc99_upload-1-ld8lmmwhz2wf-000-app2002040279709.jpg,News
7,Peru faces uncertainty two weeks after first round of presidential election,no description,https://www.lemonde.fr/en/international/article/2026/04/29/peru-faces-uncertainty-two-weeks-after-first-round-of-presidential-election_6752944_4.html,,True,https://img.lemde.fr/2026/04/25/0/0/8053/5369/198/132/95/0/9e3e60a_ftp-1-uu63ozf7owcw-5865189-01-06.jpg,
8,PSG edge Bayern 5-4 in Champions League semi-final epic,no description,https://www.lemonde.fr/en/sports/article/2026/04/28/psg-edge-bayern-5-4-in-champions-league-semi-final-epic_6752943_9.html,,False,https://img.lemde.fr/2026/04/28/0/0/6000/4000/198/132/95/0/87acc24_ftp-1-j4glyq3i8pkf-5890775-01-06.jpg,
9,OpenAI 'stole a charity': Musk accusations open blockbuster AI trial,no description,https://www.lemonde.fr/en/international/article/2026/04/28/openai-stole-a-charity-musk-accusations-open-blockbuster-ai-trial_6752938_4.html,,False,https://img.lemde.fr/2026/04/28/0/0/3756/2504/198/132/95/0/7cc13bc_ftp-1-cc6ynrqtn8mk-6a7afac6238e4ceba7ee90f0206fefb2-0-7d09e7f99179489bacb392aafdf03f4e.jpg,
10,How Vietnam's garment factories benefited from Trump's trade policy,no description,https://www.lemonde.fr/en/economy/article/2026/04/28/how-vietnam-s-garment-factories-benefited-from-trump-s-trade-policy_6752939_19.html,,True,https://img.lemde.fr/2026/04/14/0/0/6240/4160/198/132/95/0/382fe7e_upload-1-6sbbbvqlpvwh-26-dscf1999.jpg,
11,El Salvador's president entrusts monitoring of chronic patients to Google's AI,no description,https://www.lemonde.fr/en/international/article/2026/04/28/el-salvador-s-president-entrusts-monitoring-of-chronic-patients-to-google-s-ai_6752934_4.html,,True,,
12,Iran tests new plan to resolve war with the US,no description,https://www.lemonde.fr/en/international/article/2026/04/28/iran-tests-new-plan-to-resolve-war-with-the-us_6752932_4.html,,True,,
13,Greenland's rare earths: 'What could not be seized by military force is being acquired via Wall Street',no description,https://www.lemonde.fr/en/economy/article/2026/04/28/greenland-s-rare-earths-what-could-not-be-seized-by-military-force-is-being-acquired-via-wall-street_6752935_19.html,,True,,
14,"As bird numbers plummet, Brittany's seagull egg sterilization is facing mounting criticism",no description,https://www.lemonde.fr/en/environment/article/2026/04/28/as-bird-numbers-plummet-brittany-s-seagull-egg-sterilization-is-facing-mounting-criticism_6752902_114.html,,True,,
15,France's awkward stance over deepening crisis in Mali,no description,https://www.lemonde.fr/en/international/article/2026/04/28/france-s-awkward-stance-over-deepening-crisis-in-mali_6752930_4.html,,True,,
16,French authorities begin intercepting migrant small boats in English Channel,no description,https://www.lemonde.fr/en/international/article/2026/04/28/french-authorities-begin-intercepting-migrant-small-boats-in-english-channel_6752921_4.html,,True,,
17,Israel's opposition unites against Netanyahu,no description,https://www.lemonde.fr/en/international/article/2026/04/28/israel-s-opposition-unites-against-netanyahu_6752924_4.html,,True,,
18,"Manon Fleury, Michelin-starred chef: 'I constantly thought about cooking because I was anorexic'",no description,https://www.lemonde.fr/en/gastronomie/article/2026/04/28/manon-fleury-michelin-starred-chef-i-constantly-thought-about-cooking-because-i-was-anorexic_6752919_89.html,,True,,
19,"China, the other land of foie gras","As the French foie gras industry recovers after years of hardship caused by the avian flu epidemic, China has, over the past two years, become the world's second-largest producer of foie gras, writes Le Monde's Laurence Girard in her column.",https://www.lemonde.fr/en/economy/article/2026/04/28/china-the-other-land-of-foie-gras_6752910_19.html,Laurence Girard,True,https://img.lemde.fr/2026/04/03/0/0/5763/3842/664/442/75/0/0f2e56a_upload-1-v0sscsuenjgr-000-33xa8kr.jpg,Column
20,Oil traders' windfall profits highlight paradoxes of Swiss model,Geneva is full of rumors about the record profits made by oil market players. The legal framework in which they operate has drawn criticism and sparked calls for tighter regulation.,https://www.lemonde.fr/en/economy/article/2026/04/27/oil-traders-windfall-profits-highlight-paradoxes-of-swiss-model_6752865_19.html,Serge Enderlin,True,https://img.lemde.fr/2026/04/13/383/0/1972/1314/664/442/75/0/58c4114_upload-1-ehf4lgyzweyt-le-monde.jpg,Investigation
21,"Bologna, a symbol of progressive Italy, is targeted by the far right","Heir to humanist ideas and an antifascist culture established after World War II, the capital of Emilia-Romagna has become a laboratory for resistance to reactionary ideas in Italy.",https://www.lemonde.fr/en/opinion/article/2026/04/27/bologna-a-symbol-of-progressive-italy-is-targeted-by-the-far-right_6752896_23.html,Allan Kaval,True,https://img.lemde.fr/2026/04/21/105/114/3642/2428/664/442/75/0/133b9f2_upload-1-z75qwx4lxh3s-laurent.jpg,Investigation
22,Inquiry into French public broadcasting was guided by far-right tactics,no description,https://www.lemonde.fr/en/opinion/article/2026/04/28/inquiry-into-french-public-broadcasting-was-guided-by-far-right-tactics_6752918_23.html,Le Monde,False,,Editorial
23,"French Socialists' policy platform: Neither new nor complete, but at least it exists",no description,https://www.lemonde.fr/en/opinion/article/2026/04/25/french-socialists-policy-platform-neither-new-nor-complete-but-at-least-it-exists_6752823_23.html,Le Monde,False,,Editorial
24,'The masters of AI will be hated for their wealth and their transformation of society',no description,https://www.lemonde.fr/en/opinion/article/2026/04/21/the-masters-of-ai-will-be-hated-for-their-wealth-and-their-transformation-of-society_6752683_23.html,Arnaud Leparmentier,,,Column
