,headline,description,url,byline,premium,image_url,article type
0,"Hantavirus: After first positive case in France, government aims to 'break chain' of transmission","With the repatriation of five French nationals, now hospitalized in Paris, questions have arisen regarding the management and isolation of their contacts. The procedures for quarantine have been specified by decree.",https://www.lemonde.fr/en/environment/article/2026/05/11/hantavirus-after-first-positive-case-in-france-government-aims-to-break-chain-of-transmission_6753326_114.html,,True,https://img.lemde.fr/2026/05/10/0/0/2241/1494/400/266/75/0/faaa43a_ftp-1-clp6ap7sykqw-5996151-01-06.jpg,
1,"In Nairobi, Macron ends a decade of turmoil in France-Africa relations",no description,https://www.lemonde.fr/en/international/article/2026/05/11/in-nairobi-macron-ends-a-decade-of-turmoil-in-france-africa-relations_6753333_4.html,,True,https://img.lemde.fr/2026/05/10/0/0/6792/4528/398/265/75/0/942864d_ftp-1-b6i5vb36gwwv-5995999-01-06.jpg,
2,Pakistan emerges as a self-interested mediator in the Iran conflict,no description,https://www.lemonde.fr/en/international/article/2026/05/11/pakistan-emerges-as-a-self-interested-mediator-in-the-iran-conflict_6753336_4.html,,True,https://img.lemde.fr/2026/04/11/0/0/2827/1884/398/265/75/0/c3bd857_ftp-1-ypnk5oxekjvu-2026-04-11t200034z-1744710408-rc2xmkagcfao-rtrmadp-3-iran-crisis-ceasefire-pakistan.JPG,
3,Embattled UK PM Starmer vows to prove 'doubters' wrong,"British Prime Minister Keir Starmer, who has been mired in the scandal around Jeffrey Epstein and criticism over his policies, sought to react to Thursday's local elections, in which his Labour party lost nearly 1,500 council seats.",https://www.lemonde.fr/en/international/article/2026/05/11/embattled-uk-pm-starmer-vows-to-prove-doubters-wrong_6753334_4.html,,False,https://img.lemde.fr/2026/05/11/43/0/3000/2000/398/265/75/0/360c393_ftp-1-gsyzjsdrbcph-2026-05-11t092456z-2096302665-rc2x6larstdv-rtrmadp-3-britain-politics-starmer.JPG,
4,"In Madagascar, Russia seeks a new African stronghold","After bursting onto the scene alongside the junta, which seized power in October 2025, by providing it with weapons and military instructors from Africa Corps, Moscow has been advancing its pawns on many fronts.",https://www.lemonde.fr/en/le-monde-africa/article/2026/05/11/in-madagascar-russia-seeks-a-new-african-stronghold_6753320_124.html,,True,https://img.lemde.fr/2026/05/04/0/0/6271/4180/398/265/75/0/1baede9_upload-1-0t3srfrxd8gc-2026-02-19t093837z-1202038768-rc2xojaw626j-rtrmadp-3-russia-madagascar.JPG,
5,Spanish woman priest challenges the Vatican,"Christina Moreira advocates for women's right to the priesthood, and was excommunicated by the Vatican for seeking the role. She continues her vocation as a parish priest in Galicia, disturbing figures high up in the Catholic Church.",https://www.lemonde.fr/en/international/article/2026/05/11/in-spain-the-woman-priest-challenging-the-vatican_6753322_4.html,,True,https://img.lemde.fr/2026/04/13/0/0/7500/5000/398/265/75/0/21ed622_upload-1-auwx75rpp4p1-1.jpg,
6,"Who is Iyad Ag Ghali, the jihadist behind the destabilization of Mali?","A central figure in Sahelian jihad for nearly two decades, pursued in turn by the French and the Russians, Ghali led the offensive against the junta in Bamako. Since 2012, the jihadist and leader of Jama'at Nusrat al-Islam wal-Muslimin (JNIM) has softened his rhetoric, seeking to appear more approachable and less radical.",https://www.lemonde.fr/en/le-monde-africa/article/2026/05/11/who-is-iyad-ag-ghali-the-jihadist-behind-the-destabilization-of-mali_6753321_124.html,Benjamin Roger,True,https://img.lemde.fr/2026/05/10/36/0/1772/1181/664/442/75/0/dfde4a7_upload-1-gb8n3nki479a-dfde4a7-upload-1-uqbgeochpkfc-lemonde-agghali-b-300dpi-main.jpg,Profile
7,Iran releases Nobel Peace Prize winner Narges Mohammadi over health concerns,no description,https://www.lemonde.fr/en/international/article/2026/05/11/iran-releases-nobel-peace-prize-winner-narges-mohammadi-over-health-concerns_6753317_4.html,,False,https://img.lemde.fr/2026/05/10/0/0/1279/853/198/132/95/0/6e297b5_ftp-1-52wrazeommdx-0f7a2cb7e4834d9987cfd89ee63274fa-0-09f2759ee3f74e4e94743d733af36462.jpg,
8,Starmer's future as UK prime minister hangs by a thread,no description,https://www.lemonde.fr/en/international/article/2026/05/11/starmer-s-future-as-uk-prime-minister-hangs-by-a-thread_6753324_4.html,,True,https://img.lemde.fr/2026/05/09/112/0/5000/3333/198/132/95/0/1f013c4_ftp-1-3edr2s1h17en-5985576-01-06.jpg,
9,China's green industries profit from Middle East war,no description,https://www.lemonde.fr/en/economy/article/2026/05/11/china-s-green-industries-profit-from-middle-east-war_6753318_19.html,,True,https://img.lemde.fr/2026/05/04/0/0/3343/2228/198/132/95/0/e00fc33_upload-1-txfg8d1bqlty-000-a8hx6en.jpg,
10,Philippine lawmakers vote to impeach VP Sara Duterte,no description,https://www.lemonde.fr/en/international/article/2026/05/11/philippine-lawmakers-vote-to-impeach-vp-sara-duterte_6753332_4.html,,False,https://img.lemde.fr/2026/05/11/0/1/6445/4297/198/132/95/0/b1e2b63_ftp-1-0r6fsl9kntsz-5999490-01-06.jpg,
11,"'There are no innocents in Gaza': Channel 14, the Israeli television channel accused of genocidal rhetoric",no description,https://www.lemonde.fr/en/international/article/2026/05/10/there-are-no-innocents-in-gaza-channel-14-the-israeli-television-channel-accused-of-genocidal-rhetoric_6753311_4.html,,True,,
12,Paris's La Villette reinvents itself as an urban climate laboratory,no description,https://www.lemonde.fr/en/culture/article/2026/05/11/paris-s-la-villette-reinvents-itself-as-an-urban-climate-laboratory_6753315_30.html,,True,,
13,"In Hungary, jubilation marks Péter Magyar's inauguration as prime minister",no description,https://www.lemonde.fr/en/international/article/2026/05/10/in-hungary-jubilation-marks-peter-magyar-s-inauguration-as-prime-minister_6753299_4.html,,True,,
14,"Women are featured on Cannes's poster, but still sidelined at the festival",no description,https://www.lemonde.fr/en/m-le-mag/article/2026/05/10/cannes-2026-women-are-featured-on-the-poster-but-still-sidelined-at-the-festival_6753302_117.html,,True,,
15,Official development assistance: African countries mobilize to break free from dependence,no description,https://www.lemonde.fr/en/economy/article/2026/05/11/official-development-assistance-african-countries-mobilize-to-break-free-from-dependence_6753331_19.html,,True,,
16,Barcelona takes La Liga title after beating Real Madrid,no description,https://www.lemonde.fr/en/international/article/2026/05/11/barcelona-takes-la-liga-title-after-beating-real-madrid_6753316_4.html,,False,,
17,PSG on the brink of another Ligue 1 title,no description,https://www.lemonde.fr/en/sports/article/2026/05/11/psg-on-the-brink-of-another-ligue-1-title_6753319_9.html,,False,,
18,Energy transition becomes more accessible to the French middle class,no description,https://www.lemonde.fr/en/economy/article/2026/05/10/energy-transition-becomes-more-accessible-to-the-french-middle-class_6753306_19.html,,True,,
19,The social measures tech leaders put forward to address AI's destructive potential sound familiar in Europe,"Aware of the potentially devastating impact their technology could have on jobs and society, the leaders of OpenAI and Anthropic are advancing a range of progressive ideas aimed at preserving social cohesion.",https://www.lemonde.fr/en/economy/article/2026/05/10/universal-income-reduced-work-week-capital-tax-options-tech-leaders-put-forward-to-address-ai-s-destructive-potential-sound-familiar-in-europe_6753313_19.html,Arnaud Leparmentier,True,https://img.lemde.fr/2026/05/07/16/981/2496/1664/664/442/75/0/e85cfd9_upload-1-m443vjbu9n1i-000-984w8yd.jpg,In Depth
20,How much space should cities give to wild vegetation?,"Bordeaux's new city council has launched a major program to weed sidewalks across the city, while in Montpellier, officials are considering expanding what it calls France's first 'wild district.'",https://www.lemonde.fr/en/environment/article/2026/05/10/how-much-space-should-cities-give-to-wild-vegetation_6753308_114.html,Chloé Dasquet,True,https://img.lemde.fr/2026/05/08/0/0/8256/5504/664/442/75/0/20e646c_upload-1-ghagtnhm03al-sipa-01266443-000007.jpg,In Depth
21,How chicken is taking over France's fast-food market,"The number of fast-food chains dedicated to chicken is booming in France. At the heart of this success is affordable comfort food, offering an unbeatable quantity-for-price ratio at a time when purchasing power is on the decline.",https://www.lemonde.fr/en/economy/article/2026/05/09/fried-breaded-or-grilled-how-chicken-is-taking-over-france-s-fast-food-market_6753283_19.html,Jessica Gourdon,True,https://img.lemde.fr/2026/05/08/0/18/9492/6328/664/442/75/0/a950fb2_upload-1-5z8cqcais1qr-divergence-cf2134012.JPG,In Depth
22,'Israel's impunity in Gaza can only encourage it to be just as ruthless in Lebanon',no description,https://www.lemonde.fr/en/opinion/article/2026/05/10/israel-s-impunity-in-gaza-can-only-encourage-it-to-be-just-as-ruthless-in-lebanon_6753307_23.html,Jean-Pierre Filiu,,https://img.lemde.fr/2023/07/31/0/0/0/0/100/100/60/0/d45bb07_1690791602941-eac5c14-1647333440018-jean-pierre-filiu-2019.jpg,Column
23,'The word 'masculinism' is deeply inappropriate and depoliticizes feminism',no description,https://www.lemonde.fr/en/opinion/article/2026/05/10/genevieve-fraisse-the-word-masculinism-is-deeply-inappropriate-and-depoliticizes-feminism_6753312_23.html,Anne-Toscane Viudes,,,Interview
24,'Trump is now portrayed by some of his opponents as the Antichrist',no description,https://www.lemonde.fr/en/religions/article/2026/05/08/trump-is-now-portrayed-by-some-of-his-opponents-as-the-antichrist_6753264_63.html,Joël Schnapp,,,Op-Ed
