,headline,description,url,byline,premium,image_url,article type
0,"'The war in Iran is limited to three countries, but the list of collateral victims keeps growing'","Since the start of the conflict in the Middle East, the specter of powerlessness has affected many countries, and what was supposed to be a regional war has become a global crisis, writes Le Monde columnist Gilles Paris.",https://www.lemonde.fr/en/opinion/article/2026/04/15/the-war-in-iran-is-limited-to-three-countries-but-the-list-of-collateral-victims-keeps-growing_6752468_23.html,,True,https://img.lemde.fr/2026/04/14/0/0/7081/4721/400/266/75/0/79a1872_ftp-1-1y2jwpilgmio-5764427-01-06.jpg,
1,Pope Leo rebukes Cameroon's elites in the country's capital: 'The chains of corruption must be broken',no description,https://www.lemonde.fr/en/le-monde-africa/article/2026/04/16/pope-leo-rebukes-cameroon-s-elites-in-the-country-s-capital-the-chains-of-corruption-must-be-broken_6752470_124.html,,True,https://img.lemde.fr/2026/04/15/0/0/3600/2400/398/265/75/0/a02db5c_ftp-1-evnqme0ygldw-5776231-01-06.jpg,
2,Concerns are mounting over private credit in the United States,no description,https://www.lemonde.fr/en/economy/article/2026/04/16/concerns-are-mounting-over-private-credit-in-the-united-states_6752473_19.html,,True,https://img.lemde.fr/2026/04/15/783/0/2913/1942/398/265/75/0/5d213f4_upload-1-ogqvomqiwyt7-credit-prive.jpg,
3,A prominent Palestinian human rights advocate is being barred from entering France,"Shawan Jabarin, the general director of Al-Haq, a West Bank-based NGO that is currently under US sanctions, was scheduled to speak before the European Parliament's human rights committee in Strasbourg this past Tuesday. However, French authorities denied his visa application.",https://www.lemonde.fr/en/international/article/2026/04/16/a-prominent-palestinian-human-rights-advocate-is-being-barred-from-entering-france_6752471_4.html,,True,https://img.lemde.fr/2026/04/15/0/0/2206/1470/398/265/75/0/039d1da_upload-1-t0pi7mzg7l8p-ll-jabarin-shawan-01-1.jpg,
4,Military Advisor to Iran's Supreme Leader Threatens to Sink US Ships in the Strait of Hormuz,"Following Iran's threats, the US announced it was tightening sanctions against Iran's oil industry as the Strait of Hormuz remains closed.",https://www.lemonde.fr/en/international/article/2026/04/16/military-advisor-to-iran-s-supreme-leader-threatens-to-sink-us-ships-in-the-strait-of-hormuz_6752475_4.html,,False,https://img.lemde.fr/2026/04/15/0/429/4642/3095/398/265/75/0/d08812a_ftp-1-xlpfp37k4gxy-2026-04-15t220022z-1420308447-rc2gnkajfdsi-rtrmadp-3-usa-iran-sanctions.JPG,
5,"Calder at the Fondation Louis Vuitton in Paris, a festive experience","The exhibition spans the sculptor's entire body of work and takes over the entire building, spilling out onto the exterior. The journey is a joyful celebration, filled with lightness and movement.",https://www.lemonde.fr/en/culture/article/2026/04/15/the-calder-exhibition-at-the-fondation-louis-vuitton-in-paris-offers-a-festive-experience_6752434_30.html,,True,https://img.lemde.fr/2026/04/14/0/283/6985/4657/398/265/75/0/bb86eaa_upload-1-lrzimhmiwxjt-dispersed-objects-with-brass-gong-1948.jpg,
6,The Curtis Yarvin conundrum: Should one debate with the far right?,The reactionary American blogger close to the Trumpian figures was invited to a symposium in Germany with prominent scholars. Some critics say the invitation signals that red lines have vanished from intellectual debate.,https://www.lemonde.fr/en/opinion/article/2026/04/15/the-curtis-yarvin-conundrum-should-one-debate-with-the-far-right_6752467_23.html,Marc-Olivier Bherer,True,https://img.lemde.fr/2026/04/13/897/0/2000/1333/664/442/75/0/5a668f3_upload-1-7e3ghisnxbqo-rea11328452.jpg,Feature
7,Left-wing presidential candidate climbs to second place in Peru elections,no description,https://www.lemonde.fr/en/international/article/2026/04/16/left-wing-presidential-candidate-climbs-to-second-place-in-peru-elections_6752474_4.html,,False,https://img.lemde.fr/2026/04/15/1/0/7483/4988/198/132/95/0/84bb3bf_ftp-1-iqtvb6nqqwos-5778789-01-06.jpg,
8,"Live Nation, parent company of the events giant Ticketmaster, found guilty of illegal monopoly in the US",no description,https://www.lemonde.fr/en/international/article/2026/04/16/live-nation-parent-company-of-the-events-giant-ticketmaster-found-guilty-of-illegal-monopoly-in-the-us_6752472_4.html,,False,https://img.lemde.fr/2026/04/15/0/0/2482/1655/198/132/95/0/14678b1_ftp-1-bzrhs8e6ravm-4c969650397c46508ba79e97582c54fc-0-242acf8b9a3c4e0fa187293e5534bed6.jpg,
9,Shooting in Turkish school leaves at least nine dead and 13 injured,no description,https://www.lemonde.fr/en/international/article/2026/04/15/shooting-in-turkish-school-leaves-at-least-nine-dead-and-13-injured_6752464_4.html,,False,https://img.lemde.fr/2026/04/15/0/0/1687/1124/198/132/95/0/61ce2ec_ftp-1-damm3fz5hp4k-ad58005b28f044ddb19099d4dbaaa967-0-02e8ae306bc64b4c8d90467098da29d0.jpg,
10,Firing of respected French publisher demonstrates billionaire Bolloré's tightening grip,no description,https://www.lemonde.fr/en/economy/article/2026/04/15/firing-of-respected-french-publisher-reveals-billionaire-bollore-s-tightening-grip_6752461_19.html,,True,https://img.lemde.fr/2026/04/15/0/0/3543/2362/198/132/95/0/f1be563_upload-1-6rdlrqvfuwqo-oro1944004.jpg,
11,France's Ekitiké ruled out of 2026 World Cup due to injury,no description,https://www.lemonde.fr/en/sports/article/2026/04/15/france-s-ekitike-ruled-out-of-the-2026-world-cup-due-to-injury_6752469_9.html,,False,,
12,'Kevin Warsh's nomination to the Fed reinforces the impression that an oligarchy runs the US',no description,https://www.lemonde.fr/en/economy/article/2026/04/15/kevin-warsh-s-nomination-to-the-fed-reinforces-the-impression-that-an-oligarchy-runs-the-us_6752457_19.html,,False,,
13,"BBC announces up to 2,000 layoffs in next two years",no description,https://www.lemonde.fr/en/economy/article/2026/04/15/bbc-announces-up-to-2-000-layoffs-in-next-two-years_6752465_19.html,,False,,
14,How Algeria tried to erase the two suicide attacks during Pope Leo's visit,no description,https://www.lemonde.fr/en/le-monde-africa/article/2026/04/15/how-algeria-tried-to-erase-the-two-suicide-attacks-during-pope-leo-s-visit_6752443_124.html,,True,,
15,Sarkozy loyalist hits back after ex-president's attacks at appeal trial over alleged Libyan funding,no description,https://www.lemonde.fr/en/france/article/2026/04/15/sarkozy-loyalist-hits-back-after-ex-president-s-attacks-at-appeal-trial-over-alleged-libyan-funding_6752446_7.html,,True,,
16,"Sepideh Farsi, filmmaker: 'We are witnessing the destruction of Iranian heritage, culture and environment'",no description,https://www.lemonde.fr/en/opinion/article/2026/04/15/sepideh-farsi-filmmaker-we-are-witnessing-the-destruction-of-iranian-heritage-culture-and-environment_6752432_23.html,,True,,
17,UK signs deal to rejoin EU's Erasmus student exchange program,no description,https://www.lemonde.fr/en/international/article/2026/04/15/uk-signs-deal-to-rejoin-eu-s-erasmus-student-exchange-program_6752466_4.html,,False,,
18,French MPs vote to scrap low-emission zones,no description,https://www.lemonde.fr/en/environment/article/2026/04/15/french-mps-vote-to-scrap-low-emission-zones_6752454_114.html,,True,,
19,'The presence of PFAS in my blood is out of my control': Six Europeans on living in 'forever pollution' hotspots,"Being a victim is neither a profession nor their identity. Meta, Cristina, Doris, Stéphanie, Mari and Toon live in PFAS contamination hotspots in six European countries.",https://www.lemonde.fr/en/les-decodeurs/visuel/2026/04/14/the-presence-of-pfas-in-my-blood-is-out-of-my-control-six-europeans-on-living-in-forever-pollution-hotspots_6752421_8.html,Stéphane Horel,True,https://img.lemde.fr/2026/04/03/0/0/6232/4154/664/442/75/0/e825d1c_upload-1-47g3fxhz2zdx-0c6a3920.jpg,Visual Story
20,Will California's next governor be a Republican?,The crowded field of Democratic candidates running in the gubernatorial election raises the possibility that a Trump-aligned Republican could win in November in this deeply progressive state.,https://www.lemonde.fr/en/international/article/2026/04/14/will-california-s-next-governor-be-a-republican_6752385_4.html,Arnaud Leparmentier,True,https://img.lemde.fr/2026/03/21/0/0/2580/1720/664/442/75/0/b2b643e_ftp-1-nzbpcnic9ade-49f87561ce454acba71159c635e5529c-1-ae5effac1444477dabd3ce9848eaa0de.jpg,Letter from...
21,New online search tool in Germany reveals if ancestors were Nazi Party members,"In partnership with American and German archives, the weekly 'Die Zeit' has launched a searchable tool granting access to more than 12 million documents, cataloging the bulk of Nazi Party (NSDAP) memberships from 1925 to 1945.",https://www.lemonde.fr/en/international/article/2026/04/14/new-online-search-tool-in-germany-reveals-if-ancestors-were-nazi-party-members_6752420_4.html,Cécile Boutelet,True,https://img.lemde.fr/2026/04/12/152/63/2786/1857/664/442/75/0/50bbdd5_upload-1-zpasarzt01dv-000-was1059723.jpg,In Depth
22,"Hungary elections: 'Once the champagne has been popped, European leaders must reassess their expectations for the new government'",no description,https://www.lemonde.fr/en/opinion/article/2026/04/15/hungary-elections-once-the-champagne-has-been-popped-european-leaders-must-reassess-their-expectations-for-the-new-government_6752427_23.html,Pawel Zerka  and  Piotr Buras,,,Op-Ed
23,French voters' desire for change must be heard by future presidential candidates,no description,https://www.lemonde.fr/en/opinion/article/2026/04/14/the-french-s-desire-for-change-must-be-heard-by-future-presidential-candidates_6752412_23.html,Le Monde,False,,Editorial
24,"'Steve Witkoff, Trump's favorite negotiator, boosts his business more than peace'",no description,https://www.lemonde.fr/en/international/article/2026/04/12/steve-witkoff-trump-s-favorite-negotiator-boosts-his-business-more-than-peace_6752340_4.html,Jean-Pierre Filiu,,https://img.lemde.fr/2023/07/31/0/0/0/0/100/100/60/0/d45bb07_1690791602941-eac5c14-1647333440018-jean-pierre-filiu-2019.jpg,Column
