,headline,description,url,byline,premium,image_url,article type
0,Finland faces yet another racist scandal,no description,https://www.lemonde.fr/en/international/article/2025/12/20/finland-faces-yet-another-racist-scandal_6748691_4.html,,True,,
1,US sets record defense budget but imposes limits on Donald Trump's military ambitions,no description,https://www.lemonde.fr/en/international/article/2025/12/19/us-sets-record-defense-budget-but-imposes-limits-on-donald-trump-s-military-ambitions_6748683_4.html,,True,,
2,EU to loan €90 billion to Ukraine while delaying Mercosur deal,no description,https://www.lemonde.fr/en/international/article/2025/12/19/eu-to-loan-90-billion-to-ukraine-amid-delay-to-mercosur-deal_6748666_4.html,,True,,
3,Trump dogged by cost of living crisis and Republican revolt,no description,https://www.lemonde.fr/en/international/article/2025/12/19/trump-dogged-by-cost-of-living-crisis-and-republican-dissent_6748663_4.html,,True,,
4,'Trump's ideological challenge to Europe is more dangerous than the security one',no description,https://www.lemonde.fr/en/opinion/article/2025/12/11/trump-s-ideological-challenge-to-europe-is-more-dangerous-than-the-security-one_6748393_23.html,,True,,
5,"Attacked by Trump, Europe wavers between denial and fear of reprisals",no description,https://www.lemonde.fr/en/international/article/2025/12/11/attacked-by-trump-europe-wavers-between-denial-and-fear-of-reprisals_6748382_4.html,,True,,
6,Bosnia and Herzegovina's Serb entity elects ally of  former leader Dodik,no description,https://www.lemonde.fr/en/international/article/2025/11/24/bosnia-and-herzegovina-s-serb-entity-elects-ally-of-former-leader-dodik_6747765_4.html,,True,,
7,"In France's Somme, bagpipers keep the memory of the Great War alive",no description,https://www.lemonde.fr/en/history/article/2025/11/11/in-france-s-somme-bagpipers-keep-the-memory-of-the-great-war-alive_6747347_157.html,,True,,
8,French lawmakers fail to agree on state budget bill,no description,https://www.lemonde.fr/en/france/article/2025/12/19/french-lawmakers-fail-to-agree-on-a-state-budget-bill_6748664_7.html,,False,,
9,"French anesthetist sentenced to life in prison: 'We cannot bring back our loved ones, but at least there is a semblance of justice'",no description,https://www.lemonde.fr/en/france/article/2025/12/19/french-anesthetist-sentenced-to-life-in-prison-we-cannot-bring-back-our-loved-ones-but-at-least-there-is-a-semblance-of-justice_6748670_7.html,,True,,
10,"At the Rétrofutur Museum in Paris, looking to the past to better understand the future",no description,https://www.lemonde.fr/en/france/article/2025/12/18/at-the-retrofutur-museum-in-paris-looking-to-the-past-to-better-understand-the-future_6748646_7.html,,True,,
11,The Sarkozys' damning indictment in witness Takieddine's false retraction,no description,https://www.lemonde.fr/en/france/article/2025/12/18/the-sarkozys-s-damning-indictment-in-witness-takieddine-s-false-retraction_6748631_7.html,,True,,
12,The French studio behind a viral Christmas ad,no description,https://www.lemonde.fr/en/videos/video/2025/12/12/the-french-studio-behind-a-viral-christmas-ad_6748436_108.html,,False,,
13,"Israel's D9 bulldozer, a tool of destruction in Gaza",no description,https://www.lemonde.fr/en/videos/video/2025/11/27/israel-s-d9-bulldozer-a-tool-of-destruction-in-gaza_6747870_108.html,,True,,
14,"Ukraine's Pokrovsk faces fierce fighting, footage analyzed by Le Monde reveals",no description,https://www.lemonde.fr/en/videos/video/2025/11/21/ukraine-s-pokrovsk-faces-fierce-fighting-footage-analyzed-by-le-monde-reveals_6747708_108.html,,True,,
15,Afghanistan: Relentless repression continues over four years into Taliban's rule,no description,https://www.lemonde.fr/en/videos/video/2025/10/04/afghanistan-relentless-repression-continues-over-four-years-into-taliban-s-rule_6746092_108.html,,False,,
16,"Sydney attack: 'Relatively spared from terrorism, Australia is therefore less prepared for it'",no description,https://www.lemonde.fr/en/opinion/article/2025/12/19/sydney-attack-relatively-spared-from-terrorism-australia-is-therefore-less-prepared-for-it_6748659_23.html,,True,,
17,"'There was a theft at the Louvre because, in a museum, security always takes a back seat to art and welcoming the public'",no description,https://www.lemonde.fr/en/opinion/article/2025/12/19/there-was-a-theft-at-the-louvre-because-in-a-museum-security-always-takes-a-back-seat-to-art-and-welcoming-the-public_6748681_23.html,,True,,
18,Trump and the risks of adventurism in Venezuela,no description,https://www.lemonde.fr/en/opinion/article/2025/12/19/trump-and-the-risks-of-adventurism-in-venezuela_6748678_23.html,,False,,
19,"'Private geoengineering comes at a cost, and that cost is public'",no description,https://www.lemonde.fr/en/opinion/article/2025/12/19/private-geoengineering-comes-at-a-cost-and-that-cost-is-public_6748677_23.html,,True,,
20,"Pina Picierno, the Italian MEP threatened by Russia for backing Ukraine",no description,https://www.lemonde.fr/en/m-le-mag/article/2025/12/19/pina-picierno-the-italian-mep-threatened-by-russia-for-backing-ukraine_6748658_117.html,,True,,
21,"Astoria, Zohran Mamdani's working-class New York",no description,https://www.lemonde.fr/en/m-le-mag/article/2025/12/19/astoria-zohran-mamdani-s-working-class-new-york_6748657_117.html,,True,,
22,Trump's FBI purge: 'We are not trending toward an authoritarian force. We are at one',no description,https://www.lemonde.fr/en/m-le-mag/article/2025/12/14/trump-s-fbi-purge-we-are-not-trending-toward-an-authoritarian-force-we-are-at-one_6748490_117.html,,True,,
23,A meat-forward restaurant and an exclusive club for the rich: The Washington of Trump loyalists,no description,https://www.lemonde.fr/en/m-le-mag/article/2025/12/14/a-meat-forward-restaurant-and-an-exclusive-club-for-the-rich-the-washington-of-trump-loyalists_6748486_117.html,,True,,
24,Five creative craft workshops to enjoy doing in Paris with your child,no description,https://www.lemonde.fr/en/intimacy/article/2025/12/13/in-paris-five-creative-craft-workshops-to-enjoy-doing-with-your-child_6748451_310.html,,True,,
25,Jewels of power go on display in Paris,no description,https://www.lemonde.fr/en/culture/article/2025/12/11/the-power-gems-on-display-in-paris_6748374_30.html,,False,,
26,Five spots in Paris to enjoy a (great) plant-based sandwich,no description,https://www.lemonde.fr/en/lifestyle/article/2025/12/04/in-paris-five-spots-to-enjoy-a-great-plant-based-sandwich_6748131_37.html,,True,,
27,"Bayonne's 'Little Louvre,' the Bonnat-Helleu Museum, reopens after 14 years",no description,https://www.lemonde.fr/en/culture/article/2025/11/28/bayonne-s-little-louvre-the-bonnat-helleu-museum-reopens-after-14-years_6747913_30.html,,True,,
28,Farmer anger spreads in protests from southern France to Brussels,"The protest movement among French farmers intensified on Thursday, fueled by the outbreak of lumpy skin disease among cattle. Convoys demonstrated in Brussels against the EU-Mercosur free trade agreement, changes to the EU's Common Agricultural Policy and a proposed new fertilizer tax.",https://www.lemonde.fr/en/economy/article/2025/12/19/farmer-anger-spreads-in-protests-from-southern-france-to-brussels_6748680_19.html,,True,https://img.lemde.fr/2025/12/18/0/0/7156/4771/400/266/75/0/0957273_upload-1-daprlecm9upk-agriculteurs-ul-myop-1127.jpg,
29,US says more than 70 targets hit in strikes against IS in Syria,no description,https://www.lemonde.fr/en/international/article/2025/12/19/pentagon-announces-syria-operation-in-response-to-attack-on-us-troops_6748686_4.html,,False,https://img.lemde.fr/2025/12/17/0/0/6000/4000/398/265/75/0/5cf63dd_ftp-1-bkk77t0t6gwy-2025-12-17t183226z-1747429452-rc2hiiaztien-rtrmadp-3-syria-security-trump.JPG,
30,EU-Mercosur deal divides France's agricultural sectors,no description,https://www.lemonde.fr/en/economy/article/2025/12/19/eu-mercosur-deal-divides-france-s-agricultural-sectors_6748675_19.html,,True,https://img.lemde.fr/2025/12/18/0/0/7555/5037/398/265/75/0/906a4bf_upload-1-io1sp46xzuc1-agriculteurs-ul-myop-0539.jpg,
31,"US Justice Department begins release of Epstein files, including previously unseen photos of Clinton","The vast disclosure included seven pages listing 254 masseuses – every name obscured beneath thick black bars and the explanation 'redacted to protect potential victim information.' The newly released photographs included a younger-looking Bill Clinton reclining in a hot tub, part of the image obscured by a stark black rectangle.",https://www.lemonde.fr/en/international/article/2025/12/20/us-justice-department-begins-release-of-epstein-files_6748690_4.html,,False,https://img.lemde.fr/2025/12/19/0/109/3465/2310/398/265/75/0/cc4b1f5_ftp-1-0oz9dxdc57xg-2025-12-19t224228z-329045717-rc2yjiawnrzn-rtrmadp-3-usa-trump-epstein-files.JPG,
32,Trump announces lower drug price deals with 9 pharmaceutical companies,"The US President, on Friday, also vowed to urge US health insurance executives to voluntarily lower costs, as millions of Americans brace for a surge in premiums that could prove politically damaging for Republicans.",https://www.lemonde.fr/en/international/article/2025/12/19/trump-to-ask-health-insurance-companies-to-lower-costs-as-he-announces-lower-drug-price-deals_6748687_4.html,,False,https://img.lemde.fr/2025/12/19/1/0/6500/4333/398/265/75/0/e9f2c20_ftp-1-qze0iwunz5rr-2025-12-19t200929z-1370044786-rc2wjiadjadx-rtrmadp-3-usa-trump.JPG,
33,"'Emily in Paris,' season 5, on Netflix: Her weekend in Rome","The production moved a few episodes to Italy, where, once again, it is the character Sylvie, played by Philippine Leroy-Beaulieu, who delivers the best moments.",https://www.lemonde.fr/en/culture/article/2025/12/20/emily-in-paris-season-5-on-netflix-her-weekend-in-rome_6748689_30.html,,True,https://img.lemde.fr/2025/12/18/0/0/3600/2400/398/265/75/0/0c672e2_upload-1-k34pbfh9bvlu-eip-unit-01426r.jpg,
34,"'There was a theft at the Louvre because, in a museum, security always takes a back seat to art and welcoming the public'","Since the robbery on October 19, there have been calls for the resignation of Laurence des Cars, the institution's president. But she is far from being solely responsible for the failures that allowed this theft to take place, argues Le Monde columnist Michel Guerrin.",https://www.lemonde.fr/en/opinion/article/2025/12/19/there-was-a-theft-at-the-louvre-because-in-a-museum-security-always-takes-a-back-seat-to-art-and-welcoming-the-public_6748681_23.html,Michel Guerrin,True,https://img.lemde.fr/2025/12/17/0/0/2692/1794/664/442/75/0/68e7e5c_ftp-1-v8mpfem61et8-5702850-01-06.jpg,Column
35,"Without a budget, France plans to start 2026 with special finance law",no description,https://www.lemonde.fr/en/politics/article/2025/12/19/without-a-budget-france-plans-to-start-2026-with-special-finance-law_6748672_5.html,,True,https://img.lemde.fr/2025/12/16/0/0/8640/5760/198/132/95/0/48af16c_ftp-1-qr8r2zgplpr7-5695753-01-06.jpg,
36,Gaza civil defense says 5 killed in Israeli shelling of shelter,no description,https://www.lemonde.fr/en/international/article/2025/12/19/gaza-civil-defense-says-5-killed-in-israeli-shelling-of-shelter_6748685_4.html,,False,https://img.lemde.fr/2025/12/19/0/0/5845/3896/198/132/95/0/6e7b8aa_ftp-1-douwzrvii3b0-040f36b890de45739a9836e4210e724b-0-4369f535f10241f1b87cc1991fa78d6c.jpg,
37,Perrier: Nestlé allowed to continue natural mineral water production despite recent contamination incidents,no description,https://www.lemonde.fr/en/environment/article/2025/12/19/perrier-nestle-allowed-to-continue-natural-mineral-water-production-despite-recent-contamination-incidents_6748673_114.html,,True,https://img.lemde.fr/2025/12/19/0/0/5760/3840/198/132/95/0/a0e0316_upload-1-mxblfcnvzsdl-sipa-00893956-000019.jpg,
38,Finland faces yet another racist scandal,no description,https://www.lemonde.fr/en/international/article/2025/12/20/finland-faces-yet-another-racist-scandal_6748691_4.html,,True,https://img.lemde.fr/2025/12/12/0/0/6144/4096/198/132/95/0/80affc2_ftp-1-mcenoaw4iqiy-1e24922755464a71ad58a71273e923d1-0-a1a103081d144b209392e008988f71b8.jpg,
39,"After a month of Shein at French department store BHV, controversy fails to boost sales",no description,https://www.lemonde.fr/en/economy/article/2025/12/20/after-a-month-of-shein-at-french-department-store-bhv-controversy-fails-to-boost-sales_6748688_19.html,,True,,
40,Trump dogged by cost of living crisis and Republican revolt,no description,https://www.lemonde.fr/en/international/article/2025/12/19/trump-dogged-by-cost-of-living-crisis-and-republican-dissent_6748663_4.html,,True,,
41,Rubio says won't force deal on Ukraine as Europeans join Miami talks,no description,https://www.lemonde.fr/en/international/article/2025/12/19/rubio-says-won-t-force-deal-on-ukraine-as-europeans-join-miami-talks_6748684_4.html,,False,,
42,US sets record defense budget but imposes limits on Donald Trump's military ambitions,no description,https://www.lemonde.fr/en/international/article/2025/12/19/us-sets-record-defense-budget-but-imposes-limits-on-donald-trump-s-military-ambitions_6748683_4.html,,True,,
43,"Louvre staff call off strike and museum to open 'as normal,' unions say",no description,https://www.lemonde.fr/en/france/article/2025/12/19/louvre-staff-call-off-strike-museum-to-open-as-normal-unions_6748665_7.html,,False,,
44,French public debt reaches a new high at 117.4% of GDP,no description,https://www.lemonde.fr/en/politics/article/2025/12/19/french-public-debt-reaches-a-new-high-at-117-4-of-gdp_6748671_5.html,,True,,
45,"Astoria, Zohran Mamdani's working-class New York",no description,https://www.lemonde.fr/en/m-le-mag/article/2025/12/19/astoria-zohran-mamdani-s-working-class-new-york_6748657_117.html,,True,,
46,EU to loan €90 billion to Ukraine while delaying Mercosur deal,no description,https://www.lemonde.fr/en/international/article/2025/12/19/eu-to-loan-90-billion-to-ukraine-amid-delay-to-mercosur-deal_6748666_4.html,,True,,
47,'It is easier to flatter the people than to serve. Therein lies the last obstacle to an RN victory in 2027',"Populism has never been stronger in France, but there is a crucial difference between flattering the people and serving them, and the Rassemblement National is currently stumbling on that divide, writes Le Monde columnist Françoise Fressoz.",https://www.lemonde.fr/en/opinion/article/2025/12/16/it-is-easier-to-flatter-the-people-than-to-serve-therein-lies-the-last-obstacle-to-an-rn-victory-in-2027_6748559_23.html,Françoise Fressoz,True,https://img.lemde.fr/2025/06/09/0/0/4747/3165/664/442/75/0/cac918e_ftp-import-images-1-4qw2zufkberx-2025-06-09t143924z-2426115-rc21zeamdo8l-rtrmadp-3-eu-farright.JPG,Column
48,A French farmer's distress: 'I found the first dead cow when I went to the pasture',"Near Benque, a village an hour from Toulouse, farmer Christian Lasserre discovered three carcasses on Saturday. He fears a new outbreak of lumpy skin disease and the culling of the entire herd.",https://www.lemonde.fr/en/economy/article/2025/12/17/a-french-farmer-s-distress-i-found-the-first-dead-cow-when-i-went-to-the-pasture_6748577_19.html,Raphaëlle Bacqué,True,https://img.lemde.fr/2025/12/14/107/0/4500/3000/664/442/75/0/f6f1887_upload-1-lot8fatesqby-mfache-14122025-le-monde-blocage-agriculteurs-au-pied-du-calvaire-haute-garonne-060.jpg,Feature
49,Minnesota's Somali community stands up to Trump: 'We are no less American than other Americans',"After the revelation of a Covid-19 relief fraud scheme involving nearly 80 individuals of Somali origin, the American president deployed immigration police within the large Somali community in Minnesota, whose members are predominantly US citizens.",https://www.lemonde.fr/en/international/article/2025/12/16/minnesota-s-somali-community-stands-up-to-trump-we-are-no-less-american-than-other-americans_6748564_4.html,Nicolas Chapuis,True,https://img.lemde.fr/2025/12/13/1/0/7848/5232/664/442/75/0/8e93b18_upload-1-vysuibbjvrkr-srjge0055.JPG,Feature
50,Trump and the risks of adventurism in Venezuela,no description,https://www.lemonde.fr/en/opinion/article/2025/12/19/trump-and-the-risks-of-adventurism-in-venezuela_6748678_23.html,Le Monde,False,,Editorial
51,"'Freed from the Western bogeyman, countries of the Global South would quickly be dominated by the Chinese superpower'",no description,https://www.lemonde.fr/en/opinion/article/2025/12/17/freed-from-the-western-bogeyman-countries-of-the-global-south-would-quickly-be-dominated-by-the-chinese-superpower_6748607_23.html,Gilles Paris,,https://img.lemde.fr/2022/03/18/0/0/0/0/100/100/60/0/bfe4dc9_1647595527633-f2df5fa-237.jpeg,Column
52,"Sydney attack: 'Relatively spared from terrorism, Australia is therefore less prepared for it'",no description,https://www.lemonde.fr/en/opinion/article/2025/12/19/sydney-attack-relatively-spared-from-terrorism-australia-is-therefore-less-prepared-for-it_6748659_23.html,Romain Fathi,,,Op-Ed
