,headline,description,url,byline,premium,image_url,article type
0,"Laos' 4,000 Islands archipelago grapples with China's economic expansion",no description,https://www.lemonde.fr/en/international/article/2025/12/27/laos-4-000-islands-archipelago-grapples-with-china-s-economic-expansion_6748861_4.html,,True,,
1,"Mariupol, Ukraine: A model city of 'new Russia'",no description,https://www.lemonde.fr/en/international/article/2025/12/26/mariupol-ukraine-a-model-city-of-new-russia_6748856_4.html,,True,,
2,"Trump orders strikes on 'terrorists' in Nigeria, bolstering cooperation with Abuja",no description,https://www.lemonde.fr/en/international/article/2025/12/26/trump-orders-strikes-on-terrorists-in-nigeria-bolstering-cooperation-with-abuja_6748854_4.html,,True,,
3,Where have all the New York City children gone?,no description,https://www.lemonde.fr/en/international/article/2025/12/26/where-have-all-the-new-york-city-children-gone_6748853_4.html,,True,,
4,'Trump's ideological challenge to Europe is more dangerous than the security one',no description,https://www.lemonde.fr/en/opinion/article/2025/12/11/trump-s-ideological-challenge-to-europe-is-more-dangerous-than-the-security-one_6748393_23.html,,True,,
5,"Attacked by Trump, Europe wavers between denial and fear of reprisals",no description,https://www.lemonde.fr/en/international/article/2025/12/11/attacked-by-trump-europe-wavers-between-denial-and-fear-of-reprisals_6748382_4.html,,True,,
6,Bosnia and Herzegovina's Serb entity elects ally of  former leader Dodik,no description,https://www.lemonde.fr/en/international/article/2025/11/24/bosnia-and-herzegovina-s-serb-entity-elects-ally-of-former-leader-dodik_6747765_4.html,,True,,
7,"In France's Somme, bagpipers keep the memory of the Great War alive",no description,https://www.lemonde.fr/en/history/article/2025/11/11/in-france-s-somme-bagpipers-keep-the-memory-of-the-great-war-alive_6747347_157.html,,True,,
8,"Three women stabbed in the Paris metro, a suspect has been arrested",no description,https://www.lemonde.fr/en/france/article/2025/12/26/three-women-stabbed-in-the-paris-metro-a-suspect-has-been-arrested_6748857_7.html,,False,,
9,Why more young people are turning to religion,no description,https://www.lemonde.fr/en/france/article/2025/12/25/why-more-young-people-are-turning-to-religion_6748827_7.html,,True,,
10,French biathlon team races ahead on the unpredictable road to the Olympics,no description,https://www.lemonde.fr/en/sports/article/2025/12/25/french-biathlon-team-races-ahead-on-the-unpredictable-road-to-the-olympics_6748823_9.html,,True,,
11,"'Knowing they will all be together without me is hard': Christmas, a lonely time for many struggling students",no description,https://www.lemonde.fr/en/france/article/2025/12/24/knowing-they-will-all-be-together-without-me-is-hard-christmas-a-time-of-loneliness-for-many-struggling-students_6748800_7.html,,True,,
12,The French studio behind a viral Christmas ad,no description,https://www.lemonde.fr/en/videos/video/2025/12/12/the-french-studio-behind-a-viral-christmas-ad_6748436_108.html,,False,,
13,"Israel's D9 bulldozer, a tool of destruction in Gaza",no description,https://www.lemonde.fr/en/videos/video/2025/11/27/israel-s-d9-bulldozer-a-tool-of-destruction-in-gaza_6747870_108.html,,True,,
14,"Ukraine's Pokrovsk faces fierce fighting, footage analyzed by Le Monde reveals",no description,https://www.lemonde.fr/en/videos/video/2025/11/21/ukraine-s-pokrovsk-faces-fierce-fighting-footage-analyzed-by-le-monde-reveals_6747708_108.html,,True,,
15,Afghanistan: Relentless repression continues over four years into Taliban's rule,no description,https://www.lemonde.fr/en/videos/video/2025/10/04/afghanistan-relentless-repression-continues-over-four-years-into-taliban-s-rule_6746092_108.html,,False,,
16,'Trump is coming to terms with his own planned obsolescence',no description,https://www.lemonde.fr/en/opinion/article/2025/12/26/trump-is-coming-to-terms-with-his-own-planned-obsolescence_6748840_23.html,,True,,
17,'The myth of 'European censorship' is wielded by the Trump administration to avoid regulating Big Tech',no description,https://www.lemonde.fr/en/opinion/article/2025/12/26/the-myth-of-european-censorship-is-wielded-by-the-trump-administration-to-avoid-regulating-big-tech_6748855_23.html,,True,,
18,Trump's uncertain peace in Africa's Great Lakes region,no description,https://www.lemonde.fr/en/opinion/article/2025/12/26/trump-s-uncertain-peace-in-africa-s-great-lakes-region_6748851_23.html,,False,,
19,2026 budget: The risk of deadlock,no description,https://www.lemonde.fr/en/opinion/article/2025/12/24/2026-budget-the-risk-of-deadlock_6748812_23.html,,False,,
20,"At Marseille's MuCEM, an exhibition explores the sunken island of Ferdinandea",no description,https://www.lemonde.fr/en/m-le-mag/article/2025/12/27/at-marseille-s-mucem-an-exhibition-explores-the-sunken-island-of-ferdinandea_6748860_117.html,,True,,
21,Disneyland Paris at 40: When Mickey Mouse said 'bonjour' to Paris,no description,https://www.lemonde.fr/en/m-le-mag/article/2025/12/22/disneyland-paris-at-40-when-mickey-mouse-said-bonjour-to-paris_6748740_117.html,,True,,
22,Madagascar's metalheads lead charge of anger: 'It's easier to make yourself heard when you scream',no description,https://www.lemonde.fr/en/m-le-mag/article/2025/12/21/madagascar-s-metalheads-lead-charge-of-anger-it-s-easier-to-make-yourself-heard-when-you-scream_6748730_117.html,,True,,
23,Da Vinci's secret tunnels at Milan's Sforza Castle appear to be nothing more than sewers,no description,https://www.lemonde.fr/en/m-le-mag/article/2025/12/21/da-vinci-s-secret-tunnels-at-milan-s-sforza-castle-appear-to-be-nothing-more-than-sewers_6748712_117.html,,True,,
24,Five creative craft workshops to enjoy doing in Paris with your child,no description,https://www.lemonde.fr/en/intimacy/article/2025/12/13/in-paris-five-creative-craft-workshops-to-enjoy-doing-with-your-child_6748451_310.html,,True,,
25,Jewels of power go on display in Paris,no description,https://www.lemonde.fr/en/culture/article/2025/12/11/the-power-gems-on-display-in-paris_6748374_30.html,,False,,
26,Five spots in Paris to enjoy a (great) plant-based sandwich,no description,https://www.lemonde.fr/en/lifestyle/article/2025/12/04/in-paris-five-spots-to-enjoy-a-great-plant-based-sandwich_6748131_37.html,,True,,
27,"Bayonne's 'Little Louvre,' the Bonnat-Helleu Museum, reopens after 14 years",no description,https://www.lemonde.fr/en/culture/article/2025/11/28/bayonne-s-little-louvre-the-bonnat-helleu-museum-reopens-after-14-years_6747913_30.html,,True,,
28,"Mariupol, Ukraine: A model city of 'new Russia'","Since 2015, photographer Gabriele Micalizzi has been documenting the Donbas region from the Russian side of the front line, an area where Moscow enforces very strict access conditions for journalists. In November, he secured permission to enter Donetsk Oblast, a region of occupied Ukraine, and traveled to Mariupol, a city destroyed by Russian forces in 2022, which has since been colonized and rebuilt in record time.",https://www.lemonde.fr/en/international/article/2025/12/26/mariupol-ukraine-a-model-city-of-new-russia_6748856_4.html,,True,https://img.lemde.fr/2025/12/12/0/2/2995/1997/400/266/75/0/a1cd417_upload-1-vft2koqhy7vm-mig2025026-g-l9452742.jpg,
29,"Three women stabbed in the Paris metro, a suspect has been arrested",no description,https://www.lemonde.fr/en/france/article/2025/12/26/three-women-stabbed-in-the-paris-metro-a-suspect-has-been-arrested_6748857_7.html,,False,https://img.lemde.fr/2024/10/24/0/0/2250/1500/398/265/75/0/fb05b64_1729786778193-frame-157.jpg,
30,"Trump orders strikes on 'terrorists' in Nigeria, bolstering cooperation with Abuja",no description,https://www.lemonde.fr/en/international/article/2025/12/26/trump-orders-strikes-on-terrorists-in-nigeria-bolstering-cooperation-with-abuja_6748854_4.html,,True,https://img.lemde.fr/2025/12/26/0/268/2898/1932/398/265/75/0/db52eea_ftp-1-ilm9uphuv2gz-2025-12-26t065446z-1838506797-rc26oiaipi5m-rtrmadp-3-usa-trump-nigeria.JPG,
31,Yemen separatists defy alleged Saudi air strikes as tensions escalate,Emirati-backed separatists in Yemen said they would press ahead with their campaign to restore an independent south after air strikes blamed on Saudi Arabia hit their positions.,https://www.lemonde.fr/en/international/article/2025/12/27/yemen-separatists-defy-alleged-saudi-air-strikes-as-tensions-escalate_6748859_4.html,,False,https://img.lemde.fr/2025/12/25/0/0/5472/3648/398/265/75/0/cbb7e31_ftp-1-fw0ieenul9ou-0350d586a7b74df69e073ab72396edab-0-941e0c97c28a41f599bff36fa66ededc.jpg,
32,"In Belarus, the shadow political prisoners","Beyond the roughly 1,000 political prisoners who have been officially identified, hundreds more languish in prison without being recorded. The regime of Alexander Lukashenko has done everything it can to keep them hidden and ensure they are forgotten.",https://www.lemonde.fr/en/international/article/2025/12/26/in-belarus-the-shadow-political-prisoners_6748846_4.html,,True,https://img.lemde.fr/2025/12/23/1136/0/3500/2333/398/265/75/0/548a4e2_upload-1-8j4r4lseqqhl-00066-belarus-political-prisoners-16dec2025-vilnius.jpg,
33,"At Marseille's MuCEM, an exhibition explores the sunken island of Ferdinandea","Until September 20, 2026, at the MuCEM in Marseille, artist Clément Cogitore dedicates an exhibit to Ferdinandea, a short-lived island off the coast of Sicily that appeared in the 19th century following a volcanic eruption and was later submerged.",https://www.lemonde.fr/en/m-le-mag/article/2025/12/27/at-marseille-s-mucem-an-exhibition-explores-the-sunken-island-of-ferdinandea_6748860_117.html,,True,https://img.lemde.fr/2025/12/12/262/0/1125/750/398/265/75/0/20d104f_ftp-1-3npmjwpsogtv-409711-3448907.jpg,
34,"In the home of Zara, at the heart of fashion photography","In just four years, Marta Ortega Pérez, head of the Spanish group Inditex, has transformed her foundation in A Coruña, Galicia, into a venue showcasing the greats of fashion photography. Following retrospectives dedicated to Peter Lindbergh, Irving Penn and Helmut Newton, American photographer Annie Leibovitz has been exhibiting her work in this former industrial building in the port since the end of November.",https://www.lemonde.fr/en/lifestyle/article/2025/12/26/in-the-home-of-zara-at-the-heart-of-fashion-photography_6748858_37.html,Raphaël Malkin,True,https://img.lemde.fr/2025/12/12/62/0/1500/1000/664/442/75/0/e14f680_ftp-1-rhritwxwvpux-409844-3450336.jpg,Feature
35,"Laos' 4,000 Islands archipelago grapples with China's economic expansion",no description,https://www.lemonde.fr/en/international/article/2025/12/27/laos-4-000-islands-archipelago-grapples-with-china-s-economic-expansion_6748861_4.html,,True,https://img.lemde.fr/2025/12/19/85/0/2048/1365/198/132/95/0/f69429c_upload-1-l32g2q18uc3t-pontfranc-ais1920dec4-2025.JPEG,
36,Where have all the New York City children gone?,no description,https://www.lemonde.fr/en/international/article/2025/12/26/where-have-all-the-new-york-city-children-gone_6748853_4.html,,True,https://img.lemde.fr/2025/12/18/69/0/3971/2647/198/132/95/0/c18bc1e_upload-1-uaj5bbxttrsb-dsc4395.jpeg,
37,"Semiconductors: ASML, the tech giant at the center of the US-China conflict in the race for AI",no description,https://www.lemonde.fr/en/economy/article/2025/12/26/semiconductors-asml-the-tech-giant-at-the-center-of-the-us-china-conflict-in-the-race-for-ai_6748844_19.html,,True,https://img.lemde.fr/2025/12/23/0/0/5146/3431/198/132/95/0/0924ea7_upload-1-oacsngq6m9fl-2023-07-07t101423z-1002194652-rc2ck1aq7zho-rtrmadp-3-netherlands-economy-asml.JPG,
38,"Arthur Hadade, the chameleon who launched the 'Spotify of contemporary art'",no description,https://www.lemonde.fr/en/campus/article/2025/12/26/arthur-hadade-the-chameleon-who-launched-the-spotify-of-contemporary-art_6748841_11.html,,True,https://img.lemde.fr/2025/12/02/1136/0/4480/2986/198/132/95/0/e54099f_upload-1-7aa0jyxuj8yo-cur8.jpg,
39,Prosecutors seek 10-year sentence for ousted South Korea president over martial law bid,no description,https://www.lemonde.fr/en/international/article/2025/12/26/prosecutors-seek-10-year-sentence-for-ousted-south-korea-president-over-martial-law-bid_6748847_4.html,,False,,
40,Russians are evading sanctions with fake Romanian documents,no description,https://www.lemonde.fr/en/international/article/2025/12/26/russians-are-evading-sanctions-with-fake-romanian-documents_6748839_4.html,,True,,
41,Turkey detains dozens of IS suspects planning attacks on Christmas and New Year's celebrations,no description,https://www.lemonde.fr/en/international/article/2025/12/26/turkey-detains-dozens-of-is-suspects-planning-attacks-on-christmas-and-new-year-s-celebrations_6748834_4.html,,False,,
42,'Tyranny is booming': Kimmel warns of rising fascism in Christmas message to UK viewers,no description,https://www.lemonde.fr/en/culture/article/2025/12/26/tyranny-is-booming-kimmel-warns-of-rising-fascism-in-christmas-message-to-uk-viewers_6748835_30.html,,False,,
43,Former Malaysian PM Najib Razak convicted in corruption scandal,no description,https://www.lemonde.fr/en/international/article/2025/12/26/former-malaysian-pm-najib-razak-convicted-in-corruption-scandal_6748845_4.html,,False,,
44,North Korea's Kim Jong Un orders factories to make more missiles in 2026,no description,https://www.lemonde.fr/en/international/article/2025/12/26/north-korea-s-kim-jong-un-orders-factories-to-make-more-missiles-in-2026_6748838_4.html,,False,,
45,Pop goes the cocktail! Five champagne cocktail recipes for the end-of-year festivities,no description,https://www.lemonde.fr/en/lifestyle/article/2025/12/26/pop-goes-the-cocktail-five-champagne-cocktail-recipes-for-the-end-of-year-festivities_6748836_37.html,,True,,
46,Escaping New York's winter and its 'communist' mayor for Miami,no description,https://www.lemonde.fr/en/international/article/2025/12/25/escaping-new-york-s-winter-and-its-communist-mayor-for-miami_6748833_4.html,,True,,
47,Why more young people are turning to religion,"Many researchers have observed a resurgence of religious commitment among young people in France, often accompanied by a certain rigorism. This renewed spiritual quest is linked both to the anxieties of our era and, at times, a search for identity.",https://www.lemonde.fr/en/france/article/2025/12/25/why-more-young-people-are-turning-to-religion_6748827_7.html,Sarah Belouezzane,True,https://img.lemde.fr/2025/12/22/0/0/3543/2362/664/442/75/0/57386fe_upload-1-7ibjm61ya1sj-jeunesreligion.jpg,In Depth
48,Lumpy skin disease: Why are French farms experiencing so many animal disease outbreaks?,"Combined with globalized trade, the overall rise in temperatures driven by human-induced climate change has allowed insects and other vectors of diseases once confined to tropical regions to spread northward.",https://www.lemonde.fr/en/environment/article/2025/12/24/lumpy-skin-disease-why-are-french-farms-experiencing-so-many-animal-disease-outbreaks_6748798_114.html,Delphine Roucaute,True,https://img.lemde.fr/2025/12/17/0/4/4174/2783/664/442/75/0/80ad02c_ftp-1-atpceh6nabte-5703396-01-06.jpg,Explainer
49,Algeria demands 'apologies' and 'reparations' from France for its colonial past,"Algerian MPs passed a law on Wednesday, December 24, to 'criminalize French colonization,' amid ongoing diplomatic tensions between Algiers and Paris.",https://www.lemonde.fr/en/international/article/2025/12/24/algeria-demands-apologies-and-reparations-from-france-for-its-colonial-past_6748813_4.html,Frédéric Bobin and  Hamid Nasri,True,https://img.lemde.fr/2025/12/24/0/1/2406/1604/664/442/75/0/1f8d27b_upload-1-gzosvwpiw0as-000-8pn4wr.jpg,News
50,Trump's uncertain peace in Africa's Great Lakes region,no description,https://www.lemonde.fr/en/opinion/article/2025/12/26/trump-s-uncertain-peace-in-africa-s-great-lakes-region_6748851_23.html,Le Monde,False,,Editorial
51,2026 budget: The risk of deadlock,no description,https://www.lemonde.fr/en/opinion/article/2025/12/24/2026-budget-the-risk-of-deadlock_6748812_23.html,Le Monde,False,,Editorial
52,'Trump is coming to terms with his own planned obsolescence',no description,https://www.lemonde.fr/en/opinion/article/2025/12/26/trump-is-coming-to-terms-with-his-own-planned-obsolescence_6748840_23.html,Gilles Paris,,https://img.lemde.fr/2022/03/18/0/0/0/0/100/100/60/0/bfe4dc9_1647595527633-f2df5fa-237.jpeg,Column
