,headline,description,url,byline,premium,image_url,article type
0,"France is still trading uranium with Russia, nearly four years after Ukraine invasion","With uranium still spared from European Commission sanctions against Russia, the anti-nuclear NGO Greenpeace has highlighted that France remains tied to the Russian group Rosatom.",https://www.lemonde.fr/en/economy/article/2026/01/28/france-is-still-trading-uranium-with-russia-nearly-four-years-after-ukraine-invasion_6749895_19.html,,True,https://img.lemde.fr/2026/01/27/1/0/8192/5461/400/266/75/0/4ecf5e6_upload-1-v9arzbb5itnz-000-33bp8cx.jpg,
1,Capgemini in turmoil over its work with ICE,no description,https://www.lemonde.fr/en/economy/article/2026/01/28/capgemini-in-turmoil-over-its-work-with-ice_6749879_19.html,,True,https://img.lemde.fr/2026/01/22/0/0/5500/3666/398/265/75/0/796103a_ftp-1-nbq3mnwmfxs6-2026-01-22t123846z-1051895246-rc2c6jaod3ci-rtrmadp-3-davos-meeting.JPG,
2,"Greenland threat is a 'strategic wake-up call for all of Europe,' says Macron",no description,https://www.lemonde.fr/en/international/article/2026/01/28/greenland-threat-strategic-wake-up-call-for-all-of-europe-says-macron_6749890_4.html,,False,https://img.lemde.fr/2026/01/28/1/0/5900/3933/398/265/75/0/c098cd7_ftp-1-3m1bk5nixyqm-2026-01-28t125758z-1875793754-rc2cajau556y-rtrmadp-3-usa-trump-greenland-france.JPG,
3,Iran in collective shock after bloody crackdown,"Even though internet access remains mostly cut off, a few openings have allowed the population to grasp the unprecedented violence unleashed on protesters: tens of thousands killed, mass arrests, hospitals under surveillance and overcrowded prisons.",https://www.lemonde.fr/en/international/article/2026/01/28/after-the-crackdown-iran-is-in-a-state-of-collective-shock_6749876_4.html,,True,https://img.lemde.fr/2026/01/26/0/0/2500/1666/398/265/75/0/5e5672f_upload-1-swwwcfrwnxf4-06.jpg,
4,Half of new immigrants in France are students or refugees,"Legal immigration flows continue to rise, while economic immigration is declining and regularizations are falling, according to Interior Ministry figures published on Tuesday.",https://www.lemonde.fr/en/france/article/2026/01/28/half-of-new-immigrants-in-france-are-students-or-refugees_6749887_7.html,,True,https://img.lemde.fr/2026/01/27/0/0/4896/3264/398/265/75/0/0edec7e_ftp-1-t1udpbbeahdu-5997970-01-06.jpg,
5,Work-related cancers remain a blind spot in France's public health system,A study conducted by doctors and occupational sociologists at the Avignon Hospital Center on over 500 lymphoma patients found there was a 'massive underestimation' of work-related cancers in France.,https://www.lemonde.fr/en/environment/article/2026/01/28/work-related-cancers-remain-a-blind-spot-in-france-s-public-health-system_6749877_114.html,,True,https://img.lemde.fr/2026/01/26/303/0/1501/1000/398/265/75/0/fb3ccb9_upload-1-79rfi4tgioxo-asselin-pour-le-monde18.jpg,
6,"Paris Haute Couture Week: Chanel dazzles, Armani faces new challenge","Matthieu Blazy delivered his first light and airy haute couture show for Chanel, while Armani Privé unveiled its debut collection without Giorgio Armani.",https://www.lemonde.fr/en/lifestyle/article/2026/01/28/paris-haute-couture-week-chanel-dazzles-armani-faces-new-challenge_6749883_37.html,Elvire von Bardeleben and  Valentin Pérez,False,https://img.lemde.fr/2026/01/28/0/0/8256/5504/664/442/75/0/ba4931c_upload-1-l3bfn8r6bgep-chanel-spring-summer-2026-haute-couture-chanel-1-9-hd.jpg,Feature
7,French Parliament's lessons from a monthslong budget battle,no description,https://www.lemonde.fr/en/politics/article/2026/01/28/french-parliament-s-lessons-from-a-monthslong-budget-battle_6749888_5.html,,True,https://img.lemde.fr/2026/01/28/0/0/5899/3933/198/132/95/0/cca2a96_upload-1-6yhvgbkq8230-jmug260127002.jpg,
8,How India and the EU created a common market to counter Trump,no description,https://www.lemonde.fr/en/economy/article/2026/01/28/how-india-and-the-eu-created-a-common-market-to-counter-trump_6749870_19.html,,True,https://img.lemde.fr/2026/01/27/0/0/2646/1764/198/132/95/0/e791e45_ftp-1-mwbqlqlh27ok-d3d0ed2451624237a90f08fa8bfc4668-1-09411701743346e88232767ac427f28b.jpg,
9,Former French senator found guilty of drugging MP with intent to sexually assault or rape,no description,https://www.lemonde.fr/en/france/article/2026/01/28/former-french-senator-found-guilty-of-drugging-mp-with-intent-to-sexually-assault-or-rape_6749878_7.html,,True,https://img.lemde.fr/2026/01/27/1/0/6299/4199/198/132/95/0/5550ccb_ftp-1-17rbfxcywy7v-59fda3167a5445bd84fbabffa846d3d7-0-548c8625d5a448ccbbc443ba2bcef949.jpg,
10,Paris men's fashion: Saint Laurent showcases raw elegance,no description,https://www.lemonde.fr/en/lifestyle/article/2026/01/28/paris-men-s-fashion-saint-laurent-showcases-raw-elegance_6749894_37.html,,False,https://img.lemde.fr/2026/01/27/0/0/6000/4000/198/132/95/0/22086c3_ftp-1-r6mqfsvmydow-5002874-01-06.jpg,
11,Trump says he will 'de-escalate' in Minneapolis after shooting backlash,no description,https://www.lemonde.fr/en/global-issues/article/2026/01/28/trump-says-will-de-escalate-in-minneapolis-after-shooting-backlash-rejects-assassin-label-used-for-pretti_6749868_199.html,,False,,
12,Judge temporarily blocks deportation of 5-year-old  detained by ICE,no description,https://www.lemonde.fr/en/international/article/2026/01/28/judge-temporarily-blocks-deportation-of-5-year-old-child-detained-by-ice_6749874_4.html,,False,,
13,Le Pen's appeal trial: Far-right ex-assistants struggle to justify their jobs,no description,https://www.lemonde.fr/en/france/article/2026/01/28/le-pen-s-appeal-trial-far-right-ex-assistants-struggle-to-justify-their-jobs_6749880_7.html,,True,,
14,"French Parliament aims to abolish 'marital duty,' an outdated concept",no description,https://www.lemonde.fr/en/politics/article/2026/01/28/the-assemblee-nationale-aims-to-abolish-marital-duty_6749872_5.html,,True,,
15,Victor Wembanyama 'horrified' by ICE killings of Renee Good and Alex Pretti,no description,https://www.lemonde.fr/en/international/video/2026/01/28/victor-wembanyama-horrified-by-ice-killings-of-renee-good-and-alex-pretti_6749884_4.html,,False,,
16,'The Wizard of the Kremlin': Inside the turbulent Latvian shoot of Assayas's film,no description,https://www.lemonde.fr/en/culture/article/2026/01/27/the-wizard-of-the-kremlin-inside-the-turbulent-latvian-shoot-of-assayas-film_6749862_30.html,,True,,
17,Rugby: Heart attack ends iconic French prop Atonio's career,no description,https://www.lemonde.fr/en/sports/article/2026/01/28/rugby-heart-attack-ends-iconic-french-prop-atonio-s-career_6749881_9.html,,False,,
18,Paris's Musée Marmottan Monet explores the mysterious state of sleep,no description,https://www.lemonde.fr/en/culture/article/2026/01/28/new-exhibit-at-the-musee-marmottan-monet-explores-the-mysterious-state-of-sleep_6749873_30.html,,True,,
19,Why there are so many French presidential hopefuls,"As a result of political fragmentation, the growing number of figures who have declared their candidacies or are thinking about doing so is making the 2027 presidential election highly uncertain, writes Le Monde's Solenn de Royer in her column.",https://www.lemonde.fr/en/politics/article/2026/01/27/why-there-are-so-many-french-presidential-hopefuls_6749847_5.html,Solenn de Royer,True,https://img.lemde.fr/2026/01/06/0/0/3000/2000/664/442/75/0/7413969_upload-1-xu9q28ewr6iu-frame-1357.png,Column
20,Richard Ford: 'I tell my European friends how it feels not to understand my country',"The novelist expresses concern, in an op-ed for Le Monde, about the direction his country has taken under President Donald Trump. He laments that Americans do not appear to pay attention to the erosion of their constitutional rights, nor do they grasp how difficult it will be to turn back.",https://www.lemonde.fr/en/opinion/article/2026/01/26/richard-ford-i-tell-my-european-friends-how-it-feels-not-to-understand-my-country_6749832_23.html,Richard Ford,True,https://img.lemde.fr/2026/01/23/7/0/2317/1544/664/442/75/0/828b57a_upload-1-j0sh5bkugzno-000-ny43g.jpg,Op-Ed
21,"Footage shows death of Alex Pretti, killed by US Border Patrol in Minneapolis",The 37-year-old nurse was killed Saturday after federal immigration agents fired at least 10 shots.,https://www.lemonde.fr/en/international/video/2026/01/25/footage-shows-death-of-alex-pretti-killed-by-us-border-patrol-in-minneapolis_6749789_4.html,Le Monde's video desk,False,https://img.lemde.fr/2026/01/25/0/0/1186/790/664/442/75/0/fb7d328_ftp-1-5jzufsx0wnxl-2026-01-25t011454z-1505822313-rc2z7jadq4xu-rtrmadp-3-usa-trump-minnesota.JPG,Video
22,A pragmatic trade agreement between India and the EU,no description,https://www.lemonde.fr/en/opinion/article/2026/01/28/a-pragmatic-trade-agreement-between-india-and-the-eu_6749882_23.html,Le Monde,False,,Editorial
23,Europe: 'A new social federalism must be invented as the response of democratic states to empires',no description,https://www.lemonde.fr/en/opinion/article/2026/01/28/europe-a-new-social-federalism-must-be-invented-as-the-response-of-democratic-states-to-empires_6749891_23.html,Collective,,,Op-Ed
24,"France's municipal elections, a powerful indicator of the country's mood",no description,https://www.lemonde.fr/en/opinion/article/2026/01/27/france-s-municipal-elections-a-powerful-indicator-of-the-country-s-mood_6749852_23.html,Le Monde,False,,Editorial
