,headline,description,url,byline,premium,image_url,article type
0,Putin and Trump to meet in Alaska next week to discuss Ukrainian territorial concessions,no description,https://www.lemonde.fr/en/international/article/2025/08/09/putin-and-trump-to-meet-in-alaska-next-week-to-discuss-ukrainian-territorial-concessions_6744211_4.html,,True,,
1,"In Israel, ultra-Orthodox Jews are opposing Netanyahu to avoid conscription",no description,https://www.lemonde.fr/en/international/article/2025/08/09/in-israel-ultra-orthodox-jews-are-opposing-netanyahu-to-avoid-conscription_6744203_4.html,,True,,
2,Israel prepares to occupy the entire Gaza Strip,no description,https://www.lemonde.fr/en/international/article/2025/08/08/israel-prepares-to-occupy-the-entire-gaza-strip_6744189_4.html,,True,,
3,"After the arrest of Shaolin's 'CEO monk,' China is cracking down on Buddhist temples",no description,https://www.lemonde.fr/en/international/article/2025/08/08/after-the-arrest-of-shaolin-s-ceo-monk-china-is-cracking-down-on-buddhist-temples_6744186_4.html,,True,,
4,French man arrested in Slovenia for crimes committed in Croatia during 1991 war,no description,https://www.lemonde.fr/en/international/article/2025/08/06/french-man-arrested-in-slovenia-for-crimes-committed-in-croatia-during-1991-war_6744113_4.html,,True,,
5,"30 years after the Bosnian War, its refugees still cannot return home",no description,https://www.lemonde.fr/en/international/article/2025/08/03/thirty-years-after-the-bosnian-war-its-refugees-still-cannot-return-home_6744026_4.html,,True,,
6,Early and intense wildfire season has arrived around the Mediterranean,no description,https://www.lemonde.fr/en/europe/article/2025/07/17/wildfire-season-arrives-early-and-intense-around-the-mediterranean_6743466_143.html,,True,,
7,"Srebrenica massacre commemoration: 30 years later, the enduring bitterness of grieving families",no description,https://www.lemonde.fr/en/international/article/2025/07/12/srebrenica-massacre-commemoration-30-years-later-the-enduring-bitterness-of-grieving-families_6743301_4.html,,True,,
8,High heat threatens to reignite wildfires in southern France,no description,https://www.lemonde.fr/en/france/article/2025/08/08/high-heat-threatens-to-reignite-blaze-after-france-s-largest-wildfire-in-decades_6744195_7.html,,False,,
9,"In France, suicide affects men three times more than women",no description,https://www.lemonde.fr/en/france/article/2025/08/08/in-france-suicide-affects-men-three-times-more-than-women_6744184_7.html,,True,,
10,Extreme heat is causing more drownings in France,no description,https://www.lemonde.fr/en/france/article/2025/08/07/extreme-heat-is-causing-more-drownings-in-france_6744163_7.html,,True,,
11,Qatargate: French investigators scrutinize FIFA's contracts,no description,https://www.lemonde.fr/en/france/article/2025/08/06/qatargate-french-investigators-scrutinize-fifa-s-contracts_6744124_7.html,,True,,
12,Watch: Tsunami warnings sound in Japan after 8.8 magnitude quake off Russian coast,no description,https://www.lemonde.fr/en/videos/video/2025/07/30/watch-tsunami-warnings-sound-in-japan-after-8-8-magnitude-quake-off-russian-coast_6743900_108.html,,False,,
13,What is France's 'Black code' and why hasn't it been repealed?,no description,https://www.lemonde.fr/en/videos/video/2025/05/31/what-is-france-s-black-code-and-why-hasn-t-it-been-repealed_6741860_108.html,,False,,
14,How was the European Union created?,no description,https://www.lemonde.fr/en/videos/video/2025/05/29/how-was-the-european-union-created_6741795_108.html,,False,,
15,Glide bombs: Russia's secret to making cheap weapons,no description,https://www.lemonde.fr/en/videos/video/2025/05/25/glide-bombs-russia-s-secret-to-making-cheap-weapons_6741646_108.html,,True,,
16,Agnès Levallois: 'The war in Gaza is political and has no military rationale',no description,https://www.lemonde.fr/en/opinion/article/2025/08/08/agnes-levallois-the-war-in-gaza-is-political-and-has-no-military-rationale_6744201_23.html,,True,,
17,Gaza: Stopping Benjamin Netanyahu's tragic escalation,no description,https://www.lemonde.fr/en/opinion/article/2025/08/09/gaza-stopping-benjamin-netanyahu-s-tragic-escalation_6744212_23.html,,False,,
18,The Duplomb Law's partial blocking affirms a healthy environment as a constitutional right,no description,https://www.lemonde.fr/en/opinion/article/2025/08/08/the-duplomb-law-s-partial-blocking-affirms-a-healthy-environment-as-a-constitutional-right_6744190_23.html,,False,,
19,Trumpism: A political phenomenon that defies all definition,no description,https://www.lemonde.fr/en/opinion/article/2025/08/08/trumpism-a-political-phenomenon-that-defies-all-definition_6744182_23.html,,True,,
20,"A Hiroshima survivor breaks decades of silence: 'Speaking about it could be seen as shameful, for the person or their family'",no description,https://www.lemonde.fr/en/m-le-mag/article/2025/08/06/a-hiroshima-survivor-breaks-decades-of-silence-speaking-about-it-could-be-seen-as-shameful-for-the-person-or-their-family_6744103_117.html,,True,,
21,"China's 'Dalifornia,' a bohemian haven for young people searching for meaning",no description,https://www.lemonde.fr/en/m-le-mag/article/2025/08/02/china-s-dalifornia-a-bohemian-haven-for-young-people-searching-for-meaning_6744014_117.html,,True,,
22,"Retracing James Baldwin's footsteps in Istanbul, the city that saved his life",no description,https://www.lemonde.fr/en/m-le-mag/article/2025/07/27/retracing-james-baldwin-s-footsteps-in-istanbul-the-city-that-saved-his-life_6743763_117.html,,True,,
23,Three erotic experiences inspired by… your wardrobe,no description,https://www.lemonde.fr/en/m-le-mag/article/2025/07/22/three-erotic-experiences-inspired-by-your-wardrobe_6743593_117.html,,True,,
24,"At Musée d'Orsay, a Courbet painting gets a new life before visitors' eyes",no description,https://www.lemonde.fr/en/culture/article/2025/07/26/at-musee-d-orsay-a-courbet-painting-gets-a-new-life-before-visitors-eyes_6743744_30.html,,True,,
25,Avignon Festival 2025: An edition marked by emotion and fragility,no description,https://www.lemonde.fr/en/culture/article/2025/07/26/avignon-festival-2025-an-edition-marked-by-emotion-and-fragility_6743733_30.html,,True,,
26,The challenge of surtitling at the Avignon Festival,no description,https://www.lemonde.fr/en/culture/article/2025/07/20/the-challenge-of-surtitling-at-the-avignon-festival_6743560_30.html,,True,,
27,"In Arles, Fragonard's Museum of Fashion and Costume gracefully unveils treasures",no description,https://www.lemonde.fr/en/m-le-mag/article/2025/07/17/in-arles-fragonard-s-museum-of-fashion-and-costume-gracefully-unveils-treasures_6743450_117.html,,True,,
28,Putin and Trump to meet in Alaska next week to discuss Ukrainian territorial concessions,This will be the first meeting between the two leaders since the Republican returned to the White House. The US president has scored a not insignificant diplomatic win by hosting the summit on American soil.,https://www.lemonde.fr/en/international/article/2025/08/09/putin-and-trump-to-meet-in-alaska-next-week-to-discuss-ukrainian-territorial-concessions_6744211_4.html,,True,https://img.lemde.fr/2025/08/08/3/0/1458/972/400/266/75/0/65454b5_ftp-import-images-1-qd0axj04k5xq-5596350-01-06.jpg,
29,Gaza: Stopping Benjamin Netanyahu's tragic escalation,no description,https://www.lemonde.fr/en/opinion/article/2025/08/09/gaza-stopping-benjamin-netanyahu-s-tragic-escalation_6744212_23.html,,False,https://img.lemde.fr/2025/08/09/0/0/6000/4000/398/265/75/0/583778c_upload-1-io5jryahycqi-000-686q8w9.jpg,Editorial
30,"Ayn Rand's irresistible attraction to the dominance of the 'alpha male,' as embodied by Elon Musk",no description,https://www.lemonde.fr/en/summer-reads/article/2025/08/09/ayn-rand-s-irresistible-attraction-to-the-dominance-of-the-alpha-male-as-embodied-by-elon-musk_6744209_183.html,,True,https://img.lemde.fr/2025/07/28/74/0/3543/2362/398/265/75/0/ee8f5ed_upload-1-m67ljwrxcqze-lemonde-musk-2025-rand.jpg,
31,"Astronaut James Lovell, the man who never walked on the Moon, has died",The former US Navy pilot and commander of the Apollo 13 mission was the only member of the Apollo program to travel twice to the Moon without ever setting foot on its surface.,https://www.lemonde.fr/en/obituaries/article/2025/08/08/astronaut-james-lovell-the-man-who-never-walked-on-the-moon-has-died_6744200_15.html,,True,https://img.lemde.fr/2025/08/08/98/0/2276/1517/398/265/75/0/92b2586_upload-1-1asb40nbdzkh-ap6901010923.jpg,
32,Agnès Levallois: 'The war in Gaza is political and has no military rationale',"In an opinion piece for Le Monde, the vice president of the Institute for Research and Studies on the Mediterranean and the Middle East, analyzes statements by Israeli Prime Minister Benjamin Netanyahu, who has announced his intention to take full control of the Gaza Strip.",https://www.lemonde.fr/en/opinion/article/2025/08/08/agnes-levallois-the-war-in-gaza-is-political-and-has-no-military-rationale_6744201_23.html,,True,https://img.lemde.fr/2025/07/27/0/0/8640/5760/398/265/75/0/3ff36b9_ftp-import-images-1-q26h43lvpj2z-8db6e041e3e64cc4ba9c5dafa5ae88bf-0-000a2b61b8864877b03a312b86ae8aa6.jpg,
33,"Maryam, Afghan chef: 'Leaving Afghanistan brought a whirlwind of emotions, not knowing who you are anymore'","'Refugee Recipes' (5/6). Maryam left Afghanistan at the age of 13, crossing 11 countries to reach France. Along the way, in Turkey, she discovered kumpir – a stuffed baked potato – which has since become her lucky dish.",https://www.lemonde.fr/en/summer-reads/article/2025/08/09/maryam-afghan-chef-leaving-afghanistan-brought-a-whirlwind-of-emotions-not-knowing-who-you-are-anymore-migrating-to-find-yourself-again_6744206_183.html,,True,https://img.lemde.fr/2025/07/31/210/0/5000/3333/398/265/75/0/d0c4eb4_upload-1-bb3yhrvblmyo-725-recettes-refuges-001.jpg,
34,Boko Haram lures young people with no prospects from the Lake Chad area,"'Lake Chad's Troubled Waters' (4/4). In Chad's Lac province, 96% of the population is illiterate, and young people have resigned themselves to scraping by with intermittent jobs. This is a boon for the jihadist group, which recruits disadvantaged people by promising them a steady income.",https://www.lemonde.fr/en/le-monde-africa/article/2025/08/09/boko-haram-lures-young-people-with-no-prospects-from-the-lake-chad-area_6744214_124.html,Carol Valade,True,https://img.lemde.fr/2025/07/30/0/0/4200/2800/664/442/75/0/97c45ef_upload-1-vnijaipj1bud-bojo-lac-lemonde-12.jpg,Feature
35,Zelensky says Kyiv won't give up land as US-Russia summit confirmed,no description,https://www.lemonde.fr/en/international/article/2025/08/09/zelensky-says-kyiv-won-t-give-up-land-as-us-russia-summit-confirmed_6744215_4.html,,False,https://img.lemde.fr/2025/08/08/24/0/1691/1127/198/132/95/0/2743da5_ftp-import-images-1-iygfd4adqgw2-5596367-01-06.jpg,
36,Crew-10 astronauts head back to Earth after 5 months on SpaceX capsule,no description,https://www.lemonde.fr/en/international/article/2025/08/09/crew-10-astronauts-head-back-to-earth-after-5-months-on-spacex-capsule_6744205_4.html,,False,https://img.lemde.fr/2025/08/06/0/0/8256/5504/198/132/95/0/9dc3b99_ftp-import-images-1-hw2frtlesw7i-dd96ff5a02734b8d83f63b9822ed6186-0-de3ff5872b864c1d8544eaf6d3693e00.jpg,
37,"France's Constitutional Council partially blocks Duplomb Law, yet political battles continue",no description,https://www.lemonde.fr/en/politics/article/2025/08/08/france-s-constitutional-council-partially-blocks-duplomb-law-yet-political-battle-continues_6744187_5.html,,True,https://img.lemde.fr/2025/08/08/16/0/5184/3456/198/132/95/0/e60ef1f_upload-1-vpixeye2hnpc-080-hl-bohier-2815546.jpg,
38,Leaders of Armenia and Azerbaijan shake hands and sign deal at White House peace summit,no description,https://www.lemonde.fr/en/international/article/2025/08/09/leaders-of-armenia-and-azerbaijan-shake-hands-and-sign-deal-at-white-house-peace-summit_6744204_4.html,,False,https://img.lemde.fr/2025/08/08/0/0/4176/2784/198/132/95/0/4fcfdda_ftp-import-images-1-jcjhxoaiavbm-0e5bb7c18cfb4196a677c6f1151b9df0-0-cfc8bea6196f453d858623897136b77a.jpg,
39,"In Israel, ultra-Orthodox Jews are opposing Netanyahu to avoid conscription",no description,https://www.lemonde.fr/en/international/article/2025/08/09/in-israel-ultra-orthodox-jews-are-opposing-netanyahu-to-avoid-conscription_6744203_4.html,,True,,
40,Trump demands $1 billion from UCLA over last year's pro-Palestinian protests,no description,https://www.lemonde.fr/en/international/article/2025/08/09/trump-demands-1-billion-from-ucla-over-last-year-s-pro-palestinian-protests_6744208_4.html,,False,,
41,US partners seek relief as Trump tariffs upend global trade,no description,https://www.lemonde.fr/en/international/article/2025/08/08/us-partners-seek-relief-as-trump-tariffs-upend-global-trade_6744183_4.html,,False,,
42,"Direct mayoral elections in Paris, Lyon, Marseille get green light from France's top court",no description,https://www.lemonde.fr/en/politics/article/2025/08/08/direct-mayoral-elections-in-paris-lyon-marseille-get-green-light-from-france-s-top-court_6744192_5.html,,True,,
43,"ChatGPT: OpenAI launches GPT-5, the latest version of its language processing tool",no description,https://www.lemonde.fr/en/pixels/article/2025/08/08/chatgpt-openai-launches-gpt-5-the-latest-version-of-its-language-processing-tool_6744176_13.html,,True,,
44,The advantage of tiny lemurs as research subjects,no description,https://www.lemonde.fr/en/science/article/2025/08/08/the-advantage-of-tiny-lemurs-as-research-subjects_6744178_10.html,,True,,
45,"On an Indonesian island, traces of human presence over one million years old have been discovered",no description,https://www.lemonde.fr/en/science/article/2025/08/08/on-an-indonesian-island-traces-of-human-presence-over-one-million-years-old-have-been-discovered_6744181_10.html,,True,,
46,"'Here, you can dress however you want': Women-only parties make crowds feel freer",no description,https://www.lemonde.fr/en/summer-reads/article/2025/08/08/here-you-can-dress-however-you-want-women-only-parties-make-crowds-feel-freer_6744185_183.html,,True,,
47,"Life with a disfigured face: 'You never get used to others' stares, you just live with it'","Whether due to an accident or illness, a major facial alteration can profoundly disrupt one's sense of identity. People who have been disfigured describe the painful processes of reclaiming their lives.",https://www.lemonde.fr/en/intimacy/article/2025/08/08/life-with-a-disfigured-face-you-never-get-used-to-others-stares-you-just-live-with-it_6744198_310.html,Adam Lebert,True,https://img.lemde.fr/2025/07/29/2321/0/5455/3636/664/442/75/0/81b1292_upload-1-xpbd6vromym2-hl-avolker-9855-2.jpg,Investigation
48,"Mojgan Habibi, chef: 'Before, I was afraid of everything. Now, I have found my freedom'","'Refuge Recipes' (4/6). Iranian native Mojgan Habibi is the breakfast chef at Hôtel du Couvent in Nice. Khoresht mast, a dish reserved for special occasions and made with yogurt, spices, honey and meat, brings back memories of her happy youth in Isfahan before her marriage, when she was free to create and sing.",https://www.lemonde.fr/en/summer-reads/article/2025/08/06/mojgan-habibi-chef-before-i-was-afraid-of-everything-now-i-have-found-my-freedom_6744130_183.html,Camille Labro,True,https://img.lemde.fr/2025/07/24/205/0/1125/750/664/442/75/0/b4f352d_ftp-import-images-1-d6ol0ra8jrrw-391411-3432698.jpg,Your stories
49,'We are far too eager to entrust the management of the world to AI instead of recognizing its limits',"Media historian Jérôme Bourdon reminds readers that artificial intelligence is part of a long human history, and questions whether this technological revolution is on the verge of becoming a new religion.",https://www.lemonde.fr/en/opinion/article/2025/08/08/we-are-far-too-eager-to-entrust-the-management-of-the-world-to-ai-instead-of-recognizing-its-limits_6744180_23.html,Jérôme Bourdon,True,https://img.lemde.fr/2025/07/24/0/92/2815/1877/664/442/75/0/6b3acad_ftp-import-images-1-ynf0ddcncapn-2025-07-24t104735z-730988214-rc2q56awiabd-rtrmadp-3-relx-results.JPG,Op-Ed
50,The Duplomb Law's partial blocking affirms a healthy environment as a constitutional right,no description,https://www.lemonde.fr/en/opinion/article/2025/08/08/the-duplomb-law-s-partial-blocking-affirms-a-healthy-environment-as-a-constitutional-right_6744190_23.html,Le Monde,False,,Editorial
51,"Leila Sansour: 'This is not a war between religions, but a brutal domination of one people by another'",no description,https://www.lemonde.fr/en/opinion/article/2025/08/04/leila-sansour-this-is-not-a-war-between-religions-but-a-brutal-domination-of-one-people-by-another_6744059_23.html,Leila Sansour,,,Op-Ed
52,"Wildfires: 'We must make prevention a political and collective priority, commensurate with the new challenges posed by climate change'",no description,https://www.lemonde.fr/en/opinion/article/2025/08/08/wildfires-we-must-make-prevention-a-political-and-collective-priority-commensurate-with-the-new-challenges-posed-by-climate-change_6744177_23.html,Damien Ballereau,,,Op-Ed
