,headline,description,url,byline,premium,image_url,article type
0,Sanae Takaichi becomes Japan's first woman prime minister,no description,https://www.lemonde.fr/en/international/article/2025/10/21/sanae-takaichi-becomes-japan-s-first-woman-prime-minister_6746638_4.html,,True,,
1,Putin's tortuous flight plan to Budapest,no description,https://www.lemonde.fr/en/international/article/2025/10/21/putin-s-tortuous-flight-plan-to-budapest_6746633_4.html,,True,,
2,A Gaza hospital director remains imprisoned by Israel,no description,https://www.lemonde.fr/en/international/article/2025/10/21/a-gaza-hospital-director-remains-imprisoned-by-israel_6746623_4.html,,True,,
3,Colombia criticizes US after it strikes boats on pretext of fighting 'narcoterrorism',no description,https://www.lemonde.fr/en/international/article/2025/10/21/colombia-criticizes-the-us-after-it-strikes-boats-under-the-pretext-of-fighting-narcoterrorism_6746622_4.html,,True,,
4,"After Charlie Kirk's murder, Europe's far right swears allegiance to Trump's politics",no description,https://www.lemonde.fr/en/les-decodeurs/article/2025/10/20/the-murder-of-charlie-kirk-how-europe-s-far-right-swore-allegiance-to-trump-s-politics_6746586_8.html,,True,,
5,Sanctions against Russia spark rift between US and Europe over China,no description,https://www.lemonde.fr/en/international/article/2025/09/15/sanctions-against-russia-spark-rift-between-us-and-europe-over-china_6745411_4.html,,True,,
6,France's political instability puts Franco-German alliance to the test,no description,https://www.lemonde.fr/en/opinion/article/2025/08/30/france-s-political-instability-puts-franco-german-alliance-to-the-test_6744873_23.html,,False,,
7,France faces prospect of paying higher borrowing costs than Italy,no description,https://www.lemonde.fr/en/economy/article/2025/08/19/france-faces-prospect-of-paying-higher-borrowing-costs-than-italy_6744519_19.html,,True,,
8,Spectacular Louvre heist highlights security flaws at world's largest museum,no description,https://www.lemonde.fr/en/france/article/2025/10/20/spectacular-louvre-heist-highlights-security-flaws-at-world-s-largest-museum_6746591_7.html,,True,,
9,Louvre heist captivates global news media,no description,https://www.lemonde.fr/en/france/video/2025/10/20/louvre-heist-captivates-global-news-media_6746604_7.html,,False,,
10,Louvre heist: Photos of the stolen jewels,no description,https://www.lemonde.fr/en/france/article/2025/10/20/louvre-heist-photos-of-the-stolen-jewels_6746590_7.html,,False,,
11,Four men charged in alleged plot to attack a Russian dissident in southern France,no description,https://www.lemonde.fr/en/france/article/2025/10/20/four-men-charged-in-alleged-plot-to-attack-russian-dissident-in-southern-france_6746584_7.html,,True,,
12,Afghanistan: Relentless repression continues over four years into Taliban's rule,no description,https://www.lemonde.fr/en/videos/video/2025/10/04/afghanistan-relentless-repression-continues-over-four-years-into-taliban-s-rule_6746092_108.html,,False,,
13,Watch: Hundreds of thousands march in France against budget cuts,no description,https://www.lemonde.fr/en/videos/video/2025/09/19/french-strikes-watch-what-happened-as-hundreds-of-thousands-marched-against-budget-cuts_6745548_108.html,,False,,
14,Emmys 2025: 'Adolescence' star Owen Cooper becomes youngest winner for best supporting actor,no description,https://www.lemonde.fr/en/videos/video/2025/09/15/emmys-2025-adolescence-star-owen-cooper-becomes-youngest-winner-for-best-supporting-actor_6745427_108.html,,False,,
15,"From 'influence peddling' to 'corruption,' what is French Culture Minister Rachida Dati accused of?",no description,https://www.lemonde.fr/en/videos/video/2025/09/06/from-influence-peddling-to-corruption-what-is-french-culture-minister-rachida-dati-accused-of_6745094_108.html,,False,,
16,'Abandoning the corporate sustainability due diligence directive would be a historic mistake for Europe',no description,https://www.lemonde.fr/en/opinion/article/2025/10/20/abandoning-the-corporate-sustainability-due-diligence-directive-would-be-a-historic-mistake-for-europe_6746593_23.html,,True,,
17,Fragile Middle East ceasefire is tested by renewed violence in Gaza,no description,https://www.lemonde.fr/en/opinion/article/2025/10/21/fragile-middle-east-ceasefire-is-tested-by-renewed-violence-in-gaza_6746637_23.html,,False,,
18,'France has lost all budgetary credibility',no description,https://www.lemonde.fr/en/opinion/article/2025/10/21/france-has-lost-all-budgetary-credibility_6746627_23.html,,True,,
19,France's democratic crisis is showing increasingly alarming symptoms,no description,https://www.lemonde.fr/en/opinion/article/2025/10/21/france-s-democratic-crisis-is-showing-increasingly-alarming-symptons_6746626_23.html,,False,,
20,The wild Albanian island where the Trumps want to build a luxury hotel,no description,https://www.lemonde.fr/en/m-le-mag/article/2025/10/19/the-wild-albanian-island-where-the-trumps-want-bid-to-build-a-luxury-hotel_6746568_117.html,,True,,
21,"France's last military pigeons, custodians of a fading tradition",no description,https://www.lemonde.fr/en/m-le-mag/article/2025/10/17/france-s-last-military-pigeons-custodians-of-a-fading-tradition_6746510_117.html,,True,,
22,"Rabbi, drag queen and gay: Amichai Lau-Lavie, a Jewish trailblazer",no description,https://www.lemonde.fr/en/m-le-mag/article/2025/10/11/rabbi-drag-queen-and-gay-amichai-lau-lavie-a-jewish-trailblazer_6746337_117.html,,True,,
23,Matthieu Blazy: 'Just because Karl was a legend does not mean that everyone who designs for Chanel has to be one too',no description,https://www.lemonde.fr/en/m-le-mag/article/2025/10/08/chanel-s-new-face-matthieu-blazy-just-because-karl-was-a-legend-does-not-mean-that-everyone-who-designs-for-chanel-has-to-be-one-too_6746228_117.html,,True,,
24,"'The spirit of the new Fondation Cartier is not that of a cathedral where one must always do more, always bigger'",no description,https://www.lemonde.fr/en/culture/article/2025/10/21/the-spirit-of-the-new-fondation-cartier-is-not-that-of-a-cathedral-where-one-must-always-do-more-always-bigger_6746624_30.html,,True,,
25,"Jean-François Piège, guardian of Paris's bistro heritage",no description,https://www.lemonde.fr/en/lifestyle/article/2025/10/18/jean-francois-piege-guardian-of-paris-s-bistro-heritage_6746545_37.html,,True,,
26,Five places in and near Paris to savor choux à la crème,no description,https://www.lemonde.fr/en/lifestyle/article/2025/10/15/five-places-in-the-paris-region-to-savor-choux-a-la-creme_6746447_37.html,,True,,
27,"Berthe Weill at the Musée de l'Orangerie, the treasures of an eclectic gallerist",no description,https://www.lemonde.fr/en/culture/article/2025/10/14/the-treasures-of-berthe-weill-the-eclectic-gallerist-at-the-paris-musee-de-l-orangerie_6746402_30.html,,True,,
28,Sarkozy enters Paris jail for start of five-year sentence,"Convicted of criminal conspiracy over a scheme to obtain Libyan financing for his 2007 presidential campaign, the former French president started serving his sentence on Tuesday. He has appealed the verdict.",https://www.lemonde.fr/en/police-and-justice/article/2025/10/21/sarkozy-enters-paris-jail-for-start-of-five-year-sentence_6746628_106.html,,True,https://img.lemde.fr/2025/10/21/0/0/4999/3333/400/266/75/0/4ad4444_upload-1-7kvyb4x8req0-bg-hl-21oct25-france-sarko-13008.JPG,
29,"After lightning Louvre heist, museum management and culture ministry feel heat",no description,https://www.lemonde.fr/en/culture/article/2025/10/21/after-lightning-louvre-heist-museum-management-and-culture-ministry-feel-heat_6746635_30.html,,True,https://img.lemde.fr/2025/10/20/0/0/7834/5222/398/265/75/0/3af18dc_upload-1-bc5qxavfjq49-000-34qg7dl.jpg,
30,Sanae Takaichi becomes Japan's first woman prime minister,no description,https://www.lemonde.fr/en/international/article/2025/10/21/sanae-takaichi-becomes-japan-s-first-woman-prime-minister_6746638_4.html,,True,https://img.lemde.fr/2025/10/21/0/28/3912/2608/398/265/75/0/7f8352d_ftp-import-images-1-nvvyqezpmlwx-2025-10-21t060600z-994591518-rc25ghaprccz-rtrmadp-3-japan-politics.JPG,
31,Poll: French government crisis has deepened public distrust of political leaders,"Political instability has come at a high cost, fueling growing distrust and a sense that democracy is dysfunctional, according to the 13th annual 'French Fractures' survey by Ipsos for Le Monde, the Jean Jaurès Foundation, CEVIPOF and the Montaigne Institute.",https://www.lemonde.fr/en/politics/article/2025/10/21/poll-french-government-crisis-deepened-public-distrust-of-political-leaders_6746625_5.html,,True,https://img.lemde.fr/2025/10/06/0/0/5899/3933/398/265/75/0/3a8b05d_upload-1-ujo29vm8w8ef-jmug250326004.jpg,
32,Putin's tortuous flight plan to Budapest,"If the meeting between Donald Trump and Vladimir Putin does take place in Hungary, the Russian president's plane may have to make a lengthy detour to the south to avoid flying over European Union countries that are hostile to him.",https://www.lemonde.fr/en/international/article/2025/10/21/putin-s-tortuous-flight-plan-to-budapest_6746633_4.html,,True,https://img.lemde.fr/2025/09/01/82/0/5188/3458/398/265/75/0/917ed48_upload-1-t5vaonrbkgf8-097955.jpg,
33,"'The spirit of the new Fondation Cartier is not that of a cathedral where one must always do more, always bigger'","Chris Dercon, director of the Paris institution, shares his vision for the new space, redesigned by Jean Nouvel, in the building that formerly housed Louvre des Antiquaires.",https://www.lemonde.fr/en/culture/article/2025/10/21/the-spirit-of-the-new-fondation-cartier-is-not-that-of-a-cathedral-where-one-must-always-do-more-always-bigger_6746624_30.html,,True,https://img.lemde.fr/2025/10/16/557/0/3987/2658/398/265/75/0/84774c8_upload-1-ldvz4ttirexd-chris-dercon-photoa-thibaut-voisin.jpg,
34,Historian Eric Anceau: Louvre heist 'surpasses theft of Mona Lisa in 1911',The specialist in 19th-century French and European history reacts to the theft of eight French crown jewels that embody a part of the nation's history and heritage.,https://www.lemonde.fr/en/culture/article/2025/10/21/historian-eric-anceau-on-the-louvre-heist-this-theft-is-more-serious-than-that-of-the-mona-lisa-in-1911_6746634_30.html,Emmanuelle Jardonnet,True,https://img.lemde.fr/2025/10/20/0/549/3999/2666/664/442/75/0/0d78ec6_ftp-import-images-1-ehhhq3q7uzhm-2025-10-20t103945z-663762904-rc2mfhahb7zy-rtrmadp-3-france-crime-louvre.JPG,Interview
35,Israel receives remains of Gaza hostage as ceasefire tensions continue,no description,https://www.lemonde.fr/en/international/article/2025/10/20/israel-receives-remains-of-gaza-hostage-as-ceasefire-tensions-continue_6746616_4.html,,False,https://img.lemde.fr/2025/10/13/1/0/5997/3998/198/132/95/0/e3e85ee_ftp-import-images-1-bnq6w9jmiw8t-60afb60637b64b3c89fca1598a106c24-1-2bb8c4154e784119b18546483310c67f.jpg,
36,A Gaza hospital director remains imprisoned by Israel,no description,https://www.lemonde.fr/en/international/article/2025/10/21/a-gaza-hospital-director-remains-imprisoned-by-israel_6746623_4.html,,True,https://img.lemde.fr/2025/10/18/0/0/3808/2538/198/132/95/0/ead3ccc_upload-1-m8410goljexy-000-43lm472.jpg,
37,Colombia criticizes US after it strikes boats on pretext of fighting 'narcoterrorism',no description,https://www.lemonde.fr/en/international/article/2025/10/21/colombia-criticizes-the-us-after-it-strikes-boats-under-the-pretext-of-fighting-narcoterrorism_6746622_4.html,,True,https://img.lemde.fr/2025/10/17/57/0/5500/3666/198/132/95/0/ba7c29e_ftp-import-images-1-k9omz2pbwvin-2025-10-17t033736z-573883999-rc24dhay5cuj-rtrmadp-3-usa-venezuela-trump-trinidad.JPG,
38,"Crashed Lisbon funicular had faulty cable, investigation says",no description,https://www.lemonde.fr/en/international/article/2025/10/20/crashed-lisbon-funicular-had-faulty-cable-investigation-says_6746618_4.html,,False,https://img.lemde.fr/2025/10/20/1/0/6603/4402/198/132/95/0/878bc98_ftp-import-images-1-wxky6wdzebmp-5220522-01-06.jpg,
39,Former Senegalese president Macky Sall's barely concealed ambition to become UN secretary-general,no description,https://www.lemonde.fr/en/le-monde-africa/article/2025/10/21/former-senegalese-president-macky-sall-s-barely-concealed-ambition-to-become-un-secretary-general_6746620_124.html,,True,,
40,US appeals court rules Trump can deploy National Guard  in Portland,no description,https://www.lemonde.fr/en/international/article/2025/10/21/us-appeals-court-says-trump-can-deploy-national-guard-in-portland_6746619_4.html,,False,,
41,"Filip Turek, the Czech Trumpist 'Motorist' who flirts with Nazi symbols",no description,https://www.lemonde.fr/en/international/article/2025/10/20/filip-turek-the-czech-trumpist-motorist-who-flirts-with-nazi-symbols_6746613_4.html,,True,,
42,Louvre heist: Who were the royals the stolen jewels belonged to?,no description,https://www.lemonde.fr/en/culture/article/2025/10/20/louvre-heist-who-were-the-royals-to-whom-the-priceless-stolen-jewels-belonged_6746612_30.html,,False,,
43,Slovak court delivers 21-year jail term to man who shot PM,no description,https://www.lemonde.fr/en/international/article/2025/10/21/slovak-court-delivers-21-year-jail-term-to-man-who-shot-pm_6746636_4.html,,False,,
44,Madagascar president names civilian prime minister after military takeover,no description,https://www.lemonde.fr/en/international/article/2025/10/20/madagascar-president-names-civilian-prime-minister-after-military-takeover_6746617_4.html,,False,,
45,"'The Gaza agreement is fragile, but the Americans are on top of it': Words of hope from an Israeli peace broker",no description,https://www.lemonde.fr/en/international/article/2025/10/20/the-gaza-agreement-is-fragile-but-the-americans-are-on-top-of-it-words-of-hope-from-an-israeli-peacemaker_6746614_4.html,,True,,
46,Louvre heist: Photos of the stolen jewels,no description,https://www.lemonde.fr/en/france/article/2025/10/20/louvre-heist-photos-of-the-stolen-jewels_6746590_7.html,,False,,
47,Spectacular Louvre heist highlights security flaws at world's largest museum,"Empress Eugénie's 2,000-diamond tiara and the necklace from the sapphire set of Queen Marie-Amélie and Queen Hortense, made up of eight sapphires and 631 diamonds, were among the items stolen by a gang of four thieves who entered through a window.",https://www.lemonde.fr/en/france/article/2025/10/20/spectacular-louvre-heist-highlights-security-flaws-at-world-s-largest-museum_6746591_7.html,"Laurent Telo,  Roxana Azimi and  Sylvie Kerviel",True,https://img.lemde.fr/2025/10/19/0/0/5500/3666/664/442/75/0/6ee718c_ftp-import-images-1-hvmzei1vx1tx-2025-10-19t161952z-400991512-rc22fhasyuw0-rtrmadp-3-france-crime-louvre.JPG,In Depth
48,'Nicolas Sarkozy's supporters have undermined the foundations of political and judicial life',"Philippe Conte, professor emeritus of criminal law at Panthéon-Assas University, says the judges who convicted the former French president of criminal conspiracy merely enforced the laws written by those now denouncing them.",https://www.lemonde.fr/en/opinion/article/2025/10/20/nicolas-sarkozy-s-supporters-have-undermined-the-foundations-of-political-and-judicial-life_6746589_23.html,Anne Chemin,True,https://img.lemde.fr/2025/10/09/992/0/3335/2223/664/442/75/0/af06997_upload-1-fn7cc2nckibl-philippe-conte.jpg,Interview
49,"Zaho de Sagazan: 'Without others, without friendship, you can't achieve much'","'I wouldn't be where I am today if...' In this series, Le Monde interviews a personality about a decisive moment in their life. The singer-songwriter highlights the people who have shaped her journey and continue to support her.",https://www.lemonde.fr/en/culture/article/2025/10/19/zaho-de-sagazan-without-others-without-friendship-you-can-t-achieve-much_6746582_30.html,Vanessa Schneider,True,https://img.lemde.fr/2025/09/26/172/0/2625/1750/664/442/75/0/6ae9359_upload-1-jjxn85a2hfym-dea0231853.jpg,Interview
50,Fragile Middle East ceasefire is tested by renewed violence in Gaza,no description,https://www.lemonde.fr/en/opinion/article/2025/10/21/fragile-middle-east-ceasefire-is-tested-by-renewed-violence-in-gaza_6746637_23.html,Le Monde,False,,Editorial
51,Trump's exasperating inconsistency over the war in Ukraine,no description,https://www.lemonde.fr/en/opinion/article/2025/10/18/trump-s-exasperating-inconsistency-over-the-war-in-ukraine_6746556_23.html,Le Monde,False,,Editorial
52,"'By calling those who oppose his policies antisemitic, Netanyahu only stokes the scourge'",no description,https://www.lemonde.fr/en/opinion/article/2025/10/20/by-labeling-his-critics-as-anti-semitic-netanyahu-only-fuels-the-problem_6746587_23.html,Philippe Bernard,,https://img.lemde.fr/2025/02/13/0/0/0/0/100/100/60/0/e49d71b_sirius-fs-upload-1-hfccvvna5map-1739442970267-capture-da-a-cran-2025-02-13-113500.png,Column
