,headline,description,url,byline,premium,image_url,article type
0,"Lisbon's Gloria funicular derails, plunging the city into mourning",no description,https://www.lemonde.fr/en/international/article/2025/09/04/lisbon-s-gloria-funicular-derails-plunging-the-city-into-mourning_6745033_4.html,,True,,
1,Harvard wins major legal victory against Trump,no description,https://www.lemonde.fr/en/international/article/2025/09/04/harvard-wins-major-legal-victory-against-trump_6745032_4.html,,True,,
2,Europe is now Ukraine's main source of military support,no description,https://www.lemonde.fr/en/international/article/2025/09/04/europe-is-now-ukraine-s-main-source-of-military-support_6745030_4.html,,True,,
3,No classes for Palestinian children as Israel shuts six UN-run schools in East Jerusalem,no description,https://www.lemonde.fr/en/international/article/2025/09/04/palestinian-students-barred-from-returning-to-school-after-israel-shuts-down-six-un-run-schools-in-east-jerusalem_6745029_4.html,,True,,
4,France's political instability puts Franco-German alliance to the test,no description,https://www.lemonde.fr/en/opinion/article/2025/08/30/france-s-political-instability-puts-franco-german-alliance-to-the-test_6744873_23.html,,False,,
5,France faces prospect of paying higher borrowing costs than Italy,no description,https://www.lemonde.fr/en/economy/article/2025/08/19/france-faces-prospect-of-paying-higher-borrowing-costs-than-italy_6744519_19.html,,True,,
6,French man arrested in Slovenia for crimes committed in Croatia during 1991 war,no description,https://www.lemonde.fr/en/international/article/2025/08/06/french-man-arrested-in-slovenia-for-crimes-committed-in-croatia-during-1991-war_6744113_4.html,,True,,
7,"30 years after the Bosnian War, its refugees still cannot return home",no description,https://www.lemonde.fr/en/international/article/2025/08/03/thirty-years-after-the-bosnian-war-its-refugees-still-cannot-return-home_6744026_4.html,,True,,
8,French serial rapist midwife shattered his victims' intimacy,no description,https://www.lemonde.fr/en/france/article/2025/09/04/french-serial-rapist-midwife-shattered-his-victims-intimacy_6745040_7.html,,True,,
9,Macron's weakened centrist bloc scrambles to survive ahead of confidence vote,no description,https://www.lemonde.fr/en/france/article/2025/09/04/macron-s-weakened-centrist-bloc-scrambles-to-survive-ahead-of-confidence-vote_6745045_7.html,,True,,
10,Why a judge ordered Depardieu to stand trial on two counts of rape,no description,https://www.lemonde.fr/en/france/article/2025/09/03/why-a-judge-ordered-depardieu-to-stand-trial-on-two-counts-of-rape_6745009_7.html,,True,,
11,"For France's teachers, a back-to-school season marked by growing weariness",no description,https://www.lemonde.fr/en/france/article/2025/09/02/for-france-s-teachers-a-back-to-school-season-marked-by-growing-weariness_6744949_7.html,,True,,
12,Watch: Tsunami warnings sound in Japan after 8.8 magnitude quake off Russian coast,no description,https://www.lemonde.fr/en/videos/video/2025/07/30/watch-tsunami-warnings-sound-in-japan-after-8-8-magnitude-quake-off-russian-coast_6743900_108.html,,False,,
13,What is France's 'Black code' and why hasn't it been repealed?,no description,https://www.lemonde.fr/en/videos/video/2025/05/31/what-is-france-s-black-code-and-why-hasn-t-it-been-repealed_6741860_108.html,,False,,
14,How was the European Union created?,no description,https://www.lemonde.fr/en/videos/video/2025/05/29/how-was-the-european-union-created_6741795_108.html,,False,,
15,Glide bombs: Russia's secret to making cheap weapons,no description,https://www.lemonde.fr/en/videos/video/2025/05/25/glide-bombs-russia-s-secret-to-making-cheap-weapons_6741646_108.html,,True,,
16,"Julia Kristeva, psychoanalyst and writer: 'The Trumpist deal is the complete absence of the social contract'",no description,https://www.lemonde.fr/en/opinion/article/2025/09/04/julia-kristeva-psychoanalyst-and-writer-the-trumpist-deal-is-the-complete-absence-of-the-social-contract_6745025_23.html,,True,,
17,Mercosur deal reveals Europe's double loss of influence,no description,https://www.lemonde.fr/en/opinion/article/2025/09/04/mercosur-deal-reveals-europe-s-double-loss-of-influence_6745036_23.html,,False,,
18,'Japan's lesson is clear: Simply reducing the school schedule is not enough for children's well-being',no description,https://www.lemonde.fr/en/opinion/article/2025/09/04/japan-s-lesson-is-clear-simply-reducing-the-school-schedule-is-not-enough-for-children-s-well-being_6745027_23.html,,True,,
19,There is no 'Global South.' Is there a West?,no description,https://www.lemonde.fr/en/opinion/article/2025/09/03/faced-with-the-global-south-dominated-by-china-which-does-not-exist-the-west-under-trump-exists-less-and-less_6745006_23.html,,True,,
20,"Lorde, New Zealand electropop sensation: 'With 'Virgin,' I wanted to document my femininity'",no description,https://www.lemonde.fr/en/m-le-mag/article/2025/08/31/lorde-new-zealand-electropop-sensation-with-virgin-i-wanted-to-document-my-femininity_6744888_117.html,,True,,
21,The letters from two Ukrainian sisters: 'I'm almost grateful I experienced the attacks. Now I know what my loved ones go through',no description,https://www.lemonde.fr/en/m-le-mag/article/2025/08/30/the-letters-from-two-ukrainian-sisters-i-m-almost-grateful-to-have-experienced-the-attacks-now-i-know-what-my-loved-ones-go-through_6744874_117.html,,True,,
22,"Vanessa Paradis, a French icon",no description,https://www.lemonde.fr/en/m-le-mag/article/2025/08/30/vanessa-paradis-a-french-icon_6744859_117.html,,True,,
23,Argentina falls in love with a poetic livestream from the ocean: 'Patrick Star is Argentinian!',no description,https://www.lemonde.fr/en/m-le-mag/article/2025/08/29/how-argentina-fell-in-love-with-a-poetic-live-stream-from-the-depths-of-the-ocean-patrick-the-starfish-is-argentinian_6744822_117.html,,True,,
24,It's pain suisse time! Five places in and around Paris to find this treat,no description,https://www.lemonde.fr/en/lifestyle/article/2025/09/04/it-s-pain-suisse-time-five-places-in-the-paris-region-to-find-this-treat_6745022_37.html,,True,,
25,"At Musée d'Orsay, a Courbet painting gets a new life before visitors' eyes",no description,https://www.lemonde.fr/en/culture/article/2025/07/26/at-musee-d-orsay-a-courbet-painting-gets-a-new-life-before-visitors-eyes_6743744_30.html,,True,,
26,Avignon Festival 2025: An edition marked by emotion and fragility,no description,https://www.lemonde.fr/en/culture/article/2025/07/26/avignon-festival-2025-an-edition-marked-by-emotion-and-fragility_6743733_30.html,,True,,
27,The challenge of surtitling at the Avignon Festival,no description,https://www.lemonde.fr/en/culture/article/2025/07/20/the-challenge-of-surtitling-at-the-avignon-festival_6743560_30.html,,True,,
28,"By 'dramatizing' debt issue, French PM Bayrou risks exacerbating democratic fatigue",French Prime Minister François Bayrou's call for sacrifices fuels us-and-them populist rhetoric and could alienate citizens who already expect little from politics.,https://www.lemonde.fr/en/politics/article/2025/09/04/by-dramatizing-debt-issue-french-pm-bayrou-risks-exacerbating-democratic-fatigue_6745048_5.html,,True,https://img.lemde.fr/2025/09/02/0/0/5899/3933/400/266/75/0/7e9cfbf_upload-1-ymxh6fdp4tu8-jmug250902055.jpg,
29,Macron says 26 countries pledged troops to guarantee a ceasefire in Ukraine,no description,https://www.lemonde.fr/en/international/article/2025/09/04/war-in-ukraine-macron-says-26-countries-pledged-troops-to-guarantee-a-ceasefire_6745046_4.html,,False,https://img.lemde.fr/2025/09/04/667/0/5000/3333/398/265/75/0/8b57039_upload-1-ljfvqqlq3qfx-kzihnioglu-macron-reunion-coalition-04092025-2-3.jpg,
30,Top EU official slams Europe's failure to stop 'genocide' in Gaza,no description,https://www.lemonde.fr/en/international/article/2025/09/04/war-in-gaza-top-eu-official-slams-europe-s-failure-to-act_6745047_4.html,,False,https://img.lemde.fr/2025/08/07/0/3/4993/3329/398/265/75/0/9c8b90c_ftp-import-images-1-gvwmky13d1u6-2025-08-07t095736z-1411332836-rc27mfaxfazi-rtrmadp-3-israel-palestinians-gaza-eu.JPG,
31,Macron's weakened centrist bloc scrambles to survive ahead of confidence vote,"With the Assemblée Nationale slated to hold a confidence vote that could topple the government next Monday, French President Emmanuel Macron is calling for unity among his ranks. Prime Minister François Bayrou's lack of clear direction has deepened rifts among the various parties within the governing coalition.",https://www.lemonde.fr/en/france/article/2025/09/04/macron-s-weakened-centrist-bloc-scrambles-to-survive-ahead-of-confidence-vote_6745045_7.html,,True,https://img.lemde.fr/2025/09/02/0/0/5899/3933/398/265/75/0/fc6cbb7_upload-1-q5nyhtwluzgh-jmug250902132.jpg,
32,Rubio slams France over Palestine recognition,The US Secretary of State told reporters in Ecuador on Thursday that he had warned France and other countries that Israel may respond by annexing the West Bank.,https://www.lemonde.fr/en/international/article/2025/09/04/rubio-slams-france-over-palestine-recognition_6745050_4.html,,False,https://img.lemde.fr/2025/09/04/0/0/8640/5760/398/265/75/0/9f6ec88_ftp-import-images-1-zs9qmsu7ixll-2025-09-04t174726z-1793053645-rc24lgaoqw6z-rtrmadp-3-usa-latam-rubio.JPG,
33,"Giorgio Armani, one of the makers of modern fashion, is dead","Creator, designer and stylist, he made the tailored suit into a status symbol. Armani, who reigned for more than 40 years over a veritable empire, died on Thursday, September 4, at the age of 91, his fashion house confirmed.",https://www.lemonde.fr/en/obituaries/article/2025/09/04/giorgio-armani-one-of-the-makers-of-modern-fashion-is-dead_6745043_15.html,,True,https://img.lemde.fr/2025/06/30/1087/0/4948/3298/398/265/75/0/76ac8c5_upload-1-3lyfatoh3cd5-nyc54862.jpg,
34,Jonathan Anderson brings a breath of fresh art,"'Essence of a Style' (2/6). Appointed to the helm of some of the biggest fashion houses, six designers are set to command the industry's attention this season. We look back at what has defined their distinctive touch so far, before their trial by fire. In this chapter, the former creative director of Loewe, who has moved to Dior.",https://www.lemonde.fr/en/summer-reads/article/2025/09/04/jonathan-anderson-brings-a-breath-of-fresh-art_6745035_183.html,Sophie Abriat,True,https://img.lemde.fr/2025/07/10/153/0/1125/750/664/442/75/0/b5e2bd1_ftp-import-images-1-72vxwfzaggzo-390081-3430489.jpg,Profile
35,Lisbon funicular crash: First details of victims released while Portugal mourns the tragedy,no description,https://www.lemonde.fr/en/international/article/2025/09/04/lisbon-funicular-crash-first-details-of-victims-released-while-portugal-mourns-the-tragedy_6745049_4.html,,False,https://img.lemde.fr/2025/09/04/0/238/2529/1686/198/132/95/0/b39645f_ftp-import-images-1-t4niwcg4tovh-2025-09-04t164725z-108222374-rc24lgaj7xqy-rtrmadp-3-portugal-accident-drone.JPG,
36,"Afghanistan earthquake death toll reaches 2,200, deadliest in decades",no description,https://www.lemonde.fr/en/international/article/2025/09/04/afghanistan-earthquake-death-toll-reaches-2-200-making-it-the-deadliest-in-decades_6745041_4.html,,False,https://img.lemde.fr/2025/09/03/0/0/4312/2875/198/132/95/0/36acd9d_ftp-import-images-1-owkjahl245yb-5783595-01-06.jpg,
37,French serial rapist midwife shattered his victims' intimacy,no description,https://www.lemonde.fr/en/france/article/2025/09/04/french-serial-rapist-midwife-shattered-his-victims-intimacy_6745040_7.html,,True,https://img.lemde.fr/2025/04/10/0/0/3000/2000/198/132/95/0/b96eb89_sirius-fs-upload-1-xbh6jmsgmu5e-1744297402352-frame-9.jpg,
38,French ceramics museum struck by €9.5 million porcelain heist,no description,https://www.lemonde.fr/en/culture/article/2025/09/04/museum-in-limoges-struck-by-a-9-5-million-porcelain-heist_6745044_30.html,,False,https://img.lemde.fr/2025/09/04/0/2/4296/2864/198/132/95/0/0ff2209_upload-1-wo59hbojk6nb-0ff2209-upload-1-5taj3nqorgx3-maxpeoplefrfour942442.jpg,
39,French women's boxing team barred from world championships after late gender tests,no description,https://www.lemonde.fr/en/france/article/2025/09/04/french-women-s-boxing-team-barred-from-world-championships-after-late-gender-tests_6745037_7.html,,False,,
40,Harvard wins major legal victory against Trump,no description,https://www.lemonde.fr/en/international/article/2025/09/04/harvard-wins-major-legal-victory-against-trump_6745032_4.html,,True,,
41,"Lisbon's Gloria funicular derails, plunging the city into mourning",no description,https://www.lemonde.fr/en/international/article/2025/09/04/lisbon-s-gloria-funicular-derails-plunging-the-city-into-mourning_6745033_4.html,,True,,
42,It's pain suisse time! Five places in and around Paris to find this treat,no description,https://www.lemonde.fr/en/lifestyle/article/2025/09/04/it-s-pain-suisse-time-five-places-in-the-paris-region-to-find-this-treat_6745022_37.html,,True,,
43,Trump administration appeals to Supreme Court to save tariffs ruled illegal,no description,https://www.lemonde.fr/en/economy/article/2025/09/04/trump-appeals-to-supreme-court-to-save-his-tariffs-ruled-illegal_6745031_19.html,,False,,
44,European and Ukrainian leaders call Trump after summit on ceasefire security guarantees,no description,https://www.lemonde.fr/en/international/article/2025/09/04/war-in-ukraine-european-leaders-call-trump-after-summit-on-ceasefire-security-guarantees_6745042_4.html,,False,,
45,No classes for Palestinian children as Israel shuts six UN-run schools in East Jerusalem,no description,https://www.lemonde.fr/en/international/article/2025/09/04/palestinian-students-barred-from-returning-to-school-after-israel-shuts-down-six-un-run-schools-in-east-jerusalem_6745029_4.html,,True,,
46,Europe is now Ukraine's main source of military support,no description,https://www.lemonde.fr/en/international/article/2025/09/04/europe-is-now-ukraine-s-main-source-of-military-support_6745030_4.html,,True,,
47,"After years on the sidelines, France's Socialists are having a moment","Prime Minister François Bayrou's impending downfall stems from his inability to win over the Socialists. They now face a difficult choice between finding an agreement with Macron's coalition or maintaining a stance of radical opposition, observes Le Monde columnist Françoise Fressoz.",https://www.lemonde.fr/en/opinion/article/2025/09/03/after-eight-years-on-the-sidelines-france-s-socialists-are-having-their-moment_6744992_23.html,Françoise Fressoz,True,https://img.lemde.fr/2025/08/30/0/0/6000/4000/664/442/75/0/302dfef_upload-1-ko4xs2gm5uw7-cbi1271053.jpg,Column
48,"'Block Everything': Anger in France is deep, but mass strikes appear unlikely","The choice of a Wednesday for the planned September 10 protests raises questions about who has the option to strike, especially as labor disputes in French workplaces have been particularly rare in recent years.",https://www.lemonde.fr/en/economy/article/2025/09/04/block-everything-anger-in-france-is-deep-but-mass-strikes-appear-unlikely_6745028_19.html,Aline Leclerc,True,https://img.lemde.fr/2025/09/02/0/0/6000/4000/664/442/75/0/69fd44e_upload-1-1g4acvwmoldt-20250902nrc0496.jpg,In Depth
49,"Thomas Piketty: 'To succeed in the climate transition, we must redistribute wealth differently'","In an interview with Le Monde, the French economist explains that protecting the planet from climate change cannot be achieved without reducing inequality.",https://www.lemonde.fr/en/economy/article/2025/09/02/thomas-piketty-to-succeed-in-the-climate-transition-we-must-redistribute-wealth-differently_6744947_19.html,Cécile Cazenave and  Nabil Wakim,True,https://img.lemde.fr/2025/07/31/0/44/3277/2185/664/442/75/0/f20120f_upload-1-0uy2httchsz0-img-3724.jpg,Interview
50,Mercosur deal reveals Europe's double loss of influence,no description,https://www.lemonde.fr/en/opinion/article/2025/09/04/mercosur-deal-reveals-europe-s-double-loss-of-influence_6745036_23.html,Le Monde,False,,Editorial
51,Xi Jinping at the center of his world,no description,https://www.lemonde.fr/en/opinion/article/2025/09/03/xi-jinping-at-the-center-of-his-world_6745001_23.html,Le Monde,False,,Editorial
52,'Japan's lesson is clear: Simply reducing the school schedule is not enough for children's well-being',no description,https://www.lemonde.fr/en/opinion/article/2025/09/04/japan-s-lesson-is-clear-simply-reducing-the-school-schedule-is-not-enough-for-children-s-well-being_6745027_23.html,Christian Galan,,,Op-Ed
