,headline,description,url,byline,premium,image_url,article type
0,'I am as afraid of the rain as I was of the war': How severe weather compounds the suffering of displaced Gazans,no description,https://www.lemonde.fr/en/international/article/2025/12/04/i-am-as-afraid-of-the-rain-as-i-was-of-the-war-how-severe-weather-compounds-the-suffering-of-displaced-gazans_6748128_4.html,,True,,
1,The European Commission unveils plan to continue financial support for Ukraine after US aid ends,no description,https://www.lemonde.fr/en/international/article/2025/12/04/the-european-commission-unveils-plan-to-continue-financial-support-for-ukraine-after-us-aid-ends_6748127_4.html,,True,,
2,Negotiating peace: A chaotic art with no established rules,no description,https://www.lemonde.fr/en/international/article/2025/12/03/negotiating-peace-a-chaotic-art-with-no-established-rules_6748123_4.html,,True,,
3,"Behind Gaza's 'yellow line,' Israel's postwar laboratory",no description,https://www.lemonde.fr/en/international/article/2025/12/03/behind-gaza-s-yellow-line-israel-s-postwar-laboratory_6748121_4.html,,True,,
4,Bosnia and Herzegovina's Serb entity elects ally of  former leader Dodik,no description,https://www.lemonde.fr/en/international/article/2025/11/24/bosnia-and-herzegovina-s-serb-entity-elects-ally-of-former-leader-dodik_6747765_4.html,,True,,
5,"In France's Somme, bagpipers keep the memory of the Great War alive",no description,https://www.lemonde.fr/en/history/article/2025/11/11/in-france-s-somme-bagpipers-keep-the-memory-of-the-great-war-alive_6747347_157.html,,True,,
6,Latvia: Public mobilization grows in support of treaty for preventing violence against women,no description,https://www.lemonde.fr/en/international/article/2025/11/06/in-latvia-public-mobilization-continues-to-grow-in-support-of-the-istanbul-convention-for-preventing-violence-against-women_6747156_4.html,,True,,
7,"After Charlie Kirk's murder, Europe's far right swears allegiance to Trump's politics",no description,https://www.lemonde.fr/en/les-decodeurs/article/2025/10/20/the-murder-of-charlie-kirk-how-europe-s-far-right-swore-allegiance-to-trump-s-politics_6746586_8.html,,True,,
8,France sentences student for defacing tomb of guillotine abolitionist,no description,https://www.lemonde.fr/en/france/article/2025/12/03/france-sentences-student-for-defacing-tomb-of-guillotine-abolitionist_6748124_7.html,,False,,
9,Marseille grapples with drug trafficking: 'They are so many and they have so much money',no description,https://www.lemonde.fr/en/france/article/2025/12/02/marseille-grapples-with-drug-trafficking-they-are-so-many-and-they-have-so-much-money_6748047_7.html,,True,,
10,Foreign interference: Why France is raising its voice and turning to the courts,no description,https://www.lemonde.fr/en/france/article/2025/12/01/foreign-interference-why-france-is-raising-its-voice-and-turning-to-the-courts_6748034_7.html,,True,,
11,French mayor convicted and set to be incarcerated in sex-tape blackmail case,no description,https://www.lemonde.fr/en/france/article/2025/12/01/french-mayor-convicted-and-set-to-be-incarcerated-in-sex-tape-blackmail-case_6748032_7.html,,True,,
12,"Israel's D9 bulldozer, a tool of destruction in Gaza",no description,https://www.lemonde.fr/en/videos/video/2025/11/27/israel-s-d9-bulldozer-a-tool-of-destruction-in-gaza_6747870_108.html,,True,,
13,"Ukraine's Pokrovsk faces fierce fighting, footage analyzed by Le Monde reveals",no description,https://www.lemonde.fr/en/videos/video/2025/11/21/ukraine-s-pokrovsk-faces-fierce-fighting-footage-analyzed-by-le-monde-reveals_6747708_108.html,,True,,
14,Afghanistan: Relentless repression continues over four years into Taliban's rule,no description,https://www.lemonde.fr/en/videos/video/2025/10/04/afghanistan-relentless-repression-continues-over-four-years-into-taliban-s-rule_6746092_108.html,,False,,
15,Watch: Hundreds of thousands march in France against budget cuts,no description,https://www.lemonde.fr/en/videos/video/2025/09/19/french-strikes-watch-what-happened-as-hundreds-of-thousands-marched-against-budget-cuts_6745548_108.html,,False,,
16,The real questions raised by Macron on news media,no description,https://www.lemonde.fr/en/opinion/article/2025/12/03/the-real-questions-raised-by-macron-on-news-media_6748107_23.html,,False,,
17,'The quality of geopolitical relations with major economies has a significant impact on growth',no description,https://www.lemonde.fr/en/opinion/article/2025/12/04/the-quality-of-geopolitical-relations-with-major-economies-has-a-significant-impact-on-growth_6748134_23.html,,True,,
18,'The fall of Assad marked a still uncertain close to a cycle of uprisings and crackdowns that began in Tunisia 15 years ago',no description,https://www.lemonde.fr/en/opinion/article/2025/12/04/the-fall-of-assad-marked-a-still-uncertain-close-to-a-cycle-of-uprisings-and-crackdowns-that-began-in-tunisia-15-years-ago_6748132_23.html,,True,,
19,"Le Monde's cartoon of the day, by Maarten Wolterink",no description,https://www.lemonde.fr/en/opinion/article/2025/12/03/le-monde-s-cartoon-of-the-day-by-maarten-wolterink_6748115_23.html,,False,,
20,The first time Le Monde wrote about Jeffrey Epstein,no description,https://www.lemonde.fr/en/m-le-mag/article/2025/12/01/the-first-time-le-monde-wrote-about-jeffrey-epstein_6748001_117.html,,True,,
21,The last-minute fight to save Gaza's ancient archaeological treasures,no description,https://www.lemonde.fr/en/m-le-mag/article/2025/11/30/the-last-minute-fight-to-save-gaza-s-ancient-archaeological-treasures_6747984_117.html,,True,,
22,The art of being Oscar Wilde's grandson,no description,https://www.lemonde.fr/en/m-le-mag/article/2025/11/30/the-art-of-being-oscar-wilde-s-grandson_6747977_117.html,,True,,
23,"Gay Talese, the last titan of the American press",no description,https://www.lemonde.fr/en/m-le-mag/article/2025/11/29/gay-talese-the-last-titan-of-the-american-press_6747954_117.html,,True,,
24,"In Paris, five spots to enjoy a (great) plant-based sandwich",no description,https://www.lemonde.fr/en/lifestyle/article/2025/12/04/in-paris-five-spots-to-enjoy-a-great-plant-based-sandwich_6748131_37.html,,True,,
25,"Bayonne's 'Little Louvre,' the Bonnat-Helleu Museum, reopens after 14 years",no description,https://www.lemonde.fr/en/culture/article/2025/11/28/bayonne-s-little-louvre-the-bonnat-helleu-museum-reopens-after-14-years_6747913_30.html,,True,,
26,Victor Hugo's interior architecture on display in Paris,no description,https://www.lemonde.fr/en/lifestyle/article/2025/11/23/victor-hugo-s-interior-architecture-on-display-in-paris_6747753_37.html,,True,,
27,A stroll through Cachan: From a royal aqueduct to a panoramic garden,no description,https://www.lemonde.fr/en/lifestyle/article/2025/11/22/a-stroll-through-cachan-from-a-royal-aqueduct-to-a-panoramic-garden_6747720_37.html,,True,,
28,How Edouard Philippe hopes to succeed Macron,"Sixteen months ahead of France's presidential election, the center-right former prime minister has been working to establish himself as the natural choice successor to Emmanuel Macron. He has ruled out participating in a primary with other contenders.",https://www.lemonde.fr/en/politics/article/2025/12/04/how-edouard-philippe-hopes-to-succeed-macron_6748133_5.html,,True,https://img.lemde.fr/2025/12/02/0/81/6195/4130/400/266/75/0/ec886b3_upload-1-byclpmnymdit-000-36w67ac.jpg,
29,Macron tells Xi that France and China must overcome their 'differences',no description,https://www.lemonde.fr/en/international/article/2025/12/04/macron-tells-xi-that-france-and-china-must-overcome-their-differences_6748135_4.html,,False,https://img.lemde.fr/2025/12/04/258/0/8000/5333/398/265/75/0/3ea4e5d_ftp-1-zubpcbbpvwk4-c79d71873d5f40dca5c69370a039ff98-0-c37d6a32819745e2b92a81952488da34.jpg,
30,'I am as afraid of the rain as I was of the war': How severe weather compounds the suffering of displaced Gazans,no description,https://www.lemonde.fr/en/international/article/2025/12/04/i-am-as-afraid-of-the-rain-as-i-was-of-the-war-how-severe-weather-compounds-the-suffering-of-displaced-gazans_6748128_4.html,,True,https://img.lemde.fr/2025/12/01/0/0/8640/5760/398/265/75/0/6806249_upload-1-c6hgrdie487j-822135.jpg,
31,Pentagon watchdog finds Hegseth put US troops at risk with Signal message,The US Defense Secretary had used the messaging app to share sensitive information about a military strike in Yemen. He is also under fire for US strikes on alleged drug-trafficking boats that experts say are extrajudicial killings.,https://www.lemonde.fr/en/international/article/2025/12/03/pentagon-watchdog-finds-hegseth-put-us-troops-at-risk-with-signal-message_6748126_4.html,,False,https://img.lemde.fr/2025/12/02/0/0/7521/5014/398/265/75/0/615aaf7_ftp-1-rjnfbj88sm83-153d8287ae104bb0b4d14e0dd454b51c-1-12c7865388834ae6bb15b1a8a0915cf9.jpg,
32,France is updating its polar strategy amid rising geopolitical tensions in the Arctic,"The strategy, which covers the period from 2026 to 2040, aims to support polar research and, above all, to address defense concerns – though it comes with no guaranteed funding.",https://www.lemonde.fr/en/environment/article/2025/12/04/france-is-updating-its-polar-strategy-amid-rising-geopolitical-tensions-in-the-arctic_6748129_114.html,,True,https://img.lemde.fr/2025/12/03/14/0/3126/2084/398/265/75/0/3c04850_upload-1-amtkr3xcswjg-epaphotos253444.jpg,
33,"In Paris, five spots to enjoy a (great) plant-based sandwich","A 'dwich' with button mushrooms in the style of roast chicken, a Japanese snack with sweet or savory options, a banh mi without meat or Maggi sauce: Here is our selection of Parisian spots to savor delicious vegetarian sandwiches.",https://www.lemonde.fr/en/lifestyle/article/2025/12/04/in-paris-five-spots-to-enjoy-a-great-plant-based-sandwich_6748131_37.html,,True,https://img.lemde.fr/2025/11/28/0/0/1311/874/398/265/75/0/4d7d49a_upload-1-3ym3odcyfa0f-plan-d-3h4a6173rec.jpg,
34,'The fall of Assad marked a still uncertain close to a cycle of uprisings and crackdowns that began in Tunisia 15 years ago',"The Syrian transition, underway for the past year, must avoid sliding back into the kind of brutal authoritarianism that defined the Assad era, warns Gilles Paris.",https://www.lemonde.fr/en/opinion/article/2025/12/04/the-fall-of-assad-marked-a-still-uncertain-close-to-a-cycle-of-uprisings-and-crackdowns-that-began-in-tunisia-15-years-ago_6748132_23.html,Gilles Paris,True,https://img.lemde.fr/2025/12/03/0/0/7599/5066/664/442/75/0/dc2d2a6_upload-1-ze6udgbuxmqs-000-36pw9lf.jpg,Column
35,The European Commission unveils plan to continue financial support for Ukraine after US aid ends,no description,https://www.lemonde.fr/en/international/article/2025/12/04/the-european-commission-unveils-plan-to-continue-financial-support-for-ukraine-after-us-aid-ends_6748127_4.html,,True,https://img.lemde.fr/2025/12/03/0/0/8256/5504/198/132/95/0/73b01db_upload-1-spqr6hygy85s-221775.jpg,
36,"'Mektoub, My Love: Canto Due': Abdellatif Kechiche's Mediterranean gem",no description,https://www.lemonde.fr/en/culture/article/2025/12/03/mektoub-my-love-canto-due-abdellatif-kechiche-s-mediterranean-gem_6748120_30.html,,True,https://img.lemde.fr/2025/11/28/0/380/1287/858/198/132/95/0/611b25f_upload-1-t1eg9twaytr1-still-2025-07-17-172533-2-5-4.jpg,
37,Israel and Lebanon engage in direct talks for the first time in decades,no description,https://www.lemonde.fr/en/middle-east-crisis/article/2025/12/03/israel-and-lebanon-engage-in-direct-talks-for-the-first-time-in-decades_6748117_368.html,,False,https://img.lemde.fr/2025/11/28/0/0/3012/2008/198/132/95/0/58366b6_ftp-import-images-1-iwacjx4wzsmh-5549183-01-06.jpg,
38,Devastated Sudanese families recount el-Fasher massacre,no description,https://www.lemonde.fr/en/le-monde-africa/article/2025/12/03/devastated-sudanese-families-recount-el-fasher-massacre-the-rsf-killed-people-point-blank-in-their-homes_6748106_124.html,,True,https://img.lemde.fr/2025/12/02/2670/0/5504/3669/198/132/95/0/bd950c3_upload-1-gh2bna2sjegt-abd1090.jpg,
39,Algerian court upholds French journalist's seven-year prison sentence,no description,https://www.lemonde.fr/en/le-monde-africa/article/2025/12/03/algerian-court-upholds-french-journalist-s-seven-year-prison-sentence_6748122_124.html,,True,,
40,New Orleans is the latest target of the Trump administration's immigration crackdown,no description,https://www.lemonde.fr/en/international/article/2025/12/04/new-orleans-is-the-latest-target-of-the-trump-administration-s-immigration-crackdown_6748130_4.html,,False,,
41,Netanyahu says he will visit New York despite Mamdani's threats to arrest him,no description,https://www.lemonde.fr/en/international/article/2025/12/03/netanyahu-says-he-will-visit-new-york-despite-mamdani-s-threats-to-arrest-him_6748125_4.html,,False,,
42,France sentences student for defacing tomb of guillotine abolitionist,no description,https://www.lemonde.fr/en/france/article/2025/12/03/france-sentences-student-for-defacing-tomb-of-guillotine-abolitionist_6748124_7.html,,False,,
43,Former EU foreign policy chief Mogherini charged in 'fraud and corruption' probe,no description,https://www.lemonde.fr/en/international/article/2025/12/03/former-eu-foreign-policy-chief-mogherini-charged-in-fraud-and-corruption-probe_6748118_4.html,,False,,
44,"Behind Gaza's 'yellow line,' Israel's postwar laboratory",no description,https://www.lemonde.fr/en/international/article/2025/12/03/behind-gaza-s-yellow-line-israel-s-postwar-laboratory_6748121_4.html,,True,,
45,Influential study on glyphosate safety retracted 25 years after publication,no description,https://www.lemonde.fr/en/environment/article/2025/12/03/influential-study-on-glyphosate-safety-retracted-25-years-after-publication_6748114_114.html,,True,,
46,"US D-Day veteran Charles Shay, who lived in France, dies aged 101",no description,https://www.lemonde.fr/en/international/article/2025/12/03/us-d-day-veteran-charles-shay-who-lived-in-france-dies-aged-101_6748119_4.html,,False,,
47,'Nighttime prohibition': Warsaw city center bans alcohol sales at night,"Nearly 180 municipalities in Poland have already opted to ban the sale of alcohol at night. On November 1, two central districts in Warsaw followed suit. The measure, which was initially intended to apply across the entire capital, has sparked heated debate.",https://www.lemonde.fr/en/international/article/2025/12/03/nighttime-prohibition-warsaw-city-center-bans-alcohol-sales-at-night_6748094_4.html,Hélène Bienvenu,True,https://img.lemde.fr/2025/12/03/87/0/4660/3106/664/442/75/0/7d89132_upload-1-mysqthimo3ov-7d89132-upload-1-dwllatgzamur-000-dv1445925.jpg,Letter from...
48,The significant trade imbalance between France and China,"Even as Chinese competition increasingly undermines French industries, including in innovation, many French companies argue that maintaining a presence in China remains essential. President Emmanuel Macron is visiting the country from December 3 to 5.",https://www.lemonde.fr/en/economy/article/2025/12/03/the-significant-trade-imbalance-between-france-and-china_6748097_19.html,Harold Thibault and  Jordan Pouille,True,https://img.lemde.fr/2025/11/30/0/0/1668/1112/664/442/75/0/27f3fa0_upload-1-rjgidkvkulr2-eco-4925-commerce-chine-france-media-appel.png,In Depth
49,Negotiating peace: A chaotic art with no established rules,"Donald Trump, casting himself as mediator in the Russia-Ukraine war, has been pushing Kyiv and European leaders to accept his 'peace plan,' drafted with Moscow. His seemingly erratic approach reveals a deeper issue: the absence of any standards governing peace processes.",https://www.lemonde.fr/en/international/article/2025/12/03/negotiating-peace-a-chaotic-art-with-no-established-rules_6748123_4.html,Rémy Ourdan,True,https://img.lemde.fr/2025/12/01/3/0/4240/2826/664/442/75/0/2a440f6_upload-1-iwjab3q9xqd5-xab-39.jpg,In Depth
50,The real questions raised by Macron on news media,no description,https://www.lemonde.fr/en/opinion/article/2025/12/03/the-real-questions-raised-by-macron-on-news-media_6748107_23.html,Le Monde,False,,Editorial
51,"Laurence Nardon: 'Trump has demonstrated unexpected activity in international issues, much to the dismay of his MAGA base'",no description,https://www.lemonde.fr/en/opinion/article/2025/12/03/laurence-nardon-trump-has-demonstrated-unexpected-activity-in-international-issues-much-to-the-dismay-of-his-maga-base_6748102_23.html,Laurence Nardon,,,Op-Ed
52,"'For Europe, catching up in the digital sector should not mean deregulating at every turn'",no description,https://www.lemonde.fr/en/opinion/article/2025/12/01/for-europe-catching-up-in-the-digital-sector-should-not-mean-deregulating-at-every-turn_6748039_23.html,Stéphane Lauer,,https://img.lemde.fr/2025/02/13/0/0/0/0/100/100/60/0/04174ed_sirius-fs-upload-1-8wlz4p8ntxj8-1739442785932-capture-da-a-cran-2025-02-13-113207.png,Column
