,headline,description,url,byline,premium,image_url,article type
0,Netanyahu continues war against Hezbollah in Lebanon despite Iran ceasefire,"The Israeli prime minister stressed that Donald Trump's truce does not apply to Lebanon, contradicting his Pakistani counterpart, who is mediating the conflict and said the suspension of hostilities is meant to apply 'everywhere.'",https://www.lemonde.fr/en/international/article/2026/04/08/netanyahu-continues-war-against-hezbollah-in-lebanon-despite-iran-ceasefire_6752229_4.html,,True,https://img.lemde.fr/2026/04/08/0/0/7008/4672/600/400/75/0/14d186c_upload-1-6i2xwfttlm3m-as106499.jpeg,
1,Trump blasts NATO after closed-door meeting with Secretary-General Rutte,"The US president accused allies of 'turning their back' on the American people after Washington's partners refused to back his war on Iran. After his meeting on Wednesday, he attacked NATO on social media and appeared to renew threats over Greenland.",https://www.lemonde.fr/en/international/article/2026/04/08/white-house-says-trump-will-discuss-possibility-of-leaving-nato_6752238_4.html,,False,https://img.lemde.fr/2026/04/08/0/0/5005/3337/398/265/75/0/4b39611_ftp-1-dflkmvkoffwy-19fdea0da4934934a81246a79fbf37a1-0-0cdebbbc256f4c528479f02145f00cbb.jpg,
2,"As the oil shock hits, China's truck drivers face the threat of layoffs: 'Under these conditions, we might as well leave the truck in the parking lot'","Fearing a loss of competitiveness for their products, transport companies remain highly reluctant to pass on to their customers fuel cost increases that have been triggered by the war in Iran and the blockade of the Strait of Hormuz.",https://www.lemonde.fr/en/economy/article/2026/04/09/as-the-oil-shock-hits-china-s-truck-drivers-face-the-threat-of-layoffs-under-these-conditions-we-might-as-well-leave-the-truck-in-the-parking-lot_6752245_19.html,,True,https://img.lemde.fr/2026/04/08/0/0/3456/2304/398/265/75/0/3c385b5_upload-1-qsguzf3mbxc1-maxnewsfrsix200885.jpg,
3,Emmanuel Grégoire launches the first four major initiatives of his term as mayor of Paris,"After-school care, housing, sheltering people living on the streets, Parc des Princes: The Socialist mayor is convening a Paris City Council meeting on April 14 to implement the top priorities of his program.",https://www.lemonde.fr/en/politics/article/2026/04/09/emmanuel-gregoire-launches-the-first-four-major-initiatives-of-his-term-as-mayor-of-paris_6752248_5.html,,True,https://img.lemde.fr/2026/04/03/909/0/4000/2666/398/265/75/0/c71c8cd_upload-1-4tayrm9wcwvs-kzihnioglu-paris-pol-entretien-gregoire-emmanuel-02042026-48.JPG,
4,Residents of PFAS-polluted areas turn anger into political action in Brussels,"For the first time since the 'forever chemicals' scandal came to light, residents from contamination hotspots across Europe gathered in Brussels in early March to take part in political action training. Le Monde followed that historic moment.",https://www.lemonde.fr/en/les-decodeurs/article/2026/04/09/residents-of-pfas-polluted-areas-turn-anger-into-political-action-in-brussels_6752247_8.html,Stéphane Horel,True,https://img.lemde.fr/2026/04/03/1613/0/3871/2580/664/442/75/0/080e1cb_upload-1-freja14pkpvz-0c6a3958.jpg,Feature
5,The exhausting 'racial burden' for victims of everyday racism,no description,https://www.lemonde.fr/en/opinion/article/2026/04/09/the-exhausting-racial-burden-for-victims-of-everyday-racism_6752243_23.html,,True,https://img.lemde.fr/2026/04/04/0/0/5332/3555/198/132/95/0/bb40988_ftp-1-qxrju4rmzsdc-5677837-01-06.jpg,
6,Another allegation of police violence at a Paris precinct,no description,https://www.lemonde.fr/en/france/article/2026/04/09/another-allegation-of-police-violence-at-a-paris-precinct_6752244_7.html,,True,https://img.lemde.fr/2026/02/25/0/0/1500/1000/198/132/95/0/b5dba56_upload-1-b4svwiom8sgm-frame-999.jpg,
7,'Iran is caught in a vice between two regimes of silence: War and repression',no description,https://www.lemonde.fr/en/opinion/article/2026/04/09/iran-is-caught-in-a-vice-between-two-regimes-of-silence-war-and-repression_6752242_23.html,,True,https://img.lemde.fr/2026/03/05/0/0/1500/1000/198/132/95/0/32e42c9_upload-1-6kdnma8rsdxb-frame-1463.jpg,
8,PSG dominate Liverpool and take the lead in the Champions League quarter-final first leg,no description,https://www.lemonde.fr/en/sports/article/2026/04/08/psg-vs-liverpool-the-parisians-dominate-liverpool-and-take-the-lead-in-the-champions-league-quarter-final-first-leg_6752240_9.html,,False,https://img.lemde.fr/2026/04/08/26/0/2028/1352/198/132/95/0/85a5b98_ftp-1-jvokoja7kwbu-2026-04-08t210247z-1549383650-up1em481mgmec-rtrmadp-3-soccer-champions-psg-liv.JPG,
9,Al Jazeera journalist Mohammed Wishah killed by Israeli drone strike,no description,https://www.lemonde.fr/en/international/article/2026/04/08/al-jazeera-journalist-mohammed-washah-killed-by-israeli-drone-strike_6752239_4.html,,False,https://img.lemde.fr/2026/04/08/0/0/6406/4270/198/132/95/0/5342e90_ftp-1-24wfbeuwqghr-fbbad86f1d864153bac6510560a56eab-0-06483cbf06f44ad4bd3a8bd674f972d4.jpg,
10,'Africa Fashion': Vibrant exhibition sparks curiosity,no description,https://www.lemonde.fr/en/lifestyle/article/2026/04/09/africa-fashion-a-vibrant-exhibition-sparks-curiosity_6752241_37.html,,True,https://img.lemde.fr/2026/04/07/0/0/1500/1000/198/132/95/0/c3b61d7_upload-1-gcphrao0tsbx-2026-web-modestyles-expo-africa-fashion-10.jpg,
11,"North Korea tested missiles on Monday, Tuesday and Wednesday, state media confirms",no description,https://www.lemonde.fr/en/international/article/2026/04/09/north-korea-tested-missiles-on-monday-tuesday-and-wednesday-state-media-confirms_6752249_4.html,,False,,
12,The stunning images from NASA's Artemis II mission over the Moon,no description,https://www.lemonde.fr/en/science/article/2026/04/08/stunning-footage-from-nasa-s-artemis-ii-mission-over-the-moon_6752226_10.html,,False,,
13,Arthur Kenigsberg: 'Orban is the only European leader simultaneously backed by Putin and Trump',no description,https://www.lemonde.fr/en/opinion/article/2026/04/08/arthur-kenigsberg-central-europe-specialist-orban-is-the-only-european-leader-simultaneously-backed-by-putin-and-trump_6752232_23.html,,True,,
14,The French government's fear: Appearing impotent,no description,https://www.lemonde.fr/en/opinion/article/2026/04/08/the-french-government-s-fear-appearing-impotent_6752237_23.html,,True,,
15,"One Health summit yields pledges on human, animal and environmental health, but lacks clear direction",no description,https://www.lemonde.fr/en/environment/article/2026/04/08/one-health-summit-yields-pledges-on-human-animal-and-environmental-health-but-lacks-clear-direction_6752235_114.html,,True,,
16,Court unconvinced as Sarkozy seeks to distance himself from co-defendants,no description,https://www.lemonde.fr/en/france/article/2026/04/08/court-unconvinced-as-sarkozy-seeks-to-distance-himself-from-co-defendants_6752227_7.html,,True,,
17,"In Hungary, Vance backs Orban in last-ditch attempt five days before elections","The American vice president praised the Hungarian prime minister during a rally in Budapest on Tuesday. In power since 2010, the nationalist leader is not the favorite in the April 12 legislative elections.",https://www.lemonde.fr/en/international/article/2026/04/08/in-hungary-vance-backs-orban-in-last-ditch-attempt-five-days-before-elections_6752222_4.html,Jean-Baptiste Chastand,True,https://img.lemde.fr/2026/04/07/0/4/2184/1456/664/442/75/0/1b2262d_ftp-1-6lcr6lk7mbw2-2026-04-07t211413z-1793918980-rc2hkkaecf9t-rtrmadp-3-hungary-usa-vance.JPG,News
18,"'A global club in a global city, PSG has every interest in staying at the Parc des Princes'","New Paris Mayor Emmanuel Grégoire has reopened talks with the Parisian club, suggesting the team could stay in its historic stadium, according to Jérôme Latta.",https://www.lemonde.fr/en/sports/article/2026/04/08/a-global-club-in-a-global-city-psg-has-every-interest-in-staying-at-the-parc-des-princes_6752209_9.html,Jérôme Latta,True,https://img.lemde.fr/2026/04/03/0/0/3466/2311/664/442/75/0/f6ab84c_ftp-1-tfayiiccwdnl-5672123-01-06.jpg,Column
19,Israel's rule of law and democracy are on the brink of collapse,"The introduction of the death penalty for Palestinians convicted of 'a terrorist act,' but not for Israeli Jews guilty of abuses and the murder of civilians in the occupied West Bank, is emblematic of the ongoing transformation of Israel.",https://www.lemonde.fr/en/international/article/2026/04/07/israel-rule-of-law-and-democracy-on-the-brink-of-collapse_6752168_4.html,Luc Bronner,True,https://img.lemde.fr/2026/03/30/0/0/4813/3208/664/442/75/0/d700d98_ftp-1-sonnlguxda3p-2026-03-30t201333z-25698780-rc27fka29ypx-rtrmadp-3-israel-palestinians-death-penalty.JPG,News analysis
20,Coal's resurgence is a symptom of an incomplete energy transition,no description,https://www.lemonde.fr/en/opinion/article/2026/04/08/coal-s-resurgence-is-a-symptom-of-an-incomplete-energy-transition_6752223_23.html,Le Monde,False,,Editorial
21,Will Self: 'Our historical condition is a peculiar mixture of omniscience and impotence',no description,https://www.lemonde.fr/en/opinion/article/2026/04/05/will-self-our-historical-condition-is-a-peculiar-mixture-of-omniscience-and-impotence_6752142_23.html,Will Self,,,Op-Ed
22,"'With Céline Dion's Paris shows, the city becomes a spin-off product of mega-concerts'",no description,https://www.lemonde.fr/en/opinion/article/2026/04/03/with-celine-dion-s-paris-shows-the-city-becomes-a-spin-off-product-of-mega-concerts_6752064_23.html,Rémy Knafou,,,Op-Ed
