,headline,description,url,byline,premium,image_url,article type
0,The 'al-Munasseq' Facebook page is a window into Gaza's distress,no description,https://www.lemonde.fr/en/international/article/2025/09/21/the-al-munasseq-facebook-page-is-a-window-into-gaza-s-distress_6745611_4.html,,True,,
1,Macron's slow shift toward recognizing the State of Palestine,no description,https://www.lemonde.fr/en/international/article/2025/09/21/macron-s-slow-shift-toward-recognizing-the-state-of-palestine_6745610_4.html,,True,,
2,The US plan to expel hundreds of thousands of Palestinians from Gaza,no description,https://www.lemonde.fr/en/international/article/2025/09/21/the-us-plan-to-expel-hundreds-of-thousands-of-palestinians-from-gaza_6745606_4.html,,True,,
3,China's Covid-era witness Zhang Zhan reportedly sentenced to jail in new case,no description,https://www.lemonde.fr/en/international/article/2025/09/21/china-s-covid-era-witness-zhang-zhan-reportedly-sentenced-to-jail-in-new-case_6745604_4.html,,True,,
4,Sanctions against Russia spark rift between US and Europe over China,no description,https://www.lemonde.fr/en/international/article/2025/09/15/sanctions-against-russia-spark-rift-between-us-and-europe-over-china_6745411_4.html,,True,,
5,France's political instability puts Franco-German alliance to the test,no description,https://www.lemonde.fr/en/opinion/article/2025/08/30/france-s-political-instability-puts-franco-german-alliance-to-the-test_6744873_23.html,,False,,
6,France faces prospect of paying higher borrowing costs than Italy,no description,https://www.lemonde.fr/en/economy/article/2025/08/19/france-faces-prospect-of-paying-higher-borrowing-costs-than-italy_6744519_19.html,,True,,
7,French man arrested in Slovenia for crimes committed in Croatia during 1991 war,no description,https://www.lemonde.fr/en/international/article/2025/08/06/french-man-arrested-in-slovenia-for-crimes-committed-in-croatia-during-1991-war_6744113_4.html,,True,,
8,French senator accused of drugging colleague will resign next month,no description,https://www.lemonde.fr/en/france/article/2025/09/20/french-senator-accused-of-drugging-colleague-will-resign-next-month_6745593_7.html,,False,,
9,French and American far right gather in Paris for Charlie Kirk commemoration,no description,https://www.lemonde.fr/en/france/article/2025/09/20/french-and-american-far-right-gather-in-paris-for-charlie-kirk-commemoration_6745583_7.html,,True,,
10,France creates a registry of 'influence activities' to combat foreign interference,no description,https://www.lemonde.fr/en/france/article/2025/09/19/france-creates-a-registry-of-influence-activities-to-combat-foreign-interference_6745564_7.html,,True,,
11,Watch: Hundreds of thousands march in France against budget cuts,no description,https://www.lemonde.fr/en/videos/video/2025/09/19/french-strikes-watch-what-happened-as-hundreds-of-thousands-marched-against-budget-cuts_6745548_108.html,,False,,
12,Watch: Hundreds of thousands march in France against budget cuts,no description,https://www.lemonde.fr/en/videos/video/2025/09/19/french-strikes-watch-what-happened-as-hundreds-of-thousands-marched-against-budget-cuts_6745548_108.html,,False,,
13,Emmys 2025: 'Adolescence' star Owen Cooper becomes youngest winner for best supporting actor,no description,https://www.lemonde.fr/en/videos/video/2025/09/15/emmys-2025-adolescence-star-owen-cooper-becomes-youngest-winner-for-best-supporting-actor_6745427_108.html,,False,,
14,"From 'influence peddling' to 'corruption,' what is French Culture Minister Rachida Dati accused of?",no description,https://www.lemonde.fr/en/videos/video/2025/09/06/from-influence-peddling-to-corruption-what-is-french-culture-minister-rachida-dati-accused-of_6745094_108.html,,False,,
15,Watch: Tsunami warnings sound in Japan after 8.8 magnitude quake off Russian coast,no description,https://www.lemonde.fr/en/videos/video/2025/07/30/watch-tsunami-warnings-sound-in-japan-after-8-8-magnitude-quake-off-russian-coast_6743900_108.html,,False,,
16,South Korea eyes constitutional reform amid fears of abuse of executive power,no description,https://www.lemonde.fr/en/opinion/article/2025/09/21/south-korea-eyes-constitutional-reform-amid-fears-of-abuse-of-executive-power_6745595_23.html,,True,,
17,'Middle Eastern powers seem trapped by their dependence on the US and its ties with Israel',no description,https://www.lemonde.fr/en/opinion/article/2025/09/21/middle-eastern-powers-seem-trapped-by-their-dependence-on-the-us-and-its-ties-with-israel_6745609_23.html,,True,,
18,'Are there words left to describe the horror we are wreaking on Gaza?',no description,https://www.lemonde.fr/en/opinion/article/2025/09/20/are-there-words-left-to-describe-the-horror-we-are-wreaking-on-gaza_6745586_23.html,,True,,
19,The imperative of recognizing the State of Palestine,no description,https://www.lemonde.fr/en/opinion/article/2025/09/20/the-imperative-of-recognizing-the-state-of-palestine_6745582_23.html,,False,,
20,Historian Tal Bruttmann's sharp eye on the Holocaust,no description,https://www.lemonde.fr/en/m-le-mag/article/2025/09/21/historian-tal-bruttmann-s-sharp-eye-on-the-holocaust_6745597_117.html,,True,,
21,The silent and destructive spread of laughing gas: 'That shit took my whole life',no description,https://www.lemonde.fr/en/m-le-mag/article/2025/09/20/the-silent-and-destructive-spread-of-laughing-gas-that-shit-took-my-whole-life_6745588_117.html,,True,,
22,"On the 250th anniversary of Jane Austen's birth, take a trip into the world of the English novelist's superfans",no description,https://www.lemonde.fr/en/m-le-mag/article/2025/09/20/on-the-250th-anniversary-of-jane-austen-s-birth-take-a-trip-into-the-world-of-the-english-novelist-s-superfans_6745580_117.html,,True,,
23,"Nadav Lapid, a voice of dissension in Israeli cinema",no description,https://www.lemonde.fr/en/m-le-mag/article/2025/09/17/nadav-lapid-a-voice-of-dissension-in-israeli-cinema_6745496_117.html,,True,,
24,Tradition done right: Five Paris restaurants reimagining the classics,no description,https://www.lemonde.fr/en/lifestyle/article/2025/09/08/tradition-done-right-five-paris-restaurants-reimagining-the-classics_6745133_37.html,,True,,
25,Paris Design Week: A 15th edition marked by abundance,no description,https://www.lemonde.fr/en/lifestyle/article/2025/09/05/paris-design-week-a-15th-edition-marked-by-abundance_6745060_37.html,,True,,
26,It's pain suisse time! Five places in and around Paris to find this treat,no description,https://www.lemonde.fr/en/lifestyle/article/2025/09/04/it-s-pain-suisse-time-five-places-in-the-paris-region-to-find-this-treat_6745022_37.html,,True,,
27,"At Musée d'Orsay, a Courbet painting gets a new life before visitors' eyes",no description,https://www.lemonde.fr/en/culture/article/2025/07/26/at-musee-d-orsay-a-courbet-painting-gets-a-new-life-before-visitors-eyes_6743744_30.html,,True,,
28,Macron's slow shift toward recognizing the State of Palestine,"After expressing unwavering support for Israel, the French president gradually shifted his stance on the two-state solution following October 7, 2023, and the conflict in Gaza. This reversal will culminate in France's official recognition of the State of Palestine at the UN on September 22.",https://www.lemonde.fr/en/international/article/2025/09/21/macron-s-slow-shift-toward-recognizing-the-state-of-palestine_6745610_4.html,,True,https://img.lemde.fr/2025/09/18/2334/0/4000/2666/400/266/75/0/c31be14_upload-1-4ofqdv0harel-kzihnioglu-macron-reunion-coalition-04092025-hd-118.jpg,
29,The 'al-Munasseq' Facebook page is a window into Gaza's distress,no description,https://www.lemonde.fr/en/international/article/2025/09/21/the-al-munasseq-facebook-page-is-a-window-into-gaza-s-distress_6745611_4.html,,True,https://img.lemde.fr/2025/09/19/0/0/6765/4510/398/265/75/0/836d37d_ftp-import-images-1-ufswhjggylae-8d3a85e68a8d4beeaa870b24e2cc113d-0-30c30736a25c43fa9f7f97a3dc8c99a3.jpg,
30,The US plan to expel hundreds of thousands of Palestinians from Gaza,no description,https://www.lemonde.fr/en/international/article/2025/09/21/the-us-plan-to-expel-hundreds-of-thousands-of-palestinians-from-gaza_6745606_4.html,,True,https://img.lemde.fr/2025/09/20/0/28/4405/2937/398/265/75/0/55fcaa8_ftp-import-images-1-uhsrnxs6wptf-2025-09-20t090106z-302219402-rc2kvgafa0d7-rtrmadp-3-israel-palestinians-gaza.JPG,
31,Estonia says UN Security Council to meet over Russian air incursion,"'On September 22... the United Nations Security Council will convene an emergency meeting in response to Russia's brazen violation of Estonian airspace last Friday,' a statement from the Estonian ministry said.",https://www.lemonde.fr/en/international/article/2025/09/21/estonia-says-un-security-council-to-meet-over-russian-air-incursion_6745603_4.html,,False,https://img.lemde.fr/2025/09/19/1/0/4400/2933/398/265/75/0/d0d6141_ftp-import-images-1-usu9fxmz0z6o-5937392-01-06.jpg,
32,Bernard Arnault riles French left with attack on economist behind wealth tax plan,"France's richest man described Gabriel Zucman, the academic behind a plan to have the ultra-rich pay at least a 2% tax on their fortune, as a 'far-left activist' who wanted to 'destroy the French economy.'",https://www.lemonde.fr/en/france/article/2025/09/21/bernard-arnault-riles-french-left-with-attack-on-economist-behind-wealth-tax-plan_6745608_7.html,,False,https://img.lemde.fr/2025/09/19/0/0/5820/3880/398/265/75/0/a945e2f_ftp-import-images-1-4cnrt9mlcipj-2025-09-19t141628z-420911767-rc2x0fat69xh-rtrmadp-3-europe-economy-wealthtax-analysis.JPG,
33,China's Covid-era witness Zhang Zhan reportedly sentenced to jail in new case,"Lawyer Zhang Zhan, disbarred for her human rights activism, was arrested again in August 2024, just a few months after finishing her first four-year prison sentence following the Wuhan lockdown.",https://www.lemonde.fr/en/international/article/2025/09/21/china-s-covid-era-witness-zhang-zhan-reportedly-sentenced-to-jail-in-new-case_6745604_4.html,,True,https://img.lemde.fr/2021/11/05/0/0/3000/2000/398/265/75/0/230c5c5_5956855-01-06.jpg,
34,Giverny's thriving business around Monet's gardens risks oversaturation,"Chinese and American film shoots and a prime minister who has made it his home base: Just an hour from Paris, this village of 460 residents draws hundreds of thousands of visitors. Yet its fame brings little benefit to the locals.",https://www.lemonde.fr/en/economy/article/2025/09/21/giverny-s-thriving-business-around-monet-s-gardens-risks-oversaturation_6745602_19.html,Jessica Gourdon,True,https://img.lemde.fr/2025/09/17/1/0/4300/2866/664/442/75/0/0726070_upload-1-3kkogac5uwhe-maxnewsworldsix709729.jpg,Feature
35,'Middle Eastern powers seem trapped by their dependence on the US and its ties with Israel',no description,https://www.lemonde.fr/en/opinion/article/2025/09/21/middle-eastern-powers-seem-trapped-by-their-dependence-on-the-us-and-its-ties-with-israel_6745609_23.html,,True,https://img.lemde.fr/2025/09/16/0/11/1944/1296/198/132/95/0/c0b783f_ftp-import-images-1-p64mo4mx0nen-8773ad4be44745709be8cf05a1d966f5-0-c619dc918cda42f6aa80110d4d2127bf.jpg,
36,French mayors to fly Palestinian flags for UN recognition despite government orders,no description,https://www.lemonde.fr/en/france/article/2025/09/21/french-mayors-to-fly-palestinian-flags-as-france-recognizes-the-state-of-palestine_6745601_7.html,,False,https://img.lemde.fr/2025/09/18/0/0/6000/4000/198/132/95/0/1cab334_ftp-import-images-1-ynq1qmkclyo3-2025-09-18t104229z-799899500-rc2augahapq3-rtrmadp-3-france-protest.JPG,
37,European airports getting back online after cyberattack,no description,https://www.lemonde.fr/en/europe/article/2025/09/21/european-airports-getting-back-online-after-cyberattack_6745605_143.html,,False,https://img.lemde.fr/2025/09/21/0/0/5500/3666/198/132/95/0/237232e_ftp-import-images-1-034bmpzviiyz-2025-09-21t090419z-695655473-rc2qvga23ujm-rtrmadp-3-europe-airports-cyberattack.JPG,
38,Historian Tal Bruttmann's sharp eye on the Holocaust,no description,https://www.lemonde.fr/en/m-le-mag/article/2025/09/21/historian-tal-bruttmann-s-sharp-eye-on-the-holocaust_6745597_117.html,,True,https://img.lemde.fr/2025/08/22/0/0/1500/1000/198/132/95/0/d2fc9bd_ftp-import-images-1-ky8y9j30ogeg-393874-3433033.jpg,
39,Japan faces a rising wave of xenophobia,no description,https://www.lemonde.fr/en/international/article/2025/09/21/japan-faces-a-rising-wave-of-xenophobia_6745598_4.html,,True,,
40,Israeli reservists called up to Gaza torn between doubt and duty,no description,https://www.lemonde.fr/en/international/article/2025/09/20/israeli-reservists-called-up-to-gaza-torn-between-doubt-and-duty_6745587_4.html,,True,,
41,"Grenoble, Strasbourg and Rennes top France's ranking of bike-friendly cities",no description,https://www.lemonde.fr/en/environment/article/2025/09/21/grenoble-strasbourg-and-rennes-top-france-s-ranking-of-bike-friendly-cities_6745594_114.html,,True,,
42,'Are there words left to describe the horror we are wreaking on Gaza?',no description,https://www.lemonde.fr/en/opinion/article/2025/09/20/are-there-words-left-to-describe-the-horror-we-are-wreaking-on-gaza_6745586_23.html,,True,,
43,Iran to suspend cooperation with UN's nuclear watchdog over European sanctions,no description,https://www.lemonde.fr/en/international/article/2025/09/20/iran-says-cooperation-with-the-international-atomic-energy-agency-will-be-suspended-after-european-move-on-un-sanctions_6745592_4.html,,False,,
44,Trump and Xi set to meet as TikTok deal nears resolution,no description,https://www.lemonde.fr/en/international/article/2025/09/20/trump-and-xi-set-to-meet-as-tiktok-deal-nears-resolution_6745590_4.html,,True,,
45,Russia escalates military tensions with European countries,no description,https://www.lemonde.fr/en/international/article/2025/09/20/russia-escalates-military-tensions-with-european-countries_6745577_4.html,,True,,
46,French and American far right gather in Paris for Charlie Kirk commemoration,no description,https://www.lemonde.fr/en/france/article/2025/09/20/french-and-american-far-right-gather-in-paris-for-charlie-kirk-commemoration_6745583_7.html,,True,,
47,France's situation causes concern in Brussels,"The country's political instability, the rise of the far right and deteriorating public finances are worrying its European partners. The appointment of PM Sébastien Lecornu, who has so far not been very involved in EU affairs, has done little to reassure them.",https://www.lemonde.fr/en/politics/article/2025/09/20/france-s-situation-causes-concern-in-brussels_6745579_5.html,Virginie Malingre,True,https://img.lemde.fr/2025/09/10/0/0/5899/3933/664/442/75/0/2622b16_upload-1-ioc0vx6vhrn6-jmug250910030.jpg,In Depth
48,French protestors caught between anger and disillusionment,"Eight days after the 'Block Everything' protest movement on September 10, the union coalition called for mobilization against 'austerity' on Thursday, September 18. More than 250 gatherings took place across France, demanding a change in political direction and greater tax justice.",https://www.lemonde.fr/en/france/article/2025/09/18/september-18-day-of-protest-demonstrators-caught-between-anger-and-disillusionment_6745531_7.html,,True,https://img.lemde.fr/2025/09/18/1/0/1616/1077/664/442/75/0/26a757b_upload-1-34celxywipe3-dsc7129.jpeg,News
49,Two French baby boomers on what their generation got wrong,The economist Jean Pisani-Ferry and the politician Jean-Louis Bourlanges each delivered a harsh review of the past decades as they were decorated with the Légion d'Honneur in early September.,https://www.lemonde.fr/en/opinion/article/2025/09/20/two-french-baby-boomers-on-what-their-generation-got-wrong_6745575_23.html,Pascal Riché and  Sylvie Kauffmann,False,https://img.lemde.fr/2023/10/29/3/0/5900/3933/664/442/75/0/69c8dda_1698607470601-jmug231023019.jpg,Document
50,The imperative of recognizing the State of Palestine,no description,https://www.lemonde.fr/en/opinion/article/2025/09/20/the-imperative-of-recognizing-the-state-of-palestine_6745582_23.html,Le Monde,False,,Editorial
51,"Nathalie Loiseau, MEP: 'After the assassination of Charlie Kirk, silence speaks louder than words'",no description,https://www.lemonde.fr/en/opinion/article/2025/09/16/nathalie-loiseau-mep-after-the-assassination-of-charlie-kirk-silence-speaks-louder-than-words_6745455_23.html,Nathalie Loiseau,,,Op-Ed
52,"Michel Duclos, former diplomat: 'Recognizing a Palestinian state is a step toward a peace'",no description,https://www.lemonde.fr/en/opinion/article/2025/09/19/michel-duclos-former-diplomat-recognizing-a-palestinian-state-is-a-lever-towards-a-peaceful-settlement_6745537_23.html,Michel Duclos,,,Op-Ed
