,headline,description,url,byline,premium,image_url,article type
0,"Moldova elections: Aside from Russia, Romanian far right also interfering",no description,https://www.lemonde.fr/en/international/article/2025/09/28/moldova-elections-aside-from-russia-romanian-far-right-also-interfering_6745859_4.html,,True,,
1,"In Canada, First Nations seek to reclaim their national parks",no description,https://www.lemonde.fr/en/international/article/2025/09/28/in-canada-first-nations-seek-to-reclaim-their-national-parks_6745854_4.html,,True,,
2,Families of French prisoners in Iran torn between hope and uncertainty,no description,https://www.lemonde.fr/en/international/article/2025/09/28/families-of-french-prisoners-in-iran-torn-between-hope-and-uncertainty_6745853_4.html,,True,,
3,"As new sanctions loom, Iran is already in an economic crisis",no description,https://www.lemonde.fr/en/international/article/2025/09/27/as-new-sanctions-loom-iran-is-already-in-an-economic-crisis_6745848_4.html,,True,,
4,Sanctions against Russia spark rift between US and Europe over China,no description,https://www.lemonde.fr/en/international/article/2025/09/15/sanctions-against-russia-spark-rift-between-us-and-europe-over-china_6745411_4.html,,True,,
5,France's political instability puts Franco-German alliance to the test,no description,https://www.lemonde.fr/en/opinion/article/2025/08/30/france-s-political-instability-puts-franco-german-alliance-to-the-test_6744873_23.html,,False,,
6,France faces prospect of paying higher borrowing costs than Italy,no description,https://www.lemonde.fr/en/economy/article/2025/08/19/france-faces-prospect-of-paying-higher-borrowing-costs-than-italy_6744519_19.html,,True,,
7,French man arrested in Slovenia for crimes committed in Croatia during 1991 war,no description,https://www.lemonde.fr/en/international/article/2025/08/06/french-man-arrested-in-slovenia-for-crimes-committed-in-croatia-during-1991-war_6744113_4.html,,True,,
8,French investigators believe Russia involved in dumping of pig heads at mosques,no description,https://www.lemonde.fr/en/france/article/2025/09/27/french-investigators-believe-russia-involved-in-dumping-of-pig-heads-at-mosques_6745830_7.html,,True,,
9,"France has been 'dropping out of democracy' since 2017, warns an NGO report",no description,https://www.lemonde.fr/en/france/article/2025/09/27/france-has-been-dropping-out-of-democracy-since-2017-warns-an-ngo-report_6745803_7.html,,True,,
10,"Excerpt from the decision convicting Sarkozy: 'Acts of exceptional seriousness, likely to undermine citizens' trust'",no description,https://www.lemonde.fr/en/france/article/2025/09/26/excerpt-from-the-decision-in-sarkozy-s-conviction-acts-of-exceptional-seriousness-likely-to-undermine-citizens-trust_6745782_7.html,,True,,
11,The day Sarkozy learned he was going to prison,no description,https://www.lemonde.fr/en/france/article/2025/09/26/the-day-sarkozy-learned-he-was-going-to-prison_6745758_7.html,,True,,
12,Watch: Hundreds of thousands march in France against budget cuts,no description,https://www.lemonde.fr/en/videos/video/2025/09/19/french-strikes-watch-what-happened-as-hundreds-of-thousands-marched-against-budget-cuts_6745548_108.html,,False,,
13,Emmys 2025: 'Adolescence' star Owen Cooper becomes youngest winner for best supporting actor,no description,https://www.lemonde.fr/en/videos/video/2025/09/15/emmys-2025-adolescence-star-owen-cooper-becomes-youngest-winner-for-best-supporting-actor_6745427_108.html,,False,,
14,"From 'influence peddling' to 'corruption,' what is French Culture Minister Rachida Dati accused of?",no description,https://www.lemonde.fr/en/videos/video/2025/09/06/from-influence-peddling-to-corruption-what-is-french-culture-minister-rachida-dati-accused-of_6745094_108.html,,False,,
15,Watch: Tsunami warnings sound in Japan after 8.8 magnitude quake off Russian coast,no description,https://www.lemonde.fr/en/videos/video/2025/07/30/watch-tsunami-warnings-sound-in-japan-after-8-8-magnitude-quake-off-russian-coast_6743900_108.html,,False,,
16,The troubling direction of American justice,no description,https://www.lemonde.fr/en/opinion/article/2025/09/27/the-troubling-direction-of-american-justice_6745818_23.html,,False,,
17,"'After colonizing the adult world, AI enters the world of children'",no description,https://www.lemonde.fr/en/opinion/article/2025/09/28/after-colonizing-the-adult-world-ai-enters-the-world-of-children_6745857_23.html,,True,,
18,'To frame Kirk's death as escalation misses the truth. The real threat is normalization',no description,https://www.lemonde.fr/en/opinion/article/2025/09/26/to-frame-kirk-s-death-as-escalation-misses-the-truth-the-real-threat-is-normalization_6745775_23.html,,True,,
19,'Israel's isolation is the price of pursuing a war in Gaza without clear objectives',no description,https://www.lemonde.fr/en/opinion/article/2025/09/26/israel-s-isolation-is-the-price-of-pursuing-a-war-in-gaza-without-clear-objectives_6745764_23.html,,True,,
20,"Vivian Jenna Wilson, Elon Musk's transgender daughter, has become a New York Fashion Week sensation",no description,https://www.lemonde.fr/en/m-le-mag/article/2025/09/24/vivian-jenna-wilson-elon-musk-s-transgender-daughter-has-become-a-new-york-fashion-week-sensation_6745690_117.html,,True,,
21,Historian Tal Bruttmann's sharp eye on the Holocaust,no description,https://www.lemonde.fr/en/m-le-mag/article/2025/09/21/historian-tal-bruttmann-s-sharp-eye-on-the-holocaust_6745597_117.html,,True,,
22,The silent and destructive spread of laughing gas: 'That shit took my whole life',no description,https://www.lemonde.fr/en/m-le-mag/article/2025/09/20/the-silent-and-destructive-spread-of-laughing-gas-that-shit-took-my-whole-life_6745588_117.html,,True,,
23,"For the 250th anniversary of Jane Austen's birth, take a trip into the world of her superfans",no description,https://www.lemonde.fr/en/m-le-mag/article/2025/09/20/on-the-250th-anniversary-of-jane-austen-s-birth-take-a-trip-into-the-world-of-the-english-novelist-s-superfans_6745580_117.html,,True,,
24,Tradition done right: Five Paris restaurants reimagining the classics,no description,https://www.lemonde.fr/en/lifestyle/article/2025/09/08/tradition-done-right-five-paris-restaurants-reimagining-the-classics_6745133_37.html,,True,,
25,Paris Design Week: A 15th edition marked by abundance,no description,https://www.lemonde.fr/en/lifestyle/article/2025/09/05/paris-design-week-a-15th-edition-marked-by-abundance_6745060_37.html,,True,,
26,It's pain suisse time! Five places in and around Paris to find this treat,no description,https://www.lemonde.fr/en/lifestyle/article/2025/09/04/it-s-pain-suisse-time-five-places-in-the-paris-region-to-find-this-treat_6745022_37.html,,True,,
27,"At Musée d'Orsay, a Courbet painting gets a new life before visitors' eyes",no description,https://www.lemonde.fr/en/culture/article/2025/07/26/at-musee-d-orsay-a-courbet-painting-gets-a-new-life-before-visitors-eyes_6743744_30.html,,True,,
28,How can Europe withstand pressure from Russia and the US? Two experts debate,Tensions with Russia to the East and the United States to the West are testing Europe's model. Sylvain Kahn and Guillaume Lagane examine this shifting landscape and the possible responses.,https://www.lemonde.fr/en/books/article/2025/09/28/how-can-europe-withstand-pressure-from-russia-and-us-two-experts-debate_6745858_33.html,,True,https://img.lemde.fr/2025/05/10/0/0/4002/2668/400/266/75/0/577fbe0_sirius-fs-upload-1-ek3iklxhs65i-1746883330047-739056.jpg,
29,"Moldova elections: Aside from Russia, Romanian far right also interfering",no description,https://www.lemonde.fr/en/international/article/2025/09/28/moldova-elections-aside-from-russia-romanian-far-right-also-interfering_6745859_4.html,,True,https://img.lemde.fr/2025/09/26/29/0/5546/3697/398/265/75/0/9d55578_upload-1-y3vzw7wxoq3t-000-49ru2t2.jpg,
30,Trump authorizes troop deployment and use of 'full force if necessary' in Portland,no description,https://www.lemonde.fr/en/international/article/2025/09/27/trump-authorizes-troop-deployment-and-use-of-full-force-if-necessary-in-portland_6745846_4.html,,False,https://img.lemde.fr/2025/09/27/0/0/7122/4748/398/265/75/0/805e42a_ftp-import-images-1-kxzdaavteh5d-7bfcd5a20fda4c93b2256697dcf84619-0-2c6ce077aa9e4b0d80f94fef4e760d14.jpg,
31,Families of French prisoners in Iran torn between hope and uncertainty,"On Thursday, Emmanuel Macron spoke of a 'solid prospect' for the release of four French nationals detained by Tehran.",https://www.lemonde.fr/en/international/article/2025/09/28/families-of-french-prisoners-in-iran-torn-between-hope-and-uncertainty_6745853_4.html,,True,https://img.lemde.fr/2025/09/25/0/0/4000/2666/398/265/75/0/0e557bf_upload-1-gmzxquyg681z-2025-07-06t000000z-879232631-mt1lepic000wov0km-rtrmadp-3-iran-hostage-rally-for-cecile-kohler-and-jacques-paris-july-6.JPG,
32,"'After colonizing the adult world, AI enters the world of children'","There are no age limits for AI companies. As digital emotional 'companions' emerge, young children have become tech firms' latest targets.",https://www.lemonde.fr/en/opinion/article/2025/09/28/after-colonizing-the-adult-world-ai-enters-the-world-of-children_6745857_23.html,,True,https://img.lemde.fr/2025/02/06/4/0/1800/1200/398/265/75/0/1d11d0f_sirius-fs-upload-1-lmmddwbqjapr-1738856789577-mei-dia-2.png,
33,The bustier: Between constraint and freedom,"The bustier, a pinnacle of femininity, is a garment full of contradictions, capable of imposing certain constraints while also becoming a tool for asserting oneself.",https://www.lemonde.fr/en/lifestyle/article/2025/09/28/the-bustier-between-constraint-and-freedom_6745855_37.html,,False,https://img.lemde.fr/2025/09/11/106/0/1228/818/398/265/75/0/d2e2497_ftp-import-images-1-sx0qi2iz5mud-396720-3437296.jpg,
34,The business school graduates catching the culinary bug,A growing number of business school alumni are venturing into the restaurant industry. But can their cost-efficient recipes work in the kitchen?,https://www.lemonde.fr/en/lifestyle/article/2025/09/28/the-business-school-graduates-catching-the-culinary-bug_6745856_37.html,Léo Pajon,True,https://img.lemde.fr/2025/09/10/192/0/1831/1220/664/442/75/0/76f55c4_upload-1-m5f1patk7gff-le-monde-gastro-def-1.jpg,Feature
35,French legal community denounces threats against judge overseeing Sarkozy trial,no description,https://www.lemonde.fr/en/france/article/2025/09/28/french-lawyers-denounce-threats-against-judge-overseeing-sarkozy-trial_6745852_7.html,,False,https://img.lemde.fr/2025/09/25/0/0/5637/3758/198/132/95/0/a60c581_ftp-import-images-1-go60r1t6a1pl-5990412-01-06.jpg,
36,Crowd crush at political rally for popular actor Vijay in southern India kills at least 36,no description,https://www.lemonde.fr/en/international/article/2025/09/28/stampede-at-political-rally-for-popular-actor-vijay-in-southern-india-kills-at-least-36_6745851_4.html,,False,https://img.lemde.fr/2025/09/27/0/139/811/541/198/132/95/0/d05f801_upload-1-a6tp3ev7do72-d05f801-upload-1-dgirqxbvitfy-capture-da-ei-cran-2025-09-27-ai-3-41-32a-pm.png,
37,"Madagascar protesters gather once more, days after unrest began",no description,https://www.lemonde.fr/en/international/article/2025/09/28/protesters-gather-once-more-in-madagascar-days-after-unrest-began_6745850_4.html,,False,https://img.lemde.fr/2025/09/27/0/0/3402/2268/198/132/95/0/483601d_ftp-import-images-1-s7fnurwc52st-5007936-01-06.jpg,
38,New drone sightings over Denmark's biggest military base,no description,https://www.lemonde.fr/en/international/article/2025/09/27/new-drone-sightings-over-denmark-s-biggest-military-base_6745807_4.html,,False,https://img.lemde.fr/2025/09/26/0/26/5112/3408/198/132/95/0/762626d_ftp-import-images-1-hsd6dcr6fbmn-df277eb34427443ebd5f5df4e7f96f10-0-4167f9078f6046c3857bfb440b604cd0.jpg,
39,"In Canada, First Nations seek to reclaim their national parks",no description,https://www.lemonde.fr/en/international/article/2025/09/28/in-canada-first-nations-seek-to-reclaim-their-national-parks_6745854_4.html,,True,,
40,Gaza: Diplomats press Trump to push Israel toward ending war,no description,https://www.lemonde.fr/en/international/article/2025/09/27/gaza-diplomats-press-trump-to-push-israel-toward-ending-war_6745820_4.html,,True,,
41,Paris-Berlin and Paris-Vienna night trains under threat as French government cuts subsidies,no description,https://www.lemonde.fr/en/economy/article/2025/09/27/paris-berlin-and-paris-vienna-night-trains-under-threat-as-the-french-government-withdraws-subsidies_6745799_19.html,,True,,
42,"'Put Your Soul on Your Hand and Walk,' a cinematic memorial to Palestinian photographer Fatma Hassona",no description,https://www.lemonde.fr/en/culture/article/2025/09/27/put-your-soul-on-your-hand-and-walk-a-cinematic-memorial-to-palestinian-photographer-fatma-hassona_6745802_30.html,,True,,
43,"Russia stokes fear ahead of Moldova elections, claiming NATO invasion is imminent",no description,https://www.lemonde.fr/en/international/article/2025/09/27/russia-stokes-fear-ahead-of-moldova-elections-claiming-nato-invasion-is-imminent_6745844_4.html,,True,,
44,England wins Women's Rugby World Cup,no description,https://www.lemonde.fr/en/sports/article/2025/09/27/england-wins-women-s-rugby-world-cup_6745847_9.html,,False,,
45,French PM presents deficit targets slightly below predecessor's,no description,https://www.lemonde.fr/en/politics/article/2025/09/27/french-pm-presents-deficit-targets-slightly-below-predecessor-s_6745842_5.html,,True,,
46,French investigators believe Russia involved in dumping of pig heads at mosques,no description,https://www.lemonde.fr/en/france/article/2025/09/27/french-investigators-believe-russia-involved-in-dumping-of-pig-heads-at-mosques_6745830_7.html,,True,,
47,"As new sanctions loom, Iran is already in an economic crisis",The apparent openness promised in 2024 by President Pezeshkian has done little to lift a country weighed down by runaway inflation and endemic corruption.,https://www.lemonde.fr/en/international/article/2025/09/27/as-new-sanctions-loom-iran-is-already-in-an-economic-crisis_6745848_4.html,Ghazal Golshiri and  Madjid Zerrouky,True,https://img.lemde.fr/2025/09/25/0/0/5899/3933/664/442/75/0/572a33d_upload-1-vq4meoyqkr8k-jmug250924036.jpg,In Depth
48,The day Sarkozy learned he was going to prison,"Nicolas Sarkozy will become the first former president of the French Republic to sleep behind bars after being convicted of criminal conspiracy, in the case of alleged Libyan financing of his 2007 presidential campaign.",https://www.lemonde.fr/en/france/article/2025/09/26/the-day-sarkozy-learned-he-was-going-to-prison_6745758_7.html,Franck Johannès,True,https://img.lemde.fr/2025/09/25/0/0/2503/1668/664/442/75/0/06b3cdb_ftp-import-images-1-4sy7ltjml1k2-97d221d144ef49f6b9a8ae3f4604c3f0-1-63b8023f79f14f098444069a1704210e.jpg,News
49,Sarkozy's conviction: Five questions about what happens next,Former French president Nicolas Sarkozy was sentenced to five years in prison for 'criminal conspiracy' in the case of alleged Libyan funding for his 2007 presidential campaign. He has appealed. Here's an overview of the next steps.,https://www.lemonde.fr/en/les-decodeurs/article/2025/09/26/sarkozy-s-conviction-five-questions-about-what-happens-next_6745771_8.html,Les Décodeurs,False,https://img.lemde.fr/2025/09/26/0/2/4749/3166/664/442/75/0/a1c8438_upload-1-uijl12ayjclz-915865.jpg,News
50,The troubling direction of American justice,no description,https://www.lemonde.fr/en/opinion/article/2025/09/27/the-troubling-direction-of-american-justice_6745818_23.html,Le Monde,False,,Editorial
51,Sarkozy conviction: No one is above the law,no description,https://www.lemonde.fr/en/opinion/article/2025/09/26/sarkozy-conviction-no-one-is-above-the-law_6745763_23.html,Le Monde,False,,Editorial
52,"'In Sudan, it is as if a congenital curse is at work. And the worst is yet to come'",no description,https://www.lemonde.fr/en/opinion/article/2025/09/26/in-sudan-it-is-as-if-a-congenital-curse-is-at-work-and-the-worst-is-yet-to-come_6745757_23.html,Alain Frachon,,https://img.lemde.fr/2025/02/13/0/0/0/0/100/100/60/0/012c520_sirius-fs-upload-1-siebgildln9p-1739442624103-capture-da-a-cran-2025-02-13-112806.png,Column
