,headline,description,url,byline,premium,image_url,article type
0,"War in Gaza: Hamas agrees to ceasefire proposal, Israel reviews accord",no description,https://www.lemonde.fr/en/international/article/2025/08/19/war-in-gaza-hamas-agrees-to-ceasefire-proposal-israel-reviews-accord_6744512_4.html,,True,,
1,Europeans leaders mobilize to prevent a Ukraine peace deal too favorable to Moscow,no description,https://www.lemonde.fr/en/international/article/2025/08/19/europeans-leaders-mobilize-to-prevent-a-ukraine-peace-deal-too-favorable-to-moscow_6744511_4.html,,True,,
2,"In Ukraine peace talks, Donbas question remains crucial and unresolved",no description,https://www.lemonde.fr/en/international/article/2025/08/19/in-ukraine-peace-talks-donbas-region-remains-a-knotty-issue_6744510_4.html,,True,,
3,Diplomatic efforts intensify ahead of possible Zelensky-Putin meeting,no description,https://www.lemonde.fr/en/international/article/2025/08/19/war-in-ukraine-diplomatic-efforts-intensify-ahead-of-possible-zelensky-putin-meeting_6744508_4.html,,True,,
4,France faces prospect of paying higher borrowing costs than Italy,no description,https://www.lemonde.fr/en/economy/article/2025/08/19/france-faces-prospect-of-paying-higher-borrowing-costs-than-italy_6744519_19.html,,True,,
5,French man arrested in Slovenia for crimes committed in Croatia during 1991 war,no description,https://www.lemonde.fr/en/international/article/2025/08/06/french-man-arrested-in-slovenia-for-crimes-committed-in-croatia-during-1991-war_6744113_4.html,,True,,
6,"30 years after the Bosnian War, its refugees still cannot return home",no description,https://www.lemonde.fr/en/international/article/2025/08/03/thirty-years-after-the-bosnian-war-its-refugees-still-cannot-return-home_6744026_4.html,,True,,
7,Early and intense wildfire season has arrived around the Mediterranean,no description,https://www.lemonde.fr/en/europe/article/2025/07/17/wildfire-season-arrives-early-and-intense-around-the-mediterranean_6743466_143.html,,True,,
8,Bodies found in the Seine: Two criminal investigations deepen the mystery,no description,https://www.lemonde.fr/en/france/article/2025/08/16/bodies-found-in-seine-two-criminal-investigations-deepen-the-mystery_6744431_7.html,,True,,
9,"In France, accessible beaches help 'normalize vacations' for all",no description,https://www.lemonde.fr/en/france/article/2025/08/16/in-france-accessible-beaches-help-normalize-vacations-for-all_6744422_7.html,,True,,
10,Urban forests spread their cover in a time of climate change,no description,https://www.lemonde.fr/en/france/article/2025/08/16/urban-forests-spread-their-cover-in-a-time-of-climate-change_6744421_7.html,,True,,
11,"A winemaker, his daughter and a vintage for their undocumented workers",no description,https://www.lemonde.fr/en/m-le-mag/article/2025/08/15/a-winemaker-his-daughter-and-a-vintage-for-their-undocumented-workers_6744410_117.html,,True,,
12,Watch: Tsunami warnings sound in Japan after 8.8 magnitude quake off Russian coast,no description,https://www.lemonde.fr/en/videos/video/2025/07/30/watch-tsunami-warnings-sound-in-japan-after-8-8-magnitude-quake-off-russian-coast_6743900_108.html,,False,,
13,What is France's 'Black code' and why hasn't it been repealed?,no description,https://www.lemonde.fr/en/videos/video/2025/05/31/what-is-france-s-black-code-and-why-hasn-t-it-been-repealed_6741860_108.html,,False,,
14,How was the European Union created?,no description,https://www.lemonde.fr/en/videos/video/2025/05/29/how-was-the-european-union-created_6741795_108.html,,False,,
15,Glide bombs: Russia's secret to making cheap weapons,no description,https://www.lemonde.fr/en/videos/video/2025/05/25/glide-bombs-russia-s-secret-to-making-cheap-weapons_6741646_108.html,,True,,
16,"In Serbia, a strategy of fear",no description,https://www.lemonde.fr/en/opinion/article/2025/08/18/in-serbia-a-strategy-of-fear_6744487_23.html,,False,,
17,"'By choosing AI for its remembrance policy, the French government is automating an intellectual process'",no description,https://www.lemonde.fr/en/opinion/article/2025/08/19/by-choosing-ai-for-its-remembrance-policy-the-french-government-is-automating-an-intellectual-process_6744517_23.html,,True,,
18,An essential but largely unproductive meeting in Washington,no description,https://www.lemonde.fr/en/opinion/article/2025/08/19/war-in-ukraine-an-essential-but-largely-unproductive-meeting-in-washington_6744509_23.html,,False,,
19,Cigarette lit with Arc de Triomphe flame: 'The State is erring or trying to mislead us in dramatizing a non-story',no description,https://www.lemonde.fr/en/opinion/article/2025/08/18/cigarette-lit-with-arc-de-triomphe-flame-the-state-is-erring-or-trying-to-mislead-us-in-dramatizing-a-non-story_6744482_23.html,,True,,
20,Soviet-era relics in Kazakhstan rescued from ruin,no description,https://www.lemonde.fr/en/m-le-mag/article/2025/08/17/soviet-era-relics-in-kazakhstan-rescued-from-ruin_6744459_117.html,,True,,
21,Chinese Hollywood races to cash in on minidramas boom,no description,https://www.lemonde.fr/en/m-le-mag/article/2025/08/17/chinese-hollywood-races-to-cash-in-on-the-minidramas-boom_6744449_117.html,,True,,
22,"A winemaker, his daughter and a vintage for their undocumented workers",no description,https://www.lemonde.fr/en/m-le-mag/article/2025/08/15/a-winemaker-his-daughter-and-a-vintage-for-their-undocumented-workers_6744410_117.html,,True,,
23,Gaza: A few notes of beauty amid the devastation,no description,https://www.lemonde.fr/en/m-le-mag/article/2025/08/11/in-gaza-a-few-notes-of-beauty-amid-the-devastation_6744255_117.html,,True,,
24,"At Musée d'Orsay, a Courbet painting gets a new life before visitors' eyes",no description,https://www.lemonde.fr/en/culture/article/2025/07/26/at-musee-d-orsay-a-courbet-painting-gets-a-new-life-before-visitors-eyes_6743744_30.html,,True,,
25,Avignon Festival 2025: An edition marked by emotion and fragility,no description,https://www.lemonde.fr/en/culture/article/2025/07/26/avignon-festival-2025-an-edition-marked-by-emotion-and-fragility_6743733_30.html,,True,,
26,The challenge of surtitling at the Avignon Festival,no description,https://www.lemonde.fr/en/culture/article/2025/07/20/the-challenge-of-surtitling-at-the-avignon-festival_6743560_30.html,,True,,
27,"In Arles, Fragonard's Museum of Fashion and Costume gracefully unveils treasures",no description,https://www.lemonde.fr/en/m-le-mag/article/2025/07/17/in-arles-fragonard-s-museum-of-fashion-and-costume-gracefully-unveils-treasures_6743450_117.html,,True,,
28,"In Ukraine peace talks, Donbas question remains crucial and unresolved","Donald Trump wants to pressure Ukraine to cede its eastern region to Moscow, including areas still under its control. Volodymyr Zelensky has taken a cautious stance, wary of alienating the US president.",https://www.lemonde.fr/en/international/article/2025/08/19/in-ukraine-peace-talks-donbas-region-remains-a-knotty-issue_6744510_4.html,,True,https://img.lemde.fr/2025/08/18/0/0/7408/4939/400/266/75/0/42ac149_ftp-import-images-1-bdnl38odezq1-5664327-01-06.jpg,
29,Ukraine allies meet in hopes of a breakthrough in peace talks,no description,https://www.lemonde.fr/en/international/article/2025/08/19/ukraine-allies-meet-in-hopes-of-a-breakthrough-in-peace-talks_6744513_4.html,,False,https://img.lemde.fr/2025/08/18/0/0/4987/3324/398/265/75/0/43a6c86_ftp-import-images-1-ievysmhf5i8l-2025-08-18t192637z-274171725-rc2v9gayt32g-rtrmadp-3-ukraine-crisis-summit.JPG,
30,France faces prospect of paying higher borrowing costs than Italy,no description,https://www.lemonde.fr/en/economy/article/2025/08/19/france-faces-prospect-of-paying-higher-borrowing-costs-than-italy_6744519_19.html,,True,https://img.lemde.fr/2025/08/18/1/0/8192/5461/398/265/75/0/bbf1918_upload-1-4srrdfmuihya-063-2220488031.jpg,
31,"War in Gaza: Hamas agrees to ceasefire proposal, Israel reviews accord","By Tuesday morning, Prime Minister Benjamin Netanyahu's government had neither approved nor rejected the agreement accepted the previous day by Hamas. Put forward by Egypt and Qatar, the proposal called first for a 60-day truce in exchange, notably, for the release of 10 live hostages, as well as a partial withdrawal of the Israeli army.",https://www.lemonde.fr/en/international/article/2025/08/19/war-in-gaza-hamas-agrees-to-ceasefire-proposal-israel-reviews-accord_6744512_4.html,,True,https://img.lemde.fr/2025/08/19/0/0/5302/3534/398/265/75/0/d0a76e3_upload-1-rspoqa440cwz-573728.jpg,
32,"'By choosing AI for its remembrance policy, the French government is automating an intellectual process'",Historian Frédéric Clavert writes that the use of artificial intelligence (AI) by French ministries to create commemorative videos can result in highly questionable outcomes.,https://www.lemonde.fr/en/opinion/article/2025/08/19/by-choosing-ai-for-its-remembrance-policy-the-french-government-is-automating-an-intellectual-process_6744517_23.html,,True,https://img.lemde.fr/2025/08/12/0/0/3000/2000/398/265/75/0/87930c6_upload-1-s8qm4a9dbrxa-ia-soldat.jpg,
33,The third life of a synagogue transformed into a contemporary art center,'Unusual Places for an Exhibition' (1/6). Le Monde explores six art centers housed in unexpected venues. Today: a former sanctuary that was blown up by the Nazis and rebuilt after the war.,https://www.lemonde.fr/en/summer-reads/article/2025/08/19/in-northeastern-france-the-third-life-of-a-synagogue-transformed-into-a-center-of-contemporary-art_6744497_183.html,,True,https://img.lemde.fr/2025/07/16/0/0/5616/3744/398/265/75/0/6df222c_upload-1-bptua6dm8a8u-mg-6270.jpg,
34,'What I would give to inhabit again a country where the gravest offense the president could be accused of was sartorial misconduct','Letters from America' (2/6). Writer and journalist Thomas Chatterton Williams looks back at the 'ludicrous drama' caused by Barack Obama's tan suit in 2014. The contrast with Donald Trump's gaffes is striking.,https://www.lemonde.fr/en/summer-reads/article/2025/08/19/what-i-would-give-to-inhabit-again-a-country-where-the-gravest-offense-the-president-could-be-accused-of-was-sartorial-misconduct_6744502_183.html,Thomas Chatterton Williams,True,https://img.lemde.fr/2025/07/28/193/0/1866/1244/664/442/75/0/a7b317f_upload-1-fijn1ejkgz1l-costume-colo-01.jpg,Series
35,Macron calls for sanctions against Russia if diplomacy fails,no description,https://www.lemonde.fr/en/international/article/2025/08/19/macron-calls-for-sanctions-against-russia-if-diplomacy-fails_6744496_4.html,,False,https://img.lemde.fr/2025/08/18/0/0/8256/5504/198/132/95/0/07706bd_ftp-import-images-1-lzvo8ss2odaa-5664884-01-06.jpg,
36,"In Poland, thousands of young people are spending their 'vacation with the army'",no description,https://www.lemonde.fr/en/international/article/2025/08/19/in-poland-thousands-of-young-people-are-spending-their-vacation-with-the-army_6744493_4.html,,True,https://img.lemde.fr/2025/08/14/1/0/7066/4710/198/132/95/0/8dc0b6b_upload-1-63bjmffbz9kb-000-67m77zq.jpg,
37,"Hungary, an ailing economy in Europe",no description,https://www.lemonde.fr/en/economy/article/2025/08/18/hungary-an-ailing-economy-in-europe_6744492_19.html,,True,https://img.lemde.fr/2025/08/17/0/6/5793/3862/198/132/95/0/0e6cc0a_upload-1-dxvnxmwxglvz-000-37y72vm.jpg,
38,French media coverage of heat waves still has room for improvement,no description,https://www.lemonde.fr/en/economy/article/2025/08/19/french-media-coverage-of-heat-waves-still-has-room-for-improvement_6744494_19.html,,True,https://img.lemde.fr/2025/08/14/0/0/5548/3699/198/132/95/0/c3d13c2_upload-1-ac7km5tmovds-2025-06-20t152316z-1185852258-rc2b6famo5ki-rtrmadp-3-france-weather-heat-wave.JPG,
39,US universities look to conciliate with Trump administration,no description,https://www.lemonde.fr/en/international/article/2025/08/19/us-universities-look-to-conciliate-with-trump-administration_6744503_4.html,,True,,
40,Cigarette lit with Arc de Triomphe flame: 'The State is erring or trying to mislead us in dramatizing a non-story',no description,https://www.lemonde.fr/en/opinion/article/2025/08/18/cigarette-lit-with-arc-de-triomphe-flame-the-state-is-erring-or-trying-to-mislead-us-in-dramatizing-a-non-story_6744482_23.html,,True,,
41,Texas Democrats return after protesting new electoral map favorable to Republicans,no description,https://www.lemonde.fr/en/international/article/2025/08/18/texas-democrats-return-after-protesting-new-electoral-map-favorable-to-republicans_6744490_4.html,,False,,
42,Four Republican states send National Guard troops as reinforcements in DC,no description,https://www.lemonde.fr/en/international/article/2025/08/19/four-republican-states-send-national-guard-troops-as-reinforcements-in-dc_6744504_4.html,,False,,
43,"Peace is slipping further away in eastern DRC, despite mediation efforts by the US and Qatar",no description,https://www.lemonde.fr/en/international/article/2025/08/19/peace-is-slipping-further-away-in-eastern-democratic-republic-of-congo-despite-mediation-efforts-by-the-us-and-qatar_6744495_4.html,,True,,
44,"Buffeted by Trump, India seeks to strengthen ties with Russia and China",no description,https://www.lemonde.fr/en/international/article/2025/08/18/buffeted-by-trump-india-seeks-to-strengthen-ties-with-russia-and-china_6744468_4.html,,True,,
45,Air Canada flight attendants reach 'tentative' deal to end strike,no description,https://www.lemonde.fr/en/economy/article/2025/08/19/air-canada-flight-attendants-reach-tentative-deal-to-end-strike_6744515_19.html,,False,,
46,Monsoon floods in northern Pakistan claim hundreds of lives,no description,https://www.lemonde.fr/en/environment/article/2025/08/19/monsoon-floods-in-northern-pakistan-claim-hundreds-of-lives_6744518_114.html,,False,,
47,Diplomatic efforts intensify ahead of possible Zelensky-Putin meeting,"Gathered at the White House to meet with Donald Trump, European leaders and the Ukrainian president praised their host and projected unity, despite the ambiguity of US positions.",https://www.lemonde.fr/en/international/article/2025/08/19/war-in-ukraine-diplomatic-efforts-intensify-ahead-of-possible-zelensky-putin-meeting_6744508_4.html,Piotr Smolar,True,https://img.lemde.fr/2025/08/18/0/0/8140/5426/664/442/75/0/c807920_ftp-import-images-1-6rrlfxlu7hrm-5664753-01-06.jpg,In Depth
48,"A winemaker, his daughter and a vintage for their undocumented workers","In southeastern France, Philippe Grisard and his daughter, Nadège, rely daily on undocumented workers to help tend their vineyard. To draw attention to their workers' precarious legal status, they named one of their vintages 'Sans eux' ('Without Them').",https://www.lemonde.fr/en/m-le-mag/article/2025/08/15/a-winemaker-his-daughter-and-a-vintage-for-their-undocumented-workers_6744410_117.html,Laure Marchand,True,https://img.lemde.fr/2025/06/20/0/0/1500/1000/664/442/75/0/14dc29f_ftp-import-images-1-zqyxalwt7xpc-387558-3426101.jpg,Feature
49,"The lobo-guará, Brazil's maned wolf, a national icon under threat","Emblematic of the Cerrado, these animals have seen their habitat fragmented by deforestation and the spread of industrial agriculture. In the state of Minas Gerais, a sanctuary now shelters some of them, aiming to raise public awareness.",https://www.lemonde.fr/en/environment/article/2025/08/18/the-lobo-guara-brazil-s-maned-wolf-a-national-icon-under-threat_6744466_114.html,Bruno Meyerfeld,True,https://img.lemde.fr/2025/06/10/196/0/4707/3138/664/442/75/0/0f4f6af_sirius-fs-upload-1-dao3gk9sse5k-1749563308155-49484312007-774da6b66a-o.jpg,Feature
50,An essential but largely unproductive meeting in Washington,no description,https://www.lemonde.fr/en/opinion/article/2025/08/19/war-in-ukraine-an-essential-but-largely-unproductive-meeting-in-washington_6744509_23.html,Le Monde,False,,Editorial
51,"India and Pakistan, like Israel and Palestine, remain locked in their founding disputes",no description,https://www.lemonde.fr/en/international/article/2025/08/17/india-and-pakistan-like-israel-and-palestine-remain-locked-in-their-founding-disputes_6744450_4.html,Jean-Pierre Filiu,,https://img.lemde.fr/2023/07/31/0/0/0/0/100/100/60/0/d45bb07_1690791602941-eac5c14-1647333440018-jean-pierre-filiu-2019.jpg,Column
52,'The decision to 'take control' of the Gaza Strip reveals the ideological consistency of the Israeli prime minister',no description,https://www.lemonde.fr/en/opinion/article/2025/08/16/the-decision-to-take-control-of-the-gaza-strip-sheds-light-on-the-ideological-consistency-of-the-israeli-prime-minister_6744417_23.html,Amélie Férey,,,Op-Ed
