,headline,description,url,byline,premium,image_url,article type
0,"Musk breaks with Trump and launches America Party, hoping to attract US voters frustrated by polarization",no description,https://www.lemonde.fr/en/international/article/2025/07/07/musk-breaks-with-trump-and-launches-america-party-hoping-to-attract-us-voters-frustrated-by-polarization_6743102_4.html,,True,,
1,Iranian photographer Forough Alaei portrays life during the war: 'Nothing will ever be the same again',no description,https://www.lemonde.fr/en/international/article/2025/07/06/iranian-photographer-forough-alaei-portrays-life-in-tehran-during-the-war-nothing-will-ever-be-the-same-again_6743085_4.html,,True,,
2,BRICS struggle to find common ground despite shared ambition to challenge the West,no description,https://www.lemonde.fr/en/international/article/2025/07/06/brics-struggle-to-find-common-ground-despite-shared-ambition-to-challenge-the-west_6743079_4.html,,True,,
3,"In Argentina, a libertarian cartoon serves as Javier Milei's weapon in the 'culture war'",no description,https://www.lemonde.fr/en/international/article/2025/07/06/in-argentina-a-libertarian-cartoon-serves-as-javier-milei-s-weapon-in-the-culture-war_6743069_4.html,,True,,
4,Europe in an untenable position after US bombings of Iran,no description,https://www.lemonde.fr/en/europe/article/2025/06/23/europe-in-an-untenable-position-after-us-bombings-of-iran_6742626_143.html,,True,,
5,EU lawmakers seek to end statute of limitations for child sex abuse cases,no description,https://www.lemonde.fr/en/europe/article/2025/06/17/eu-lawmakers-seek-to-end-statute-of-limitations-for-child-sex-abuse-cases_6742434_143.html,,False,,
6,"Criticism is mounting in the Netherlands against Geert Wilders, who brought down the government",no description,https://www.lemonde.fr/en/international/article/2025/06/04/in-the-netherlands-criticism-is-mounting-against-geert-wilders-who-triggered-the-fall-of-the-government_6741987_4.html,,True,,
7,"Five years after Brexit, UK and EU aim for a fresh start",no description,https://www.lemonde.fr/en/international/article/2025/05/19/five-years-after-brexit-uk-and-eu-aim-for-a-fresh-start_6741415_4.html,,True,,
8,Paris shuts Seine swim spots day after reopening due to rain,no description,https://www.lemonde.fr/en/france/article/2025/07/06/paris-shuts-seine-swim-spots-day-after-reopening-due-to-rain_6743082_7.html,,False,,
9,"The arms dealer, the general's daughter and the speed demon: An inheritance battle",no description,https://www.lemonde.fr/en/m-le-mag/article/2025/07/06/the-arms-dealer-the-general-s-daughter-and-the-speed-demon-an-inheritance-battle_6743074_117.html,,True,,
10,"Since October 7, more Jewish families in the Paris region 'want to move to a place they perceive as safer'",no description,https://www.lemonde.fr/en/france/article/2025/07/04/since-october-7-more-jewish-families-in-the-paris-region-want-to-move-to-a-place-they-perceive-as-safer_6743018_7.html,,True,,
11,"Corsican mafia undergoing 'major recomposition,' intelligence report says",no description,https://www.lemonde.fr/en/france/article/2025/07/04/corsican-mafia-undergoing-major-recomposition-intelligence-report-says_6743010_7.html,,True,,
12,What is France's 'Black code' and why hasn't it been repealed?,no description,https://www.lemonde.fr/en/videos/video/2025/05/31/what-is-france-s-black-code-and-why-hasn-t-it-been-repealed_6741860_108.html,,False,,
13,How was the European Union created?,no description,https://www.lemonde.fr/en/videos/video/2025/05/29/how-was-the-european-union-created_6741795_108.html,,False,,
14,Glide bombs: Russia's secret to making cheap weapons,no description,https://www.lemonde.fr/en/videos/video/2025/05/25/glide-bombs-russia-s-secret-to-making-cheap-weapons_6741646_108.html,,True,,
15,How does the conclave pick the new pope?,no description,https://www.lemonde.fr/en/videos/video/2025/05/07/how-does-the-conclave-pick-the-new-pope_6741005_108.html,,False,,
16,Putin's choice of a long war in Ukraine,no description,https://www.lemonde.fr/en/opinion/article/2025/07/07/putin-s-choice-of-a-long-war-in-ukraine_6743095_23.html,,True,,
17,"Between France and Britain, an indispensable entente cordiale",no description,https://www.lemonde.fr/en/opinion/article/2025/07/07/between-france-and-britain-an-indispensable-entente-cordiale_6743105_23.html,,False,,
18,Iran's shameful hostage diplomacy,no description,https://www.lemonde.fr/en/opinion/article/2025/07/06/iran-s-shameful-hostage-diplomacy_6743089_23.html,,False,,
19,Political scientist Francis Dupuis-Déri: 'Incels are one of the most active communities in masculinism today',no description,https://www.lemonde.fr/en/opinion/article/2025/07/05/political-scientist-francis-dupuis-deri-incels-are-one-of-the-most-active-communities-in-masculinism-today_6743066_23.html,,True,,
20,In the jaws of the Jackal: How an informant orchestrated a policewoman's fall,no description,https://www.lemonde.fr/en/m-le-mag/article/2025/07/06/in-the-jaws-of-the-jackal-how-an-informant-orchestrated-a-policewoman-s-fall_6743075_117.html,,True,,
21,"The arms dealer, the general's daughter and the speed demon: An inheritance battle",no description,https://www.lemonde.fr/en/m-le-mag/article/2025/07/06/the-arms-dealer-the-general-s-daughter-and-the-speed-demon-an-inheritance-battle_6743074_117.html,,True,,
22,"The opportune return of Reza Pahlavi, Iran's crown prince, following US airstrikes",no description,https://www.lemonde.fr/en/m-le-mag/article/2025/07/05/the-opportune-return-of-reza-pahlavi-iran-s-crown-prince-following-us-airstrikes_6743051_117.html,,True,,
23,Art weaves a thread between Paris and the Ukrainian front line,no description,https://www.lemonde.fr/en/m-le-mag/article/2025/07/04/art-weaves-a-thread-between-paris-and-the-ukrainian-frontlines_6743005_117.html,,True,,
24,"Dubuffet, Hokusai, Giacometti: 20 must-see exhibitions this summer, in Paris and beyond",no description,https://www.lemonde.fr/en/culture/article/2025/06/28/20-must-see-exhibitions-this-summer-in-paris-and-beyond_6742801_30.html,,True,,
25,Five cultural outings to enjoy with a baby in Paris,no description,https://www.lemonde.fr/en/intimacy/article/2025/06/27/five-cultural-outings-to-enjoy-in-paris-with-a-baby_6742762_310.html,,True,,
26,New museum will honor Art Nouveau genius Hector Guimard in Paris,no description,https://www.lemonde.fr/en/culture/article/2025/06/25/new-museum-will-honor-art-nouveau-genius-hector-guimard-in-paris_6742701_30.html,,True,,
27,"Why Paris's Centre Pompidou, not even 50 years old, must close for five years",no description,https://www.lemonde.fr/en/opinion/article/2025/06/19/why-the-centre-pompidou-not-even-50-years-old-must-close-for-five-years_6742490_23.html,,True,,
28,Putin's choice of a long war in Ukraine,"The suspension of American aid to Kyiv fits neatly into the Russian leader's military plans: to intensify his offensive in Ukraine this summer, and to sustain an endless conflict, now synonymous with the survival of his regime through a newfound 'stability' built on a war economy.",https://www.lemonde.fr/en/opinion/article/2025/07/07/putin-s-choice-of-a-long-war-in-ukraine_6743095_23.html,,True,https://img.lemde.fr/2025/06/21/0/0/5887/3925/400/266/75/0/f960414_upload-1-oxlnehq9rjyx-885378.jpg,
29,"Musk breaks with Trump and launches America Party, hoping to attract US voters frustrated by polarization",no description,https://www.lemonde.fr/en/international/article/2025/07/07/musk-breaks-with-trump-and-launches-america-party-hoping-to-attract-us-voters-frustrated-by-polarization_6743102_4.html,,True,https://img.lemde.fr/2025/07/05/0/0/5242/3495/398/265/75/0/6fff314_ftp-import-images-1-omzabxser2vq-5339977-01-06.jpg,
30,Texas floods: Search for missing continues as death toll rises past 80,no description,https://www.lemonde.fr/en/united-states/article/2025/07/06/desperate-search-for-missing-girls-as-texas-flood-death-toll-rises_6743088_133.html,,False,https://img.lemde.fr/2025/07/06/0/0/5534/3689/398/265/75/0/ac30971_ftp-import-images-1-slkvil84hgeu-07df09275895460ab6b7b7042186580f-0-ffacb54e11684d96b1e0c0c6909eeaf9.jpg,
31,Netanyahu says Trump meeting could 'advance' Gaza deal ahead of Doha talks,"Under mounting pressure to end the war, the Israeli prime minister is due to meet with President Trump on Monday: 'We are working to achieve this deal that we have discussed, under the conditions that we have agreed to.'",https://www.lemonde.fr/en/international/article/2025/07/06/netanyahu-says-trump-meeting-could-advance-gaza-deal-ahead-of-doha-talks_6743091_4.html,,False,https://img.lemde.fr/2025/07/06/0/0/8640/5760/398/265/75/0/62d7c59_ftp-import-images-1-bcc6r5qdokzk-41d235b1fb1f4f508db5e53606d1ac96-0-cb97c108720441898761a840d0b0bb06.jpg,
32,Macron heads to UK for first official visit of King Charles III's reign,French President Emmanuel Macron and his wife Brigitte are to arrive at Windsor Castle on Tuesday for the first state visit of the reign of King Charles III. Macron will also address UK MPs during a three-day visit expected to improve a Franco-British relationship strained by Brexit.,https://www.lemonde.fr/en/international/article/2025/07/07/macron-heads-to-uk-for-first-official-visit-of-king-charles-iii-s-reign_6743103_4.html,,False,https://img.lemde.fr/2024/06/06/0/0/5323/3548/398/265/75/0/70a912b_b7b34c0ecc6d4aa0b763ebf36dc2a006-0-e7e4fa4f576348c091c5dbe40651ae11.jpg,
33,"In Bosnia and Herzegovina, stone treasures, canyons and cypress trees await","The Balkan country, with its painful past, is rich in historical sites and mountainous landscapes − from the Kravica Waterfalls to the Olympic sites of Sarajevo, from a medieval fortress to Tito's bunker.",https://www.lemonde.fr/en/lifestyle/article/2025/07/07/in-bosnia-and-herzegovina-stone-treasures-canyons-and-cypress-trees-await_6743092_37.html,,True,https://img.lemde.fr/2025/05/07/0/0/4792/3194/398/265/75/0/5c28c78_sirius-fs-upload-1-222zv1usp7p1-1746625708727-mostar-4596513.jpg,
34,"The relentless rush to build dams in China's Tiger Leaping Gorge: 'If we lose our land, we lose everything'","'The Himalayas Overheating' (5/6). In the far Southwest of China, plans to build massive reservoirs as part of hydroelectric dam projects have condemned dozens of mountain villages to disappear.",https://www.lemonde.fr/en/environment/article/2025/07/07/the-relentless-rush-to-build-dams-in-china-s-tiger-leaping-gorge-if-we-lose-our-land-we-lose-everything_6743094_114.html,Harold Thibault,True,https://img.lemde.fr/2025/06/26/1/0/7952/5301/664/442/75/0/917961b_upload-1-mpdgjq05eo2m-2024-07-08t120110z-328861670-mt1vcg000t5sraj-rtrmadp-3-vcg.JPG,Feature
35,"Iran: Nearly 450,000 Afghans have left since June 1 under pressure from Tehran",no description,https://www.lemonde.fr/en/international/article/2025/07/07/iran-nearly-450-000-afghans-have-left-since-june-1-due-to-pressure-from-tehran_6743104_4.html,,False,https://img.lemde.fr/2025/06/22/0/0/6000/4000/198/132/95/0/beaf0bb_ftp-import-images-1-zl2bfvis1eb9-0d45da7884b54b3c8ff98e7c5850e3bb-0-dcef0a4ab5544819816551f327c0f3e0.jpg,
36,King Charles III to lead 20th-anniversary commemoration of the 7/7 London transit bombings,no description,https://www.lemonde.fr/en/international/article/2025/07/07/king-charles-iii-will-lead-20th-anniversary-commemoration-of-the-7-7-london-transit-bombings_6743093_4.html,,False,https://img.lemde.fr/2025/07/06/0/0/1999/1333/198/132/95/0/d364595_ftp-import-images-1-9sy6rovlzses-664824aefa2e41328b34669ba0a2d533-1-f71be8c64cb247448b823bbbfd87ed0d.jpg,
37,Did the Prophet Muhammad invent political Islam?,no description,https://www.lemonde.fr/en/history/article/2025/07/06/did-the-prophet-muhammad-invent-political-islam_6743090_157.html,,True,https://img.lemde.fr/2025/05/23/215/0/5150/3433/198/132/95/0/dc5d762_sirius-fs-upload-1-d71bquv5mwjo-1747991007539-g6564385.jpg,
38,BRICS struggle to find common ground despite shared ambition to challenge the West,no description,https://www.lemonde.fr/en/international/article/2025/07/06/brics-struggle-to-find-common-ground-despite-shared-ambition-to-challenge-the-west_6743079_4.html,,True,https://img.lemde.fr/2025/07/05/0/0/3600/2400/198/132/95/0/4661c56_upload-1-bwh5tztc4ust-epaliveeight369379-1.jpg,
39,"Larry Ellison, the return of Silicon Valley's big spender",no description,https://www.lemonde.fr/en/united-states/article/2025/07/06/larry-ellison-the-return-of-silicon-valley-s-big-spender_6743086_133.html,,True,,
40,Texas in shock after fatal flood kills over 80 people with dozens missing,no description,https://www.lemonde.fr/en/united-states/article/2025/07/06/texas-in-shock-after-fatal-flood-kills-over-50-people-and-leaves-dozens-missing_6743076_133.html,,True,,
41,Paris shuts Seine swim spots day after reopening due to rain,no description,https://www.lemonde.fr/en/france/article/2025/07/06/paris-shuts-seine-swim-spots-day-after-reopening-due-to-rain_6743082_7.html,,False,,
42,"The arms dealer, the general's daughter and the speed demon: An inheritance battle",no description,https://www.lemonde.fr/en/m-le-mag/article/2025/07/06/the-arms-dealer-the-general-s-daughter-and-the-speed-demon-an-inheritance-battle_6743074_117.html,,True,,
43,Nice's Contemporary Art Biennale explores the city's unique relationship to the sea,no description,https://www.lemonde.fr/en/culture/article/2025/07/06/nice-s-contemporary-art-biennale-explores-the-city-s-unique-relationship-to-the-sea_6743081_30.html,,True,,
44,Political scientist Francis Dupuis-Déri: 'Incels are one of the most active communities in masculinism today',no description,https://www.lemonde.fr/en/opinion/article/2025/07/05/political-scientist-francis-dupuis-deri-incels-are-one-of-the-most-active-communities-in-masculinism-today_6743066_23.html,,True,,
45,The impossible warming of China-EU relations,no description,https://www.lemonde.fr/en/international/article/2025/07/05/the-impossible-warming-of-china-eu-relations_6743065_4.html,,True,,
46,"French workers strike over reduced remote work: 'If I don't have the option, my life is completely dedicated to the company'",no description,https://www.lemonde.fr/en/economy/article/2025/07/05/french-workers-strike-over-reduced-remote-work-if-i-don-t-have-the-option-my-life-is-completely-dedicated-to-the-company_6743060_19.html,,True,,
47,Iranian photographer Forough Alaei portrays life during the war: 'Nothing will ever be the same again',"After the first Israeli bombings in Iran, Iranian photographer Forough Alaei left Tehran to take refuge with her family on the Caspian Sea coast. She documented those days when war plunged them into the unknown.",https://www.lemonde.fr/en/international/article/2025/07/06/iranian-photographer-forough-alaei-portrays-life-in-tehran-during-the-war-nothing-will-ever-be-the-same-again_6743085_4.html,Audrey Delaporte and  Forough Alaei,True,https://img.lemde.fr/2025/07/01/81/0/5000/3333/664/442/75/0/08316d8_upload-1-h9yjifhlhfq7-dscf9406.jpg,Gallery
48,Starlink: The newest asset for rebel and jihadist groups in West Africa,Billionaire Elon Musk's satellite internet system has become an increasingly common tool for armed groups to communicate in areas lacking traditional land-based communications infrastructure.,https://www.lemonde.fr/en/international/article/2025/07/05/starlink-the-newest-asset-for-rebel-and-jihadist-groups-in-west-africa_6743055_4.html,Célia Cuordifede,True,https://img.lemde.fr/2025/06/11/0/0/5568/3712/664/442/75/0/7e28a8f_upload-1-tvoa4l6x7eku-000-36xl3pg.jpg,In Depth
49,In the jaws of the Jackal: How an informant orchestrated a policewoman's fall,"Sonia C. was still a law enforcement officer when, in April 2024, she was sentenced to three years in prison for handing police files to an informant known as the Jackal. The former officer, who loved to party until dawn and used cocaine, still pleads that she was too naïve.",https://www.lemonde.fr/en/m-le-mag/article/2025/07/06/in-the-jaws-of-the-jackal-how-an-informant-orchestrated-a-policewoman-s-fall_6743075_117.html,Raphaël Malkin,True,https://img.lemde.fr/2025/04/28/0/474/4527/3018/664/442/75/0/e0852c6_sirius-fs-upload-1-wp3bgt6geeyk-1745851578565-richard-copie.jpg,Long Read
50,"Between France and Britain, an indispensable entente cordiale",no description,https://www.lemonde.fr/en/opinion/article/2025/07/07/between-france-and-britain-an-indispensable-entente-cordiale_6743105_23.html,Le Monde,False,,Editorial
51,United States: A budget bill with an exorbitant price tag,no description,https://www.lemonde.fr/en/opinion/article/2025/07/04/united-states-a-budget-bill-with-an-exorbitant-price-tag_6743022_23.html,Le Monde,False,,Editorial
52,"'Trump's diplomacy, hastily and wrongly labeled as isolationist, is interventionist'",no description,https://www.lemonde.fr/en/opinion/article/2025/07/03/trump-s-diplomacy-hastily-and-wrongly-labeled-as-isolationist-is-interventionist_6742973_23.html,Sylvie Kauffmann,,https://img.lemde.fr/2023/07/06/0/0/0/0/100/100/60/0/97cb851_1688634309022-cd62c21-403.jpg,Column
