,headline,description,url,byline,premium,image_url,article type
0,"Zohran Mamdani leads New York mayoral race, rattling Democratic establishment",no description,https://www.lemonde.fr/en/international/article/2025/10/27/zohran-mamdani-leads-new-york-mayoral-race-rattling-democratic-establishment_6746831_4.html,,True,,
1,European industry caught in crossfire of China's rare earths war,no description,https://www.lemonde.fr/en/international/article/2025/10/27/european-industry-caught-in-crossfire-of-china-s-rare-earths-war_6746830_4.html,,True,,
2,Israeli hostages gradually lift veil on conditions in captivity,no description,https://www.lemonde.fr/en/international/article/2025/10/27/israeli-hostages-gradually-lift-veil-on-conditions-in-captivity_6746823_4.html,,True,,
3,Argentina's legislative elections: Milei wins surprise victory in midterm vote,no description,https://www.lemonde.fr/en/international/article/2025/10/27/argentina-s-legislative-elections-milei-wins-surprise-victory-in-midterm-vote_6746809_4.html,,True,,
4,"After Charlie Kirk's murder, Europe's far right swears allegiance to Trump's politics",no description,https://www.lemonde.fr/en/les-decodeurs/article/2025/10/20/the-murder-of-charlie-kirk-how-europe-s-far-right-swore-allegiance-to-trump-s-politics_6746586_8.html,,True,,
5,Sanctions against Russia spark rift between US and Europe over China,no description,https://www.lemonde.fr/en/international/article/2025/09/15/sanctions-against-russia-spark-rift-between-us-and-europe-over-china_6745411_4.html,,True,,
6,France's political instability puts Franco-German alliance to the test,no description,https://www.lemonde.fr/en/opinion/article/2025/08/30/france-s-political-instability-puts-franco-german-alliance-to-the-test_6744873_23.html,,False,,
7,France faces prospect of paying higher borrowing costs than Italy,no description,https://www.lemonde.fr/en/economy/article/2025/08/19/france-faces-prospect-of-paying-higher-borrowing-costs-than-italy_6744519_19.html,,True,,
8,Ten people stand trial in Paris for online harassment of Brigitte Macron,no description,https://www.lemonde.fr/en/france/article/2025/10/27/ten-people-stand-trial-in-paris-for-online-harassment-of-brigitte-macron_6746805_7.html,,False,,
9,Louvre heist: What we know about the two arrested suspects,no description,https://www.lemonde.fr/en/france/article/2025/10/26/louvre-heist-what-we-know-about-the-two-arrested-suspects_6746789_7.html,,True,,
10,"Emilie König, IS jihadist and propagandist, will go before French criminal court",no description,https://www.lemonde.fr/en/france/article/2025/10/25/emilie-konig-is-jihadist-and-propagandist-will-go-before-french-criminal-court_6746771_7.html,,True,,
11,Cédric Jubillar trial: What led to the 30-year prison sentence for the murder of his wife,no description,https://www.lemonde.fr/en/france/article/2025/10/23/cedric-jubillar-trial-what-led-to-the-30-year-prison-sentence-for-the-murder-of-his-wife_6746716_7.html,,True,,
12,Afghanistan: Relentless repression continues over four years into Taliban's rule,no description,https://www.lemonde.fr/en/videos/video/2025/10/04/afghanistan-relentless-repression-continues-over-four-years-into-taliban-s-rule_6746092_108.html,,False,,
13,Watch: Hundreds of thousands march in France against budget cuts,no description,https://www.lemonde.fr/en/videos/video/2025/09/19/french-strikes-watch-what-happened-as-hundreds-of-thousands-marched-against-budget-cuts_6745548_108.html,,False,,
14,Emmys 2025: 'Adolescence' star Owen Cooper becomes youngest winner for best supporting actor,no description,https://www.lemonde.fr/en/videos/video/2025/09/15/emmys-2025-adolescence-star-owen-cooper-becomes-youngest-winner-for-best-supporting-actor_6745427_108.html,,False,,
15,"From 'influence peddling' to 'corruption,' what is French Culture Minister Rachida Dati accused of?",no description,https://www.lemonde.fr/en/videos/video/2025/09/06/from-influence-peddling-to-corruption-what-is-french-culture-minister-rachida-dati-accused-of_6745094_108.html,,False,,
16,'Museums are not strongholds nor vaults': Directors of the world's leading institutions voice support for Louvre museum director,no description,https://www.lemonde.fr/en/opinion/article/2025/10/27/museums-are-not-strongholds-nor-vaults-directors-of-the-world-s-leading-institutions-voice-support-for-louvre-museum-director_6746814_23.html,,True,,
17,France's government has abandoned its climate plans,no description,https://www.lemonde.fr/en/opinion/article/2025/10/27/france-s-government-has-abandoned-its-climate-plans_6746820_23.html,,False,,
18,"'Dependence on China for rare earths calls for a united front, which Trump has weakened'",no description,https://www.lemonde.fr/en/opinion/article/2025/10/26/dependence-on-china-for-rare-earths-calls-for-a-united-front-which-trump-has-weakened_6746797_23.html,,True,,
19,"Art historian Thomas Schlesser: 'Thinking a museum could be defended with gunfire is symptomatic of a rampant, demagogic foolishness'",no description,https://www.lemonde.fr/en/opinion/article/2025/10/26/art-historian-thomas-schlesser-thinking-a-museum-could-be-defended-with-gunfire-is-symptomatic-of-a-rampant-demagogic-foolishness_6746793_23.html,,True,,
20,Brigitte Macron's never-ending fake news nightmare,no description,https://www.lemonde.fr/en/m-le-mag/article/2025/10/25/brigitte-macron-s-never-ending-fake-news-nightmare_6746763_117.html,,True,,
21,A new Israeli-Palestinian restaurant promotes peace through food in Paris,no description,https://www.lemonde.fr/en/m-le-mag/article/2025/10/22/a-new-israeli-palestinian-restaurant-promotes-peace-through-food-in-paris_6746662_117.html,,True,,
22,The wild Albanian island where the Trumps want to build a luxury hotel,no description,https://www.lemonde.fr/en/m-le-mag/article/2025/10/19/the-wild-albanian-island-where-the-trumps-want-bid-to-build-a-luxury-hotel_6746568_117.html,,True,,
23,"France's last military pigeons, custodians of a fading tradition",no description,https://www.lemonde.fr/en/m-le-mag/article/2025/10/17/france-s-last-military-pigeons-custodians-of-a-fading-tradition_6746510_117.html,,True,,
24,Twelve artistic happenings to catch outside Art Basel Paris,no description,https://www.lemonde.fr/en/culture/article/2025/10/24/twelve-artistic-happenings-to-catch-outside-art-basel-paris_6746743_30.html,,True,,
25,A new Israeli-Palestinian restaurant promotes peace through food in Paris,no description,https://www.lemonde.fr/en/m-le-mag/article/2025/10/22/a-new-israeli-palestinian-restaurant-promotes-peace-through-food-in-paris_6746662_117.html,,True,,
26,"'The spirit of the new Fondation Cartier is not that of a cathedral where one must always do more, always bigger'",no description,https://www.lemonde.fr/en/culture/article/2025/10/21/the-spirit-of-the-new-fondation-cartier-is-not-that-of-a-cathedral-where-one-must-always-do-more-always-bigger_6746624_30.html,,True,,
27,"Jean-François Piège, guardian of Paris's bistro heritage",no description,https://www.lemonde.fr/en/lifestyle/article/2025/10/18/jean-francois-piege-guardian-of-paris-s-bistro-heritage_6746545_37.html,,True,,
28,European industry caught in crossfire of China's rare earths war,"Western technology sectors, including automotive, defense, aerospace, energy and chemicals, have raised the alarm over Beijing's new restrictions on the export of these strategic minerals.",https://www.lemonde.fr/en/international/article/2025/10/27/european-industry-caught-in-crossfire-of-china-s-rare-earths-war_6746830_4.html,,True,https://img.lemde.fr/2025/10/24/1617/0/3882/2588/400/266/75/0/805fa20_upload-1-ernlhjpx8py6-rea11426200.jpg,
29,Israeli hostages gradually lift veil on conditions in captivity,no description,https://www.lemonde.fr/en/international/article/2025/10/27/israeli-hostages-gradually-lift-veil-on-conditions-in-captivity_6746823_4.html,,True,https://img.lemde.fr/2025/10/22/495/0/7420/4946/398/265/75/0/83c4da7_upload-1-8jab7whnjr2r-ll-shilo-avinatan-or-14.jpg,
30,Czech president tasks billionaire Andrej Babis with forming new government,no description,https://www.lemonde.fr/en/international/article/2025/10/27/czech-president-tasks-billionaire-andrej-babis-with-forming-new-government_6746825_4.html,,False,https://img.lemde.fr/2025/10/27/0/0/6499/4333/398/265/75/0/bc7f0c7_ftp-import-images-1-5fctajlepzf0-2025-10-27t121643z-1820935048-rc245hawsbqv-rtrmadp-3-czech-politics.JPG,
31,Ouattara wins landslide fourth term as Côte d'Ivoire president,President Alassane Ouattara secured a crushing 89.77% in an election that his two greatest rivals were barred from.,https://www.lemonde.fr/en/le-monde-africa/article/2025/10/27/ouattara-wins-landslide-fourth-term-as-cote-d-ivoire-president_6746828_124.html,,False,https://img.lemde.fr/2025/10/25/15/0/3991/2660/398/265/75/0/79d889e_ftp-import-images-1-my8okzo0td8i-1679f22fa2cf4e9aad8cc68d189a7bf7-0-af79ffbc5af247409cc1e23a2e81ea2e.jpg,
32,'Museums are not strongholds nor vaults': Directors of the world's leading institutions voice support for Louvre museum director,"In an open letter, 57 curators and directors from the world's most prestigious museums express their solidarity with the staff of the Louvre museum after the heist that made global headlines.",https://www.lemonde.fr/en/opinion/article/2025/10/27/museums-are-not-strongholds-nor-vaults-directors-of-the-world-s-leading-institutions-voice-support-for-louvre-museum-director_6746814_23.html,,True,https://img.lemde.fr/2025/10/26/0/0/6000/4000/398/265/75/0/0842a1c_ftp-import-images-1-xxdoahehv5gx-2025-10-26t155636z-1141331603-rc2qjhad76z0-rtrmadp-3-france-crime-louvre.JPG,
33,Ten people stand trial in Paris for online harassment of Brigitte Macron,France's first lady has long been the target of disinformation. Ten defendants went on trial in a Paris court on Monday over online harassment of Brigitte Macron.,https://www.lemonde.fr/en/france/article/2025/10/27/ten-people-stand-trial-in-paris-for-online-harassment-of-brigitte-macron_6746805_7.html,,False,https://img.lemde.fr/2025/10/08/0/0/5116/3410/398/265/75/0/9281379_ftp-import-images-1-yuqqwxfsiyyj-2025-10-08t112737z-1742489139-rc2m7ha2grk1-rtrmadp-3-france-jordan.JPG,
34,"Zohran Mamdani leads New York mayoral race, rattling Democratic establishment","A week before the vote, the self-proclaimed socialist leads the polls after a savvy campaign on the cost of living. But his stance to the left of the party unsettles even his own camp, while questions linger over the funding of his social platform.",https://www.lemonde.fr/en/international/article/2025/10/27/zohran-mamdani-leads-new-york-mayoral-race-rattling-democratic-establishment_6746831_4.html,Nicolas Chapuis,True,https://img.lemde.fr/2025/10/27/0/0/5287/3524/664/442/75/0/daf3043_ftp-import-images-1-a6gydo0vv91x-d11759fb56604c40b1d8dd7f6ce18d61-1-dc4069155ff947b6b39edf58efd0edec.jpg,Profile
35,Cameroon's veteran leader Paul Biya wins controversial eighth term,no description,https://www.lemonde.fr/en/le-monde-africa/article/2025/10/27/cameroon-s-veteran-leader-paul-biya-wins-controversial-eighth-term_6746821_124.html,,False,https://img.lemde.fr/2025/10/27/0/146/4593/3062/198/132/95/0/9f1fc81_ftp-import-images-1-aanaaqqaepvq-2025-10-27t105435z-861699868-rc247haqbxrp-rtrmadp-3-cameroon-election.JPG,
36,French cyclist freed by Russia says detention was 'strange experience',no description,https://www.lemonde.fr/en/international/article/2025/10/27/french-cyclist-freed-by-russia-says-detention-was-strange-experience_6746826_4.html,,False,https://img.lemde.fr/2025/10/23/46/0/5075/3383/198/132/95/0/91802b2_ftp-import-images-1-2tjxdqmy0mu0-2025-10-23t060354z-386164496-rc2ghharrrpy-rtrmadp-3-russia-france-cyclist.JPG,
37,"Canada's Carney 'ready' to resume US trade talks, Trump says won't meet 'for a while'",no description,https://www.lemonde.fr/en/economy/article/2025/10/27/canadian-pm-ready-to-resume-us-trade-talks_6746818_19.html,,False,https://img.lemde.fr/2025/10/27/10/0/7388/4925/198/132/95/0/cfa5fe4_ftp-import-images-1-ygs8eoeo9r2y-5279242-01-06.jpg,
38,Argentina's legislative elections: Milei wins surprise victory in midterm vote,no description,https://www.lemonde.fr/en/international/article/2025/10/27/argentina-s-legislative-elections-milei-wins-surprise-victory-in-midterm-vote_6746809_4.html,,True,https://img.lemde.fr/2025/10/27/0/0/5191/3460/198/132/95/0/de69355_ftp-import-images-1-6b4jfhrrnka6-2025-10-27t013628z-1007295347-rc21khank483-rtrmadp-3-argentina-election.JPG,
39,Turkey and UK sign $11 billion Eurofighter deal as Starmer visits,no description,https://www.lemonde.fr/en/international/article/2025/10/27/turkey-and-uk-sign-11-billion-eurofighter-deal-as-starmer-visits_6746829_4.html,,False,,
40,"Elon Musk's life after Washington, from Tesla to robots and tunnels",no description,https://www.lemonde.fr/en/economy/article/2025/10/27/elon-musk-s-life-after-washington-from-tesla-to-robots-and-tunnels_6746802_19.html,,True,,
41,PKK withdraws fighters from Turkey in first phase of peace process,no description,https://www.lemonde.fr/en/international/article/2025/10/27/pkk-withdraws-fighters-from-turkey-in-first-phase-of-peace-process_6746817_4.html,,False,,
42,"Orson Welles, the magician of all media at the Cinémathèque française",no description,https://www.lemonde.fr/en/culture/article/2025/10/27/orson-welles-the-magician-of-all-media-at-the-cinematheque-francaise_6746804_30.html,,True,,
43,"Behind the 'one in, one out' deal with London, migrant lives remain in limbo",no description,https://www.lemonde.fr/en/international/article/2025/10/26/behind-the-one-in-one-out-deal-with-london-migrant-lives-remain-in-limbo_6746790_4.html,,True,,
44,Asia stocks surge on US-China trade deal breakthrough,no description,https://www.lemonde.fr/en/international/article/2025/10/27/asia-stocks-surge-on-us-china-trade-deal-breakthrough_6746803_4.html,,False,,
45,The renaissance of the Kariri Indigenous people in northeastern Brazil,no description,https://www.lemonde.fr/en/international/article/2025/10/27/the-renaissance-of-the-kariri-indigenous-people-in-northeastern-brazil_6746798_4.html,,True,,
46,"Mohammed Shia al-Sudani, the 'builder' seeking to safeguard Iraq's fragile stability",no description,https://www.lemonde.fr/en/international/article/2025/10/26/mohammed-shia-al-sudani-the-builder-seeking-to-safeguard-iraq-s-fragile-stability_6746788_4.html,,True,,
47,Montmartre property dispute pits Moulin Rouge against poet Jacques Prévert's estate,"The cabaret has terminated the lease of the neighboring apartment-museum of the famed writer, which had been open to the public by appointment until now.",https://www.lemonde.fr/en/culture/article/2025/10/25/montmartre-property-dispute-pits-moulin-rouge-against-poet-jacques-prevert-s-estate_6746773_30.html,Roxana Azimi,True,https://img.lemde.fr/2025/10/21/21/0/5499/3666/664/442/75/0/40d8c10_upload-1-g4xudyhspmae-credit-bellini.jpg,Investigation
48,"Mouhamadou Fall, first French athlete to join Enhanced Games: 'For me, it's not doping, but a chance to learn more about the human body's limits'","The French sprinter announced Thursday that he has signed up for the Enhanced Games, an event where doping is permitted – even encouraged. In an interview with Le Monde, the multiple French champion in the 100 m and 200 m explains his decision.",https://www.lemonde.fr/en/sports/article/2025/10/26/mouhamadou-fall-first-french-athlete-to-join-enhanced-games-for-me-it-s-not-doping-but-a-chance-to-learn-more-about-the-human-body-s-limits_6746796_9.html,Patricia Jolly,True,https://img.lemde.fr/2025/10/25/16/0/2977/1984/664/442/75/0/0611934_upload-1-7pv6zltbtvys-000-32d932z.jpg,Interview
49,Heroes' Memorial in Kyiv carries the pain of all Ukraine,"Spontaneously created after the Russian invasion, this self-managed memorial honoring fallen soldiers has become a central site for civilians and military personnel alike.",https://www.lemonde.fr/en/international/article/2025/10/25/heroes-memorial-in-kyiv-carries-the-pain-of-all-ukraine_6746774_4.html,Faustine Vincent,True,https://img.lemde.fr/2025/10/24/0/0/4300/2866/664/442/75/0/fde8543_upload-1-nooo4tbshwaq-natalia-maidankiev-21.jpg,Feature
50,France's government has abandoned its climate plans,no description,https://www.lemonde.fr/en/opinion/article/2025/10/27/france-s-government-has-abandoned-its-climate-plans_6746820_23.html,Le Monde,False,,Editorial
51,A so-called 'peace' without the Palestinians is just a new form of war,no description,https://www.lemonde.fr/en/international/article/2025/10/26/a-so-called-peace-without-the-palestinians-is-just-a-new-form-of-war_6746794_4.html,Jean-Pierre Filiu,,https://img.lemde.fr/2023/07/31/0/0/0/0/100/100/60/0/d45bb07_1690791602941-eac5c14-1647333440018-jean-pierre-filiu-2019.jpg,Column
52,Fragile Middle East ceasefire is tested by renewed violence in Gaza,no description,https://www.lemonde.fr/en/opinion/article/2025/10/21/fragile-middle-east-ceasefire-is-tested-by-renewed-violence-in-gaza_6746637_23.html,Le Monde,False,,Editorial
