,headline,description,url,byline,premium,image_url,article type
0,West Bank Palestinian granted refugee status in France due to violence in occupied territory,no description,https://www.lemonde.fr/en/international/article/2025/12/12/west-bank-palestinian-granted-refugee-status-in-france-due-to-violence-in-occupied-territory_6748426_4.html,,True,,
1,The poignant testimonies of Russian soldiers returning from Ukraine,no description,https://www.lemonde.fr/en/international/article/2025/12/12/the-poignant-testimonies-of-russian-soldiers-returning-from-ukraine_6748412_4.html,,True,,
2,Syria's new army confronts the legacy of civil war,no description,https://www.lemonde.fr/en/international/article/2025/12/12/in-syria-the-new-army-confronts-the-legacy-of-civil-war_6748403_4.html,,True,,
3,Ukraine ready to consider Donbas demilitarized zone in concession to end war,no description,https://www.lemonde.fr/en/international/article/2025/12/11/ukraine-ready-to-accept-donbas-demilitarized-zone-in-concession-to-end-war_6748397_4.html,,True,,
4,'Trump's ideological challenge to Europe is more dangerous than the security one',no description,https://www.lemonde.fr/en/opinion/article/2025/12/11/trump-s-ideological-challenge-to-europe-is-more-dangerous-than-the-security-one_6748393_23.html,,True,,
5,"Attacked by Trump, Europe wavers between denial and fear of reprisals",no description,https://www.lemonde.fr/en/international/article/2025/12/11/attacked-by-trump-europe-wavers-between-denial-and-fear-of-reprisals_6748382_4.html,,True,,
6,Bosnia and Herzegovina's Serb entity elects ally of  former leader Dodik,no description,https://www.lemonde.fr/en/international/article/2025/11/24/bosnia-and-herzegovina-s-serb-entity-elects-ally-of-former-leader-dodik_6747765_4.html,,True,,
7,"In France's Somme, bagpipers keep the memory of the Great War alive",no description,https://www.lemonde.fr/en/history/article/2025/11/11/in-france-s-somme-bagpipers-keep-the-memory-of-the-great-war-alive_6747347_157.html,,True,,
8,French supermarket's veggie wolf Christmas ad goes viral,no description,https://www.lemonde.fr/en/france/article/2025/12/11/french-supermarket-s-veggie-wolf-christmas-ad-goes-viral_6748391_7.html,,False,,
9,The mysterious 'knocker' scaring elderly women in a Brittany town,no description,https://www.lemonde.fr/en/france/article/2025/12/12/the-mysterious-knocker-scaring-elderly-women-in-a-brittany-town_6748408_7.html,,True,,
10,The actor and rape accusations behind Brigitte Macron's 'stupid bitches' remark,no description,https://www.lemonde.fr/en/france/article/2025/12/11/the-actor-and-rape-accusations-behind-brigitte-macron-s-stupid-bitches-remark_6748396_7.html,,True,,
11,Top French court reviews France-UK migrant agreement,no description,https://www.lemonde.fr/en/france/article/2025/12/11/top-french-court-reviews-france-uk-migrant-agreement_6748392_7.html,,True,,
12,"Israel's D9 bulldozer, a tool of destruction in Gaza",no description,https://www.lemonde.fr/en/videos/video/2025/11/27/israel-s-d9-bulldozer-a-tool-of-destruction-in-gaza_6747870_108.html,,True,,
13,"Ukraine's Pokrovsk faces fierce fighting, footage analyzed by Le Monde reveals",no description,https://www.lemonde.fr/en/videos/video/2025/11/21/ukraine-s-pokrovsk-faces-fierce-fighting-footage-analyzed-by-le-monde-reveals_6747708_108.html,,True,,
14,Afghanistan: Relentless repression continues over four years into Taliban's rule,no description,https://www.lemonde.fr/en/videos/video/2025/10/04/afghanistan-relentless-repression-continues-over-four-years-into-taliban-s-rule_6746092_108.html,,False,,
15,Watch: Hundreds of thousands march in France against budget cuts,no description,https://www.lemonde.fr/en/videos/video/2025/09/19/french-strikes-watch-what-happened-as-hundreds-of-thousands-marched-against-budget-cuts_6745548_108.html,,False,,
16,How the Trumpist world is projecting its own obsession with decline onto Europe,no description,https://www.lemonde.fr/en/opinion/article/2025/12/12/how-the-trumpist-world-is-projecting-its-own-obsession-with-decline-onto-europe_6748411_23.html,,True,,
17,Who will dare to condemn the terror imposed by Israel in the West Bank?,no description,https://www.lemonde.fr/en/opinion/article/2025/12/12/who-will-dare-to-condemn-the-terror-imposed-by-israel-in-the-west-bank_6748420_23.html,,False,,
18,Sarkozy casts himself as new Dreyfus in prison memoir,no description,https://www.lemonde.fr/en/opinion/article/2025/12/12/sarkozy-casts-himself-as-new-dreyfus-in-prison-memoir_6748419_23.html,,True,,
19,'Trump's ideological challenge to Europe is more dangerous than the security one',no description,https://www.lemonde.fr/en/opinion/article/2025/12/11/trump-s-ideological-challenge-to-europe-is-more-dangerous-than-the-security-one_6748393_23.html,,True,,
20,The lawyer suing far-right French mayors for setting up Nativity scenes,no description,https://www.lemonde.fr/en/m-le-mag/article/2025/12/07/the-woman-suing-french-far-right-mayors-for-setting-up-nativity-scenes_6748246_117.html,,True,,
21,100 years of the photobooth: Meet the people keeping them alive,no description,https://www.lemonde.fr/en/m-le-mag/article/2025/12/07/100-years-of-the-photobooth-meet-the-people-keeping-them-alive_6748232_117.html,,False,,
22,"Iran's independent cinema in full revolt: 'With Woman, Life, Freedom, a major barrier was broken'",no description,https://www.lemonde.fr/en/m-le-mag/article/2025/12/04/iran-s-independent-cinema-in-full-revolt-with-woman-life-freedom-a-major-barrier-was-broken_6748162_117.html,,True,,
23,The first time Le Monde wrote about Jeffrey Epstein,no description,https://www.lemonde.fr/en/m-le-mag/article/2025/12/01/the-first-time-le-monde-wrote-about-jeffrey-epstein_6748001_117.html,,True,,
24,Jewels of power go on display in Paris,no description,https://www.lemonde.fr/en/culture/article/2025/12/11/the-power-gems-on-display-in-paris_6748374_30.html,,False,,
25,Five spots in Paris to enjoy a (great) plant-based sandwich,no description,https://www.lemonde.fr/en/lifestyle/article/2025/12/04/in-paris-five-spots-to-enjoy-a-great-plant-based-sandwich_6748131_37.html,,True,,
26,"Bayonne's 'Little Louvre,' the Bonnat-Helleu Museum, reopens after 14 years",no description,https://www.lemonde.fr/en/culture/article/2025/11/28/bayonne-s-little-louvre-the-bonnat-helleu-museum-reopens-after-14-years_6747913_30.html,,True,,
27,Victor Hugo's interior architecture on display in Paris,no description,https://www.lemonde.fr/en/lifestyle/article/2025/11/23/victor-hugo-s-interior-architecture-on-display-in-paris_6747753_37.html,,True,,
28,"Ten years after it was signed, what has the Paris Agreement on climate change achieved?","Signed on December 12, 2015, the treaty has slowed global warming, but has not limited it to a sustainable level.",https://www.lemonde.fr/en/environment/article/2025/12/12/ten-years-after-it-was-signed-what-has-the-paris-agreement-on-climate-change-achieved_6747162_115.html,,True,https://img.lemde.fr/2025/11/05/0/4/4920/3280/400/266/75/0/9725b26_upload-1-nhx6tfecguvl-9725b26-upload-1-sgsenjv5i3a5-000-par8316482-1.jpg,
29,Sarkozy casts himself as new Dreyfus in prison memoir,no description,https://www.lemonde.fr/en/opinion/article/2025/12/12/sarkozy-casts-himself-as-new-dreyfus-in-prison-memoir_6748419_23.html,,True,https://img.lemde.fr/2025/12/10/0/0/6470/4313/398/265/75/0/b092923_ftp-1-f0avxzvt1vnp-5648345-01-06.jpg,
30,Zelensky visits troops as Ukraine says it has gained ground near Kupiansk,no description,https://www.lemonde.fr/en/international/article/2025/12/12/zelensky-visits-troops-as-ukraine-says-it-has-gained-ground-near-kupiansk_6748431_4.html,,False,https://img.lemde.fr/2025/12/12/0/0/2889/1926/398/265/75/0/229b518_ftp-1-o4wtnimg01yi-5663545-01-06.jpg,
31,How the Trumpist world is projecting its own obsession with decline onto Europe,"Published on December 5 by the American administration, the national security strategy – essentially a political manifesto of the MAGA movement – criticizes Europe and reveals a narrow, exclusionary vision of Western civilization, one rooted in the traditional white family and in Christian identity.",https://www.lemonde.fr/en/opinion/article/2025/12/12/how-the-trumpist-world-is-projecting-its-own-obsession-with-decline-onto-europe_6748411_23.html,,True,https://img.lemde.fr/2025/12/11/0/0/6240/4160/398/265/75/0/7c6220d_upload-1-vmeuz1zjzqto-000-74dr8ep.jpg,
32,EU decides to impose €3 tax on small parcels to tackle Chinese imports,"The European Union will impose a temporary €3 tax on small parcels entering the bloc starting in July of next year, finance ministers agreed Friday. The move is designed to counter Chinese platforms AliExpress, Temu and Shein, which European retailers say do not comply with EU rules.",https://www.lemonde.fr/en/economy/article/2025/12/12/eu-decides-to-impose-3-tax-on-small-parcels-from-china_6748427_19.html,,False,https://img.lemde.fr/2025/12/12/0/0/8256/5504/398/265/75/0/abb3574_ftp-1-0ypty9hx8vsp-5663431-01-06.jpg,
33,"At the Grand Palais, a full house for Eva Jospin and Claire Tabouret","The Parisian institution is bringing together exhibitions by the two French artists, who share a  favored material.",https://www.lemonde.fr/en/culture/article/2025/12/12/at-the-grand-palais-a-full-house-for-eva-jospin-and-claire-tabouret_6748407_30.html,,True,https://img.lemde.fr/2025/12/09/0/0/2953/1968/398/265/75/0/c9eb1b7_upload-1-7htd5ybhyghd-2-panorama-2016-eva-jospin-c-flufoto-bar-s-aras-elif-c-ak-rlar-courtesy-noirmontartproduction.JPG,
34,The mysterious 'knocker' scaring elderly women in a Brittany town,"For more than two years, a prowler has been knocking on doors and shutters during the night in a village in Brittany, France, creating a climate of fear among his preferred targets: elderly women. Authorities were slow to take the case seriously.",https://www.lemonde.fr/en/france/article/2025/12/12/the-mysterious-knocker-scaring-elderly-women-in-a-brittany-town_6748408_7.html,Florence Aubenas,True,https://img.lemde.fr/2025/12/08/0/0/6048/4032/664/442/75/0/77fe432_upload-1-hwcuar4pnrd8-dsc7573.jpg,Feature
35,The poignant testimonies of Russian soldiers returning from Ukraine,no description,https://www.lemonde.fr/en/international/article/2025/12/12/the-poignant-testimonies-of-russian-soldiers-returning-from-ukraine_6748412_4.html,,True,https://img.lemde.fr/2025/12/11/0/351/3925/2617/198/132/95/0/af8dc20_upload-1-mlldxswobulk-dmitriy-drakon-01-copie.jpg,
36,Nobel Peace laureate Narges Mohammadi arrested in Iran,no description,https://www.lemonde.fr/en/international/article/2025/12/12/nobel-peace-laureate-narges-mohammadi-arrested-in-iran_6748430_4.html,,False,https://img.lemde.fr/2023/10/07/268/0/1707/1138/198/132/95/0/9ee1b6d_1696662435425-060007.jpg,
37,West Bank Palestinian granted refugee status in France due to violence in occupied territory,no description,https://www.lemonde.fr/en/international/article/2025/12/12/west-bank-palestinian-granted-refugee-status-in-france-due-to-violence-in-occupied-territory_6748426_4.html,,True,https://img.lemde.fr/2025/12/12/0/0/6577/4384/198/132/95/0/f2df9c3_upload-1-kiolxxh2rdcf-000-34jt834.jpg,
38,French police use tear gas to disperse protesters protecting condemned cows,no description,https://www.lemonde.fr/en/france/article/2025/12/12/french-forces-use-tear-gas-to-disperse-protesters-protecting-condemned-cows_6748418_7.html,,False,https://img.lemde.fr/2025/12/12/0/0/5247/3498/198/132/95/0/e153bc5_ftp-1-pot4w2jcsjk6-5662867-01-06.jpg,
39,'Clair Obscur: Expedition 33' sweeps nine Game Awards,no description,https://www.lemonde.fr/en/pixels/article/2025/12/12/clair-obscur-expedition-33-sweeps-nine-game-awards_6748414_13.html,,True,,
40,"Thai PM dissolves parliament, paving way for national elections",no description,https://www.lemonde.fr/en/international/article/2025/12/12/thai-pm-dissolves-parliament-paving-way-for-national-elections_6748406_4.html,,False,,
41,EU rules for at least 25% recycled plastic in cars,no description,https://www.lemonde.fr/en/economy/article/2025/12/12/eu-rules-for-at-least-25-recycled-plastic-in-cars_6748423_19.html,,False,,
42,Reddit files legal challenge to Australia's social media ban,no description,https://www.lemonde.fr/en/pixels/article/2025/12/12/reddit-files-legal-challenge-to-australia-s-social-media-ban_6748409_13.html,,False,,
43,Top French court reviews France-UK migrant agreement,no description,https://www.lemonde.fr/en/france/article/2025/12/11/top-french-court-reviews-france-uk-migrant-agreement_6748392_7.html,,True,,
44,French supermarket's veggie wolf Christmas ad goes viral,no description,https://www.lemonde.fr/en/france/article/2025/12/11/french-supermarket-s-veggie-wolf-christmas-ad-goes-viral_6748391_7.html,,False,,
45,Former Iraqi president Salih appointed new UN refugee agency chief,no description,https://www.lemonde.fr/en/international/article/2025/12/12/former-iraqi-president-salih-appointed-new-un-refugee-agency-chief_6748421_4.html,,False,,
46,Syria's new army confronts the legacy of civil war,no description,https://www.lemonde.fr/en/international/article/2025/12/12/in-syria-the-new-army-confronts-the-legacy-of-civil-war_6748403_4.html,,True,,
47,Ukraine ready to consider Donbas demilitarized zone in concession to end war,"Mykhailo Podolyak, an advisor to Ukrainian President Volodymyr Zelensky, tells Le Monde that the zone would require Ukrainian and Russian forces to both pull back from the front line.",https://www.lemonde.fr/en/international/article/2025/12/11/ukraine-ready-to-accept-donbas-demilitarized-zone-in-concession-to-end-war_6748397_4.html,Claire Gatinois and  Philippe Ricard,True,https://img.lemde.fr/2025/12/11/3/0/5152/3434/664/442/75/0/daa5a95_upload-1-kxul8vagu0ym-451887.jpg,News
48,Israel's reign of terror over the West Bank,"Deadly shootings by the army, beatings by settlers, devastating raids, arbitrary arrests, torture in prison: The level of violence inflicted on Palestinians living in the territory has never been so high since the Israeli occupation began in 1967.",https://www.lemonde.fr/en/international/article/2025/12/10/israel-imposes-reign-of-terror-on-the-west-bank_6748359_4.html,Luc Bronner,True,https://img.lemde.fr/2025/12/10/0/0/8640/5760/664/442/75/0/f8c1f93_upload-1-eqkb3adrxrwo-ap25122440679898.jpg,In Depth
49,'Trump's ideological challenge to Europe is more dangerous than the security one',"The Trump administration has cast itself as the protector of 'Western civilization.' Elon Musk wants the European Union to be dismantled. It is up to European democrats to contest this role and fight this battle, argues Le Monde columnist Sylvie Kauffmann.",https://www.lemonde.fr/en/opinion/article/2025/12/11/trump-s-ideological-challenge-to-europe-is-more-dangerous-than-the-security-one_6748393_23.html,Sylvie Kauffmann,True,https://img.lemde.fr/2025/12/09/0/0/4800/3200/664/442/75/0/484514b_upload-1-itjsdfltha4b-248433.jpg,Column
50,Who will dare to condemn the terror imposed by Israel in the West Bank?,no description,https://www.lemonde.fr/en/opinion/article/2025/12/12/who-will-dare-to-condemn-the-terror-imposed-by-israel-in-the-west-bank_6748420_23.html,Le Monde,False,,Editorial
51,The shockwaves of the Trump administration's strategic vision,no description,https://www.lemonde.fr/en/opinion/article/2025/12/11/the-shockwaves-of-the-trump-administration-s-strategic-vision_6748383_23.html,Le Monde,False,,Editorial
52,Sarkozy's astonishing about-face on the far right,no description,https://www.lemonde.fr/en/opinion/article/2025/12/09/sarkozy-suggests-alliance-with-far-right-is-inevitable_6748307_23.html,Le Monde,False,,Editorial
