,headline,description,url,byline,premium,image_url,article type
0,Jeffrey Epstein's business ties with banker Ariane de Rothschild revealed,"The latest release of the Epstein files by the US Department of Justice has confirmed the extremely close relationship between the French-German head of the Edmond de Rothschild group and the convicted sex offender. From 2013 until his death in 2019, he acted as an unofficial adviser to the Switzerland-based bank.",https://www.lemonde.fr/en/international/article/2026/02/05/jeffrey-epstein-s-business-ties-with-banker-ariane-de-rothschild-revealed_6750170_4.html,,True,https://img.lemde.fr/2026/02/04/0/0/5170/3447/400/266/75/0/0ce27c6_upload-1-x2mpvkh6rdxm-000-86za363.jpg,
1,"The 'Washington Post,' legendary American daily, is shaken by mass layoffs",no description,https://www.lemonde.fr/en/international/article/2026/02/05/the-washington-post-legendary-american-daily-is-shaken-by-mass-layoffs_6750173_4.html,,True,https://img.lemde.fr/2026/02/04/0/0/5556/3704/398/265/75/0/4582e2f_ftp-1-ymncgtcggqwl-40e2ebe02fea4cc39c5eead8680aef49-0-faa212969e5e42a1864bf4decf1d53de.jpg,
2,"Emmanuel Grégoire, Socialist candidate for Paris mayor, details proposals to Le Monde",no description,https://www.lemonde.fr/en/politics/article/2026/02/05/emmanuel-gregoire-socialist-candidate-for-paris-mayor-details-proposals-to-le-monde_6750174_5.html,,True,https://img.lemde.fr/2026/02/04/0/0/5976/3984/398/265/75/0/019cf90_upload-1-zulm94wqr2bw-daj26006d35.JPG,
3,Last US-Russia nuclear treaty ends in 'grave moment' for world,"'For the first time in more than half a century, we face a world without any binding limits on the strategic nuclear arsenals of the Russian Federation and the United States of America,' UN Secretary General Antonio Guterres.",https://www.lemonde.fr/en/international/article/2026/02/05/last-us-russia-nuclear-treaty-ends-in-grave-moment-for-world_6750158_4.html,,False,https://img.lemde.fr/2026/01/29/0/469/5062/3375/398/265/75/0/f8fd7fd_ftp-1-veol66vxm8bo-2026-01-29t182421z-1296989132-rc25bjambmwq-rtrmadp-3-un-guterres.JPG,
4,"James Galbraith, economist: 'The Fed is an agency created by Congress, controlled by it, and accountable to it'","The US inflation decline did not result from action by the Federal Reserve and a reduction in interest rates would therefore be justified, said the University of Texas professor in an interview with Le Monde. However, in his view, Trump should've let the Republican majority in both chambers of Congress pressure the central bank.",https://www.lemonde.fr/en/economy/article/2026/02/05/james-galbraith-economist-the-fed-is-an-agency-created-by-congress-controlled-by-it-and-accountable-to-it_6750164_19.html,,True,https://img.lemde.fr/2026/01/22/957/0/2858/1905/398/265/75/0/96ab85b_upload-1-wltzez8gvg1r-james-galbraith.jpg,
5,"'The Mastermind,' by Kelly Reichardt: The art of losing oneself","In telling the story of an art heist gone awry, the director paints a somber and disillusioned portrait of the 1970s.",https://www.lemonde.fr/en/culture/article/2026/02/05/the-mastermind-by-filmmaker-kelly-reichardt-the-art-of-losing-oneself_6750163_30.html,,True,https://img.lemde.fr/2026/02/04/0/300/3240/2160/398/265/75/0/634a2a7_upload-1-kltgtr5tvtf4-7-the-mastermind-still-04-2025-mastermind-movie-inc.jpg,
6,"Robbie Williams, the nostalgic pop star","For more than 30 years, the British singer has ridden a wave of global success, releasing hit after hit and filling stadiums. At 51, still in the media spotlight that once burned him, the former boy band member remains a tireless entertainer. Now on a mega tour across Europe, he has just released his 13th album, a nod to the vibrant 1990s Britpop scene that always snubbed him.",https://www.lemonde.fr/en/m-le-mag/article/2026/02/05/robbie-williams-the-nostalgic-pop-star_6750166_117.html,Clément Ghys,True,https://img.lemde.fr/2026/01/21/1847/0/6610/4406/664/442/75/0/1ca321a_upload-1-tspsubru9mmn-749-williams-lebon-002.jpg,Profile
7,Ukraine says Abu Dhabi talks with Russia 'substantive and productive',no description,https://www.lemonde.fr/en/international/article/2026/02/04/ukraine-says-abu-dhabi-talks-with-russia-substantive-and-productive_6750155_4.html,,False,https://img.lemde.fr/2026/02/04/0/40/1119/746/198/132/95/0/99a793a_ftp-1-r0poojvx3lwn-2026-02-04t152920z-2018822131-rc22fjamt7oi-rtrmadp-3-ukraine-crisis-russia-emirates-talks.JPG,
8,Relations between South Africa and Israel hit new low amid fears of US reprisals,no description,https://www.lemonde.fr/en/le-monde-africa/article/2026/02/05/relations-between-south-africa-and-israel-hit-new-low-amid-fears-of-us-reprisals_6750159_124.html,,True,https://img.lemde.fr/2026/02/01/0/0/3174/2116/198/132/95/0/17234ab_upload-1-ibsnlj7qrqqe-000-36ya7xc.jpg,
9,European intelligence services adapt to the upheavals of the Trump era,no description,https://www.lemonde.fr/en/international/article/2026/02/04/european-intelligence-services-adapt-to-the-upheavals-of-the-trump-era_6750150_4.html,,True,https://img.lemde.fr/2026/01/07/333/0/5000/3333/198/132/95/0/81adcd7_upload-1-x0ldwoh5ddft-kzihnioglu-paris-elysee-coalition-volontaires-06012026-hd-119.JPG,
10,2026 Winter Olympics: Artificial snow takes a toll on the environment,no description,https://www.lemonde.fr/en/sports/article/2026/02/04/2026-winter-olympics-artificial-snow-takes-a-toll-on-the-environment_6750118_9.html,,True,https://img.lemde.fr/2026/02/02/0/0/8256/5504/198/132/95/0/ae5c9b8_upload-1-jyneybmdcw7s-020-2253612571.jpg,
11,The traditional blouse immortalized by Matisse becomes a political symbol in Romania,no description,https://www.lemonde.fr/en/international/article/2026/02/05/the-traditional-blouse-immortalized-by-matisse-becomes-a-political-symbol-in-romania_6750162_4.html,,True,,
12,Trump's border chief removes 700 immigration officers from Minnesota,no description,https://www.lemonde.fr/en/international/article/2026/02/04/trump-s-new-border-chief-removes-700-immigration-officers-from-minnesota_6750146_4.html,,False,,
13,Man sentenced to life in prison for plotting to kill Trump in 2024,no description,https://www.lemonde.fr/en/international/article/2026/02/04/man-sentenced-to-life-in-prison-for-plotting-to-kill-trump-in-2024_6750154_4.html,,False,,
14,Democracy is fading in Africa as the world looks away,no description,https://www.lemonde.fr/en/opinion/article/2026/02/05/democracy-is-fading-in-africa-as-the-world-looks-away_6750165_23.html,,True,,
15,Boxer Imane Khelif says she took hormone treatment to lower testosterone before Paris Olympics,no description,https://www.lemonde.fr/en/sports/article/2026/02/05/boxer-imane-khelif-reveals-she-took-hormone-treatment-before-paris-olympics_6750171_9.html,,False,,
16,"'To revive a strong integration policy, it must become a government priority, separate from the issue of immigration'",no description,https://www.lemonde.fr/en/opinion/article/2026/02/05/to-revive-a-strong-integration-policy-it-must-become-a-government-priority-separate-from-the-issue-of-immigration_6750156_23.html,,True,,
17,This French territory off the coast of Canada sees 'no clear sense of worry' over Trump,no description,https://www.lemonde.fr/en/politics/article/2026/02/05/in-france-s-north-atlantic-overseas-territory-no-clear-sense-of-worry-among-residents-over-trump_6750160_5.html,,True,,
18,Foreign language learning holds strong against the AI wave,no description,https://www.lemonde.fr/en/employment/article/2026/02/05/foreign-language-learning-holds-strong-against-the-ai-wave_6750168_103.html,,True,,
19,Ukraine's 'grandfathers' go to war,"The Ukrainian army has an average age of 45, significantly older than European standards. The draft has targeted men between the ages of 25 and 60, which contrasts with recruitment practices typically seen in Western countries.",https://www.lemonde.fr/en/international/article/2026/02/04/ukraine-s-grandfathers-go-to-war_6750151_4.html,Florence Aubenas,True,https://img.lemde.fr/2026/01/12/1/0/4000/2666/664/442/75/0/891e9d7_upload-1-xyxs2ebmi3wd-reportage-vieux-soldats-13.jpg,Feature
20,Thomas Piketty: 'European countries have achieved unprecedented levels of prosperity and social well-being',"To win the cultural and intellectual battle, Europe must staunchly defend its model, writes the economist in his column, dismantling the narrative of a 'declining' continent.",https://www.lemonde.fr/en/opinion/article/2026/01/31/thomas-piketty-european-countries-have-achieved-unprecedented-levels-of-prosperity-and-social-well-being_6750003_23.html,Thomas Piketty,True,https://img.lemde.fr/2026/01/30/0/0/7345/4897/664/442/75/0/b80f0ce_upload-1-namymjecb5sm-b80f0ce-upload-1-8ui3g3l5is7w-000-34xa4p4.jpg,Column
21,Marine Le Pen's 2027 presidential bid further jeopardized by prosecution at her appeal trial,"By requesting a five-year ban on election to public office on February 3, the prosecution has fueled doubts about Marine Le Pen's ability to run in the 2027 presidential election. The appeals court is due to rule on the case by the summer.",https://www.lemonde.fr/en/politics/article/2026/02/04/le-pen-s-appeal-trial-prosecution-puts-far-right-leader-s-2027-presidential-bid-in-further-jeopardy_6750137_5.html,Corentin Lesueur,True,https://img.lemde.fr/2026/02/04/0/0/4806/3204/664/442/75/0/1ce676e_ftp-1-7ymorwawf71d-5068243-01-06.jpg,In Depth
22,The end of US-Russia nuclear treaty is a dangerous signal for deterrance,no description,https://www.lemonde.fr/en/opinion/article/2026/02/04/the-end-of-us-russia-nuclear-treaty-is-a-dangerous-signal-for-deterrance_6750134_23.html,Le Monde,False,,Editorial
23,"'Trump put liberal democracy in the crosshairs in 2025, he might pull the trigger in 2026'",no description,https://www.lemonde.fr/en/opinion/article/2026/02/05/trump-put-liberal-democracy-in-the-crosshairs-in-2025-he-might-pull-the-trigger-in-2026_6750157_23.html,David J. Simon,,,Op-Ed
24,'The race toward the geopolitical grotesque must be taken very seriously',no description,https://www.lemonde.fr/en/opinion/article/2026/02/04/the-race-toward-the-geopolitical-grotesque-must-be-taken-very-seriously_6750142_23.html,Alain Garay,,,Op-Ed
