,headline,description,url,byline,premium,image_url,article type
0,Immigrants in Chile fear for their future after a far-right leader won the presidential election,no description,https://www.lemonde.fr/en/international/article/2025/12/29/immigrants-in-chile-fear-for-their-future-after-a-far-right-leader-won-the-presidential-election_6748920_4.html,,True,,
1,Israel: The MAGA world's new obsession,no description,https://www.lemonde.fr/en/international/article/2025/12/29/israel-the-maga-world-s-new-obsession_6748918_4.html,,True,,
2,"The issues at stake in the Netanyahu-Trump meeting: Gaza, Iran, Syria and Lebanon",no description,https://www.lemonde.fr/en/international/article/2025/12/29/the-issues-at-stake-in-the-netanyahu-trump-meeting-gaza-iran-syria-and-lebanon_6748917_4.html,,True,,
3,Deadly violence erupts during protests in Syria's Alawite regions,no description,https://www.lemonde.fr/en/international/article/2025/12/29/deadly-violence-erupts-during-protests-in-syria-s-alawite-regions_6748915_4.html,,True,,
4,'Trump's ideological challenge to Europe is more dangerous than the security one',no description,https://www.lemonde.fr/en/opinion/article/2025/12/11/trump-s-ideological-challenge-to-europe-is-more-dangerous-than-the-security-one_6748393_23.html,,True,,
5,"Attacked by Trump, Europe wavers between denial and fear of reprisals",no description,https://www.lemonde.fr/en/international/article/2025/12/11/attacked-by-trump-europe-wavers-between-denial-and-fear-of-reprisals_6748382_4.html,,True,,
6,Bosnia and Herzegovina's Serb entity elects ally of  former leader Dodik,no description,https://www.lemonde.fr/en/international/article/2025/11/24/bosnia-and-herzegovina-s-serb-entity-elects-ally-of-former-leader-dodik_6747765_4.html,,True,,
7,"In France's Somme, bagpipers keep the memory of the Great War alive",no description,https://www.lemonde.fr/en/history/article/2025/11/11/in-france-s-somme-bagpipers-keep-the-memory-of-the-great-war-alive_6747347_157.html,,True,,
8,"George Clooney, his wife Amal and children become French",no description,https://www.lemonde.fr/en/france/article/2025/12/29/george-clooney-his-wife-amal-and-children-become-french_6748921_7.html,,False,,
9,'We have to know a lot of things that the French don't': Migrants face new residence permit tests,no description,https://www.lemonde.fr/en/france/article/2025/12/27/we-have-to-know-a-lot-of-things-that-the-french-don-t-migrants-face-new-residence-permit-tests_6748863_7.html,,True,,
10,Why more young people are turning to religion,no description,https://www.lemonde.fr/en/france/article/2025/12/25/why-more-young-people-are-turning-to-religion_6748827_7.html,,True,,
11,French biathlon team races ahead on the unpredictable road to the Olympics,no description,https://www.lemonde.fr/en/sports/article/2025/12/25/french-biathlon-team-races-ahead-on-the-unpredictable-road-to-the-olympics_6748823_9.html,,True,,
12,The French studio behind a viral Christmas ad,no description,https://www.lemonde.fr/en/videos/video/2025/12/12/the-french-studio-behind-a-viral-christmas-ad_6748436_108.html,,False,,
13,"Israel's D9 bulldozer, a tool of destruction in Gaza",no description,https://www.lemonde.fr/en/videos/video/2025/11/27/israel-s-d9-bulldozer-a-tool-of-destruction-in-gaza_6747870_108.html,,True,,
14,"Ukraine's Pokrovsk faces fierce fighting, footage analyzed by Le Monde reveals",no description,https://www.lemonde.fr/en/videos/video/2025/11/21/ukraine-s-pokrovsk-faces-fierce-fighting-footage-analyzed-by-le-monde-reveals_6747708_108.html,,True,,
15,Afghanistan: Relentless repression continues over four years into Taliban's rule,no description,https://www.lemonde.fr/en/videos/video/2025/10/04/afghanistan-relentless-repression-continues-over-four-years-into-taliban-s-rule_6746092_108.html,,False,,
16,"The death of Brigitte Bardot: One icon, many faces",no description,https://www.lemonde.fr/en/opinion/article/2025/12/29/the-death-of-brigitte-bardot-one-icon-many-faces_6748914_23.html,,False,,
17,"The 2026 FIFA World Cup is shaping up to be 'America First' and, above all, 'Business First'",no description,https://www.lemonde.fr/en/opinion/article/2025/12/30/the-2026-fifa-world-cup-is-shaping-up-to-be-america-first-and-above-all-business-first_6748925_23.html,,True,,
18,South Asia is both a contributor and victim of the climate crisis,no description,https://www.lemonde.fr/en/opinion/article/2025/12/28/south-asia-is-both-a-contributor-and-victim-of-the-climate-crisis_6748903_23.html,,True,,
19,'The Beatles have become an inexhaustible source of nostalgia-fueled products',no description,https://www.lemonde.fr/en/opinion/article/2025/12/28/the-beatles-have-become-an-inexhaustible-source-of-nostalgia-fueled-products_6748900_23.html,,True,,
20,"Fight, the innovative agency behind Zohran Mamdani's New York victory",no description,https://www.lemonde.fr/en/m-le-mag/article/2025/12/30/fight-the-innovative-agency-behind-zohran-mamdani-s-new-york-victory_6748931_117.html,,True,,
21,The flights of fancy of the French entrepreneur who brought Shein to Paris,no description,https://www.lemonde.fr/en/m-le-mag/article/2025/12/28/the-flights-of-fancy-of-the-french-entrepreneur-who-brought-shein-to-paris_6748883_117.html,,True,,
22,"At Marseille's MuCEM, an exhibition explores the sunken island of Ferdinandea",no description,https://www.lemonde.fr/en/m-le-mag/article/2025/12/27/at-marseille-s-mucem-an-exhibition-explores-the-sunken-island-of-ferdinandea_6748860_117.html,,True,,
23,Disneyland Paris at 40: When Mickey Mouse said 'bonjour' to Paris,no description,https://www.lemonde.fr/en/m-le-mag/article/2025/12/22/disneyland-paris-at-40-when-mickey-mouse-said-bonjour-to-paris_6748740_117.html,,True,,
24,Five creative craft workshops to enjoy doing in Paris with your child,no description,https://www.lemonde.fr/en/intimacy/article/2025/12/13/in-paris-five-creative-craft-workshops-to-enjoy-doing-with-your-child_6748451_310.html,,True,,
25,Jewels of power go on display in Paris,no description,https://www.lemonde.fr/en/culture/article/2025/12/11/the-power-gems-on-display-in-paris_6748374_30.html,,False,,
26,Five spots in Paris to enjoy a (great) plant-based sandwich,no description,https://www.lemonde.fr/en/lifestyle/article/2025/12/04/in-paris-five-spots-to-enjoy-a-great-plant-based-sandwich_6748131_37.html,,True,,
27,"Bayonne's 'Little Louvre,' the Bonnat-Helleu Museum, reopens after 14 years",no description,https://www.lemonde.fr/en/culture/article/2025/11/28/bayonne-s-little-louvre-the-bonnat-helleu-museum-reopens-after-14-years_6747913_30.html,,True,,
28,Fine champagnes at affordable prices: Le Monde's selection of the best bubbles for the holiday season,"Rémi Barroux, Stéphane Davet, Laure Gasparotto and Sébastien Jenvrin tasted 181 non-vintage champagnes, known as 'brut sans année,' each priced at no more than €50. They selected 81, from both major champagne houses and independent winemakers.",https://www.lemonde.fr/en/lifestyle/article/2025/12/30/fine-champagnes-at-affordable-prices-le-monde-s-selection-of-the-best-bubbles-for-the-holiday-season_6748929_37.html,,True,https://img.lemde.fr/2025/11/26/0/0/4500/3000/400/266/75/0/8af6f62_upload-1-oe1zmzkroo6q-joseph-perrier-michael-boudot-caves-hd-1.jpg,
29,Trump warns Hamas and Iran after Netanyahu talks in Mar-a-Lago,no description,https://www.lemonde.fr/en/international/article/2025/12/30/trump-warns-hamas-and-iran-after-netanyahu-talks-in-mar-a-lago_6748923_4.html,,False,https://img.lemde.fr/2025/12/29/3/0/1984/1322/398/265/75/0/550508a_ftp-1-lwiy7sxvxhuu-2025-12-29t223346z-110523633-rc2kqiax2ybi-rtrmadp-3-israel-palestinians-trump-netanyahu.JPG,
30,China conducts second day of military drills around Taiwan with port blockade simulation,no description,https://www.lemonde.fr/en/international/article/2025/12/30/china-conducts-second-day-of-military-drills-around-taiwan-with-port-blockade-simulation_6748928_4.html,,False,https://img.lemde.fr/2025/12/30/0/0/5952/3968/398/265/75/0/059cc3c_ftp-1-zhdi5pdtptct-5769618-01-06.jpg,
31,China's industrial-scale pig farms encounter new threats,"After a major outbreak of African swine fever in 2018, China massively industrialized its pig farming sector to ensure food self-sufficiency. This giant factory-style model, which eliminated small farmers, is now threatened by overproduction.",https://www.lemonde.fr/en/economy/article/2025/12/30/china-s-industrial-scale-pig-farms-encounter-new-threats_6748926_19.html,,True,https://img.lemde.fr/2025/12/25/0/0/4579/3053/398/265/75/0/88ce833_upload-1-r8dfxuqbno46-rea10048427.jpg,
32,"The 2026 FIFA World Cup is shaping up to be 'America First' and, above all, 'Business First'","The World Cup, which will be held in the United States, Canada and Mexico from June 11 to June 27, 2026, will be neither politically neutral, nor financially accessible, nor inclusive. It stands in stark contrast to the principles of grassroots football, writes Stéphane Lauer, columnist for Le Monde, in his opinion piece.",https://www.lemonde.fr/en/opinion/article/2025/12/30/the-2026-fifa-world-cup-is-shaping-up-to-be-america-first-and-above-all-business-first_6748925_23.html,,True,https://img.lemde.fr/2025/12/18/0/0/4153/2769/398/265/75/0/98d3203_ftp-1-wpso5bgmzlfu-8bc9e64d91144b06af3ab6538f275c9c-1-d9229eafae8e4264850e40085c97649a.jpg,
33,"Beyoncé now a billionaire, Forbes says","The 44-year-old entertainer joins a select club that includes her husband, rapper Jay-Z, as well as Taylor Swift, Bruce Springsteen and Rihanna, according to the publication, known for its rankings of the world's richest people.",https://www.lemonde.fr/en/culture/article/2025/12/30/beyonce-now-a-billionaire-forbes-says_6748924_30.html,,False,https://img.lemde.fr/2024/10/26/0/16/1825/1217/398/265/75/0/8f1e857_2024-10-26t022043z-1663401604-rc22saajxftb-rtrmadp-3-usa-election-harris-beyonce.JPG,
34,"Fight, the innovative agency behind Zohran Mamdani's New York victory","The mayor-elect owes his resounding victory in part to the political communications agency. Founded after Kamala Harris' defeat in the presidential election, Fight aims to embody the future of the Democratic Party. This renewal is anchored on the left and driven by outsider candidates and creative campaign ads.",https://www.lemonde.fr/en/m-le-mag/article/2025/12/30/fight-the-innovative-agency-behind-zohran-mamdani-s-new-york-victory_6748931_117.html,Hélène Coutard,True,https://img.lemde.fr/2025/12/10/1/0/4000/2666/664/442/75/0/8f7e537_upload-1-3xwzhlmdiq9k-rea11499041.jpg,Profile
35,Bangladesh's former prime minister Khaleda Zia dies at 80,no description,https://www.lemonde.fr/en/international/article/2025/12/30/bangladesh-s-former-prime-minister-khaleda-zia-dies-at-80_6748930_4.html,,False,https://img.lemde.fr/2025/12/30/125/0/3500/2333/198/132/95/0/ae36b5e_ftp-1-c9ewhsnxwjax-2025-12-30t023048z-1299603009-rc2qqia7jhha-rtrmadp-3-people-khaleda-zia.JPG,
36,"The issues at stake in the Netanyahu-Trump meeting: Gaza, Iran, Syria and Lebanon",no description,https://www.lemonde.fr/en/international/article/2025/12/29/the-issues-at-stake-in-the-netanyahu-trump-meeting-gaza-iran-syria-and-lebanon_6748917_4.html,,True,https://img.lemde.fr/2025/12/29/0/0/3000/2000/198/132/95/0/2f47bfa_ftp-1-chyfckdn2gts-5765810-01-06.jpg,
37,"Zelensky denies Ukraine attacked Putin's residence, accuses Russia of lies",no description,https://www.lemonde.fr/en/international/article/2025/12/29/zelensky-denies-ukraine-attacked-putin-s-residence-accuses-russia-of-lies_6748919_4.html,,False,https://img.lemde.fr/2025/12/29/0/0/7993/5328/198/132/95/0/e72318f_ftp-1-x0vn4aqttyzx-dc2cdeaa99184f5bac15b0d70f65d4b7-0-f5a0d678f4f54c4ab6bd48a8bfbe3c12.jpg,
38,"George Clooney, his wife Amal and children become French",no description,https://www.lemonde.fr/en/france/article/2025/12/29/george-clooney-his-wife-amal-and-children-become-french_6748921_7.html,,False,https://img.lemde.fr/2022/11/22/0/0/945/630/198/132/95/0/43dabfa_243555-3298743.jpg,
39,Immigrants in Chile fear for their future after a far-right leader won the presidential election,no description,https://www.lemonde.fr/en/international/article/2025/12/29/immigrants-in-chile-fear-for-their-future-after-a-far-right-leader-won-the-presidential-election_6748920_4.html,,True,,
40,Trump says US destroyed dock for Venezuela drug boats,no description,https://www.lemonde.fr/en/international/article/2025/12/29/trump-says-us-destroyed-dock-for-venezuela-drug-boats_6748922_4.html,,False,,
41,AFCON 2025: Host Morocco and South Africa join Egypt in knockout stage,no description,https://www.lemonde.fr/en/sports/article/2025/12/30/host-morocco-and-south-africa-join-egypt-in-afcon-knockout-stage_6748927_9.html,,False,,
42,Deadly violence erupts during protests in Syria's Alawite regions,no description,https://www.lemonde.fr/en/international/article/2025/12/29/deadly-violence-erupts-during-protests-in-syria-s-alawite-regions_6748915_4.html,,True,,
43,Municipal elections: Louis Sarkozy tries to make a splash in French Riviera town,no description,https://www.lemonde.fr/en/politics/article/2025/12/29/municipal-elections-louis-sarkozy-tries-to-make-a-splash-in-french-riviera-town_6748911_5.html,,True,,
44,South Asia is both a contributor and victim of the climate crisis,no description,https://www.lemonde.fr/en/opinion/article/2025/12/28/south-asia-is-both-a-contributor-and-victim-of-the-climate-crisis_6748903_23.html,,True,,
45,Brigitte Bardot's funeral will be held next week in Saint-Tropez,no description,https://www.lemonde.fr/en/france/article/2025/12/29/brigitte-bardot-to-be-buried-in-saint-tropez-cemetery_6748916_7.html,,False,,
46,Sex: Should you really 'enjoy yourself before settling down' and entering a relationship?,no description,https://www.lemonde.fr/en/intimacy/article/2025/12/28/sex-should-you-really-enjoy-yourself-before-settling-down-and-entering-a-relationship_6748904_310.html,,True,,
47,Israel: The MAGA world's new obsession,"As Israeli Prime Minister Benjamin Netanyahu is expected to meet with US President Donald Trump in Miami on Monday, December 29, Israel has become a source of contention and fantasy within the Trump movement.",https://www.lemonde.fr/en/international/article/2025/12/29/israel-the-maga-world-s-new-obsession_6748918_4.html,Piotr Smolar,True,https://img.lemde.fr/2025/12/26/0/0/4500/3000/664/442/75/0/8834a67_upload-1-eygr5usr7p6x-497511.jpg,In Depth
48,Europe's dramatic decline in pharmaceutical production threatens health sovereignty,"The rise of China and India, combined with protectionist pressure from the Trump administration, is redrawing the global map of the pharmaceutical industry. The Europe-wide deindustrialization that began in the 2000s is now accelerating.",https://www.lemonde.fr/en/international/article/2025/12/29/europe-s-dramatic-decline-in-pharmaceutical-production-threatens-health-sovereignty_6748905_4.html,Zeliha Chaffin,True,https://img.lemde.fr/2025/12/16/0/0/6927/4618/664/442/75/0/848f5a2_upload-1-y15iqkwfv81j-000-86dq2jb.jpg,In Depth
49,Six thousand new perfumes in 2025: Why manufacturers are flooding the market,"The perfume sector is experiencing a global consumption revolution: Young people are collecting bottles, and Chinese consumers are buying more and more. With L'Oréal leading the way, perfume has become the main sector driving the cosmetics industry.",https://www.lemonde.fr/en/economy/article/2025/12/27/six-thousand-new-perfumes-in-2025-why-manufacturers-are-flooding-the-market_6748866_19.html,Juliette Garnier,True,https://img.lemde.fr/2025/12/24/0/0/6000/4000/664/442/75/0/5bb9a85_upload-1-szfj4uzyf46p-000-38f47e2-1.jpg,In Depth
50,"The death of Brigitte Bardot: One icon, many faces",no description,https://www.lemonde.fr/en/opinion/article/2025/12/29/the-death-of-brigitte-bardot-one-icon-many-faces_6748914_23.html,Le Monde,False,,Editorial
51,2025: The year Europe weakened Ukraine by abandoning the Gaza Strip,no description,https://www.lemonde.fr/en/international/article/2025/12/29/2025-the-year-europe-weakened-ukraine-by-abandoning-the-gaza-strip_6748909_4.html,Jean-Pierre Filiu,,https://img.lemde.fr/2023/07/31/0/0/0/0/100/100/60/0/d45bb07_1690791602941-eac5c14-1647333440018-jean-pierre-filiu-2019.jpg,Column
52,Trump's uncertain peace in Africa's Great Lakes region,no description,https://www.lemonde.fr/en/opinion/article/2025/12/26/trump-s-uncertain-peace-in-africa-s-great-lakes-region_6748851_23.html,Le Monde,False,,Editorial
