,headline,description,url,byline,premium,image_url,article type
0,"Martine Barrat, a photographer without fear or limits","At 93, the artist has lost none of her vitality or curiosity. She lives at the legendary Hotel Chelsea in New York, where she remains one of the last year-round artist residents. Today, her work is the subject of a retrospective at the Rencontres d'Arles photography festival.",https://www.lemonde.fr/en/m-le-mag/article/2026/07/12/martine-barrat-a-photographer-without-fear-or-limits_6755391_117.html,,True,https://img.lemde.fr/2026/06/30/382/0/1200/800/400/266/75/0/509e5ca_ftp-1-hbcbynanjmsm-434309-3480713.jpg,
1,US launches new strikes on Iran after container ship hit in Hormuz,no description,https://www.lemonde.fr/en/international/article/2026/07/12/iran-announces-closure-of-the-strait-of-hormuz-until-further-notice_6755387_4.html,,False,https://img.lemde.fr/2026/07/10/0/429/4642/3095/398/265/75/0/afc85c9_ftp-1-yt2bpau69j8e-2026-07-10t130543z-1345548046-rc25amatsfkg-rtrmadp-3-iran-crisis-shipping-un.JPG,
2,'No region is safe from climate change: Brittany will not be a climate refuge',no description,https://www.lemonde.fr/en/opinion/article/2026/07/12/no-region-is-safe-from-climate-change-brittany-will-not-be-a-climate-refuge_6755386_23.html,,True,https://img.lemde.fr/2026/02/25/0/0/1500/1000/398/265/75/0/e51850b_upload-1-1m3mwho1pn4a-frame-1323.jpg,
3,Police arrest 28-year-old suspect over killing of UK politician,"Former Conservative MP Ann Widdecombe, 78, was found dead with 'serious injuries' on Thursday at her home in Devon, southwest England, according to police. The suspect was arrested in South Yorkshire on Saturday. Another man, aged 26, was detained on Friday but has since been released from custody and dismissed from the investigation.",https://www.lemonde.fr/en/international/article/2026/07/12/police-arrest-28-year-old-suspect-over-killing-of-uk-politician_6755390_4.html,,False,https://img.lemde.fr/2026/07/10/0/0/5319/3546/398/265/75/0/ce28f7e_ftp-1-29gj7aia8bzw-187d5f7264b04f4ead675ceae5642133-0-b14e47b7fe7c4d54ae6ed3b5fdf9e894.jpg,
4,Why heatwaves disrupt our sleep – and how we can protect it,"High temperatures shorten nights by affecting sleep quality, posing a threat to public health. To help combat this, one expert advises keeping up morning outings to avoid further disruptions to our body clocks.",https://www.lemonde.fr/en/science/article/2026/07/11/why-heatwaves-disrupt-our-sleep-and-how-we-can-protect-it_6755384_10.html,,True,https://img.lemde.fr/2026/07/10/0/0/4999/3333/398/265/75/0/3a63d05_upload-1-6pto5d6do2nb-000-b8e33ke.jpg,
5,How live screenings of Paris Fashion Week are making fashion more accessible,"Organized by influencer Lyas, free live screenings of fashion shows on big screens toured France during Paris Men's Fashion Week. Several hundred people gathered in Marseille for the opening night.",https://www.lemonde.fr/en/m-le-mag/article/2026/07/12/how-live-screenings-of-paris-fashion-week-are-making-fashion-more-accessible_6755385_117.html,,True,https://img.lemde.fr/2026/06/24/1/0/2500/1666/398/265/75/0/08dabae_upload-1-ij8mhd8s9ze6-z63-5244-copie.jpg,
6,"Before Emile Zola, this forgotten writer was the first to defend Alfred Dreyfus","The journalist Bernard Lazare fought relentlessly to defend Captain Dreyfus and denounce the antisemitism that drove his conviction. On Sunday, France will mark its first national day commemorating the rehabilitation of the Jewish officer.",https://www.lemonde.fr/en/m-le-mag/article/2026/07/12/before-emile-zola-this-forgotten-writer-was-the-first-to-defend-alfred-dreyfus_6755389_117.html,Marius Joly,True,https://img.lemde.fr/2026/06/30/332/0/1079/719/664/442/75/0/cb699d2_ftp-1-jsxtp7adhpqa-434253-3488274.jpg,Feature
7,Argentina secures their place in World Cup semi-final with 3-1 victory over Switzerland,no description,https://www.lemonde.fr/en/sports/article/2026/07/12/argentina-secures-their-place-in-world-cup-semi-final-with-3-1-victory-over-switzerland_6755392_9.html,,False,https://img.lemde.fr/2026/07/12/0/21/3064/2043/198/132/95/0/51e72cb_ftp-1-wfns39opbwun-2026-07-12t040618z-2104767818-up1em7c0behym-rtrmadp-3-soccer-worldcup-arg-swi.JPG,
8,Kyiv spends sleepless nights underground as Russia intensifies attacks,no description,https://www.lemonde.fr/en/international/article/2026/07/11/war-in-ukraine-kyiv-spends-sleepless-nights-underground-as-russia-intensifies-attacks_6755371_4.html,,True,https://img.lemde.fr/2026/07/10/197/0/2953/1968/198/132/95/0/2a89c88_upload-1-y4dq6fquyf20-2026-07-10-heg-ukraine-0091.JPG,
9,"England defeats Norway 2-1 in extra time, sliding into World Cup semis",no description,https://www.lemonde.fr/en/sports/article/2026/07/12/england-defeats-norway-2-1-in-extra-time-sliding-into-world-cup-semis_6755388_9.html,,False,https://img.lemde.fr/2026/07/12/0/100/5037/3358/198/132/95/0/5650c55_ftp-1-gn9gp19yalkv-5599754-01-06.jpg,
10,"'You're expected to perform, but no one wants to know how you do it': Cocaine, the toxic fuel of young professionals",no description,https://www.lemonde.fr/en/campus/article/2026/07/11/you-re-expected-to-perform-but-no-one-wants-to-know-how-you-do-it-cocaine-the-toxic-fuel-of-young-professionals_6755382_11.html,,True,https://img.lemde.fr/2026/06/26/19/0/2244/1496/198/132/95/0/a56b4a1_upload-1-ipxiw8h7o5we-01-hd.jpg,
11,Noskova defeats fellow Czech Muchova to win first Wimbledon,no description,https://www.lemonde.fr/en/sports/article/2026/07/11/noskova-defeats-fellow-czech-muchova-to-win-first-wimbledon_6755383_9.html,,False,,
12,"French stayed put during June heatwave, cutting back movements",no description,https://www.lemonde.fr/en/economy/article/2026/07/11/french-stayed-put-during-june-heatwave-cutting-back-movements_6755374_19.html,,True,,
13,Houston killing of Mexican man by ICE reignites debate over US immigration agency,no description,https://www.lemonde.fr/en/international/article/2026/07/11/houston-killing-of-mexican-man-by-ice-reignites-debate-over-us-immigration-agency_6755370_4.html,,True,,
14,Le Monde's eight favorite exhibitions at Arles Photography Festival,no description,https://www.lemonde.fr/en/culture/article/2026/07/11/arles-photography-festival-our-eight-favorite-exhibitions_6755366_30.html,,True,,
15,"France's Socialists opt for a presidential primary, but who will run?",no description,https://www.lemonde.fr/en/politics/article/2026/07/11/france-s-socialists-opt-for-a-presidential-primary-but-who-will-run_6755375_5.html,,True,,
16,Tour de France: Merlier wins second consecutive stage,no description,https://www.lemonde.fr/en/sports/article/2026/07/11/tour-de-france-merlier-wins-second-consecutive-stage_6755377_9.html,,False,,
17,'The latest chapter in Le Pen's legal saga illustrates the intractable challenge of judging politicians',no description,https://www.lemonde.fr/en/opinion/article/2026/07/11/the-latest-chapter-in-le-pen-s-legal-saga-illustrates-the-intractable-challenge-of-judging-politicians_6755376_23.html,,True,,
18,Sunday's Tour de France stage to be shortened due to 'intense heatwave',no description,https://www.lemonde.fr/en/sports/article/2026/07/11/sunday-s-tour-de-france-stage-to-be-shortened-due-to-intense-heatwave_6755378_9.html,,False,,
19,"Tiago Rodrigues, director of the Avignon Festival: 'Thanks to Europe, thanks to democracy, how lucky I have been!'","'I wouldn't be where I am today if...' In this series, Le Monde interviews a personality about a decisive moment in their life. The director of the Avignon Festival discusses the indelible mark that the Portuguese dictatorship left on his family history.",https://www.lemonde.fr/en/culture/article/2026/07/11/tiago-rodrigues-director-of-the-avignon-festival-thanks-to-europe-thanks-to-democracy-how-lucky-i-have-been_6755381_30.html,Sandrine Blanchard,True,https://img.lemde.fr/2026/06/26/1622/0/4160/2773/664/442/75/0/752bf49_upload-1-agfrwgbp92ek-tiago-rodrigues-terencebk-1.jpg,Interview
20,Silicon Valley's next generation feels the AI blues,"In California, the rise of artificial intelligence no longer generates the unanimous enthusiasm it once did. Anxiety is mounting, especially among students and engineers, as jobs have been cut and democratic risks have grown more threatening.",https://www.lemonde.fr/en/m-le-mag/article/2026/07/11/when-it-comes-to-ai-nothing-s-right-silicon-valley-is-torn_6755365_117.html,Arnaud Leparmentier,True,https://img.lemde.fr/2026/06/23/0/19/1431/954/664/442/75/0/02c5195_ftp-1-isxrj01bdeym-433389-3475879.jpg,Long Read
21,Strait of Hormuz deadlock could lead Trump into sporadic war with Iran,"The renewed US and Iranian strikes on Wednesday, despite the memorandum of understanding reached between the two countries, jeopardize hopes for a swift end to the crisis unpopular with the American public.",https://www.lemonde.fr/en/international/article/2026/07/10/strait-of-hormuz-deadlock-could-lead-trump-into-sporadic-war-with-iran_6755331_4.html,Olivier Faye,True,https://img.lemde.fr/2026/07/09/0/0/5500/3666/664/442/75/0/b4d2795_ftp-1-xwsn2n5kzo69-2026-07-09t183546z-1807862606-rc2iama15gz3-rtrmadp-3-usa-trump-nato.JPG,News
22,'Imperial obsession and reckless escalation: Vladimir Putin has never appeared so trapped by his fantasies',no description,https://www.lemonde.fr/en/opinion/article/2026/07/09/imperial-obsession-and-reckless-escalation-vladimir-putin-has-never-appeared-so-trapped-by-his-fantasies_6755314_23.html,Alain Frachon,,https://img.lemde.fr/2025/02/13/0/0/0/0/100/100/60/0/012c520_sirius-fs-upload-1-siebgildln9p-1739442624103-capture-da-a-cran-2025-02-13-112806.png,Column
23,"'In trying to avoid accusations of exaggerating, the IPCC has instead underestimated the severity of our summers'",no description,https://www.lemonde.fr/en/opinion/article/2026/07/10/in-trying-to-avoid-accusations-of-exaggerating-the-ipcc-has-instead-underestimated-the-severity-of-our-summers_6755317_23.html,Jean-Baptiste Fressoz,,,Column
24,Le Pen's presidential bid 'is the ultimate symbol of the erosion of public ethics',no description,https://www.lemonde.fr/en/opinion/article/2026/07/09/le-pen-s-presidential-bid-is-the-ultimate-symbol-of-the-erosion-of-public-ethics_6755311_23.html,Paul Cassia,,,Op-Ed
