,headline,description,url,byline,premium,image_url,article type
0,Israel considers one-way exits for Gazans to Egypt,no description,https://www.lemonde.fr/en/international/article/2025/12/04/israel-considers-one-way-exits-for-gazans-to-egypt_6748159_4.html,,True,,
1,"Modi rolls out the red carpet for Putin, defying Western pressure",no description,https://www.lemonde.fr/en/international/article/2025/12/04/modi-rolls-out-the-red-carpet-for-putin-defying-western-pressure_6748149_4.html,,True,,
2,Zelensky without Yermak: The story of a split at the top of Ukraine,no description,https://www.lemonde.fr/en/international/article/2025/12/04/zelensky-without-yermak-the-story-of-a-split-at-the-top-of-ukraine_6748137_4.html,,True,,
3,'I am as afraid of the rain as I was of the war': How severe weather compounds the suffering of displaced Gazans,no description,https://www.lemonde.fr/en/international/article/2025/12/04/i-am-as-afraid-of-the-rain-as-i-was-of-the-war-how-severe-weather-compounds-the-suffering-of-displaced-gazans_6748128_4.html,,True,,
4,Bosnia and Herzegovina's Serb entity elects ally of  former leader Dodik,no description,https://www.lemonde.fr/en/international/article/2025/11/24/bosnia-and-herzegovina-s-serb-entity-elects-ally-of-former-leader-dodik_6747765_4.html,,True,,
5,"In France's Somme, bagpipers keep the memory of the Great War alive",no description,https://www.lemonde.fr/en/history/article/2025/11/11/in-france-s-somme-bagpipers-keep-the-memory-of-the-great-war-alive_6747347_157.html,,True,,
6,Latvia: Public mobilization grows in support of treaty for preventing violence against women,no description,https://www.lemonde.fr/en/international/article/2025/11/06/in-latvia-public-mobilization-continues-to-grow-in-support-of-the-istanbul-convention-for-preventing-violence-against-women_6747156_4.html,,True,,
7,"After Charlie Kirk's murder, Europe's far right swears allegiance to Trump's politics",no description,https://www.lemonde.fr/en/les-decodeurs/article/2025/10/20/the-murder-of-charlie-kirk-how-europe-s-far-right-swore-allegiance-to-trump-s-politics_6746586_8.html,,True,,
8,France delivers suspended sentence to student for defacing former justice minister's tomb,no description,https://www.lemonde.fr/en/france/article/2025/12/03/france-sentences-student-for-defacing-tomb-of-guillotine-abolitionist_6748124_7.html,,False,,
9,French justice stalls as evidence of police violence during 2023 protest is overlooked,no description,https://www.lemonde.fr/en/france/article/2025/12/04/french-justice-stalls-as-evidence-of-police-violence-during-2023-protest-is-overlooked_6748161_7.html,,True,,
10,Marseille grapples with drug trafficking: 'They are so many and they have so much money',no description,https://www.lemonde.fr/en/france/article/2025/12/02/marseille-grapples-with-drug-trafficking-they-are-so-many-and-they-have-so-much-money_6748047_7.html,,True,,
11,Foreign interference: Why France is raising its voice and turning to the courts,no description,https://www.lemonde.fr/en/france/article/2025/12/01/foreign-interference-why-france-is-raising-its-voice-and-turning-to-the-courts_6748034_7.html,,True,,
12,"Israel's D9 bulldozer, a tool of destruction in Gaza",no description,https://www.lemonde.fr/en/videos/video/2025/11/27/israel-s-d9-bulldozer-a-tool-of-destruction-in-gaza_6747870_108.html,,True,,
13,"Ukraine's Pokrovsk faces fierce fighting, footage analyzed by Le Monde reveals",no description,https://www.lemonde.fr/en/videos/video/2025/11/21/ukraine-s-pokrovsk-faces-fierce-fighting-footage-analyzed-by-le-monde-reveals_6747708_108.html,,True,,
14,Afghanistan: Relentless repression continues over four years into Taliban's rule,no description,https://www.lemonde.fr/en/videos/video/2025/10/04/afghanistan-relentless-repression-continues-over-four-years-into-taliban-s-rule_6746092_108.html,,False,,
15,Watch: Hundreds of thousands march in France against budget cuts,no description,https://www.lemonde.fr/en/videos/video/2025/09/19/french-strikes-watch-what-happened-as-hundreds-of-thousands-marched-against-budget-cuts_6745548_108.html,,False,,
16,France must prepare for its population decline,no description,https://www.lemonde.fr/en/opinion/article/2025/12/04/france-must-prepare-for-its-population-decline_6748142_23.html,,False,,
17,French society's anti-Mafia awakening,no description,https://www.lemonde.fr/en/opinion/article/2025/12/04/french-society-s-anti-mafia-awakening_6748153_23.html,,True,,
18,'The quality of geopolitical relations with major economies has a significant impact on growth',no description,https://www.lemonde.fr/en/opinion/article/2025/12/04/the-quality-of-geopolitical-relations-with-major-economies-has-a-significant-impact-on-growth_6748134_23.html,,True,,
19,'The fall of Assad marked a still uncertain close to a cycle of uprisings and crackdowns that began in Tunisia 15 years ago',no description,https://www.lemonde.fr/en/opinion/article/2025/12/04/the-fall-of-assad-marked-a-still-uncertain-close-to-a-cycle-of-uprisings-and-crackdowns-that-began-in-tunisia-15-years-ago_6748132_23.html,,True,,
20,"Iran's independent cinema in full revolt: 'With Woman, Life, Freedom, a major barrier was broken'",no description,https://www.lemonde.fr/en/m-le-mag/article/2025/12/04/iran-s-independent-cinema-in-full-revolt-with-woman-life-freedom-a-major-barrier-was-broken_6748162_117.html,,True,,
21,The first time Le Monde wrote about Jeffrey Epstein,no description,https://www.lemonde.fr/en/m-le-mag/article/2025/12/01/the-first-time-le-monde-wrote-about-jeffrey-epstein_6748001_117.html,,True,,
22,The last-minute fight to save Gaza's ancient archaeological treasures,no description,https://www.lemonde.fr/en/m-le-mag/article/2025/11/30/the-last-minute-fight-to-save-gaza-s-ancient-archaeological-treasures_6747984_117.html,,True,,
23,The art of being Oscar Wilde's grandson,no description,https://www.lemonde.fr/en/m-le-mag/article/2025/11/30/the-art-of-being-oscar-wilde-s-grandson_6747977_117.html,,True,,
24,"In Paris, five spots to enjoy a (great) plant-based sandwich",no description,https://www.lemonde.fr/en/lifestyle/article/2025/12/04/in-paris-five-spots-to-enjoy-a-great-plant-based-sandwich_6748131_37.html,,True,,
25,"Bayonne's 'Little Louvre,' the Bonnat-Helleu Museum, reopens after 14 years",no description,https://www.lemonde.fr/en/culture/article/2025/11/28/bayonne-s-little-louvre-the-bonnat-helleu-museum-reopens-after-14-years_6747913_30.html,,True,,
26,Victor Hugo's interior architecture on display in Paris,no description,https://www.lemonde.fr/en/lifestyle/article/2025/11/23/victor-hugo-s-interior-architecture-on-display-in-paris_6747753_37.html,,True,,
27,A stroll through Cachan: From a royal aqueduct to a panoramic garden,no description,https://www.lemonde.fr/en/lifestyle/article/2025/11/22/a-stroll-through-cachan-from-a-royal-aqueduct-to-a-panoramic-garden_6747720_37.html,,True,,
28,French justice stalls as evidence of police violence during 2023 protest is overlooked,"The early November release of troubling video footage by Mediapart and 'Libération,' showing gendarmes confronting environmental activists protesting against mega-reservoirs in March 2023, has highlighted the legal system's inadequate response.",https://www.lemonde.fr/en/france/article/2025/12/04/french-justice-stalls-as-evidence-of-police-violence-during-2023-protest-is-overlooked_6748161_7.html,,True,https://img.lemde.fr/2025/12/03/0/0/5022/3348/400/266/75/0/cac55af_upload-1-gzxnrenbgowg-000-33c242h.jpg,
29,France faces legal action for failing to do its 'fair share' in reducing global greenhouse gas emissions,no description,https://www.lemonde.fr/en/environment/article/2025/12/04/france-faces-legal-action-for-failing-to-do-its-fair-share-in-reducing-global-greenhouse-gas-emissions_6748150_114.html,,True,https://img.lemde.fr/2025/12/04/0/0/5760/3840/398/265/75/0/dcd8fbe_upload-1-76ym40rjklur-080-hl-rkessler-1687397.jpg,
30,Israel considers one-way exits for Gazans to Egypt,no description,https://www.lemonde.fr/en/international/article/2025/12/04/israel-considers-one-way-exits-for-gazans-to-egypt_6748159_4.html,,True,https://img.lemde.fr/2025/10/17/0/236/5028/3352/398/265/75/0/473a36a_ftp-import-images-1-jvlczba3ouuy-2025-10-17t065708z-424544770-rc2idhai5i5h-rtrmadp-3-israel-palestinians-aid-rafah.JPG,
31,"Modi rolls out the red carpet for Putin, defying Western pressure","Russian President Vladimir Putin is making his first visit to India since the start of the war in Ukraine in February 2022, on December 4-5. Both sides have mutual economic interests.",https://www.lemonde.fr/en/international/article/2025/12/04/modi-rolls-out-the-red-carpet-for-putin-defying-western-pressure_6748149_4.html,,True,https://img.lemde.fr/2025/12/04/0/37/5085/3390/398/265/75/0/6649198_ftp-1-eut6bvsajvma-2025-12-04t050716z-338384915-rc2g9ia5cxez-rtrmadp-3-india-russia.JPG,
32,French swimmer Léon Marchand ventures into uncharted waters at the US Open,"The four-time Olympic swimming champion is set to compete in his first long-course event of the season in Austin, Texas, on Thursday. His schedule includes five races, most of which are unusual for him.",https://www.lemonde.fr/en/sports/article/2025/12/04/french-swimmer-leon-marchand-ventures-into-uncharted-waters-at-the-us-open_6748155_9.html,,True,https://img.lemde.fr/2025/12/02/0/0/3430/2287/398/265/75/0/9d5e04a_upload-1-b7evaaeinplv-000-68mq7be.jpg,
33,"Spain, Ireland and the Netherlands pull out of 2026 Eurovision over Israel's participation","The organizers of next year's Eurovision Song Contest announced they were allowing Israel to compete on Thursday, drawing quick announcements of withdrawals from European countries critical of the Israeli offensive in Gaza.",https://www.lemonde.fr/en/culture/article/2025/12/04/spain-ireland-and-the-netherlands-pull-out-of-2026-eurovision-over-israel-s-participation_6748160_30.html,,False,https://img.lemde.fr/2025/11/21/0/0/6000/4000/398/265/75/0/e94d137_ftp-import-images-1-fxiug9toxfyp-2025-11-21t160258z-1974530872-rc2qnhaum2i5-rtrmadp-3-music-eurovision.JPG,
34,"Iran's independent cinema in full revolt: 'With Woman, Life, Freedom, a major barrier was broken'","Galvanized by the movement that emerged after the death of Mahsa Amini in September 2022, more and more filmmakers are dating to shoot outside any official framework. In a country where film production is a state matter, their films, made and distributed clandestinely, show Iranian society as it really is.",https://www.lemonde.fr/en/m-le-mag/article/2025/12/04/iran-s-independent-cinema-in-full-revolt-with-woman-life-freedom-a-major-barrier-was-broken_6748162_117.html,Ghazal Golshiri,True,https://img.lemde.fr/2025/11/25/0/0/2787/1858/664/442/75/0/b4840f7_upload-1-hd2wtvewhex0-mediadap.jpg,Investigation
35,Bernard Arnault denies involvement as Hermès heir sues LVMH over loss of six million shares,no description,https://www.lemonde.fr/en/economy/article/2025/12/04/bernard-arnault-denies-involvement-as-hermes-heir-sues-lvmh-over-loss-of-six-million-shares_6748141_19.html,,True,https://img.lemde.fr/2025/12/04/0/0/8015/5343/198/132/95/0/be5f7d7_upload-1-q2nh4ijubfsz-000-42m36ku.jpg,
36,French society's anti-Mafia awakening,no description,https://www.lemonde.fr/en/opinion/article/2025/12/04/french-society-s-anti-mafia-awakening_6748153_23.html,,True,https://img.lemde.fr/2025/11/23/126/0/3000/2000/198/132/95/0/b488687_upload-1-rbttgjv3su9x-hommage-kessaci-26.jpg,
37,"Rwanda and DRC leaders sign Trump-brokered peace deal, despite new violence",no description,https://www.lemonde.fr/en/international/article/2025/12/04/rwanda-and-drc-leaders-sign-trump-brokered-peace-deal-despite-new-violence_6748163_4.html,,False,https://img.lemde.fr/2025/12/04/1/0/6684/4456/198/132/95/0/2d4b48a_ftp-1-javim1lzxftq-5598494-01-06.jpg,
38,EU launches antitrust investigation into Meta's introduction of AI features in WhatsApp,no description,https://www.lemonde.fr/en/pixels/article/2025/12/04/eu-launches-antitrust-investigation-into-meta-s-introduction-of-ai-features-in-whatsapp_6748143_13.html,,False,https://img.lemde.fr/2025/12/04/0/0/7426/4951/198/132/95/0/bfd3b47_ftp-1-zl10x6gqvd6z-5594711-01-06.jpg,
39,PFAS: Cereal-based foods also heavily contaminated,no description,https://www.lemonde.fr/en/environment/article/2025/12/04/pfas-cereal-based-foods-also-heavily-contaminated_6748138_114.html,,True,,
40,'New York Times' sues Pentagon over new restrictions on media outlets,no description,https://www.lemonde.fr/en/international/article/2025/12/04/new-york-times-sues-pentagon-over-new-restrictions-on-media-outlets_6748152_4.html,,False,,
41,Zelensky without Yermak: The story of a split at the top of Ukraine,no description,https://www.lemonde.fr/en/international/article/2025/12/04/zelensky-without-yermak-the-story-of-a-split-at-the-top-of-ukraine_6748137_4.html,,True,,
42,Former EU official Federica Mogherini resigns from College of Europe amid fraud probe,no description,https://www.lemonde.fr/en/international/article/2025/12/04/former-eu-official-federica-mogherini-resigns-from-college-of-europe-amid-fraud-probe_6748154_4.html,,False,,
43,EU unveils plan to create market regulator to unify bloc's financial markets,no description,https://www.lemonde.fr/en/economy/article/2025/12/04/eu-unveils-plan-to-create-market-regulator-to-unify-bloc-s-financial-markets_6748156_19.html,,False,,
44,Algeria dashes hopes for release of French journalist Christophe Gleizes,no description,https://www.lemonde.fr/en/le-monde-africa/article/2025/12/04/algeria-dashes-hopes-for-release-of-french-journalist-christophe-gleizes_6748139_124.html,,True,,
45,Versace announces departure of creative chief after less than nine months,no description,https://www.lemonde.fr/en/economy/article/2025/12/04/versace-announces-departure-of-creative-chief-after-less-than-nine-months_6748158_19.html,,False,,
46,European Commission unveils plan to continue financial support for Ukraine after US aid ends,no description,https://www.lemonde.fr/en/international/article/2025/12/04/the-european-commission-unveils-plan-to-continue-financial-support-for-ukraine-after-us-aid-ends_6748127_4.html,,True,,
47,"Behind Gaza's 'yellow line,' Israel's postwar laboratory","In the half of the Palestinian enclave kept under Israeli army control, several hundred members of anti-Hamas militias and criminal gangs have been brought together. Israeli authorities intend to rely on these groups to counter the Islamist movement.",https://www.lemonde.fr/en/international/article/2025/12/03/behind-gaza-s-yellow-line-israel-s-postwar-laboratory_6748121_4.html,Louis Imbert and  Marie Jo Sader,True,https://img.lemde.fr/2025/11/20/605/0/1538/1025/664/442/75/0/3d71d09_upload-1-jxkgfm0di5de-capture-d-e-cran-3.jpg,In Depth
48,'The quality of geopolitical relations with major economies has a significant impact on growth',"A recent study has revealed that economists have long underestimated the importance of a country's alignment with others in their analyses, reports Pauline Grosjean in her column for Le Monde.",https://www.lemonde.fr/en/opinion/article/2025/12/04/the-quality-of-geopolitical-relations-with-major-economies-has-a-significant-impact-on-growth_6748134_23.html,Pauline Grosjean,True,https://img.lemde.fr/2025/12/02/0/0/4800/3200/664/442/75/0/2280085_upload-1-hrk22fglghem-000-32fz32k.jpg,Column
49,Influential study on glyphosate safety retracted 25 years after publication,"A 2000 study that concluded the well-known herbicide glyphosate was safe, widely cited since then, has just been officially disavowed by the journal that published it. The scientists are suspected of having signed a text actually prepared by Monsanto.",https://www.lemonde.fr/en/environment/article/2025/12/03/influential-study-on-glyphosate-safety-retracted-25-years-after-publication_6748114_114.html,Stéphane Foucart,True,https://img.lemde.fr/2025/12/03/0/0/8017/5345/664/442/75/0/10c4799_upload-1-nstwxx8krfzi-000-33xy3mc.jpg,News
50,France must prepare for its population decline,no description,https://www.lemonde.fr/en/opinion/article/2025/12/04/france-must-prepare-for-its-population-decline_6748142_23.html,Le Monde,False,,Editorial
51,Donald Trump and the spread of impunity,no description,https://www.lemonde.fr/en/opinion/article/2025/12/02/donald-trump-and-the-spread-of-impunity_6748066_23.html,Le Monde,False,,Editorial
52,The real questions raised by Macron on news media,no description,https://www.lemonde.fr/en/opinion/article/2025/12/03/the-real-questions-raised-by-macron-on-news-media_6748107_23.html,Le Monde,False,,Editorial
