,headline,description,url,byline,premium,image_url,article type
0,"At least 4 people dead and 8 wounded in a shooting and fire at a Michigan church, police say",no description,https://www.lemonde.fr/en/international/article/2025/09/29/at-least-4-people-dead-and-8-wounded-in-a-shooting-and-fire-at-a-michigan-church-police-say_6745882_4.html,,False,,
1,The Liangma River: Beijing's urban greening success story,no description,https://www.lemonde.fr/en/international/article/2025/09/29/the-liangma-river-beijing-s-urban-greening-success-story_6745879_4.html,,True,,
2,Hamas urges Israel to halt strikes as it searches for two hostages,no description,https://www.lemonde.fr/en/international/article/2025/09/28/hamas-urges-israel-to-halt-strikes-as-it-searches-for-two-hostages_6745876_4.html,,False,,
3,How Paris airports are protected from drone flyovers,no description,https://www.lemonde.fr/en/international/article/2025/09/28/drone-flyovers-how-paris-airports-are-protected_6745862_4.html,,True,,
4,Sanctions against Russia spark rift between US and Europe over China,no description,https://www.lemonde.fr/en/international/article/2025/09/15/sanctions-against-russia-spark-rift-between-us-and-europe-over-china_6745411_4.html,,True,,
5,France's political instability puts Franco-German alliance to the test,no description,https://www.lemonde.fr/en/opinion/article/2025/08/30/france-s-political-instability-puts-franco-german-alliance-to-the-test_6744873_23.html,,False,,
6,France faces prospect of paying higher borrowing costs than Italy,no description,https://www.lemonde.fr/en/economy/article/2025/08/19/france-faces-prospect-of-paying-higher-borrowing-costs-than-italy_6744519_19.html,,True,,
7,French man arrested in Slovenia for crimes committed in Croatia during 1991 war,no description,https://www.lemonde.fr/en/international/article/2025/08/06/french-man-arrested-in-slovenia-for-crimes-committed-in-croatia-during-1991-war_6744113_4.html,,True,,
8,Young migrant found dead on beach in northern France,no description,https://www.lemonde.fr/en/france/article/2025/09/28/young-migrant-found-dead-on-beach-in-northern-france_6745866_7.html,,False,,
9,French artists and feminists call to honor women who died of illegal abortions,no description,https://www.lemonde.fr/en/france/article/2025/09/28/french-artists-and-feminists-push-to-honor-women-who-died-of-illegal-abortions_6745868_7.html,,True,,
10,French investigators believe Russia involved in dumping of pig heads at mosques,no description,https://www.lemonde.fr/en/france/article/2025/09/27/french-investigators-believe-russia-involved-in-dumping-of-pig-heads-at-mosques_6745830_7.html,,True,,
11,"France has been 'dropping out of democracy' since 2017, warns an NGO report",no description,https://www.lemonde.fr/en/france/article/2025/09/27/france-has-been-dropping-out-of-democracy-since-2017-warns-an-ngo-report_6745803_7.html,,True,,
12,Watch: Hundreds of thousands march in France against budget cuts,no description,https://www.lemonde.fr/en/videos/video/2025/09/19/french-strikes-watch-what-happened-as-hundreds-of-thousands-marched-against-budget-cuts_6745548_108.html,,False,,
13,Emmys 2025: 'Adolescence' star Owen Cooper becomes youngest winner for best supporting actor,no description,https://www.lemonde.fr/en/videos/video/2025/09/15/emmys-2025-adolescence-star-owen-cooper-becomes-youngest-winner-for-best-supporting-actor_6745427_108.html,,False,,
14,"From 'influence peddling' to 'corruption,' what is French Culture Minister Rachida Dati accused of?",no description,https://www.lemonde.fr/en/videos/video/2025/09/06/from-influence-peddling-to-corruption-what-is-french-culture-minister-rachida-dati-accused-of_6745094_108.html,,False,,
15,Watch: Tsunami warnings sound in Japan after 8.8 magnitude quake off Russian coast,no description,https://www.lemonde.fr/en/videos/video/2025/07/30/watch-tsunami-warnings-sound-in-japan-after-8-8-magnitude-quake-off-russian-coast_6743900_108.html,,False,,
16,"'After colonizing the adult world, AI enters the world of children'",no description,https://www.lemonde.fr/en/opinion/article/2025/09/28/after-colonizing-the-adult-world-ai-enters-the-world-of-children_6745857_23.html,,True,,
17,The troubling direction of American justice,no description,https://www.lemonde.fr/en/opinion/article/2025/09/27/the-troubling-direction-of-american-justice_6745818_23.html,,False,,
18,'To frame Kirk's death as escalation misses the truth. The real threat is normalization',no description,https://www.lemonde.fr/en/opinion/article/2025/09/26/to-frame-kirk-s-death-as-escalation-misses-the-truth-the-real-threat-is-normalization_6745775_23.html,,True,,
19,'Israel's isolation is the price of pursuing a war in Gaza without clear objectives',no description,https://www.lemonde.fr/en/opinion/article/2025/09/26/israel-s-isolation-is-the-price-of-pursuing-a-war-in-gaza-without-clear-objectives_6745764_23.html,,True,,
20,"Vivian Jenna Wilson, Elon Musk's transgender daughter, has become a New York Fashion Week sensation",no description,https://www.lemonde.fr/en/m-le-mag/article/2025/09/24/vivian-jenna-wilson-elon-musk-s-transgender-daughter-has-become-a-new-york-fashion-week-sensation_6745690_117.html,,True,,
21,Historian Tal Bruttmann's sharp eye on the Holocaust,no description,https://www.lemonde.fr/en/m-le-mag/article/2025/09/21/historian-tal-bruttmann-s-sharp-eye-on-the-holocaust_6745597_117.html,,True,,
22,The silent and destructive spread of laughing gas: 'That shit took my whole life',no description,https://www.lemonde.fr/en/m-le-mag/article/2025/09/20/the-silent-and-destructive-spread-of-laughing-gas-that-shit-took-my-whole-life_6745588_117.html,,True,,
23,"For the 250th anniversary of Jane Austen's birth, take a trip into the world of her superfans",no description,https://www.lemonde.fr/en/m-le-mag/article/2025/09/20/on-the-250th-anniversary-of-jane-austen-s-birth-take-a-trip-into-the-world-of-the-english-novelist-s-superfans_6745580_117.html,,True,,
24,Tradition done right: Five Paris restaurants reimagining the classics,no description,https://www.lemonde.fr/en/lifestyle/article/2025/09/08/tradition-done-right-five-paris-restaurants-reimagining-the-classics_6745133_37.html,,True,,
25,Paris Design Week: A 15th edition marked by abundance,no description,https://www.lemonde.fr/en/lifestyle/article/2025/09/05/paris-design-week-a-15th-edition-marked-by-abundance_6745060_37.html,,True,,
26,It's pain suisse time! Five places in and around Paris to find this treat,no description,https://www.lemonde.fr/en/lifestyle/article/2025/09/04/it-s-pain-suisse-time-five-places-in-the-paris-region-to-find-this-treat_6745022_37.html,,True,,
27,"At Musée d'Orsay, a Courbet painting gets a new life before visitors' eyes",no description,https://www.lemonde.fr/en/culture/article/2025/07/26/at-musee-d-orsay-a-courbet-painting-gets-a-new-life-before-visitors-eyes_6743744_30.html,,True,,
28,'Zucman tax': The great fear of France's ultra-rich,"Amid budget negotiations, the idea of a tax on the wealth of the ultra-rich is provoking an outcry from those affected, even though it is widely supported by the left and backed by public opinion.",https://www.lemonde.fr/en/politics/article/2025/09/29/zucman-tax-the-great-fear-of-france-s-ultra-rich_6745885_5.html,,True,https://img.lemde.fr/2025/09/23/1/0/3500/2333/400/266/75/0/849ff24_upload-1-zmusqbqpirho-sipa01230065-000045.jpg,
29,Italy's Meloni hardens rhetoric after killing of Charlie Kirk,no description,https://www.lemonde.fr/en/international/article/2025/09/28/italy-s-meloni-hardens-rhetoric-after-killing-of-charlie-kirk_6745861_4.html,,True,https://img.lemde.fr/2025/09/26/333/0/5000/3333/398/265/75/0/a6d381f_upload-1-ol9gtlaqkplt-kzihnioglu-otan-25062025-hd-154.JPG,
30,Hamas urges Israel to halt strikes as it searches for two hostages,no description,https://www.lemonde.fr/en/international/article/2025/09/28/hamas-urges-israel-to-halt-strikes-as-it-searches-for-two-hostages_6745876_4.html,,False,https://img.lemde.fr/2025/09/27/0/0/6000/4000/398/265/75/0/5ec56b9_ftp-import-images-1-tdgn260m3jjt-5012217-01-06.jpg,
31,Moldova's pro-EU party takes decisive lead in election fraught with Russian interference claims,Sunday's high-stakes ballot was to some extent a litmus test for the Moldovan authorities in countering what they have long alleged is a massive 'hybrid war' conducted by Russia.,https://www.lemonde.fr/en/international/article/2025/09/29/moldova-s-pro-eu-party-takes-decisive-lead-in-election-fraught-with-russian-interference-claims_6745881_4.html,,False,https://img.lemde.fr/2025/09/26/15/0/5877/3918/398/265/75/0/72d7b87_ftp-import-images-1-6gzhtinggaut-2025-09-26t164431z-1696977408-rc2qzga06prf-rtrmadp-3-moldova-election.JPG,
32,Emma Reyes' still lifes finds new life in two Paris exhibitions,"The Colombian painter's work, infused with magical realism, finally gains major recognition nearly 20 years after her death.",https://www.lemonde.fr/en/culture/article/2025/09/28/emma-reyes-still-lifes-finds-new-life-in-two-paris-exhibitions_6745877_30.html,,True,https://img.lemde.fr/2025/09/26/1644/0/5306/3537/398/265/75/0/030df16_upload-1-jlmpecp6tiey-1-reyes-untitled-1084.jpg,
33,The Liangma River: Beijing's urban greening success story,"Since 2019, an ambitious revegetation project along the canal has turned the area into a popular outdoor swimming spot, now beloved by city dwellers. The cities of Shanghai and Wuhan have also embraced the trend.",https://www.lemonde.fr/en/international/article/2025/09/29/the-liangma-river-beijing-s-urban-greening-success-story_6745879_4.html,,True,https://img.lemde.fr/2025/09/14/0/0/6562/4375/398/265/75/0/04366a2_upload-1-godrfkboyqxn-000-62fb9kd.jpg,
34,Boys' clubs at work are still a thing,"From the tech 'broligarchy' to after-work sports, informal circles of powerful men remain omnipresent in business and government. They often insidiously promote male exclusivity and hinder professional equality.",https://www.lemonde.fr/en/economy/article/2025/09/29/boys-clubs-at-work-are-still-a-thing_6745883_19.html,Thomas Lestavel,True,https://img.lemde.fr/2025/09/19/1366/0/1972/1315/664/442/75/0/18747d8_upload-1-36txzlza4noe-img-3822.jpeg,Your stories
35,New York City Mayor Eric Adams ends his reelection campaign,no description,https://www.lemonde.fr/en/international/article/2025/09/28/new-york-city-mayor-eric-adams-ends-his-reelection-campaign_6745874_4.html,,False,https://img.lemde.fr/2025/09/28/0/0/3628/2419/198/132/95/0/7fede6b_ftp-import-images-1-h59bxg22u5r3-5021498-01-06.jpg,
36,Europe's emotional Ryder Cup triumph after fighting off the US,no description,https://www.lemonde.fr/en/sports/article/2025/09/29/europe-s-emotional-ryder-cup-triumph-after-fighting-off-the-us_6745880_9.html,,False,https://img.lemde.fr/2025/09/28/0/0/4807/3205/198/132/95/0/edeae18_ftp-import-images-1-mo12suftm6er-5025802-01-06.jpg,
37,Latin artist Bad Bunny to headline Super Bowl half-time show,no description,https://www.lemonde.fr/en/sports/article/2025/09/29/latin-artist-bad-bunny-to-headline-super-bowl-half-time-show_6745886_9.html,,False,https://img.lemde.fr/2025/09/17/50/0/3500/2333/198/132/95/0/f4e78c0_ftp-import-images-1-snshkp2kk8p6-8cb331a627f14d039ab650376a421c51-1-46603d5b5de54cf2baac28bc35414a19.jpg,
38,Picasso Museum in Paris to expand with new wing and garden redesign,no description,https://www.lemonde.fr/en/culture/article/2025/09/28/picasso-museum-in-paris-to-expand-with-new-wing-and-garden-redesign_6745873_30.html,,True,https://img.lemde.fr/2025/09/28/0/26/5443/3629/198/132/95/0/73d1325_upload-1-wlmqd1csu7zh-000-36xv3ru.jpg,
39,"Svalbard, the fastest-warming place on Earth",no description,https://www.lemonde.fr/en/environment/article/2025/09/28/svalbard-the-fastest-warming-place-on-earth_6745872_114.html,,True,,
40,"At least 4 people dead and 8 wounded in a shooting and fire at a Michigan church, police say",no description,https://www.lemonde.fr/en/international/article/2025/09/29/at-least-4-people-dead-and-8-wounded-in-a-shooting-and-fire-at-a-michigan-church-police-say_6745882_4.html,,False,,
41,"Moldova elections: Aside from Russia, Romanian far right also interfering",no description,https://www.lemonde.fr/en/international/article/2025/09/28/moldova-elections-aside-from-russia-romanian-far-right-also-interfering_6745859_4.html,,True,,
42,Macron condemns threats against judges in Sarkozy case,no description,https://www.lemonde.fr/en/france/article/2025/09/28/macron-condemns-threats-against-judges-in-sarkozy-case_6745875_7.html,,False,,
43,Spain's Valencia region on red alert for heavy rains,no description,https://www.lemonde.fr/en/international/article/2025/09/29/spain-s-valencia-region-on-red-alert-for-heavy-rains_6745884_4.html,,False,,
44,Madagascar's president returns amid unrest,no description,https://www.lemonde.fr/en/le-monde-africa/article/2025/09/28/madagascar-s-president-returns-amid-unrest_6745863_124.html,,True,,
45,Gaza: Diplomats press Trump to push Israel toward ending war,no description,https://www.lemonde.fr/en/international/article/2025/09/27/gaza-diplomats-press-trump-to-push-israel-toward-ending-war_6745820_4.html,,True,,
46,The bustier: Between constraint and freedom,no description,https://www.lemonde.fr/en/lifestyle/article/2025/09/28/the-bustier-between-constraint-and-freedom_6745855_37.html,,False,,
47,French artists and feminists call to honor women who died of illegal abortions,Activists are calling to build a monument in Paris to honor the women who died from unsafe abortions before abortion was legalized in France in 1975.,https://www.lemonde.fr/en/france/article/2025/09/28/french-artists-and-feminists-push-to-honor-women-who-died-of-illegal-abortions_6745868_7.html,Solène Cordier,True,https://img.lemde.fr/2025/09/26/14/0/2173/1448/664/442/75/0/9b87044_upload-1-iaathklczg6t-2025-09-26-colcanopa.jpg,In Depth
48,How can Europe withstand pressure from Russia and the US? Two experts debate,hTensions with Russia to the East and the United States to the West are testing Europe's model. Sylvain Kahn and Guillaume Lagane examine this shifting landscape and the possible responses.,https://www.lemonde.fr/en/books/article/2025/09/28/how-can-europe-withstand-pressure-from-russia-and-us-two-experts-debate_6745858_33.html,Florent Georgesco,True,https://img.lemde.fr/2025/05/10/0/0/4002/2668/664/442/75/0/577fbe0_sirius-fs-upload-1-ek3iklxhs65i-1746883330047-739056.jpg,Interview
49,The day Sarkozy learned he was going to prison,"Nicolas Sarkozy will become the first former president of the French Republic to sleep behind bars after being convicted of criminal conspiracy, in the case of alleged Libyan financing of his 2007 presidential campaign.",https://www.lemonde.fr/en/france/article/2025/09/26/the-day-sarkozy-learned-he-was-going-to-prison_6745758_7.html,Franck Johannès,True,https://img.lemde.fr/2025/09/25/0/0/2503/1668/664/442/75/0/06b3cdb_ftp-import-images-1-4sy7ltjml1k2-97d221d144ef49f6b9a8ae3f4604c3f0-1-63b8023f79f14f098444069a1704210e.jpg,News
50,The troubling direction of American justice,no description,https://www.lemonde.fr/en/opinion/article/2025/09/27/the-troubling-direction-of-american-justice_6745818_23.html,Le Monde,False,,Editorial
51,Sarkozy conviction: No one is above the law,no description,https://www.lemonde.fr/en/opinion/article/2025/09/26/sarkozy-conviction-no-one-is-above-the-law_6745763_23.html,Le Monde,False,,Editorial
52,"'After colonizing the adult world, AI enters the world of children'",no description,https://www.lemonde.fr/en/opinion/article/2025/09/28/after-colonizing-the-adult-world-ai-enters-the-world-of-children_6745857_23.html,Corine Lesnes,,,Column
