,headline,description,url,byline,premium,image_url,article type
0,Why the EU decided to freeze Russian sovereign assets in Europe until the Ukraine war ends,no description,https://www.lemonde.fr/en/international/article/2025/12/13/why-the-eu-decided-to-freeze-russian-sovereign-assets-in-europe-until-the-ukraine-war-ends_6748461_4.html,,True,,
1,Zelensky says Ukrainian army has retaken Kupiansk,no description,https://www.lemonde.fr/en/international/article/2025/12/13/zelensky-says-ukrainian-army-has-retaken-kupiansk_6748458_4.html,,True,,
2,"In Ukraine, the challenges of holding an election during wartime",no description,https://www.lemonde.fr/en/international/article/2025/12/13/in-ukraine-the-challenges-of-holding-an-election-during-wartime_6748445_4.html,,True,,
3,Russia's phantom gains in Ukraine,no description,https://www.lemonde.fr/en/international/article/2025/12/12/russia-s-phantom-advances-in-ukraine_6748441_4.html,,True,,
4,'Trump's ideological challenge to Europe is more dangerous than the security one',no description,https://www.lemonde.fr/en/opinion/article/2025/12/11/trump-s-ideological-challenge-to-europe-is-more-dangerous-than-the-security-one_6748393_23.html,,True,,
5,"Attacked by Trump, Europe wavers between denial and fear of reprisals",no description,https://www.lemonde.fr/en/international/article/2025/12/11/attacked-by-trump-europe-wavers-between-denial-and-fear-of-reprisals_6748382_4.html,,True,,
6,Bosnia and Herzegovina's Serb entity elects ally of  former leader Dodik,no description,https://www.lemonde.fr/en/international/article/2025/11/24/bosnia-and-herzegovina-s-serb-entity-elects-ally-of-former-leader-dodik_6747765_4.html,,True,,
7,"In France's Somme, bagpipers keep the memory of the Great War alive",no description,https://www.lemonde.fr/en/history/article/2025/11/11/in-france-s-somme-bagpipers-keep-the-memory-of-the-great-war-alive_6747347_157.html,,True,,
8,French farmers block roads to protest cow disease cull,no description,https://www.lemonde.fr/en/france/article/2025/12/13/french-farmers-block-roads-to-protest-cow-disease-cull_6748463_7.html,,False,,
9,France falters on oversight of its spy services,no description,https://www.lemonde.fr/en/opinion/article/2025/12/14/france-falters-on-oversight-of-its-spy-services_6748470_23.html,,True,,
10,France moves to phase out support system for Ukrainian refugees,no description,https://www.lemonde.fr/en/france/article/2025/12/13/france-moves-to-phase-out-support-system-for-ukrainian-refugees_6748468_7.html,,True,,
11,The mysterious 'knocker' scaring elderly women in a Brittany town,no description,https://www.lemonde.fr/en/france/article/2025/12/12/the-mysterious-knocker-scaring-elderly-women-in-a-brittany-town_6748408_7.html,,True,,
12,The French studio behind a viral Christmas ad,no description,https://www.lemonde.fr/en/videos/video/2025/12/12/the-french-studio-behind-a-viral-christmas-ad_6748436_108.html,,False,,
13,"Israel's D9 bulldozer, a tool of destruction in Gaza",no description,https://www.lemonde.fr/en/videos/video/2025/11/27/israel-s-d9-bulldozer-a-tool-of-destruction-in-gaza_6747870_108.html,,True,,
14,"Ukraine's Pokrovsk faces fierce fighting, footage analyzed by Le Monde reveals",no description,https://www.lemonde.fr/en/videos/video/2025/11/21/ukraine-s-pokrovsk-faces-fierce-fighting-footage-analyzed-by-le-monde-reveals_6747708_108.html,,True,,
15,Afghanistan: Relentless repression continues over four years into Taliban's rule,no description,https://www.lemonde.fr/en/videos/video/2025/10/04/afghanistan-relentless-repression-continues-over-four-years-into-taliban-s-rule_6746092_108.html,,False,,
16,Thomas Piketty: 'The true enemy of the nationalist and extractivist right embodied by Trumpists is the global social-democratic left',no description,https://www.lemonde.fr/en/opinion/article/2025/12/13/thomas-piketty-the-true-enemy-of-the-nationalist-and-extractivist-right-embodied-by-trumpists-is-the-global-social-democratic-left_6748454_23.html,,True,,
17,France falters on oversight of its spy services,no description,https://www.lemonde.fr/en/opinion/article/2025/12/14/france-falters-on-oversight-of-its-spy-services_6748470_23.html,,True,,
18,French municipalities are the guardians of child protection,no description,https://www.lemonde.fr/en/opinion/article/2025/12/13/french-municipalities-are-the-guardians-of-child-protection_6748459_23.html,,False,,
19,Who will dare to condemn the terror imposed by Israel in the West Bank?,no description,https://www.lemonde.fr/en/opinion/article/2025/12/12/who-will-dare-to-condemn-the-terror-imposed-by-israel-in-the-west-bank_6748420_23.html,,False,,
20,'La Cage aux Folles': Paris reclaims the flamboyant musical,no description,https://www.lemonde.fr/en/m-le-mag/article/2025/12/13/la-cage-aux-folles-paris-reclaims-the-flamboyant-musical_6748465_117.html,,True,,
21,"'Am I Next?': In Los Angeles, a city targeted by ICE raids, an exhibition invites self-reflection",no description,https://www.lemonde.fr/en/m-le-mag/article/2025/12/13/am-i-next-in-los-angeles-a-city-targeted-by-ice-raids-an-exhibition-invites-self-reflection_6748446_117.html,,True,,
22,The lawyer suing far-right French mayors for setting up Nativity scenes,no description,https://www.lemonde.fr/en/m-le-mag/article/2025/12/07/the-woman-suing-french-far-right-mayors-for-setting-up-nativity-scenes_6748246_117.html,,True,,
23,100 years of the photobooth: Meet the people keeping them alive,no description,https://www.lemonde.fr/en/m-le-mag/article/2025/12/07/100-years-of-the-photobooth-meet-the-people-keeping-them-alive_6748232_117.html,,False,,
24,Five creative craft workshops to enjoy doing in Paris with your child,no description,https://www.lemonde.fr/en/intimacy/article/2025/12/13/in-paris-five-creative-craft-workshops-to-enjoy-doing-with-your-child_6748451_310.html,,True,,
25,Jewels of power go on display in Paris,no description,https://www.lemonde.fr/en/culture/article/2025/12/11/the-power-gems-on-display-in-paris_6748374_30.html,,False,,
26,Five spots in Paris to enjoy a (great) plant-based sandwich,no description,https://www.lemonde.fr/en/lifestyle/article/2025/12/04/in-paris-five-spots-to-enjoy-a-great-plant-based-sandwich_6748131_37.html,,True,,
27,"Bayonne's 'Little Louvre,' the Bonnat-Helleu Museum, reopens after 14 years",no description,https://www.lemonde.fr/en/culture/article/2025/11/28/bayonne-s-little-louvre-the-bonnat-helleu-museum-reopens-after-14-years_6747913_30.html,,True,,
28,Paris region inaugurates its first cable car,"The C1 cable car line opened on December 13, connecting the south-eastern Paris suburbs of Créteil and Villeneuve-Saint-Georges. This new mode of urban transport is attracting the interest of many local governments.",https://www.lemonde.fr/en/economy/article/2025/12/13/paris-region-inaugurates-its-first-cable-car_6748464_19.html,,True,https://img.lemde.fr/2025/12/11/0/0/5992/3994/400/266/75/0/c3401dd_upload-1-xdvceaqulmka-andia-abc-975473-027.jpg,
29,France moves to phase out support system for Ukrainian refugees,no description,https://www.lemonde.fr/en/france/article/2025/12/13/france-moves-to-phase-out-support-system-for-ukrainian-refugees_6748468_7.html,,True,https://img.lemde.fr/2025/12/10/2208/0/3987/2658/398/265/75/0/5907151_upload-1-0gts4b7ni5v3-le-monde-re-fugie-es-ukrainiennes-7.jpg,
30,"Shooting at Brown University kills at least two, injures others",no description,https://www.lemonde.fr/en/international/article/2025/12/14/multiple-people-shot-at-brown-university_6748469_4.html,,False,https://img.lemde.fr/2025/12/13/0/0/5499/3666/398/265/75/0/a2701d7_ftp-1-79o6arkhoy7h-225687e833b04b2d8f4c3c9781bb4adc-1-5765741cac7c4454a9252aab1fc7e942.jpg,
31,"Belarus frees protest leader Kolesnikova, Nobel winner Bialiatski in US-brokered deal","Rights groups, relatives and state media reported 123 people were freed, including foreign citizens, after a US envoy said that Washington was lifting some sanctions on Minsk.",https://www.lemonde.fr/en/international/article/2025/12/13/belarus-frees-protest-leader-kolesnikova-nobel-winner-bialiatski-in-us-brokered-deal_6748460_4.html,,False,https://img.lemde.fr/2025/12/13/0/0/4768/3178/398/265/75/0/385bf6a_ftp-1-n133qdmduqn1-2025-12-13t155424z-1066951881-rc2rfiasu7ne-rtrmadp-3-usa-belarus-prisoners.JPG,
32,US troops and civilian in Syria killed in IS ambush attack,"Two American troops and a civilian were killed in central Syria on Saturday after an alleged member of the Islamic State group opened fire on a joint US-Syrian patrol, officials said. Donald Trump promised retaliation.",https://www.lemonde.fr/en/international/article/2025/12/13/us-troops-and-civilian-in-syria-killed-in-is-ambush-attack_6748466_4.html,,False,https://img.lemde.fr/2025/11/14/0/0/6000/4000/398/265/75/0/a3f1953_ftp-import-images-1-qm8jethynnla-5ae0f81c04c14b74a2532501369209d5-0-02d13994c769435eaa151187825152e9.jpg,
33,Sant Ambroeus brings Italian flair to Paris's Latin Quarter,"The New York café-restaurant frequented by celebrities has opened a new location in the elegant Saint-Germain-des-Prés district, offering an Italian-American menu in an atmosphere inspired by the 1930s.",https://www.lemonde.fr/en/lifestyle/article/2025/12/13/sant-ambroeus-brings-italian-flair-to-paris-s-latin-quarter_6748462_37.html,,True,https://img.lemde.fr/2025/11/28/668/0/1001/667/398/265/75/0/d72f495_ftp-import-images-1-lpnliobp0o2u-407738-3448397.jpg,
34,'La Cage aux Folles': Paris reclaims the flamboyant musical,"French audiences mostly know 'La Cage aux Folles' from the film adaptation of Jean Poiret's play, featuring Michel Serrault's exuberant performance. But it is also a triumphant Broadway classic, freed from clichés about homosexuality. Now, director Olivier Py and actor Laurent Lafitte bring the musical to the Théâtre du Châtelet in Paris.",https://www.lemonde.fr/en/m-le-mag/article/2025/12/13/la-cage-aux-folles-paris-reclaims-the-flamboyant-musical_6748465_117.html,Clément Ghys and  Joëlle Gayot,True,https://img.lemde.fr/2025/11/26/309/0/1125/750/664/442/75/0/68d89f1_upload-1-lmhdzpbud25m-web-img-741.jpg,Long Read
35,Thomas Piketty: 'The true enemy of the nationalist and extractivist right embodied by Trumpists is the global social-democratic left',no description,https://www.lemonde.fr/en/opinion/article/2025/12/13/thomas-piketty-the-true-enemy-of-the-nationalist-and-extractivist-right-embodied-by-trumpists-is-the-global-social-democratic-left_6748454_23.html,,True,https://img.lemde.fr/2025/11/20/0/0/7547/5031/198/132/95/0/2434c8d_ftp-import-images-1-eltcos0ljil5-c18d2b6f643643f79dbc11c69485af8c-1-1722597a1803455dacdad9417c50e3b7.jpg,
36,The forgotten war between France and Cameroon,no description,https://www.lemonde.fr/en/history/visuel/2025/12/13/the-forgotten-war-between-france-and-cameroon_6748457_157.html,,True,https://img.lemde.fr/2025/10/07/86/0/800/533/198/132/95/0/c66ba2d_upload-1-ts70lfaeqfqr-ma-cameroun.jpg,
37,"Remote work: 'We are seeing more cases of dismissals under technological surveillance, especially in the US'",no description,https://www.lemonde.fr/en/economy/article/2025/12/14/remote-work-we-are-seeing-more-cases-of-dismissals-under-technological-surveillance-especially-in-the-us_6748471_19.html,,True,https://img.lemde.fr/2025/11/18/0/0/5568/3712/198/132/95/0/754f499_upload-1-dnxzpoc3owgg-000-1rk7bn.jpg,
38,French farmers angered by government culling of diseased cows,no description,https://www.lemonde.fr/en/economy/article/2025/12/13/french-farmers-angered-by-government-culling-of-diseased-cows_6748456_19.html,,True,https://img.lemde.fr/2025/12/13/0/0/4176/2784/198/132/95/0/519a9f9_upload-1-qn0ble0p1ayf-maxnewsworldsix883913.jpg,
39,Israel says killed top Hamas commander Raad Saad in Gaza,no description,https://www.lemonde.fr/en/international/article/2025/12/13/israel-says-killed-top-hamas-weapons-figure-in-gaza_6748467_4.html,,False,,
40,Zelensky says Ukrainian army has retaken Kupiansk,no description,https://www.lemonde.fr/en/international/article/2025/12/13/zelensky-says-ukrainian-army-has-retaken-kupiansk_6748458_4.html,,True,,
41,Why the EU decided to freeze Russian sovereign assets in Europe until the Ukraine war ends,no description,https://www.lemonde.fr/en/international/article/2025/12/13/why-the-eu-decided-to-freeze-russian-sovereign-assets-in-europe-until-the-ukraine-war-ends_6748461_4.html,,True,,
42,French farmers block roads to protest cow disease cull,no description,https://www.lemonde.fr/en/france/article/2025/12/13/french-farmers-block-roads-to-protest-cow-disease-cull_6748463_7.html,,False,,
43,"Thailand says four soldiers killed in Cambodia conflict, denies Trump truce claim",no description,https://www.lemonde.fr/en/international/article/2025/12/13/cambodia-says-thailand-still-bombing-hours-after-trump-truce-call_6748452_4.html,,False,,
44,"How French spies, police and military personnel are betrayed by advertising data",no description,https://www.lemonde.fr/en/pixels/article/2025/12/13/how-french-spies-police-and-military-personnel-are-betrayed-by-advertising-data_6748453_13.html,,True,,
45,Five creative craft workshops to enjoy doing in Paris with your child,no description,https://www.lemonde.fr/en/intimacy/article/2025/12/13/in-paris-five-creative-craft-workshops-to-enjoy-doing-with-your-child_6748451_310.html,,True,,
46,"In 'Wake Up Dead Man: A Knives Out Mystery,' Daniel Craig grapples with metaphysics",no description,https://www.lemonde.fr/en/culture/article/2025/12/13/in-wake-up-dead-man-a-knives-out-mystery-daniel-craig-grapples-with-metaphysics_6748450_30.html,,True,,
47,"Paris Agreement: Ten years later, key players look back on 'incredible alignment of stars'","Le Monde takes a look back at the the signing of the Paris Agreement in the French capital on December 12, 2015, a major geopolitical agreement reached after two weeks of intense negotiations that aimed to limit global warming to 'well below' 2°C and at 'pursuing efforts' to keep the temperature increase to 1.5°C.",https://www.lemonde.fr/en/environment/article/2025/12/12/paris-agreement-ten-years-later-key-players-look-back-on-incredible-alignment-of-stars_6748434_114.html,Matthieu Goar,True,https://img.lemde.fr/2025/12/11/0/0/3600/2400/664/442/75/0/3ae338f_upload-1-dpjcsuix9iyg-cop-21-20151212-13.jpg,News
48,The mysterious 'knocker' scaring elderly women in a Brittany town,"For more than two years, a prowler has been knocking on doors and shutters during the night in a village in Brittany, France, creating a climate of fear among his preferred targets: elderly women. Authorities were slow to take the case seriously.",https://www.lemonde.fr/en/france/article/2025/12/12/the-mysterious-knocker-scaring-elderly-women-in-a-brittany-town_6748408_7.html,Florence Aubenas,True,https://img.lemde.fr/2025/12/08/0/0/6048/4032/664/442/75/0/77fe432_upload-1-hwcuar4pnrd8-dsc7573.jpg,Feature
49,Ukraine ready to consider Donbas demilitarized zone in concession to end war,"Mykhailo Podolyak, an advisor to Ukrainian President Volodymyr Zelensky, tells Le Monde that the zone would require Ukrainian and Russian forces to both pull back from the front line.",https://www.lemonde.fr/en/international/article/2025/12/11/ukraine-ready-to-accept-donbas-demilitarized-zone-in-concession-to-end-war_6748397_4.html,Claire Gatinois and  Philippe Ricard,True,https://img.lemde.fr/2025/12/11/3/0/5152/3434/664/442/75/0/daa5a95_upload-1-kxul8vagu0ym-451887.jpg,News
50,France falters on oversight of its spy services,no description,https://www.lemonde.fr/en/opinion/article/2025/12/14/france-falters-on-oversight-of-its-spy-services_6748470_23.html,Jacques Follorou,,,News analysis
51,French municipalities are the guardians of child protection,no description,https://www.lemonde.fr/en/opinion/article/2025/12/13/french-municipalities-are-the-guardians-of-child-protection_6748459_23.html,Le Monde,False,,Editorial
52,Sarkozy's astonishing about-face on the far right,no description,https://www.lemonde.fr/en/opinion/article/2025/12/09/sarkozy-suggests-alliance-with-far-right-is-inevitable_6748307_23.html,Le Monde,False,,Editorial
