,headline,description,url,byline,premium,image_url,article type
0,"Violence amid PSG celebrations was not gang-driven, but acts by 'varied profiles'","Paris Saint-Germain's Champions League victory was followed by unrest in the French capital. The arrests and trials that followed present a different picture from the one hastily drawn by some politicians. With the World Cup underway, local authorities remain vigilant.",https://www.lemonde.fr/en/france/article/2026/06/13/violence-amid-psg-celebrations-was-not-gang-driven-but-acts-by-varied-profiles_6754444_7.html,,True,https://img.lemde.fr/2026/05/30/0/0/7209/4806/400/266/75/0/9df959a_ftp-1-7s06kiefdpy9-105365ca9812425295028793dbee3aad-0-53364e5059ed4da3b347ee156bd374cd.jpg,
1,"Trump says US-Iran deal to be signed Sunday, Hormuz to open afterwards",no description,https://www.lemonde.fr/en/international/article/2026/06/13/trump-says-us-iran-deal-to-be-signed-sunday-hormuz-to-open-afterwards_6754446_4.html,,False,https://img.lemde.fr/2026/06/11/0/0/6000/4000/398/265/75/0/abdb960_ftp-1-s9h6gow4jr5o-aa69e98eb53d4bb3892b6940a64e7ef1-0-5cbf935e3cd84502b318ba6f10851b22.jpg,
2,Lebanese government tracks war damage through scientific agency,no description,https://www.lemonde.fr/en/international/article/2026/06/13/lebanese-government-tracks-war-damage-through-scientific-agency_6754448_4.html,,True,https://img.lemde.fr/2026/06/10/0/0/8192/5461/398/265/75/0/dbcbfd9_upload-1-q9htiuqlgtte-lbn-lemonde-diegoibarrasanchez-009.jpg,
3,Killing of Lyhanna: What we know about the previous accusations against the suspect,"While awaiting the findings of the inquiries by the national gendarmerie's internal affairs body and the Justice Ministry's oversight authority, Le Monde has compiled the established facts and the outstanding questions surrounding the background of the suspect in the 11-year-old girl's murder.",https://www.lemonde.fr/en/france/article/2026/06/13/killing-of-lyhanna-what-we-know-about-the-previous-accusations-against-suspect-jerome-barella_6754436_7.html,,True,https://img.lemde.fr/2026/06/10/107/0/4500/3000/398/265/75/0/e91c4d1_upload-1-439pm41f6hhp-mfache-06062026-le-monde-affaire-lyhanna-gers-france-046.jpg,
4,"France prepares for another 'very intense and widespread' heat event, possibly over 40°C","The southern half of France is set to be hit first this weekend. Starting Tuesday, the heat is expected to worsen and move northward. Temperatures could reach or exceed 40°C, although some uncertainty remains.",https://www.lemonde.fr/en/environment/article/2026/06/13/france-prepares-for-another-very-intense-and-widespread-heat-event-possibly-over-40-c_6754428_114.html,,True,https://img.lemde.fr/2026/05/28/0/0/7447/4964/398/265/75/0/b0ba908_upload-1-oiq32s5xtiqo-canicule-toulouse-myop-lebeuf-6293.jpg,
5,"The perfume industry's troubled waters, from Hormuz to climate change","The fragrance industry is feeling the full force of global upheavals, which are causing supply chain problems and putting pressure on prices. In response to rising risks, the sector is reorganizing and developing new tools to better anticipate crises.",https://www.lemonde.fr/en/m-le-mag/article/2026/06/13/the-perfume-industry-s-troubled-waters-from-hormuz-to-climate-change_6754438_117.html,,True,https://img.lemde.fr/2026/05/21/0/0/4681/3121/398/265/75/0/3de3751_upload-1-5vgrvvz7qeb2-m-le-monde-jeffersonfouquet-collage03bd.jpg,
6,NBA Finals: New York rediscovers passion for basketball and the Knicks,The New York Knicks have a chance to win the NBA championship for the first time since 1973 if they prevail on Saturday against Victor Wembanyama's San Antonio Spurs. Such a feat would mark a long-awaited reconciliation between New York and its storied franchise.,https://www.lemonde.fr/en/sports/article/2026/06/13/nba-finals-new-york-rediscovers-passion-for-basketball-and-the-knicks_6754445_9.html,Nicolas Chapuis,True,https://img.lemde.fr/2026/06/11/0/0/7753/5168/664/442/75/0/f106216_ftp-1-o1x9kjby8qdp-5283925-01-06.jpg,Feature
7,Trump will take part in G7 session with Zelensky and dine with Macron at Versailles,no description,https://www.lemonde.fr/en/international/article/2026/06/13/trump-will-take-part-in-g7-session-with-zelensky-and-dine-with-macron-at-versailles_6754442_4.html,,False,https://img.lemde.fr/2025/03/01/0/0/5109/3406/198/132/95/0/5201b47_ftp-import-images-1-c5vgvutqgnqt-2025-03-01t025115z-1277697083-rc261dal5v49-rtrmadp-3-ukraine-crisis-france-britain.JPG,
8,'The Labour Party could sink into lasting decline without an electoral strategy',no description,https://www.lemonde.fr/en/opinion/article/2026/06/13/the-labour-party-could-sink-into-lasting-decline-without-an-electoral-strategy_6754435_23.html,,True,https://img.lemde.fr/2026/06/08/0/0/4999/3333/198/132/95/0/6b82115_ftp-1-yux6j0gyaeec-5259428-01-06.jpg,
9,Workers start removing Trump's name from Kennedy Center after court ruling,no description,https://www.lemonde.fr/en/international/article/2026/06/13/workers-start-removing-trump-s-name-from-kennedy-center-after-court-ruling_6754440_4.html,,False,https://img.lemde.fr/2026/06/13/0/19/5062/3375/198/132/95/0/7729c5c_ftp-1-7vj3x4rnzkfc-36a5b3b463834154ad0f106847348f20-1-3a310bcf18c844f49d7844e284599c93.jpg,
10,Two new sex abuse cases filed against French singer Patrick Bruel,no description,https://www.lemonde.fr/en/france/article/2026/06/13/two-new-sex-abuse-cases-filed-against-french-singer-patrick-bruel_6754439_7.html,,False,https://img.lemde.fr/2026/06/10/0/0/7453/4968/198/132/95/0/832f5a9_ftp-1-e5fna42uzbwn-5274647-01-06.jpg,
11,Trial of man linked to Dominique Pelicot highlights disturbing pattern of male domination,no description,https://www.lemonde.fr/en/france/article/2026/06/13/trial-of-man-linked-to-dominique-pelicot-highlights-disturbing-pattern-of-male-domination_6754437_7.html,,True,,
12,Several firms may have been involved in interference during French local elections,no description,https://www.lemonde.fr/en/pixels/article/2026/06/13/several-firms-may-have-been-involved-in-interference-during-french-local-elections_6754433_13.html,,True,,
13,French antitrust chief: SFR buyout by rivals 'not self-evident',no description,https://www.lemonde.fr/en/economy/article/2026/06/13/french-antitrust-chief-sfr-buyout-by-rivals-not-self-evident_6754434_19.html,,True,,
14,"Europeans' trust in the US hits historic low, poll finds",no description,https://www.lemonde.fr/en/international/article/2026/06/12/europeans-trust-in-the-us-hits-historic-low-poll-finds_6754415_4.html,,True,,
15,"Elon Musk's role was 'instrumental' in the Belfast riots, researchers say",no description,https://www.lemonde.fr/en/international/article/2026/06/13/musk-s-role-was-instrumental-in-the-belfast-riots-according-to-researchers_6754420_4.html,,False,,
16,"US deports migrants, including Iranian women, to Central African Republic",no description,https://www.lemonde.fr/en/le-monde-africa/article/2026/06/13/united-states-deports-migrants-including-iranian-women-to-central-african-republic_6754419_124.html,,True,,
17,France's military quietly prepares for a return to Chad,no description,https://www.lemonde.fr/en/le-monde-africa/article/2026/06/13/france-s-military-quietly-prepares-for-a-return-to-chad_6754429_124.html,,True,,
18,"Jeanne Damas celebrates 10th anniversary of Rouje, a certain ideal of 'the Parisienne'",no description,https://www.lemonde.fr/en/lifestyle/article/2026/06/13/jeanne-damas-celebrates-rouje-s-10th-anniversary-her-brand-embodying-a-certain-ideal-of-the-parisienne_6754422_37.html,,True,,
19,"Josh O'Connor, star of Spielberg's 'Disclosure Day,' wants to 'cultivate his garden'","At 36, he is one of the most sought-after actors in both independent cinema and major Hollywood productions. In just a few years, the British artist, who is passionate about gardening, has put his delicate masculinity and subtle acting style to work for a wide range of characters, from a lovesick farmer to Prince Charles or a priest.",https://www.lemonde.fr/en/m-le-mag/article/2026/06/12/josh-o-connor-star-of-spielberg-s-disclosure-day-wants-to-cultivate-his-garden_6754413_117.html,Clément Ghys,True,https://img.lemde.fr/2026/05/25/100/0/1500/1000/664/442/75/0/ed9ff5f_ftp-1-59qojkjmg5tj-429685-3472815.jpg,Profile
20,The RN's fascination with LFI's presidential election 'war machine',"Despite their political opposition, Marine Le Pen and senior figures in the far-right Rassemblement National party often praise the organization of the radical left LFI, particularly its ability to stay on message.",https://www.lemonde.fr/en/politics/article/2026/06/13/2027-french-presidential-election-the-far-right-rn-s-fascination-with-la-france-insoumise-s-war-machine_6754424_5.html,Corentin Lesueur,True,https://img.lemde.fr/2026/06/11/0/0/6720/4480/664/442/75/0/82b0d10_upload-1-hscqqwv9fgeg-cbi1300014.jpg,In Depth
21,"David Hockney, giant of British painting, dies at the age of 88","Internationally renowned, notably for his painting 'A Bigger Splash' (1967) and his series of pool paintings, the British artist, who lived in Normandy from 2019 to 2023, produced work that straddled pop art and hyperrealism, never hesitating to use new technologies as sources of inspiration. He died on June 11.",https://www.lemonde.fr/en/obituaries/article/2026/06/12/david-hockney-giant-of-british-painting-dies-at-the-age-of-88_6754391_15.html,Harry Bellet,True,https://img.lemde.fr/2026/06/09/965/0/3307/2204/664/442/75/0/b6f846b_upload-1-ljxtqome45pu-eyevine02360358.jpg,Obituary
22,The boycott of Nadav Lapid: An unacceptable essentialism,no description,https://www.lemonde.fr/en/opinion/article/2026/06/13/the-boycott-of-nadav-lapid-an-unacceptable-essentialism_6754441_23.html,Le Monde,False,,Editorial
23,"'Speaking with Putin? For Europe, there may be a window of opportunity. But how and for what purpose?'",no description,https://www.lemonde.fr/en/opinion/article/2026/06/11/speaking-with-putin-for-europe-there-may-be-a-window-of-opportunity-but-how-and-for-what-purpose_6754344_23.html,Sylvie Kauffmann,,https://img.lemde.fr/2023/07/06/0/0/0/0/100/100/60/0/97cb851_1688634309022-cd62c21-403.jpg,Column
24,"Boycott of Israeli filmmaker Nadav Lapid: 'A creator should not be reduced to their passport. It is time to stop denying their words, their actions and their work'",no description,https://www.lemonde.fr/en/opinion/article/2026/06/12/boycott-of-israeli-filmmaker-nadav-lapid-a-creator-should-not-be-reduced-to-their-passport-it-is-time-to-stop-denying-their-words-their-actions-and-their-work_6754399_23.html,Michel Guerrin,,https://img.lemde.fr/2025/02/13/0/0/0/0/100/100/60/0/582cc7b_sirius-fs-upload-1-s35ik04v2mji-1739442860260-capture-da-a-cran-2025-02-13-113357.png,Column
