,headline,description,url,byline,premium,image_url,article type
0,The ICC petitions to end Russia's plundering of Ukrainian museums,no description,https://www.lemonde.fr/en/international/article/2025/07/12/the-icc-petitions-to-end-russia-s-plundering-of-ukrainian-museums_6743292_4.html,,True,,
1,"New York, a political laboratory for Democrats",no description,https://www.lemonde.fr/en/international/article/2025/07/11/new-york-a-political-laboratory-for-democrats_6743283_4.html,,True,,
2,International justice confronts the genocide of Srebrenica,no description,https://www.lemonde.fr/en/international/article/2025/07/11/international-justice-confronts-the-genocide-of-srebrenica_6743275_4.html,,True,,
3,"In Srebrenica, 30 years after the genocide, the 'vicious circle' of denial continues",no description,https://www.lemonde.fr/en/international/article/2025/07/11/in-srebrenica-30-years-after-the-genocide-the-vicious-circle-of-denial-continues_6743270_4.html,,True,,
4,International justice confronts the genocide of Srebrenica,no description,https://www.lemonde.fr/en/international/article/2025/07/11/international-justice-confronts-the-genocide-of-srebrenica_6743275_4.html,,True,,
5,"In Srebrenica, 30 years after the genocide, the 'vicious circle' of denial continues",no description,https://www.lemonde.fr/en/international/article/2025/07/11/in-srebrenica-30-years-after-the-genocide-the-vicious-circle-of-denial-continues_6743270_4.html,,True,,
6,London hopes for a shift in French immigration policy in the Channel,no description,https://www.lemonde.fr/en/international/article/2025/07/09/london-hopes-for-a-shift-in-french-immigration-policy-in-the-english-channel_6743178_4.html,,True,,
7,"France will lend Bayeux Tapestry to the UK, Macron announces",no description,https://www.lemonde.fr/en/europe/article/2025/07/08/france-will-lend-bayeux-tapestry-to-the-uk-macron-announces_6743160_143.html,,True,,
8,French police raid far-right RN party's HQ over suspected illegal campaign financing,no description,https://www.lemonde.fr/en/france/article/2025/07/09/french-police-raid-far-right-rn-party-s-hq-over-suspected-illegal-campaign-financing_6743193_7.html,,True,,
9,Poverty and inequality in France reach highest levels in 30 years,no description,https://www.lemonde.fr/en/france/article/2025/07/09/poverty-and-inequality-in-france-reach-highest-levels-in-30-years_6743177_7.html,,True,,
10,Man sentenced to life without parole for 2019 jihadist attack in French prison,no description,https://www.lemonde.fr/en/france/article/2025/07/08/man-sentenced-to-life-without-parole-for-2019-jihadist-attack-in-french-prison_6743146_7.html,,True,,
11,France's Channel intervention strategy questioned after footage shows gendarmes stabbing migrant boat,no description,https://www.lemonde.fr/en/france/article/2025/07/08/france-s-channel-intervention-strategy-questioned-after-footage-shows-gendarmes-stabbing-migrant-boat_6743137_7.html,,True,,
12,What is France's 'Black code' and why hasn't it been repealed?,no description,https://www.lemonde.fr/en/videos/video/2025/05/31/what-is-france-s-black-code-and-why-hasn-t-it-been-repealed_6741860_108.html,,False,,
13,How was the European Union created?,no description,https://www.lemonde.fr/en/videos/video/2025/05/29/how-was-the-european-union-created_6741795_108.html,,False,,
14,Glide bombs: Russia's secret to making cheap weapons,no description,https://www.lemonde.fr/en/videos/video/2025/05/25/glide-bombs-russia-s-secret-to-making-cheap-weapons_6741646_108.html,,True,,
15,How does the conclave pick the new pope?,no description,https://www.lemonde.fr/en/videos/video/2025/05/07/how-does-the-conclave-pick-the-new-pope_6741005_108.html,,False,,
16,Thomas Piketty: 'The US's unprecedented financial fragility explains Trump's aggressiveness',no description,https://www.lemonde.fr/en/opinion/article/2025/07/12/thomas-piketty-the-us-s-unprecedented-financial-fragility-explains-trump-s-aggressiveness_6743298_23.html,,True,,
17,"With Channel migration deal, France and UK show shared determination",no description,https://www.lemonde.fr/en/opinion/article/2025/07/11/with-channel-migration-agreement-france-and-uk-show-shared-determination_6743272_23.html,,False,,
18,Support for Ukraine: 'Europeans still hope Trump will maintain his backing on intelligence',no description,https://www.lemonde.fr/en/opinion/article/2025/07/11/support-for-ukraine-europeans-still-hope-trump-will-maintain-his-backing-on-intelligence_6743256_23.html,,True,,
19,"Le Monde's cartoon of the day, by Stellina",no description,https://www.lemonde.fr/en/opinion/article/2025/07/10/le-monde-s-cartoon-of-the-day-by-stellina_6743238_23.html,,False,,
20,Nonprofit helps French festivals fight gender-based violence,no description,https://www.lemonde.fr/en/m-le-mag/article/2025/07/11/nonprofit-helps-french-festivals-fight-gender-based-violence_6743284_117.html,,True,,
21,Spain's Costa Blanca bears the scars of a real estate frenzy,no description,https://www.lemonde.fr/en/m-le-mag/article/2025/07/09/spain-s-costa-blanca-bears-the-scars-of-a-real-estate-frenzy_6743171_117.html,,True,,
22,In the jaws of the Jackal: How an informant orchestrated a policewoman's fall,no description,https://www.lemonde.fr/en/m-le-mag/article/2025/07/06/in-the-jaws-of-the-jackal-how-an-informant-orchestrated-a-policewoman-s-fall_6743075_117.html,,True,,
23,"The arms dealer, the general's daughter and the speed demon: An inheritance battle",no description,https://www.lemonde.fr/en/m-le-mag/article/2025/07/06/the-arms-dealer-the-general-s-daughter-and-the-speed-demon-an-inheritance-battle_6743074_117.html,,True,,
24,"Avignon Festival: 'When I Saw the Sea', Ali Chahrour's peaceful and political work",no description,https://www.lemonde.fr/en/culture/article/2025/07/10/avignon-festival-when-i-saw-the-sea-ali-chahrour-s-peaceful-and-political-work_6743233_30.html,,True,,
25,Nice's Contemporary Art Biennale explores the city's unique relationship to the sea,no description,https://www.lemonde.fr/en/culture/article/2025/07/06/nice-s-contemporary-art-biennale-explores-the-city-s-unique-relationship-to-the-sea_6743081_30.html,,True,,
26,"Dubuffet, Hokusai, Giacometti: 20 must-see exhibitions this summer, in Paris and beyond",no description,https://www.lemonde.fr/en/culture/article/2025/06/28/20-must-see-exhibitions-this-summer-in-paris-and-beyond_6742801_30.html,,True,,
27,Five cultural outings to enjoy with a baby in Paris,no description,https://www.lemonde.fr/en/intimacy/article/2025/06/27/five-cultural-outings-to-enjoy-in-paris-with-a-baby_6742762_310.html,,True,,
28,"At Rencontres d'Arles, the artistic blur between AI and photographers remains unresolved",The issue of works being plundered to train generative artificial intelligence search engines remains unsettled. Negotiations between representatives of creators and generative AI systems to reach a licensing agreement appear to be stalling.,https://www.lemonde.fr/en/culture/article/2025/07/12/at-rencontres-d-arles-the-artistic-blur-between-ai-and-photographers-remains-unresolved_6743296_30.html,,True,https://img.lemde.fr/2025/07/08/649/0/1772/1181/400/266/75/0/d3f26ef_upload-1-1w9uesrixdaq-2025-futu-01.jpg,
29,Judge orders Trump administration to halt indiscriminate ICE arrests in California,no description,https://www.lemonde.fr/en/global-issues/article/2025/07/12/judge-orders-trump-administration-to-halt-indiscriminate-ice-arrests-in-california_6743295_199.html,,False,https://img.lemde.fr/2025/07/01/0/0/4076/2717/398/265/75/0/42d42af_ftp-import-images-1-kslowbjb2wdk-b3bf4931191143279624205e36422877-1-0e0692d5b6b3414db6314d0006aa00b9.jpg,
30,The ICC petitions to end Russia's plundering of Ukrainian museums,no description,https://www.lemonde.fr/en/international/article/2025/07/12/the-icc-petitions-to-end-russia-s-plundering-of-ukrainian-museums_6743292_4.html,,True,https://img.lemde.fr/2025/07/11/69/0/5485/3656/398/265/75/0/eb783ec_upload-1-kmwe3c8xin0b-000-349c9z6.jpg,
31,"In Belgium, the migration minister is advocating for 'the strictest policy ever implemented'","Anneleen Van Bossuyt has taken a hard line on migration and integration policy, while distancing herself from Vlaams Belang, the powerful far-right party in Flanders.",https://www.lemonde.fr/en/global-issues/article/2025/07/12/in-belgium-the-migration-minister-is-advocating-for-the-strictest-policy-ever-implemented_6743289_199.html,,True,https://img.lemde.fr/2025/07/10/0/0/5265/3510/398/265/75/0/ea102bf_upload-1-m7hofbnz3htu-000-49ch8gx.jpg,
32,Fast-spreading Grand Canyon wildfires force tourist evacuations,"The White Sage Fire, which is 0% contained, is burning outside the Grand Canyon National Park's North Rim and has scorched roughly 8,700 acres of land. So far, around 500 tourists have been safely evacuated, authorities said on Friday.",https://www.lemonde.fr/en/environment/article/2025/07/11/fast-spreading-grand-canyon-wildfires-force-evacuations_6743287_114.html,,False,https://img.lemde.fr/2025/07/11/14/0/1280/853/398/265/75/0/23e2004_ftp-import-images-1-6dhpmsbkt7dv-0c3b87783a174c3baa2df0cd5d65d50c-0-fb53c3519845451687ba506e4f6a8197.jpg,
33,Tracking neural implants that fool the immune system,To reduce the body's rejection response – which can impair the effectiveness of neural implants – an international team of researchers has chemically bonded these devices with an anti-inflammatory drug.,https://www.lemonde.fr/en/science/article/2025/07/12/tracking-neural-implants-that-fool-the-immune-system_6743297_10.html,,True,https://img.lemde.fr/2025/07/05/0/737/7954/5303/398/265/75/0/a25ab7e_upload-1-cgarhcpe5xsv-gettyimages-2162367310.jpg,
34,Thomas Piketty: 'The US's unprecedented financial fragility explains Trump's aggressiveness',"The idea of spontaneously harmonious free trade does not stand up to scrutiny. Faced with imbalances, the right response would be to establish a common currency, argues the economist in his column.",https://www.lemonde.fr/en/opinion/article/2025/07/12/thomas-piketty-the-us-s-unprecedented-financial-fragility-explains-trump-s-aggressiveness_6743298_23.html,Thomas Piketty,True,https://img.lemde.fr/2025/07/11/1/0/4403/2935/664/442/75/0/35fc970_ftp-import-images-1-gr7oujefa3yf-2025-07-11t050146z-1669668506-rc2otdad7bwp-rtrmadp-3-palau-geopolitics.JPG,Column
35,"Trump tours Texas flood sites, defends officials amid mounting questions about response",no description,https://www.lemonde.fr/en/natural-disasters/article/2025/07/12/trump-tours-texas-flood-sites-and-defends-officials-amid-mounting-questions-about-response_6743290_225.html,,False,https://img.lemde.fr/2025/07/11/0/0/5803/3869/198/132/95/0/be8ab4d_ftp-import-images-1-uwsdt4wp2izp-5391381-01-06.jpg,
36,US sanctions Cuban president four years after historic protests,no description,https://www.lemonde.fr/en/international/article/2025/07/12/us-sanctions-cuban-president-four-years-after-historic-protests_6743294_4.html,,False,https://img.lemde.fr/2025/06/26/71/0/3867/2578/198/132/95/0/69b961a_ftp-import-images-1-ttaa0svyw576-2025-06-26t190903z-693478738-rc2iafadad2m-rtrmadp-3-belarus-summit.JPG,
37,"Ecuador's top drug lord, 'Fito,' agrees to US extradition",no description,https://www.lemonde.fr/en/global-issues/article/2025/07/12/ecuador-s-top-drug-lord-fito-agrees-to-us-extradition_6743291_199.html,,False,https://img.lemde.fr/2025/07/11/0/0/2586/1724/198/132/95/0/dde161a_ftp-import-images-1-340zlh3ute0s-5392401-01-06.jpg,
38,"To fight fires from the air, France has only 12 Canadair planes, which are 'an average of 30 years old'",no description,https://www.lemonde.fr/en/economy/article/2025/07/12/to-fight-fires-from-the-air-france-has-only-12-canadair-planes-which-are-an-average-of-30-years-old_6743293_19.html,,True,https://img.lemde.fr/2025/07/09/0/0/3000/2000/198/132/95/0/fa2b1be_upload-1-urplicifrrz1-000-64vp9cr-1.jpg,
39,"Iran's attack on Qatar air base hit geodesic dome used for US communications, satellite photos show",no description,https://www.lemonde.fr/en/international/article/2025/07/11/iran-s-attack-on-qatar-air-base-hit-geodesic-dome-used-for-us-communications-satellite-photos-show_6743286_4.html,,False,,
40,Sinner mauls Djokovic to reach first Wimbledon final,no description,https://www.lemonde.fr/en/sports/article/2025/07/12/sinner-mauls-djokovic-to-reach-first-wimbledon-final_6743288_9.html,,False,,
41,"New York, a political laboratory for Democrats",no description,https://www.lemonde.fr/en/international/article/2025/07/11/new-york-a-political-laboratory-for-democrats_6743283_4.html,,True,,
42,"France probes X over foreign interference, as investigation closes in on Musk",no description,https://www.lemonde.fr/en/pixels/article/2025/07/11/france-probes-x-over-foreign-interference-as-investigation-closes-in-on-musk_6743280_13.html,,True,,
43,Amnesty International condemns 'repression' of environmental and climate activists in France,no description,https://www.lemonde.fr/en/environment/article/2025/07/11/amnesty-international-condemns-repression-of-environmental-and-climate-activists-in-france_6743273_114.html,,True,,
44,"Macron can't run in 2027, but he is hinting at a return in 2032",no description,https://www.lemonde.fr/en/politics/article/2025/07/11/macron-can-t-run-in-2027-but-he-is-hinting-at-a-return-in-2032_6743262_5.html,,True,,
45,Dissension runs deep between Lula and Western democracies,no description,https://www.lemonde.fr/en/international/article/2025/07/11/dissension-runs-deep-between-lula-and-western-democracies_6743257_4.html,,True,,
46,Is it ever a good idea to... wear a speedo on the beach?,no description,https://www.lemonde.fr/en/lifestyle/article/2025/07/11/is-it-ever-a-good-idea-to-wear-a-speedo-on-the-beach_6743260_37.html,,False,,
47,US warns ICC member states to drop proceedings against Israel,Washington has threatened the International Criminal Court with further reprisals if it maintains arrest warrants against Benjamin Netanyahu and former Israeli defense minister Yoav Gallant. The US has already imposed sanctions on five judges and prosecutors.,https://www.lemonde.fr/en/international/article/2025/07/10/us-warns-icc-member-states-to-drop-proceedings-against-israel_6743241_4.html,Stéphanie Maupas,True,https://img.lemde.fr/2025/07/09/5/0/5177/3451/664/442/75/0/10dc315_ftp-import-images-1-cp4f2f55ni7w-2025-07-09t202146z-822976297-rc26jfapplgf-rtrmadp-3-usa-israel.JPG,In Depth
48,"Donald Trump, the White House decorator-in-chief","During his cabinet meeting on Tuesday, July 8, the president digressed on a wide variety of topics for more than an hour and a half in front of the press.",https://www.lemonde.fr/en/international/article/2025/07/11/donald-trump-the-white-house-decorator-in-chief_6743254_4.html,Gilles Paris,True,https://img.lemde.fr/2025/07/08/0/0/5787/3858/664/442/75/0/9d62944_ftp-import-images-1-xcik4eyn7shy-bb6246fb36a342829d3397eb85361cb8-0-7098177a223b4774875eb296454846b8.jpg,News
49,"In Srebrenica, 30 years after the genocide, the 'vicious circle' of denial continues","On July 11, Bosnia and Herzegovina commemorates the massacre of 8,000 Bosniaks by the forces of Serb General Ratko Mladic. Yet in a country still divided between Muslim Bosniaks, Catholic Croats and Orthodox Serbs, the work of remembrance remains far from unanimous.",https://www.lemonde.fr/en/international/article/2025/07/11/in-srebrenica-30-years-after-the-genocide-the-vicious-circle-of-denial-continues_6743270_4.html,Jean-Baptiste Chastand,True,https://img.lemde.fr/2025/07/10/455/0/6830/4553/664/442/75/0/673d5a7_upload-1-4gch38gigq2o-ry-bosnie-serbe-011.JPG,Feature
50,"With Channel migration deal, France and UK show shared determination",no description,https://www.lemonde.fr/en/opinion/article/2025/07/11/with-channel-migration-agreement-france-and-uk-show-shared-determination_6743272_23.html,Le Monde,False,,Editorial
51,Support for Ukraine: 'Europeans still hope Trump will maintain his backing on intelligence',no description,https://www.lemonde.fr/en/opinion/article/2025/07/11/support-for-ukraine-europeans-still-hope-trump-will-maintain-his-backing-on-intelligence_6743256_23.html,Philippe Ricard,,,Column
52,'The Hunger Games' in Gaza,no description,https://www.lemonde.fr/en/opinion/article/2025/07/08/the-hunger-games-in-gaza_6743167_23.html,Jean-Pierre Filiu,,https://img.lemde.fr/2023/07/31/0/0/0/0/100/100/60/0/d45bb07_1690791602941-eac5c14-1647333440018-jean-pierre-filiu-2019.jpg,Column
