,headline,description,url,byline,premium,image_url,article type
0,French firefighters brace for high-risk season after record heatwave,Fifty-two administrative departments across France are at risk of forest wildfires.,https://www.lemonde.fr/en/france/article/2026/06/28/french-firefighters-brace-for-a-high-risk-season-after-record-heatwave_6754952_7.html,,True,https://img.lemde.fr/2026/06/26/0/0/5852/3901/400/266/75/0/cf4ff90_upload-1-qjhcckgxm3y3-000-68by6nq.jpg,
1,'Our infrastructure was designed for a climate that no longer exists': France's unfinished reckoning with increasing heatwaves,no description,https://www.lemonde.fr/en/france/article/2026/06/28/our-infrastructure-was-designed-for-a-climate-that-no-longer-exists-france-s-unfinished-reckoning-with-increasing-heatwaves_6754944_7.html,,True,https://img.lemde.fr/2026/06/27/0/89/2157/1438/398/265/75/0/c290e64_upload-1-fo1fmlio2ic0-000-par2003081351124.jpg,
2,Civilian plane crash kills 11 in France,no description,https://www.lemonde.fr/en/france/article/2026/06/28/civilian-plane-crash-kills-11-in-france_6754947_7.html,,False,https://img.lemde.fr/2026/06/28/0/0/7009/4672/398/265/75/0/4f173d2_upload-1-z5jqupejkgnf-demaxnewsspecialtwo649838.jpg,
3,"From France to Italy, inside the counterfeit rings circulating fake banknotes across Europe via social media",A joint French-Italian investigation that lasted over a year led to the indictment of 12 people suspected of belonging to a huge counterfeiting network.,https://www.lemonde.fr/en/france/article/2026/06/28/from-france-to-italy-inside-the-counterfeit-rings-circulating-fake-banknotes-across-europe-via-social-media_6754949_7.html,,True,https://img.lemde.fr/2026/06/27/571/0/2362/1574/398/265/75/0/78018e4_upload-1-dft6rfrk9j6s-dessin-hd-vito-fait-des-faux-billets-lemonde.jpg,
4,250 years of American independence: The retreat from multiracial democracy,"'America 250' (7/13). A century after its founding, 38 states made up the nation. Deep divisions persisted over how to treat the Black population. Slavery had been abolished, much to the dismay of the Democrats, who were gaining ground. Although the Republicans won the presidential election, their victory came at the cost of institutionalizing segregationist policies in the Southern states.",https://www.lemonde.fr/en/international/article/2026/06/28/250-years-of-american-independence-the-retreat-from-multiracial-democracy_6754953_4.html,,True,https://img.lemde.fr/2026/06/24/0/300/3240/2160/398/265/75/0/f31cf6b_upload-1-zk0gq5a3ozhv-capture-d-e-cran-2026-06-24-a-17-28-39-3.jpg,
5,"2026 World Cup: In New York, football takes over the city where basketball is king","The North American World Cup could be on the brink of giving football its rightful place in New York City. Fields are popping up across the city, and an ever-growing number of players are starting to overshadow traditional American sports.",https://www.lemonde.fr/en/sports/article/2026/06/28/2026-world-cup-in-new-york-football-takes-over-the-city-where-basketball-is-king_6754950_9.html,,True,https://img.lemde.fr/2026/06/19/14/0/5726/3817/398/265/75/0/36601c3_ftp-1-sxafqeyspr5a-2026-06-19t192846z-237702695-up1em6j1i3xr4-rtrmadp-3-soccer-worldcup-usa-aus-fans.JPG,
6,To join the 'system' or overturn it? Far-right leader Bardella's private life and policies raise doubts,"By openly seeking to appeal to economic elites and the right, far-right leader Jordan Bardella breaks with Marine Le Pen and her father's historic 'anti-system' hostility. Some party members question his desire to pursue radical policies.",https://www.lemonde.fr/en/politics/article/2026/06/28/to-join-the-system-or-overturn-it-far-right-leader-bardella-s-private-life-and-policies-raise-doubts_6754951_5.html,Clément Guillou,True,https://img.lemde.fr/2026/06/22/1/0/8192/5461/664/442/75/0/bb25d3c_upload-1-9d9bvj70aohr-abaca-1004299-010.jpg,News analysis
7,The debate on adapting to climate change: Face 'investment wall' or pay the price of inaction?,no description,https://www.lemonde.fr/en/environment/article/2026/06/28/the-debate-on-adapting-to-climate-change-face-investment-wall-or-pay-the-price-of-inaction_6754939_114.html,,True,https://img.lemde.fr/2026/06/23/0/0/4252/2834/198/132/95/0/7b977dd_upload-1-zvyh8cnqfpdi-bavillers-034.jpg,
8,Israel government recognizes Armenian genocide in rebuke to Turkey,no description,https://www.lemonde.fr/en/international/article/2026/06/28/israel-government-recognizes-armenian-genocide-in-rebuke-to-turkey_6754948_4.html,,False,https://img.lemde.fr/2024/12/05/0/0/4102/2735/198/132/95/0/dc1a326_c26ace0b1cba4abcbb32df2ea9cb2f71-0-918fb26d42a8462c821737eb93b4f992.jpg,
9,Martin Margiela puts 200 pieces from his personal archives up for sale,no description,https://www.lemonde.fr/en/lifestyle/article/2026/06/28/martin-margiela-puts-200-pieces-from-his-personal-archives-up-for-sale_6754941_37.html,,True,https://img.lemde.fr/2026/06/18/96/0/1500/1000/198/132/95/0/71acc0a_upload-1-ac4y46udbb6l-web-770-margiela-002.jpg,
10,'I just want to know if he's still alive': The long ordeal of families searching for loved ones lost at sea,no description,https://www.lemonde.fr/en/international/article/2026/06/28/i-just-want-to-know-if-he-s-still-alive-the-long-ordeal-of-families-searching-for-loved-ones-lost-at-sea_6754938_4.html,,True,https://img.lemde.fr/2026/06/24/0/0/4200/2800/198/132/95/0/0de37b9_upload-1-4bbgxiq70cge-000-77eb8jy.jpg,
11,"'They have the same criminal mentality': One year after replacing Wagner, Russia's Africa Corps steps up abuses in Mali",no description,https://www.lemonde.fr/en/le-monde-africa/article/2026/06/27/they-have-the-same-criminal-mentality-one-year-after-replacing-wagner-russia-s-africa-corps-steps-up-abuses-in-mali_6754931_124.html,,True,,
12,Iran says US violated peace deal as both sides attack,no description,https://www.lemonde.fr/en/international/article/2026/06/28/iran-says-us-violated-peace-deal-as-both-sides-attack_6754936_4.html,,False,,
13,"From a Russian prison to a European music festival, the escape of a young anti-Putin singer",no description,https://www.lemonde.fr/en/m-le-mag/article/2026/06/27/from-a-russian-prison-to-a-european-music-festival-the-escape-of-a-young-anti-putin-singer_6754932_117.html,,True,,
14,France counts 74 drowning deaths since June 18 amid record-breaking heatwave,no description,https://www.lemonde.fr/en/international/article/2026/06/27/france-counts-74-drowning-deaths-since-june-18-amid-record-breaking-heatwave_6754934_4.html,,False,,
15,Cultural leaders rally to save French heritage under threat,no description,https://www.lemonde.fr/en/culture/article/2026/06/28/cultural-leaders-rally-to-save-french-heritage-under-threat_6754935_30.html,,True,,
16,Venezuelans call for help to rescue survivors from rubble after twin earthquakes,no description,https://www.lemonde.fr/en/international/article/2026/06/27/venezuelans-call-for-help-to-rescue-survivors-from-rubble-after-twin-earthquakes_6754928_4.html,,True,,
17,Summer brings open-air cinema to Paris,no description,https://www.lemonde.fr/en/culture/article/2026/06/28/summer-brings-open-air-cinema-to-paris_6754940_30.html,,True,,
18,"Dembélé shines at World Cup, silencing critics",no description,https://www.lemonde.fr/en/sports/article/2026/06/27/dembele-shines-at-world-cup-silencing-critics_6754927_9.html,,True,,
19,Parents outraged by lack of school guidelines during heatwave: 'We've had to scramble to make childcare arrangements',"As classroom conditions worsen, parents have tried to adapt by working from home, taking time off or relying on other adults for help. All have criticized the authorities' lack of preparation and have expressed concern for the years ahead.",https://www.lemonde.fr/en/france/article/2026/06/27/french-parents-outraged-by-lack-of-guidelines-for-schools-during-the-heatwave-we-have-had-to-scramble-to-make-childcare-arrangements_6754920_7.html,Eléa Pommiers,True,https://img.lemde.fr/2026/06/23/0/0/4252/2834/664/442/75/0/e5ef2aa_upload-1-gclsgcsu6vxt-bavillers-032.jpg,Your stories
20,"Sleeping in a cellar, waiting at a funeral home, riding the tram: How the French are improvising to survive the heatwave",Residents describe the sometimes unusual strategies they have adopted to endure the heat. Their improvised solutions highlight the shortcomings in climate change adaptation.,https://www.lemonde.fr/en/environment/article/2026/06/26/sleeping-in-a-cellar-waiting-at-a-funeral-home-riding-the-tram-how-the-french-are-improvising-to-survive-the-heatwave_6754904_114.html,Audrey Garric,True,https://img.lemde.fr/2026/06/23/0/0/5049/3366/664/442/75/0/450b612_upload-1-rvt8ooo9es4e-jlusseau-260622-le-monde-canicule-25.jpg,News
21,"In the age of AI, Chinese universities overhaul their curricula","Universities across China are undergoing a major transformation to align with the economic priorities of the Chinese government and to tackle youth unemployment. To survive, some disciplines, such as foreign languages, now have to attach themselves to hard sciences.",https://www.lemonde.fr/en/international/article/2026/06/26/in-the-age-of-ai-chinese-universities-overhaul-their-curricula_6754915_4.html,Jordan Pouille,True,https://img.lemde.fr/2026/06/19/0/19/5818/3879/664/442/75/0/60e2c46_upload-1-g3ctftz68fkz-051-xxjpbee007051-20250624-pepfn0a001.jpg,Feature
22,'Is the Gulf Persian or Arabian? Or both?',no description,https://www.lemonde.fr/en/international/article/2026/06/28/is-the-gulf-persian-or-arabian-or-both_6754946_4.html,Jean-Pierre Filiu,,https://img.lemde.fr/2023/07/31/0/0/0/0/100/100/60/0/d45bb07_1690791602941-eac5c14-1647333440018-jean-pierre-filiu-2019.jpg,Column
23,Heeding Resistance fighter Marc Bloch's warning against 'strange defeats',no description,https://www.lemonde.fr/en/opinion/article/2026/06/24/heeding-resistance-fighter-marc-bloch-s-warning-against-strange-defeats_6754836_23.html,Le Monde,False,,Editorial
24,Trumpism gains ground in Latin America,no description,https://www.lemonde.fr/en/opinion/article/2026/06/25/trumpism-gains-ground-in-latin-america_6754859_23.html,Le Monde,False,,Editorial
