,headline,description,url,byline,premium,image_url,article type
0,"After Israel-Hamas deal, international diplomacy rallies to bolster US plan",no description,https://www.lemonde.fr/en/international/article/2025/10/10/war-in-gaza-after-israel-hamas-deal-international-diplomacy-rallies-to-bolster-us-plan_6746292_4.html,,True,,
1,"In Israeli prisons, hunger and torture are ever-present",no description,https://www.lemonde.fr/en/international/article/2025/10/10/in-israeli-prisons-hunger-and-torture-are-ever-present_6746283_4.html,,True,,
2,Portland activists use humor to counter Trump's apocalyptic portrayal of the city,no description,https://www.lemonde.fr/en/international/article/2025/10/10/in-portland-activists-use-humor-to-counter-donald-trump-s-apocalyptic-portrayal-of-the-city_6746281_4.html,,True,,
3,"With the poor and migrants, Leo XIV picks up themes dear to Francis in first major text",no description,https://www.lemonde.fr/en/international/article/2025/10/09/with-the-poor-and-migrants-leo-xiv-picks-up-themes-dear-to-francis-in-first-major-text_6746272_4.html,,True,,
4,Sanctions against Russia spark rift between US and Europe over China,no description,https://www.lemonde.fr/en/international/article/2025/09/15/sanctions-against-russia-spark-rift-between-us-and-europe-over-china_6745411_4.html,,True,,
5,France's political instability puts Franco-German alliance to the test,no description,https://www.lemonde.fr/en/opinion/article/2025/08/30/france-s-political-instability-puts-franco-german-alliance-to-the-test_6744873_23.html,,False,,
6,France faces prospect of paying higher borrowing costs than Italy,no description,https://www.lemonde.fr/en/economy/article/2025/08/19/france-faces-prospect-of-paying-higher-borrowing-costs-than-italy_6744519_19.html,,True,,
7,French man arrested in Slovenia for crimes committed in Croatia during 1991 war,no description,https://www.lemonde.fr/en/international/article/2025/08/06/french-man-arrested-in-slovenia-for-crimes-committed-in-croatia-during-1991-war_6744113_4.html,,True,,
8,"France hosts Arab, Europe ministers for talks on helping Palestinians after Gaza war",no description,https://www.lemonde.fr/en/france/article/2025/10/09/france-hosts-arab-europe-ministers-for-talks-on-helping-palestinians-after-gaza-war_6746257_7.html,,False,,
9,"Robert Badinter's secret face-to-face with the guillotine, in four unseen pictures",no description,https://www.lemonde.fr/en/france/article/2025/10/09/robert-badinter-s-secret-face-to-face-with-the-guillotine-in-four-unseen-pictures_6746260_7.html,,True,,
10,"In Seine-Saint-Denis, the first residents move into the Paris 2024 Athletes' Village",no description,https://www.lemonde.fr/en/economy/article/2025/10/09/in-seine-saint-denis-the-first-residents-move-into-the-paris-2024-athletes-village_6746236_19.html,,True,,
11,"At Cédric Jubillar's trial, mother's guilt turns into damning testimony",no description,https://www.lemonde.fr/en/france/article/2025/10/08/at-cedric-jubillar-s-trial-mother-s-guilt-turns-into-damning-testimony_6746231_7.html,,True,,
12,Afghanistan: Relentless repression continues over four years into Taliban's rule,no description,https://www.lemonde.fr/en/videos/video/2025/10/04/afghanistan-relentless-repression-continues-over-four-years-into-taliban-s-rule_6746092_108.html,,False,,
13,Watch: Hundreds of thousands march in France against budget cuts,no description,https://www.lemonde.fr/en/videos/video/2025/09/19/french-strikes-watch-what-happened-as-hundreds-of-thousands-marched-against-budget-cuts_6745548_108.html,,False,,
14,Emmys 2025: 'Adolescence' star Owen Cooper becomes youngest winner for best supporting actor,no description,https://www.lemonde.fr/en/videos/video/2025/09/15/emmys-2025-adolescence-star-owen-cooper-becomes-youngest-winner-for-best-supporting-actor_6745427_108.html,,False,,
15,"From 'influence peddling' to 'corruption,' what is French Culture Minister Rachida Dati accused of?",no description,https://www.lemonde.fr/en/videos/video/2025/09/06/from-influence-peddling-to-corruption-what-is-french-culture-minister-rachida-dati-accused-of_6745094_108.html,,False,,
16,'Pope Leo XIV sends the world a directly political message with his first apostolic exhortation',no description,https://www.lemonde.fr/en/opinion/article/2025/10/10/pope-leo-xiv-sends-the-world-a-directly-political-message-with-his-first-apostolic-exhortation_6746279_23.html,,True,,
17,"Sylvie Laurent, historian: 'McCarthyism was a minor version of what is unfolding in the United States today'",no description,https://www.lemonde.fr/en/opinion/article/2025/10/10/sylvie-laurent-historian-mccarthyism-was-a-minor-version-of-what-is-unfolding-in-the-united-states-today_6746286_23.html,,True,,
18,"From Bob Dylan to Taylor Swift, the resurrection of Ophelia",no description,https://www.lemonde.fr/en/opinion/article/2025/10/10/from-bob-dylan-to-taylor-swift-the-resurrection-of-the-ophelia-myth_6746285_23.html,,True,,
19,Pension reform discontent catches up with Macron,no description,https://www.lemonde.fr/en/opinion/article/2025/10/09/pension-reform-discontent-catches-up-with-macron_6746269_23.html,,False,,
20,Matthieu Blazy: 'Just because Karl was a legend does not mean that everyone who designs for Chanel has to be one too',no description,https://www.lemonde.fr/en/m-le-mag/article/2025/10/08/chanel-s-new-face-matthieu-blazy-just-because-karl-was-a-legend-does-not-mean-that-everyone-who-designs-for-chanel-has-to-be-one-too_6746228_117.html,,True,,
21,Sweden's new list of 'cultural values' sparks controversy,no description,https://www.lemonde.fr/en/m-le-mag/article/2025/10/05/a-tool-for-integration-or-identity-politics-sweden-s-new-list-of-cultural-values-sparks-controversy_6746124_117.html,,True,,
22,The making of the Agnès b. cardigan,no description,https://www.lemonde.fr/en/m-le-mag/article/2025/10/05/the-making-of-the-agnes-b-cardigan_6746115_117.html,,True,,
23,The West Bank village of Palestine's forgotten Americans,no description,https://www.lemonde.fr/en/m-le-mag/article/2025/10/05/the-west-bank-village-of-palestine-s-forgotten-americans_6746112_117.html,,True,,
24,Five fun ways to discover Paris and its surroundings with your family,no description,https://www.lemonde.fr/en/intimacy/article/2025/10/02/five-fun-ways-to-discover-paris-and-its-surroundings-with-your-family_6745998_310.html,,True,,
25,Emma Reyes's still lifes relive in two Paris exhibitions,no description,https://www.lemonde.fr/en/culture/article/2025/09/28/emma-reyes-still-lifes-finds-new-life-in-two-paris-exhibitions_6745877_30.html,,True,,
26,Tradition done right: Five Paris restaurants reimagining the classics,no description,https://www.lemonde.fr/en/lifestyle/article/2025/09/08/tradition-done-right-five-paris-restaurants-reimagining-the-classics_6745133_37.html,,True,,
27,Paris Design Week: A 15th edition marked by abundance,no description,https://www.lemonde.fr/en/lifestyle/article/2025/09/05/paris-design-week-a-15th-edition-marked-by-abundance_6745060_37.html,,True,,
28,"After Israel-Hamas deal, international diplomacy rallies to bolster US plan","Turkey could play a major role in the stabilization force that will disarm the Palestinian movement, while France convened a conference in Paris on the 'day after.'",https://www.lemonde.fr/en/international/article/2025/10/10/war-in-gaza-after-israel-hamas-deal-international-diplomacy-rallies-to-bolster-us-plan_6746292_4.html,,True,https://img.lemde.fr/2025/10/09/0/0/5899/3933/400/266/75/0/6867294_upload-1-bijewbj2coyl-jmug251009055.jpg,
29,Nobel Peace Prize awarded to Venezuela opposition leader Maria Corina Machado,no description,https://www.lemonde.fr/en/international/article/2025/10/10/nobel-peace-prize-awarded-to-venezuela-opposition-leader-maria-corina-machado_6746295_4.html,,False,https://img.lemde.fr/2025/10/10/0/0/6499/4333/398/265/75/0/d729573_ftp-import-images-1-qgnl6xgjwpmf-2025-10-10t091219z-1547541764-rc2e6ca0xzdv-rtrmadp-3-nobel-prize-peace.JPG,
30,Macron to meet with party leaders ahead of new PM nomination,no description,https://www.lemonde.fr/en/france/article/2025/10/10/macron-to-name-new-prime-minister-amid-political-crisis_6746296_7.html,,False,https://img.lemde.fr/2025/10/09/0/0/5899/3933/398/265/75/0/4bd2bf6_upload-1-ns5armdeet4o-jmug251009030.jpg,
31,Robert Badinter enters Panthéon as France honors man who abolished guillotine,"President Emmanuel Macron hailed the former French justice minister's 'voice advocating for these great, essential and unfinished battles,' from the fight against capital punishment to the defense of human rights.",https://www.lemonde.fr/en/france/article/2025/10/09/robert-badinter-enters-the-pantheon-as-france-honors-the-man-who-ended-the-death-penalty_6746273_7.html,,False,https://img.lemde.fr/2025/10/09/0/0/5500/3666/398/265/75/0/c4f9a04_ftp-import-images-1-jrvpvg2ivggz-5124178-01-06.jpg,
32,"In Israeli prisons, hunger and torture are ever-present","Le Monde has collected the accounts of three civilians from the West Bank who were detained for months without trial or judgment and subjected to food deprivation and regular beatings. Two years after the beginning of the war against Gaza, more than 11,000 Palestinians remain incarcerated in Israel.",https://www.lemonde.fr/en/international/article/2025/10/10/in-israeli-prisons-hunger-and-torture-are-ever-present_6746283_4.html,,True,https://img.lemde.fr/2025/10/07/0/0/5760/3840/398/265/75/0/9c203e4_upload-1-3fbttmrt458a-lgeai-prisonniers-palestniens-12.jpg,
33,"From Bob Dylan to Taylor Swift, the resurrection of Ophelia","More and more female singers are reinterpreting the Shakespearean figure, drawing on her imagery but rejecting the tragic outcome of her fate.",https://www.lemonde.fr/en/opinion/article/2025/10/10/from-bob-dylan-to-taylor-swift-the-resurrection-of-the-ophelia-myth_6746285_23.html,,True,https://img.lemde.fr/2025/10/06/0/0/3778/2518/398/265/75/0/53110ae_ftp-import-images-1-zdr5zzsk2hyd-255e2aa8d2054de6a9e1937b927fcf03-0-ea6953ca38324ffea3e1b9b6bbf3043f.jpg,
34,Portland activists use humor to counter Trump's apocalyptic portrayal of the city,"Highlighting violence and 'anarchy' tied to the 'radical left,' the American president has promised to send the National Guard to the Oregon city, long known for its activism. Both local authorities and demonstrators protesting aggressive migrant expulsions have rejected this depiction.",https://www.lemonde.fr/en/international/article/2025/10/10/in-portland-activists-use-humor-to-counter-donald-trump-s-apocalyptic-portrayal-of-the-city_6746281_4.html,Arnaud Leparmentier,True,https://img.lemde.fr/2025/10/08/1/0/7361/4907/664/442/75/0/9d45fe5_upload-1-iup89ngd8qhc-705698.jpg,Feature
35,Peru lawmakers oust president accused of failing to stop crime,no description,https://www.lemonde.fr/en/international/article/2025/10/10/peru-lawmakers-oust-president-accused-of-failing-to-stop-crime_6746288_4.html,,False,https://img.lemde.fr/2025/10/10/0/0/4608/3072/198/132/95/0/2a45690_ftp-import-images-1-vz5hhjsfvg4b-2025-10-10t060145z-1087418056-rc2t8hab6pbe-rtrmadp-3-peru-politics-boluarte.JPG,
36,'Massive attack' cuts power in Ukrainian capital,no description,https://www.lemonde.fr/en/international/article/2025/10/10/massive-attack-cuts-power-in-ukrainian-capital_6746284_4.html,,False,https://img.lemde.fr/2025/10/10/0/6/6036/4024/198/132/95/0/2f5b75e_ftp-import-images-1-incstkdyfxjt-5127386-01-06.jpg,
37,"Macron looks for new prime minister, again",no description,https://www.lemonde.fr/en/politics/article/2025/10/09/macron-looks-for-new-prime-minister-again_6746259_5.html,,True,https://img.lemde.fr/2025/10/08/0/0/5799/3866/198/132/95/0/f335318_upload-1-zokzuqalmq0v-cbi1283020.jpg,
38,Robert Badinter's legacy: 'A courageous vision of political action',no description,https://www.lemonde.fr/en/politics/article/2025/10/09/robert-badinter-s-legacy-a-courageous-vision-of-political-action_6746263_5.html,,True,https://img.lemde.fr/2025/10/07/42/0/3292/2194/198/132/95/0/2e2ba24_upload-1-61kh0rglht5r-000-par7800082.jpg,
39,'Pope Leo XIV sends the world a directly political message with his first apostolic exhortation',no description,https://www.lemonde.fr/en/opinion/article/2025/10/10/pope-leo-xiv-sends-the-world-a-directly-political-message-with-his-first-apostolic-exhortation_6746279_23.html,,True,,
40,Ecuador deploys army in capital to deal with intensifying indigenous protests,no description,https://www.lemonde.fr/en/international/article/2025/10/10/ecuador-deploys-army-in-capital-to-deal-with-intensifying-indigenous-protests_6746287_4.html,,False,,
41,"With 'The Lost Bus,' the disaster film genre rises from California's ashes",no description,https://www.lemonde.fr/en/culture/article/2025/10/10/with-the-lost-bus-the-disaster-film-genre-rises-from-california-s-ashes_6746277_30.html,,True,,
42,"With the poor and migrants, Leo XIV picks up themes dear to Francis in first major text",no description,https://www.lemonde.fr/en/international/article/2025/10/09/with-the-poor-and-migrants-leo-xiv-picks-up-themes-dear-to-francis-in-first-major-text_6746272_4.html,,True,,
43,Hungarian author Laszlo Krasznahorkai awarded 2025 Nobel Prize in literature,no description,https://www.lemonde.fr/en/books/article/2025/10/09/hungarian-author-laszlo-krasznahorkai-awarded-2025-nobel-prize-in-literature_6746258_33.html,,True,,
44,Is it ever a good idea to… wear a suit to appear respectable?,no description,https://www.lemonde.fr/en/lifestyle/article/2025/10/10/is-it-ever-a-good-idea-to-wear-a-suit-to-appear-respectable_6746282_37.html,,False,,
45,"In South Korea, K-pop embraces inclusion to break taboos",no description,https://www.lemonde.fr/en/culture/article/2025/10/10/in-south-korea-k-pop-embraces-inclusion-to-break-taboos_6746276_30.html,,True,,
46,"A spa day at home, an erotic utopia to explore",no description,https://www.lemonde.fr/en/intimacy/article/2025/10/09/a-spa-day-at-home-an-erotic-utopia-to-explore_6746243_310.html,,True,,
47,"Robert Badinter's secret face-to-face with the guillotine, in four unseen pictures","Ahead of Robert Badinter's induction into France's Panthéon, one of his former aides decided to reveal photos he took in 1981. They show the man who championed the abolition of the death penalty staring down his sworn enemy, the guillotine.",https://www.lemonde.fr/en/france/article/2025/10/09/robert-badinter-s-secret-face-to-face-with-the-guillotine-in-four-unseen-pictures_6746260_7.html,Alexis de La Fontaine,True,https://img.lemde.fr/2025/10/02/1032/0/3006/2004/664/442/75/0/04067e1_upload-1-xjo4m2itjmrs-c232.jpg,Document
48,Matthieu Blazy: 'Just because Karl was a legend does not mean that everyone who designs for Chanel has to be one too',"The anticipation was overwhelming. But on Monday, the first show by Chanel's new artistic director under the glass roof of the Grand Palais lived up to all expectations. With his impeccable CV and strong personality, the 41-year-old designer has written the first page of a new chapter for the fashion house. His mission? To usher it into a new era without losing its soul.",https://www.lemonde.fr/en/m-le-mag/article/2025/10/08/chanel-s-new-face-matthieu-blazy-just-because-karl-was-a-legend-does-not-mean-that-everyone-who-designs-for-chanel-has-to-be-one-too_6746228_117.html,Caroline Rousseau,True,https://img.lemde.fr/2025/10/07/1047/0/2953/1968/664/442/75/0/478d01d_upload-1-judlpxmqg4ht-20250915-s8a6409-a4.JPG,Profile
49,"Two years after October 7, many French Jews have chosen silence: 'We're made to feel that we're on the wrong side'","Since the Hamas terrorist attack in Israel, faced with an 'outside world' perceived as hostile or incapable of understanding them, many Jews have chosen to avoid discussing current events and say they are tempted to withdraw from society.",https://www.lemonde.fr/en/france/article/2025/10/07/two-years-after-october-7-many-french-jews-have-chosen-silence-we-re-made-to-feel-that-we-re-on-the-wrong-side_6746193_7.html,Benoît Vitkine and  Louise Couvelaire,True,https://img.lemde.fr/2025/10/04/0/0/5500/3666/664/442/75/0/7606976_upload-1-25ondvbuorfw-000-36yf6r2.jpg,Your stories
50,Pension reform discontent catches up with Macron,no description,https://www.lemonde.fr/en/opinion/article/2025/10/09/pension-reform-discontent-catches-up-with-macron_6746269_23.html,Le Monde,False,,Editorial
51,Michel Barnier: 'Robert Badinter strove to bring the Republic ever closer to its ideal',no description,https://www.lemonde.fr/en/opinion/article/2025/10/09/michel-barnier-robert-badinter-strove-to-bring-the-republic-ever-closer-to-its-ideal_6746267_23.html,Michel Barnier,,,Op-Ed
52,"Sylvie Laurent, historian: 'McCarthyism was a minor version of what is unfolding in the United States today'",no description,https://www.lemonde.fr/en/opinion/article/2025/10/10/sylvie-laurent-historian-mccarthyism-was-a-minor-version-of-what-is-unfolding-in-the-united-states-today_6746286_23.html,Sylvie Laurent,,,Op-Ed
