,headline,description,url,byline,premium,image_url,article type
0,A luxury of challenges for Luca de Meo at Kering,no description,https://www.lemonde.fr/en/economy/article/2025/06/17/a-luxury-of-challenges-for-luca-de-meo-at-kering_6742413_19.html,,True,,
1,"In Belgium, the dual face of the French fry champions",no description,https://www.lemonde.fr/en/international/article/2025/06/17/in-belgium-the-dual-face-of-the-french-fry-champions_6742409_4.html,,True,,
2,"In the United Kingdom, the government has reversed course and is launching a national inquiry into 'grooming gangs'",no description,https://www.lemonde.fr/en/international/article/2025/06/17/in-the-united-kingdom-the-government-has-reversed-course-and-is-launching-a-national-inquiry-into-grooming-gangs_6742406_4.html,,True,,
3,Trump's messianic allies lead the charge against Gaza,no description,https://www.lemonde.fr/en/international/article/2025/06/16/trump-s-messianic-allies-lead-the-charge-against-gaza_6742393_4.html,,True,,
4,How the US divided Europe to invade Iraq at any cost in 2003,no description,https://www.lemonde.fr/en/history/article/2025/06/16/how-the-us-split-europe-to-invade-iraq-at-any-cost-in-2003_6742380_157.html,,True,,
5,"Criticism is mounting in the Netherlands against Geert Wilders, who brought down the government",no description,https://www.lemonde.fr/en/international/article/2025/06/04/in-the-netherlands-criticism-is-mounting-against-geert-wilders-who-triggered-the-fall-of-the-government_6741987_4.html,,True,,
6,"Five years after Brexit, UK and EU aim for a fresh start",no description,https://www.lemonde.fr/en/international/article/2025/05/19/five-years-after-brexit-uk-and-eu-aim-for-a-fresh-start_6741415_4.html,,True,,
7,"In Lithuania, the fear of war with Russia lurks just around the corner",no description,https://www.lemonde.fr/en/international/article/2025/05/18/in-lithuania-the-fear-of-war-with-russia-lurks-just-around-the-corner_6741400_4.html,,True,,
8,"The son's suicide, the father's murder and the tormented killer",no description,https://www.lemonde.fr/en/france/article/2025/06/16/the-son-s-suicide-the-father-s-murder-and-the-tormented-killer_6742398_7.html,,True,,
9,Paris Air Show opens amid tense geopolitical context,no description,https://www.lemonde.fr/en/economy/article/2025/06/16/paris-air-show-opens-amid-tense-geopolitical-context_6742379_19.html,,True,,
10,"At Paris protest in support of Gaza, anger and fear run high",no description,https://www.lemonde.fr/en/france/article/2025/06/15/at-paris-protest-in-support-of-gaza-anger-and-fear-run-high_6742365_7.html,,True,,
11,Sarkozy stripped of Legion of Honor,no description,https://www.lemonde.fr/en/france/article/2025/06/15/former-french-president-nicolas-sarkozy-stripped-of-the-legion-of-honor_6742357_7.html,,False,,
12,What is France's 'Black code' and why hasn't it been repealed?,no description,https://www.lemonde.fr/en/videos/video/2025/05/31/what-is-france-s-black-code-and-why-hasn-t-it-been-repealed_6741860_108.html,,False,,
13,How was the European Union created?,no description,https://www.lemonde.fr/en/videos/video/2025/05/29/how-was-the-european-union-created_6741795_108.html,,False,,
14,Glide bombs: Russia's secret to making cheap weapons,no description,https://www.lemonde.fr/en/videos/video/2025/05/25/glide-bombs-russia-s-secret-to-making-cheap-weapons_6741646_108.html,,True,,
15,How does the conclave pick the new pope?,no description,https://www.lemonde.fr/en/videos/video/2025/05/07/how-does-the-conclave-pick-the-new-pope_6741005_108.html,,False,,
16,"At the G7, it's Trump against the rest, in a chaotic world",no description,https://www.lemonde.fr/en/opinion/article/2025/06/16/at-the-g7-it-s-trump-against-the-rest-in-a-chaotic-world_6742384_23.html,,False,,
17,Kurdish integration offers hope for Syria's reconstruction,no description,https://www.lemonde.fr/en/opinion/article/2025/06/17/kurdish-integration-offers-hope-for-syria-s-reconstruction_6742411_23.html,,True,,
18,"'On the budget, Donald Trump's obsession consists of fulfilling impossible campaign promises'",no description,https://www.lemonde.fr/en/opinion/article/2025/06/16/on-the-budget-donald-trump-s-obsession-consists-of-fulfilling-impossible-campaign-promises_6742401_23.html,,True,,
19,Israel-Iran: 'This conflict poses a dire threat to the very foundations of human civilization',no description,https://www.lemonde.fr/en/opinion/article/2025/06/16/israel-iran-this-conflict-poses-a-grave-threat-to-the-very-foundations-of-human-civilization_6742387_23.html,,True,,
20,"On the Canadian side of lake Ontario, a new identity emerges in the shadow of Trump",no description,https://www.lemonde.fr/en/m-le-mag/article/2025/06/15/on-the-canadian-side-of-lake-ontario-a-new-identity-emerges-in-the-shadow-of-trump_6742361_117.html,,True,,
21,"Kazakhstan families search for clues about the 270,000 'missing soldiers' of the World War II Soviet Army",no description,https://www.lemonde.fr/en/m-le-mag/article/2025/06/15/kazakhstan-families-search-for-clues-about-the-270-000-missing-soldiers-of-the-world-war-ii-soviet-army_6742352_117.html,,True,,
22,Maria Grazia Chiuri's final bow at home in Rome,no description,https://www.lemonde.fr/en/m-le-mag/article/2025/06/13/in-rome-maria-grazia-chiuri-s-final-bow_6742321_117.html,,True,,
23,"The life and death of Julie, 21, swept up in the spiral of social media",no description,https://www.lemonde.fr/en/m-le-mag/article/2025/06/11/the-life-and-death-of-julie-21-swept-up-in-the-spiral-of-social-media_6742255_117.html,,True,,
24,Paris exhibition tries to answer the mystery of Cleopatra,no description,https://www.lemonde.fr/en/culture/article/2025/06/12/paris-exhibition-tries-to-answer-the-mystery-of-cleopatra_6742287_30.html,,True,,
25,"Forget the jambon-beurre, try these five delicious banh mi sandwiches in Paris",no description,https://www.lemonde.fr/en/lifestyle/article/2025/06/06/forget-the-jambon-beurre-try-these-five-delicious-banh-mi-sandwiches-in-paris_6742068_37.html,,True,,
26,"Gabriele Münter, a framing prodigy, emerges from the shadows in new Paris show",no description,https://www.lemonde.fr/en/culture/article/2025/06/04/at-the-musee-d-art-moderne-de-paris-gabriele-munter-a-framing-prodigy-has-emerged-from-the-shadows_6741982_30.html,,True,,
27,How artists dress: A work of art in itself,no description,https://www.lemonde.fr/en/culture/article/2025/05/30/how-artists-dress-a-work-of-art-in-itself_6741825_30.html,,True,,
28,The French students rethinking their US plans: 'Trump as president is just too unpredictable',"While France is not among the countries directly targeted by the American administration, many students are concerned about the climate of uncertainty created by Donald Trump's announcements.",https://www.lemonde.fr/en/campus/article/2025/06/17/the-french-students-rethinking-their-us-plans-trump-as-president-is-just-too-unpredictable_6742412_11.html,,True,https://img.lemde.fr/2025/06/16/0/0/3000/2000/400/266/75/0/0ee9bc2_upload-1-qgmjczzkveby-trump-vs-ei-tudiants-ei-trangers.jpg,
29,Netanyahu suggests killing Iran's supreme leader would end conflict,no description,https://www.lemonde.fr/en/international/article/2025/06/16/netanyahu-suggests-killing-iran-s-supreme-leader-would-end-conflict_6742402_4.html,,False,https://img.lemde.fr/2025/06/15/0/0/4926/3284/398/265/75/0/f888bfd_ftp-import-images-1-iyxam23u2o7i-729376edd1b04a15b7d59999dd17d6ce-0-24715242937940e186f09107938ac5e7.jpg,
30,Trump departs G7 early as conflict between Israel and Iran shows signs of intensifying,no description,https://www.lemonde.fr/en/international/article/2025/06/17/trump-departing-g7-early-as-conflict-between-israel-and-iran-shows-signs-of-intensifying_6742407_4.html,,False,https://img.lemde.fr/2025/06/16/109/0/6500/4333/398/265/75/0/b6338c8_ftp-import-images-1-xyq5i3cmlygi-c7421ff6b51b4b1c9f1795da9d24b6d5-0-5b2c2f0b1cad4652aa46faada312e440.jpg,
31,"In the United Kingdom, the government has reversed course and is launching a national inquiry into 'grooming gangs'","After a damning audit by a senior civil servant, Prime Minister Keir Starmer confirmed that the networks of sexual predators who operated for decades in the United Kingdom would be subject to a public inquiry.",https://www.lemonde.fr/en/international/article/2025/06/17/in-the-united-kingdom-the-government-has-reversed-course-and-is-launching-a-national-inquiry-into-grooming-gangs_6742406_4.html,,True,https://img.lemde.fr/2025/06/16/0/0/5500/3666/398/265/75/0/118db99_ftp-import-images-1-7nkp6kalcwph-3bc57db246764179aa20ba0c9db84691-0-440c6f3a29a54564bdc8ac683fc4c324.jpg,
32,Kurdish integration offers hope for Syria's reconstruction,"The country's restored unity, fractured by autonomy demands, will depend on the success of the process, with a deadline set for the end of the year.",https://www.lemonde.fr/en/opinion/article/2025/06/17/kurdish-integration-offers-hope-for-syria-s-reconstruction_6742411_23.html,,True,https://img.lemde.fr/2025/06/14/0/101/1077/718/398/265/75/0/6522b32_upload-1-1yz9cvw7oupy-000-36zp82t.jpg,
33,"In Belgium, the dual face of the French fry champions","The global appetite for 'french fries' has enabled Belgian companies to build industrial empires, but often at the cost of deteriorating working conditions and significant environmental impact.",https://www.lemonde.fr/en/international/article/2025/06/17/in-belgium-the-dual-face-of-the-french-fry-champions_6742409_4.html,,True,https://img.lemde.fr/2025/06/15/1799/0/2857/1904/398/265/75/0/744e34a_upload-1-rbtqz1hnx7fd-000-36yp9tj.jpg,
34,The failure of Obama's 'leading from behind' in Libya,"'The Transatlantic Divorce' (2/5). Elected on the promise of no longer sending American troops to the Middle East, President Barack Obama allowed France and the UK to lead the Libyan operation, which resulted in Muammar Gaddafi's fall. He emerged deeply frustrated by the shortcomings of his European allies.",https://www.lemonde.fr/en/history/article/2025/06/17/the-failure-of-obama-s-leading-from-behind-in-libya_6742410_157.html,Sylvie Kauffmann,True,https://img.lemde.fr/2025/06/16/1889/0/2323/1548/664/442/75/0/c4c2373_upload-1-bkbbzny44sqs-2011-08-23t120000z-1150375806-gm1e78n0qig01-rtrmadp-3-libya.JPG,Long Read
35,Vaccine experts fired by Trump administration 'deeply concerned' by Robert F. Kennedy Jr,no description,https://www.lemonde.fr/en/health/article/2025/06/17/vaccine-experts-fired-by-trump-administration-deeply-concerned-by-robert-f-kennedy-jr_6742408_14.html,,False,https://img.lemde.fr/2025/06/12/0/0/5869/3912/198/132/95/0/d24edc3_ftp-import-images-1-i2jcxw78qtpe-32ed806b100e4e609d1a4db90757d646-0-ccabb16ffd714b07aca054759ab793a2.jpg,
36,"At the Paris Air Show, Airbus secures a wave of Saudi orders",no description,https://www.lemonde.fr/en/economy/article/2025/06/17/at-the-paris-air-show-airbus-secures-a-wave-of-saudi-orders_6742405_19.html,,True,https://img.lemde.fr/2025/06/16/0/0/6000/4000/198/132/95/0/b8308e7_upload-1-7ymzi1jic1ff-870867.jpg,
37,"WhatsApp boss: Meta AI doesn't see your conversations, 'only the messages you send it'",no description,https://www.lemonde.fr/en/pixels/article/2025/06/16/whatsapp-boss-meta-ai-doesn-t-see-your-conversations-only-the-messages-you-send-it_6742395_13.html,,True,https://img.lemde.fr/2025/04/25/0/0/3000/2000/198/132/95/0/4311318_sirius-fs-upload-1-mqfyyznx6tpu-1745576533914-ws-pixels.jpg,
38,France shuts five Israeli booths at Paris Air Show for showcasing 'offensive weapons',no description,https://www.lemonde.fr/en/economy/article/2025/06/16/france-shuts-down-israeli-booths-at-paris-air-show-for-showcasing-offensive-weapons_6742391_19.html,,False,https://img.lemde.fr/2025/06/16/0/0/5889/3926/198/132/95/0/1b0e575_ftp-import-images-1-rgcfavsgr0t2-2025-06-16t103328z-739515023-rc2l3faecg0u-rtrmadp-3-france-airshow-israel.JPG,
39,"'On the budget, Donald Trump's obsession consists of fulfilling impossible campaign promises'",no description,https://www.lemonde.fr/en/opinion/article/2025/06/16/on-the-budget-donald-trump-s-obsession-consists-of-fulfilling-impossible-campaign-promises_6742401_23.html,,True,,
40,"Israel, under fire from Iranian missiles, comes to standstill",no description,https://www.lemonde.fr/en/international/article/2025/06/16/israel-under-fire-from-iranian-missiles-comes-to-standstill_6742389_4.html,,True,,
41,Poland delivers Trump his first electoral victory in Europe,no description,https://www.lemonde.fr/en/opinion/article/2025/06/16/poland-delivers-trump-his-first-electoral-victory-in-europe_6742374_23.html,,True,,
42,Israeli strikes on Iranian oil and gas sites plunge markets into uncertainty,no description,https://www.lemonde.fr/en/international/article/2025/06/16/israeli-strikes-on-iranian-oil-and-gas-sites-plunge-markets-into-uncertainty_6742390_4.html,,True,,
43,The young professionals taking their parents' experiences to heart and changing how they work,no description,https://www.lemonde.fr/en/campus/article/2025/06/16/the-young-professionals-taking-their-parents-experiences-to-heart-and-changing-how-they-work_6742373_11.html,,True,,
44,"NAACP won't invite Trump to its national convention, the first president to be excluded in 116 years",no description,https://www.lemonde.fr/en/international/article/2025/06/16/naacp-won-t-invite-trump-to-its-national-convention-he-will-be-1st-president-excluded-in-116-years_6742404_4.html,,False,,
45,Macron warms up for G7 with Greenland visit,no description,https://www.lemonde.fr/en/international/article/2025/06/16/macron-warms-up-for-g7-with-greenland-visit_6742382_4.html,,True,,
46,Trump's messianic allies lead the charge against Gaza,no description,https://www.lemonde.fr/en/international/article/2025/06/16/trump-s-messianic-allies-lead-the-charge-against-gaza_6742393_4.html,,True,,
47,"Iran, struck throughout by Israel, faces chaos","In addition to targeting the Islamic Republic's military and nuclear facilities, Israel has struck economic sites, police stations and ministries, hoping to throw the country into disarray.",https://www.lemonde.fr/en/international/article/2025/06/16/iran-struck-throughout-by-israel-faces-chaos_6742385_4.html,Ghazal Golshiri and  Madjid Zerrouky,True,https://img.lemde.fr/2025/06/15/171/0/4096/2730/664/442/75/0/d3a787b_upload-1-hm9kaubjzkmp-020-2219495862.jpg,News
48,"On the Canadian side of lake Ontario, a new identity emerges in the shadow of Trump","Straddling the border between Canada and the US, Lake Ontario has long served as a model for the harmonious management of a shared space. But Donald Trump's declarations undermine that balance.",https://www.lemonde.fr/en/m-le-mag/article/2025/06/15/on-the-canadian-side-of-lake-ontario-a-new-identity-emerges-in-the-shadow-of-trump_6742361_117.html,Eliott Dumoulin,True,https://img.lemde.fr/2025/05/28/250/0/1500/1000/664/442/75/0/12e67b9_ftp-import-images-1-gsveaohjspcy-383807-3424387.jpg,Feature
49,'Netanyahu called Trump's bluff' by striking Iran,"In an interview with Le Monde, Kamala Harris's former national security adviser criticizes the concept of 'peace through strength' that underpins current American foreign policy. He also acknowledges the Biden administration's mistakes, particularly in the war in Gaza.",https://www.lemonde.fr/en/international/article/2025/06/14/philip-gordon-former-kamala-harris-adviser-netanyahu-called-trump-s-bluff-by-striking-iran_6742341_4.html,Piotr Smolar,True,https://img.lemde.fr/2025/06/12/0/0/6000/4000/664/442/75/0/163dfab_upload-1-o7e71rcm7sck-000-34yp7f4.jpg,Interview
50,Israel-Iran: 'This conflict poses a dire threat to the very foundations of human civilization',no description,https://www.lemonde.fr/en/opinion/article/2025/06/16/israel-iran-this-conflict-poses-a-grave-threat-to-the-very-foundations-of-human-civilization_6742387_23.html,Group letter,,,Op-Ed
51,"At the G7, it's Trump against the rest, in a chaotic world",no description,https://www.lemonde.fr/en/opinion/article/2025/06/16/at-the-g7-it-s-trump-against-the-rest-in-a-chaotic-world_6742384_23.html,Le Monde,False,,Editorial
52,Israel's war in Iran: The choice of war and its risks,no description,https://www.lemonde.fr/en/opinion/article/2025/06/14/israel-s-war-in-iran-the-choice-of-war-and-its-risks_6742338_23.html,Le Monde,False,,Editorial
