,headline,description,url,byline,premium,image_url,article type
0,Denmark is unsettled by a wave of drone incursions,no description,https://www.lemonde.fr/en/international/article/2025/09/27/denmark-is-unsettled-by-a-wave-of-drone-incursions_6745790_4.html,,True,,
1,UN Security Council rejects Russia and China's last-ditch effort to delay sanctions on Iran,no description,https://www.lemonde.fr/en/international/article/2025/09/27/un-security-council-rejects-russia-and-china-s-last-ditch-effort-to-delay-sanctions-on-iran_6745789_4.html,,False,,
2,"Isolated at the UN, Netanyahu defies the international community",no description,https://www.lemonde.fr/en/international/article/2025/09/27/isolated-at-the-un-netanyahu-defies-the-international-community_6745788_4.html,,True,,
3,"Zohran Mamdani, the 'socialist' symbolizing Democratic voters' revolt",no description,https://www.lemonde.fr/en/international/article/2025/09/26/zohran-mamdani-the-socialist-symbolizing-democratic-voters-revolt_6745785_4.html,,True,,
4,Sanctions against Russia spark rift between US and Europe over China,no description,https://www.lemonde.fr/en/international/article/2025/09/15/sanctions-against-russia-spark-rift-between-us-and-europe-over-china_6745411_4.html,,True,,
5,France's political instability puts Franco-German alliance to the test,no description,https://www.lemonde.fr/en/opinion/article/2025/08/30/france-s-political-instability-puts-franco-german-alliance-to-the-test_6744873_23.html,,False,,
6,France faces prospect of paying higher borrowing costs than Italy,no description,https://www.lemonde.fr/en/economy/article/2025/08/19/france-faces-prospect-of-paying-higher-borrowing-costs-than-italy_6744519_19.html,,True,,
7,French man arrested in Slovenia for crimes committed in Croatia during 1991 war,no description,https://www.lemonde.fr/en/international/article/2025/08/06/french-man-arrested-in-slovenia-for-crimes-committed-in-croatia-during-1991-war_6744113_4.html,,True,,
8,The day Sarkozy learned he was going to prison,no description,https://www.lemonde.fr/en/france/article/2025/09/26/the-day-sarkozy-learned-he-was-going-to-prison_6745758_7.html,,True,,
9,"Excerpt from the decision convicting Sarkozy: 'Acts of exceptional seriousness, likely to undermine citizens' trust'",no description,https://www.lemonde.fr/en/france/article/2025/09/26/excerpt-from-the-decision-in-sarkozy-s-conviction-acts-of-exceptional-seriousness-likely-to-undermine-citizens-trust_6745782_7.html,,True,,
10,French conservatives outraged at Sarkozy's prison sentence,no description,https://www.lemonde.fr/en/france/article/2025/09/25/french-conservatives-outraged-at-sarkozy-s-prison-sentence_6745744_7.html,,True,,
11,Sarkozy's other legal battlefield: Qatar,no description,https://www.lemonde.fr/en/france/article/2025/09/25/sarkozy-s-other-legal-battlefield-qatar_6745741_7.html,,True,,
12,Watch: Hundreds of thousands march in France against budget cuts,no description,https://www.lemonde.fr/en/videos/video/2025/09/19/french-strikes-watch-what-happened-as-hundreds-of-thousands-marched-against-budget-cuts_6745548_108.html,,False,,
13,Emmys 2025: 'Adolescence' star Owen Cooper becomes youngest winner for best supporting actor,no description,https://www.lemonde.fr/en/videos/video/2025/09/15/emmys-2025-adolescence-star-owen-cooper-becomes-youngest-winner-for-best-supporting-actor_6745427_108.html,,False,,
14,"From 'influence peddling' to 'corruption,' what is French Culture Minister Rachida Dati accused of?",no description,https://www.lemonde.fr/en/videos/video/2025/09/06/from-influence-peddling-to-corruption-what-is-french-culture-minister-rachida-dati-accused-of_6745094_108.html,,False,,
15,Watch: Tsunami warnings sound in Japan after 8.8 magnitude quake off Russian coast,no description,https://www.lemonde.fr/en/videos/video/2025/07/30/watch-tsunami-warnings-sound-in-japan-after-8-8-magnitude-quake-off-russian-coast_6743900_108.html,,False,,
16,"'In Sudan, it is as if a congenital curse is at work. And the worst is yet to come'",no description,https://www.lemonde.fr/en/opinion/article/2025/09/26/in-sudan-it-is-as-if-a-congenital-curse-is-at-work-and-the-worst-is-yet-to-come_6745757_23.html,,True,,
17,'To frame Kirk's death as escalation misses the truth. The real threat is normalization',no description,https://www.lemonde.fr/en/opinion/article/2025/09/26/to-frame-kirk-s-death-as-escalation-misses-the-truth-the-real-threat-is-normalization_6745775_23.html,,True,,
18,'Israel's isolation is the price of pursuing a war in Gaza without clear objectives',no description,https://www.lemonde.fr/en/opinion/article/2025/09/26/israel-s-isolation-is-the-price-of-pursuing-a-war-in-gaza-without-clear-objectives_6745764_23.html,,True,,
19,Sarkozy conviction: No one is above the law,no description,https://www.lemonde.fr/en/opinion/article/2025/09/26/sarkozy-conviction-no-one-is-above-the-law_6745763_23.html,,False,,
20,"Vivian Jenna Wilson, Elon Musk's transgender daughter, has become a New York Fashion Week sensation",no description,https://www.lemonde.fr/en/m-le-mag/article/2025/09/24/vivian-jenna-wilson-elon-musk-s-transgender-daughter-has-become-a-new-york-fashion-week-sensation_6745690_117.html,,True,,
21,Historian Tal Bruttmann's sharp eye on the Holocaust,no description,https://www.lemonde.fr/en/m-le-mag/article/2025/09/21/historian-tal-bruttmann-s-sharp-eye-on-the-holocaust_6745597_117.html,,True,,
22,The silent and destructive spread of laughing gas: 'That shit took my whole life',no description,https://www.lemonde.fr/en/m-le-mag/article/2025/09/20/the-silent-and-destructive-spread-of-laughing-gas-that-shit-took-my-whole-life_6745588_117.html,,True,,
23,"For the 250th anniversary of Jane Austen's birth, take a trip into the world of her superfans",no description,https://www.lemonde.fr/en/m-le-mag/article/2025/09/20/on-the-250th-anniversary-of-jane-austen-s-birth-take-a-trip-into-the-world-of-the-english-novelist-s-superfans_6745580_117.html,,True,,
24,Tradition done right: Five Paris restaurants reimagining the classics,no description,https://www.lemonde.fr/en/lifestyle/article/2025/09/08/tradition-done-right-five-paris-restaurants-reimagining-the-classics_6745133_37.html,,True,,
25,Paris Design Week: A 15th edition marked by abundance,no description,https://www.lemonde.fr/en/lifestyle/article/2025/09/05/paris-design-week-a-15th-edition-marked-by-abundance_6745060_37.html,,True,,
26,It's pain suisse time! Five places in and around Paris to find this treat,no description,https://www.lemonde.fr/en/lifestyle/article/2025/09/04/it-s-pain-suisse-time-five-places-in-the-paris-region-to-find-this-treat_6745022_37.html,,True,,
27,"At Musée d'Orsay, a Courbet painting gets a new life before visitors' eyes",no description,https://www.lemonde.fr/en/culture/article/2025/07/26/at-musee-d-orsay-a-courbet-painting-gets-a-new-life-before-visitors-eyes_6743744_30.html,,True,,
28,"Zohran Mamdani, the 'socialist' symbolizing Democratic voters' revolt",The young Democrat leading in the polls ahead of the New York City mayoral election does not enjoy unanimous support within his own party.,https://www.lemonde.fr/en/international/article/2025/09/26/zohran-mamdani-the-socialist-symbolizing-democratic-voters-revolt_6745785_4.html,,True,https://img.lemde.fr/2025/09/25/0/48/3903/2602/400/266/75/0/f97980b_upload-1-xlxfi6lprdqi-2025-09-20t130147z-634688706-mt1sipa000pd0c3x-rtrmadp-3-sipa-usa.JPG,
29,"Isolated at the UN, Netanyahu defies the international community",no description,https://www.lemonde.fr/en/international/article/2025/09/27/isolated-at-the-un-netanyahu-defies-the-international-community_6745788_4.html,,True,https://img.lemde.fr/2025/09/26/1/0/8192/5461/398/265/75/0/b1ec427_ftp-import-images-1-0t113b7h69tl-2025-09-26t132321z-2128764514-rc2pzgam30ir-rtrmadp-3-un-assembly.JPG,
30,Denmark is unsettled by a wave of drone incursions,no description,https://www.lemonde.fr/en/international/article/2025/09/27/denmark-is-unsettled-by-a-wave-of-drone-incursions_6745790_4.html,,True,https://img.lemde.fr/2025/09/25/0/0/4752/3168/398/265/75/0/d7874b5_ftp-import-images-1-xxgyc0hswlxa-2025-09-25t084716z-92357533-rc2vygae4n83-rtrmadp-3-denmark-airport-drones.JPG,
31,UN Security Council rejects Russia and China's last-ditch effort to delay sanctions on Iran,"Barring an eleventh-hour deal, the reinstatement of sanctions – triggered by Britain, France and Germany – will once again freeze Iranian assets abroad, halt arms deals with Tehran and penalize any development of Iran's ballistic missile program, among other measures.",https://www.lemonde.fr/en/international/article/2025/09/27/un-security-council-rejects-russia-and-china-s-last-ditch-effort-to-delay-sanctions-on-iran_6745789_4.html,,False,https://img.lemde.fr/2025/09/26/0/0/6000/4000/398/265/75/0/5e0a649_ftp-import-images-1-y7wkom0zcwpz-2025-09-26t193441z-183829308-rc2vzgazxoic-rtrmadp-3-iran-nuclear-un.JPG,
32,Kimmel boycott ends as Sinclair and Nexstar put the late-night comedian back on the air,"'Jimmy Kimmel Live!' was temporarily pulled off the air after comments the comedian made in the wake of the murder of right-wing activist Charlie Kirk. After a public outcry over freedom of speech, ABC reversed course on Tuesday. Sinclair and Nexstar, which each own dozens of ABC-affiliated channels, followed suit on Friday.",https://www.lemonde.fr/en/international/article/2025/09/27/kimmel-boycott-ends-as-sinclair-and-nexstar-put-the-late-night-comedian-back-on-the-air_6745791_4.html,,False,https://img.lemde.fr/2025/09/26/0/1/3604/2403/398/265/75/0/2d2ce4f_ftp-import-images-1-kjxecnrcfgfg-5004076-01-06.jpg,
33,'To frame Kirk's death as escalation misses the truth. The real threat is normalization',"British geographer Clionadh Raleigh examines the consequences of the assassination of the conservative influencer. By dismissing the fact that the man charged with this murder is a 'lone wolf' and accusing the left, the Trump administration is paving the way for more violence, she says.",https://www.lemonde.fr/en/opinion/article/2025/09/26/to-frame-kirk-s-death-as-escalation-misses-the-truth-the-real-threat-is-normalization_6745775_23.html,,True,https://img.lemde.fr/2025/06/13/0/0/3000/2000/398/265/75/0/91aa791_upload-1-voro8yttjgp8-frame-1192.jpg,
34,"Excerpt from the decision convicting Sarkozy: 'Acts of exceptional seriousness, likely to undermine citizens' trust'",Former French president Nicolas Sarkozy was found guilty of criminal conspiracy in the case of alleged Libyan financing of his 2007 presidential campaign. Here is part of the court's decision.,https://www.lemonde.fr/en/france/article/2025/09/26/excerpt-from-the-decision-in-sarkozy-s-conviction-acts-of-exceptional-seriousness-likely-to-undermine-citizens-trust_6745782_7.html,Franck Johannès,True,https://img.lemde.fr/2025/09/25/0/0/7626/5084/664/442/75/0/bf7d696_ftp-import-images-1-eznqiltdd1fn-9525c62e50464b218c2664bb100eef9a-1-20bc055123944624957edb5d9eb79523.jpg,In Depth
35,French court jails three women who joined IS in Syria,no description,https://www.lemonde.fr/en/international/article/2025/09/26/french-court-jails-three-women-who-joined-is-in-syria_6745787_4.html,,False,https://img.lemde.fr/2022/09/16/0/0/4351/2900/198/132/95/0/df0a25b_1663341360054-000-9mf27h.jpg,
36,Sarkozy's conviction: Five questions about what happens next,no description,https://www.lemonde.fr/en/les-decodeurs/article/2025/09/26/sarkozy-s-conviction-five-questions-about-what-happens-next_6745771_8.html,,False,https://img.lemde.fr/2025/09/26/0/2/4749/3166/198/132/95/0/a1c8438_upload-1-uijl12ayjclz-915865.jpg,
37,'Israel's isolation is the price of pursuing a war in Gaza without clear objectives',no description,https://www.lemonde.fr/en/opinion/article/2025/09/26/israel-s-isolation-is-the-price-of-pursuing-a-war-in-gaza-without-clear-objectives_6745764_23.html,,True,https://img.lemde.fr/2025/09/22/0/0/3289/2193/198/132/95/0/693c788_ftp-import-images-1-xft5p1zcmrsq-5966381-01-06.jpg,
38,"French PM vows new government early October, says an austerity budget is 'out of the question'",no description,https://www.lemonde.fr/en/france/article/2025/09/26/french-pm-vows-new-government-early-october-says-an-austerity-budget-is-out-of-the-question_6745786_7.html,,False,https://img.lemde.fr/2025/09/17/0/0/2320/1547/198/132/95/0/364f9aa_ftp-import-images-1-agk51pawvjkd-2025-09-17t150052z-762650448-rc2zoga37ugu-rtrmadp-3-france-politics-tax.JPG,
39,Madagascar: At least five killed in unprecedented protests,no description,https://www.lemonde.fr/en/le-monde-africa/article/2025/09/26/madagascar-at-least-five-killed-after-unprecedented-protests_6745772_124.html,,True,,
40,EU accelerates 'drone wall' plans after Russian incursions,no description,https://www.lemonde.fr/en/russia/article/2025/09/26/eu-accelerates-drone-wall-plans-after-russian-incursions_6745783_140.html,,False,,
41,A troubling surge of anti-Ukrainian xenophobia in Poland,no description,https://www.lemonde.fr/en/international/article/2025/09/26/in-poland-a-troubling-surge-in-anti-ukrainian-xenophobia_6745755_4.html,,True,,
42,"Iran and Russia sign $25-billion deal to build nuclear power plants, state media says",no description,https://www.lemonde.fr/en/international/article/2025/09/26/iran-and-russia-sign-25-billion-deal-to-build-nuclear-power-plants-state-media-says_6745774_4.html,,False,,
43,A Turkish feminist activist removes the hijab she had worn for decades,no description,https://www.lemonde.fr/en/international/article/2025/09/26/in-turkey-a-feminist-activist-removes-the-hijab-she-wore-for-decades_6745756_4.html,,True,,
44,Why Netanyahu's plane avoided French airspace,no description,https://www.lemonde.fr/en/international/article/2025/09/26/why-netanyahu-s-plane-avoided-french-airspace_6745773_4.html,,True,,
45,Lyon removes Palestinian flag after French court order,no description,https://www.lemonde.fr/en/france/article/2025/09/26/lyon-removes-palestinian-flag-after-french-court-order_6745762_7.html,,False,,
46,"Paris's Mausolée, once a clandestine graffiti residence, now opens its doors to the public",no description,https://www.lemonde.fr/en/culture/article/2025/09/26/in-paris-the-mausolee-formerly-a-clandestine-graffiti-residence-opens-its-doors-to-the-public_6745754_30.html,,True,,
47,The day Sarkozy learned he was going to prison,"Nicolas Sarkozy will become the first former president of the French Republic to sleep behind bars after being convicted of criminal conspiracy, in the case of alleged Libyan financing of his 2007 presidential campaign.",https://www.lemonde.fr/en/france/article/2025/09/26/the-day-sarkozy-learned-he-was-going-to-prison_6745758_7.html,Franck Johannès,True,https://img.lemde.fr/2025/09/25/0/0/2503/1668/664/442/75/0/06b3cdb_ftp-import-images-1-4sy7ltjml1k2-97d221d144ef49f6b9a8ae3f4604c3f0-1-63b8023f79f14f098444069a1704210e.jpg,News
48,"Alexus Grynkewich, top NATO commander in Europe: 'Russia has always tried to maneuver for advantage over the alliance'","As the repercussions of the war in Ukraine increasingly impact Europe, NATO's new supreme allied commander Europe explains the measures aimed at countering any actions that target NATO member states.",https://www.lemonde.fr/en/international/article/2025/09/24/alexus-grynkewich-top-nato-commander-in-europe-russia-has-always-tried-to-maneuver-for-advantage-over-the-alliance_6745696_4.html,"Chloé Hoorman,  Elise Vincent and  Philippe Jacqué",True,https://img.lemde.fr/2025/09/12/0/0/7201/4800/664/442/75/0/342c643_ftp-import-images-1-7kuzmj5o2apf-5866935-01-06.jpg,Interview
49,San Francisco's comeback is fueled by AI giants,"San Francisco's new mayor, Daniel Lurie, boasts about the city's falling crime rate, the return of residents and tourists and its rise as a hub for artificial intelligence, though he admits problems remain.",https://www.lemonde.fr/en/international/article/2025/09/25/san-francisco-s-comeback-is-fueled-by-ai-giants_6745742_4.html,Arnaud Leparmentier,True,https://img.lemde.fr/2025/09/12/73/0/5400/3600/664/442/75/0/9f871d7_upload-1-s0xc7c6azkow-aubrey-trinnaman-le-monde-115.jpg,Conversation
50,Sarkozy conviction: No one is above the law,no description,https://www.lemonde.fr/en/opinion/article/2025/09/26/sarkozy-conviction-no-one-is-above-the-law_6745763_23.html,Le Monde,False,,Editorial
51,"'By going after Kimmel, Trump intended to put an end to shows that mock him. The opposite has happened'",no description,https://www.lemonde.fr/en/international/article/2025/09/26/by-going-after-jimmy-kimmel-donald-trump-intended-to-put-an-end-to-the-shows-that-mock-him-the-opposite-has-happened_6745751_4.html,Michel Guerrin,,https://img.lemde.fr/2025/02/13/0/0/0/0/100/100/60/0/582cc7b_sirius-fs-upload-1-s35ik04v2mji-1739442860260-capture-da-a-cran-2025-02-13-113357.png,Column
52,"The United States, an AI-doped economy",no description,https://www.lemonde.fr/en/opinion/article/2025/09/23/the-united-states-an-ai-doped-economy_6745662_23.html,Le Monde,False,,Editorial
