,headline,description,url,byline,premium,image_url,article type
0,2026 Winter Olympics open amid geopolitical and climate tensions,"The Winter Olympics, which begin on Friday, promise a spectacle of athletic achievement, emotion and entertainment broadcast worldwide. Yet its organizers must now prove that their dispersed venue model is viable.",https://www.lemonde.fr/en/sports/article/2026/02/06/2026-winter-olympics-open-amid-geopolitical-and-climate-tensions_6750218_9.html,,True,https://img.lemde.fr/2026/02/03/0/2/3495/2330/400/266/75/0/b167da7_upload-1-eklaus0enqhs-mig2026001-l1000181.jpg,
1,French government expects resistance from Jack Lang after summons to explain Epstein ties,no description,https://www.lemonde.fr/en/politics/article/2026/02/06/french-government-braces-for-strong-resistance-after-summoning-jack-lang-to-explain-epstein-ties_6750217_5.html,,True,https://img.lemde.fr/2026/02/06/0/0/1920/1280/398/265/75/0/22d9ae2_upload-1-yg4eyusu9qsw-12.jpg,
2,Jean-Luc Mélenchon courts small business owners,no description,https://www.lemonde.fr/en/politics/article/2026/02/06/jean-luc-melenchon-courts-small-business-owners_6750213_5.html,,True,https://img.lemde.fr/2026/01/29/0/0/9345/6230/398/265/75/0/72e9c09_upload-1-kmvj5ervgosz-hanslucas-hl-xbouzas-3033613.jpg,
3,"France warns of possible 'IS resurgence' in Syria, where 'French citizens' security is also at stake'","According to Paris, the Syrian authorities' agreement with Kurdish forces challenges the structure of the fight against the jihadist group in Syria and Iraq. On Thursday, France's foreign minister traveled to Damascus, Baghdad and Erbil.",https://www.lemonde.fr/en/international/article/2026/02/06/france-warns-of-possible-is-resurgence-in-syria-where-french-citizens-security-is-also-at-stake_6750215_4.html,,True,https://img.lemde.fr/2026/02/06/0/0/4723/3149/398/265/75/0/23a7e35_upload-1-0q4hmgbqcxaf-vdsl3806-a-02-26.jpg,
4,French judge and her mother freed after a cryptocurrency-linked abduction,The two women were kidnapped on Wednesday night. The judge's partner is an active investor in the cryptocurrency sector.,https://www.lemonde.fr/en/france/article/2026/02/06/french-judge-and-her-mother-freed-after-a-cryptocurrency-linked-abduction_6750220_7.html,,True,https://img.lemde.fr/2024/10/24/0/0/2250/1500/398/265/75/0/fb05b64_1729786778193-frame-157.jpg,
5,Six Nations: France holds promises with decisive victory against Ireland,"The French, buoyed by the return of Antoine Dupont, convincingly defeated the Irish at the Stade de France (36-14). They have launched their title defense with panache.",https://www.lemonde.fr/en/sports/article/2026/02/06/six-nations-france-holds-promises-with-decisive-victory-against-ireland_6750210_9.html,,True,https://img.lemde.fr/2026/02/05/0/0/6426/4284/398/265/75/0/ba1c37b_ftp-1-hgw7ocvqqopk-5083448-01-06.jpg,
6,UK inquiry further incriminates French rescue services in 2021 Channel shipwreck,"The findings of a British public inquiry reveal that French rescue services on November 24, 2021, instructed an oil tanker to continue its course, even though it was likely the ship had located the distressed dinghy in which 31 people perished.",https://www.lemonde.fr/en/france/article/2026/02/06/uk-inquiry-further-incriminates-french-rescue-services-in-2021-channel-shipwreck_6750216_7.html,Julia Pascual,True,https://img.lemde.fr/2024/03/14/177/0/4252/2834/664/442/75/0/2c4a513_1710458441316-34.jpg,In Depth
7,"France detects Russia-linked Epstein smear attempt against Macron, says government source",no description,https://www.lemonde.fr/en/international/article/2026/02/06/france-detects-russia-linked-epstein-smear-attempt-against-macron-government-source_6750221_4.html,,False,https://img.lemde.fr/2026/02/03/911/0/6830/4553/198/132/95/0/dca3ab3_upload-1-pnzf4c0gpefp-kzihnioglu-vesoul-pol-macron-vo-03022026-27.JPG,
8,EU tells TikTok to change its 'addictive' design or face fines,no description,https://www.lemonde.fr/en/pixels/article/2026/02/06/eu-tells-tiktok-to-change-its-addictive-design-or-face-fines_6750224_13.html,,False,https://img.lemde.fr/2026/02/05/3/0/5152/3434/198/132/95/0/b74728b_ftp-1-w8zm0jh0yadi-2026-02-05t101756z-1454875971-rc2onfahkukx-rtrmadp-3-turkey-eu.JPG,
9,"Canada, France open consulates in Greenland in show of support",no description,https://www.lemonde.fr/en/international/article/2026/02/06/canada-france-open-consulates-in-greenland-in-show-of-support_6750214_4.html,,False,https://img.lemde.fr/2026/02/06/0/0/6000/4000/198/132/95/0/b8e4923_ftp-1-0dnhopes7z4s-5084943-01-06.jpg,
10,Suspected former member of the Kosovo Liberation Army arrested for war crimes,no description,https://www.lemonde.fr/en/international/article/2026/02/06/serbia-a-kosovo-national-suspected-former-member-of-the-kosovo-liberation-army-arrested-for-war-crimes_6750198_4.html,,False,https://img.lemde.fr/2015/09/21/34/0/3984/2656/198/132/95/0/d255ff7_d46403cf65b049d5bcaeab710b6e3b9c-d46403cf65b049d5bcaeab710b6e3b9c-0.jpg,
11,"Kimi Onoda, Japan's young minister likened to 'Joan of Arc,' courts the conservative electorate",no description,https://www.lemonde.fr/en/international/article/2026/02/06/kimi-onoda-japan-s-young-minister-likened-to-joan-of-arc-courts-the-conservative-electorate_6750204_4.html,,True,,
12,Pretzels and Käseküeche: The comforting treasures of Alsatian cuisine,no description,https://www.lemonde.fr/en/lifestyle/article/2026/02/06/pretzels-and-kasekueche-the-comforting-treasures-of-alsatian-cuisine_6750201_37.html,,True,,
13,"Ahmed Yousef, former Hamas official: 'We have lost everything, armed struggle has failed'",no description,https://www.lemonde.fr/en/international/article/2026/02/06/ahmed-yousef-former-hamas-official-we-have-lost-everything-armed-struggle-has-failed_6750202_4.html,,True,,
14,How Marine Le Pen changed her defense strategy,no description,https://www.lemonde.fr/en/politics/video/2026/02/06/how-marine-le-pen-changed-her-defense-strategy_6750203_5.html,,False,,
15,"Secondhand market booms, challenging luxury industry",no description,https://www.lemonde.fr/en/economy/article/2026/02/06/secondhand-market-booms-challenging-luxury-industry_6750196_19.html,,True,,
16,Iran's participation in BRICS+ naval drills against South Africa's wishes causes confusion,no description,https://www.lemonde.fr/en/le-monde-africa/article/2026/02/06/iran-s-participation-in-brics-naval-drills-against-south-africa-s-wishes-causes-confusion_6750199_124.html,,True,,
17,"Lore Baudrit, captain of France's Olympic women's hockey team: 'We train like pros, but don't get paid'",no description,https://www.lemonde.fr/en/sports/article/2026/02/05/lore-baudrit-captain-of-france-s-olympic-women-s-hockey-team-we-train-like-pros-but-don-t-get-paid_6750191_9.html,,True,,
18,European intelligence services adapt to the upheavals of the Trump era,no description,https://www.lemonde.fr/en/international/article/2026/02/04/european-intelligence-services-adapt-to-the-upheavals-of-the-trump-era_6750150_4.html,,True,,
19,This French territory off the coast of Canada has 'no clear sense of worry' over Trump,"Elected representatives in Saint-Pierre-et-Miquelon, the only French overseas territory in the North Atlantic, home to 6,000 people, aim to deepen ties with their major partner, Canada, amid growing geopolitical tensions with the US.",https://www.lemonde.fr/en/politics/article/2026/02/05/in-france-s-north-atlantic-overseas-territory-no-clear-sense-of-worry-among-residents-over-trump_6750160_5.html,Nathalie Guibert,True,https://img.lemde.fr/2026/02/04/0/461/4983/3322/664/442/75/0/62c60a5_upload-1-aeq9310opr6y-000-328t6x7.jpg,Feature
20,"'Canada, better the 28th EU member than the 51st US state'","The Canadian prime minister has called for an alliance of middle powers to stand up to the world's great powers. This is a compelling idea, and one that Europe has been pursuing for 60 years, writes Le Monde columnist Pascal Riché.",https://www.lemonde.fr/en/opinion/article/2026/02/05/canada-better-the-28th-eu-member-than-the-51st-us-state_6750176_23.html,Pascal Riché,True,https://img.lemde.fr/2026/01/27/0/0/3000/2000/664/442/75/0/81d7cb9_ftp-1-uoipoh2milsu-09d1335b3d5d49dd85e57ace9fe88f8b-0-f6ff238d556a4edfb36f6cd5a4b948e2.jpg,Column
21,Epstein's correspondence reveals links to French public figures,"Millions of emails released by the US Department of Justice reveal the financier's relationships, some more intense than others, with several figures from France's politics and culture.",https://www.lemonde.fr/en/france/article/2026/02/05/epstein-s-correspondence-reveals-links-to-french-public-figures_6750183_7.html,Ivanne Trippenbach,True,https://img.lemde.fr/2026/02/04/0/0/1920/1280/664/442/75/0/f1544e2_upload-1-obf49ovg2ril-02.jpg,In Depth
22,The US versus human rights,no description,https://www.lemonde.fr/en/opinion/article/2026/02/06/the-us-versus-human-rights_6750219_23.html,Le Monde,False,,Editorial
23,"'Not only is Trump not crazy, but he is dangerous': Historian Laure Murat salutes Minneapolis 'lesson in democracy'",no description,https://www.lemonde.fr/en/opinion/article/2026/02/05/not-only-is-trump-not-crazy-but-he-is-dangerous-historian-laure-murat-salutes-minneapolis-lesson-in-democracy_6750188_23.html,Laure Murat,,,Op-Ed
24,'The US always promises to extract itself from Middle Eastern quagmires while continuing to get stuck knee-deep',no description,https://www.lemonde.fr/en/opinion/article/2026/02/04/the-us-always-promises-to-extract-itself-from-middle-eastern-quagmires-while-continuing-to-get-stuck-knee-deep_6750133_23.html,Gilles Paris,,https://img.lemde.fr/2022/03/18/0/0/0/0/100/100/60/0/bfe4dc9_1647595527633-f2df5fa-237.jpeg,Column
