,headline,description,url,byline,premium,image_url,article type
0,"In Peru, the scourge of insecurity is fueling a political crisis",no description,https://www.lemonde.fr/en/international/article/2025/10/16/in-peru-the-scourge-of-insecurity-is-fueling-a-political-crisis_6746465_4.html,,True,,
1,Israel rejoices in the return of hostages and looks toward an uncertain future: 'Our hearts are forever broken',no description,https://www.lemonde.fr/en/international/article/2025/10/15/israel-rejoices-at-hostage-returns-awaits-more-bodies-and-doubts-about-future-our-hearts-are-forever-broken_6746455_4.html,,True,,
2,China targets major 'underground' church,no description,https://www.lemonde.fr/en/international/article/2025/10/15/a-crackdown-targets-one-of-china-s-main-underground-churches_6746442_4.html,,True,,
3,French authorities fear mounting 'MAGA sphere' intrusions into domestic politics,no description,https://www.lemonde.fr/en/international/article/2025/10/14/french-authorities-fear-mounting-maga-sphere-intrusions-into-domestic-politics_6746437_4.html,,True,,
4,Sanctions against Russia spark rift between US and Europe over China,no description,https://www.lemonde.fr/en/international/article/2025/09/15/sanctions-against-russia-spark-rift-between-us-and-europe-over-china_6745411_4.html,,True,,
5,France's political instability puts Franco-German alliance to the test,no description,https://www.lemonde.fr/en/opinion/article/2025/08/30/france-s-political-instability-puts-franco-german-alliance-to-the-test_6744873_23.html,,False,,
6,France faces prospect of paying higher borrowing costs than Italy,no description,https://www.lemonde.fr/en/economy/article/2025/08/19/france-faces-prospect-of-paying-higher-borrowing-costs-than-italy_6744519_19.html,,True,,
7,French man arrested in Slovenia for crimes committed in Croatia during 1991 war,no description,https://www.lemonde.fr/en/international/article/2025/08/06/french-man-arrested-in-slovenia-for-crimes-committed-in-croatia-during-1991-war_6744113_4.html,,True,,
8,"Cédric Jubillar denies killing wife, alternating between 'I don't know' and 'I don't remember'",no description,https://www.lemonde.fr/en/france/article/2025/10/14/cedric-jubillar-denies-killing-wife-alternating-between-i-don-t-know-and-i-don-t-remember_6746427_7.html,,True,,
9,France-UK migrant return agreement challenged in French court,no description,https://www.lemonde.fr/en/france/article/2025/10/14/france-uk-migrant-return-agreement-challenged-in-french-court_6746418_7.html,,True,,
10,Pelicot rape case closes with forgettable appeal trial,no description,https://www.lemonde.fr/en/france/article/2025/10/10/pelicot-rape-case-closes-with-a-forgettable-appeal-trial_6746300_7.html,,True,,
11,"Robert Badinter's secret face-to-face with the guillotine, in four unseen pictures",no description,https://www.lemonde.fr/en/france/article/2025/10/09/robert-badinter-s-secret-face-to-face-with-the-guillotine-in-four-unseen-pictures_6746260_7.html,,True,,
12,Afghanistan: Relentless repression continues over four years into Taliban's rule,no description,https://www.lemonde.fr/en/videos/video/2025/10/04/afghanistan-relentless-repression-continues-over-four-years-into-taliban-s-rule_6746092_108.html,,False,,
13,Watch: Hundreds of thousands march in France against budget cuts,no description,https://www.lemonde.fr/en/videos/video/2025/09/19/french-strikes-watch-what-happened-as-hundreds-of-thousands-marched-against-budget-cuts_6745548_108.html,,False,,
14,Emmys 2025: 'Adolescence' star Owen Cooper becomes youngest winner for best supporting actor,no description,https://www.lemonde.fr/en/videos/video/2025/09/15/emmys-2025-adolescence-star-owen-cooper-becomes-youngest-winner-for-best-supporting-actor_6745427_108.html,,False,,
15,"From 'influence peddling' to 'corruption,' what is French Culture Minister Rachida Dati accused of?",no description,https://www.lemonde.fr/en/videos/video/2025/09/06/from-influence-peddling-to-corruption-what-is-french-culture-minister-rachida-dati-accused-of_6745094_108.html,,False,,
16,Trump's plan for Gaza and the requirements of lasting peace,no description,https://www.lemonde.fr/en/opinion/article/2025/10/15/trump-s-plan-for-gaza-and-the-requirements-of-lasting-peace_6746454_23.html,,False,,
17,'The words exchanged by Trump and Abbas will hardly make up for lost time',no description,https://www.lemonde.fr/en/opinion/article/2025/10/16/the-words-exchanged-by-trump-and-abbas-will-hardly-make-up-for-lost-time_6746467_23.html,,True,,
18,Finding a path out of France's crisis,no description,https://www.lemonde.fr/en/opinion/article/2025/10/15/finding-a-path-out-of-france-s-crisis_6746461_23.html,,False,,
19,The French Socialists' impossible choice,no description,https://www.lemonde.fr/en/opinion/article/2025/10/14/the-french-socialists-impossible-choice_6746426_23.html,,True,,
20,"Rabbi, drag queen and gay: Amichai Lau-Lavie, a Jewish trailblazer",no description,https://www.lemonde.fr/en/m-le-mag/article/2025/10/11/rabbi-drag-queen-and-gay-amichai-lau-lavie-a-jewish-trailblazer_6746337_117.html,,True,,
21,Matthieu Blazy: 'Just because Karl was a legend does not mean that everyone who designs for Chanel has to be one too',no description,https://www.lemonde.fr/en/m-le-mag/article/2025/10/08/chanel-s-new-face-matthieu-blazy-just-because-karl-was-a-legend-does-not-mean-that-everyone-who-designs-for-chanel-has-to-be-one-too_6746228_117.html,,True,,
22,Sweden's new list of 'cultural values' sparks controversy,no description,https://www.lemonde.fr/en/m-le-mag/article/2025/10/05/a-tool-for-integration-or-identity-politics-sweden-s-new-list-of-cultural-values-sparks-controversy_6746124_117.html,,True,,
23,The making of the Agnès b. cardigan,no description,https://www.lemonde.fr/en/m-le-mag/article/2025/10/05/the-making-of-the-agnes-b-cardigan_6746115_117.html,,True,,
24,Five places in and near Paris to savor choux à la crème,no description,https://www.lemonde.fr/en/lifestyle/article/2025/10/15/five-places-in-the-paris-region-to-savor-choux-a-la-creme_6746447_37.html,,True,,
25,"Berthe Weill at the Musée de l'Orangerie, the treasures of an eclectic gallerist",no description,https://www.lemonde.fr/en/culture/article/2025/10/14/the-treasures-of-berthe-weill-the-eclectic-gallerist-at-the-paris-musee-de-l-orangerie_6746402_30.html,,True,,
26,Five fun ways to discover Paris and its surroundings with your family,no description,https://www.lemonde.fr/en/intimacy/article/2025/10/02/five-fun-ways-to-discover-paris-and-its-surroundings-with-your-family_6745998_310.html,,True,,
27,Emma Reyes's still lifes relive in two Paris exhibitions,no description,https://www.lemonde.fr/en/culture/article/2025/09/28/emma-reyes-still-lifes-finds-new-life-in-two-paris-exhibitions_6745877_30.html,,True,,
28,'The words exchanged by Trump and Abbas will hardly make up for lost time',"The blatantly pro-Israel stance of the US president leaves very little room for the Palestinians, observes Le Monde columnist Gilles Paris.",https://www.lemonde.fr/en/opinion/article/2025/10/16/the-words-exchanged-by-trump-and-abbas-will-hardly-make-up-for-lost-time_6746467_23.html,,True,https://img.lemde.fr/2025/10/13/0/0/5652/3768/400/266/75/0/3a27bd1_ftp-import-images-1-8mamatnpjo7g-5158330-01-06.jpg,
29,Israel threatens to resume fighting if Hamas does not respect Gaza truce deal,no description,https://www.lemonde.fr/en/international/article/2025/10/16/israel-threatens-to-resume-fighting-if-hamas-does-not-respect-gaza-truce-deal_6746466_4.html,,False,https://img.lemde.fr/2025/10/15/0/0/5500/3666/398/265/75/0/aee47be_ftp-import-images-1-v50l281xiamg-2025-10-15t193608z-214898803-rc2ichaqntyb-rtrmadp-3-israel-palestinians-gaza.JPG,
30,Hamas says it has handed over all the hostage remains it can reach,no description,https://www.lemonde.fr/en/international/article/2025/10/15/israel-says-hamas-handed-over-remains-that-do-not-match-any-former-hostages_6746452_4.html,,False,https://img.lemde.fr/2025/10/14/0/0/8040/5360/398/265/75/0/2464316_ftp-import-images-1-8ur75xg7lttq-5168827-01-06.jpg,
31,Trump confirms the CIA is conducting covert operations inside Venezuela,"Asked on Wednesday why he had authorized the CIA to take action in Venezuela, Trump affirmed he had made the move, also stating that the administration 'is looking at land' as it considers further strikes in the region. Trump declined, however, to say whether the CIA has the authority to take action against President Nicolás Maduro.",https://www.lemonde.fr/en/international/article/2025/10/15/trump-says-us-certainly-considering-strikes-on-land-against-venezuela-cartels_6746464_4.html,,False,https://img.lemde.fr/2025/09/26/0/61/5851/3901/398/265/75/0/6207e1e_ftp-import-images-1-y2dd7jrrfyy1-2025-09-26t192809z-872090282-rc2ksgaowjtq-rtrmadp-3-usa-venezuela.JPG,
32,"In Peru, the scourge of insecurity is fueling a political crisis","The wave of violence linked to organized crime has cost President Dina Boluarte her seat. Bus drivers, shopkeepers and artists have been the main victims of extortion, and on Wednesday, they are set to protest alongside the rest of the population against a corrupt system.",https://www.lemonde.fr/en/international/article/2025/10/16/in-peru-the-scourge-of-insecurity-is-fueling-a-political-crisis_6746465_4.html,,True,https://img.lemde.fr/2025/10/12/0/0/6499/4333/398/265/75/0/53094f2_ftp-import-images-1-s292xjvi1qhg-2025-10-12t223703z-12858528-rc2maha7nfo4-rtrmadp-3-peru-protest.JPG,
33,Five places in and near Paris to savor choux à la crème,"Our selection of bakeries and pastry shops to fully indulge in choux – whether filled with vanilla cream, peanut cream or Japanese cane sugar.",https://www.lemonde.fr/en/lifestyle/article/2025/10/15/five-places-in-the-paris-region-to-savor-choux-a-la-creme_6746447_37.html,,True,https://img.lemde.fr/2025/10/08/80/256/4151/2767/398/265/75/0/42835aa_upload-1-jo2fpag4jvbq-tapisserie-chou-reca-maurine-toussaint-9.jpg,
34,Confused by French politics? Our answers to the questions you are afraid to ask,How did we get here? That's one of many questions that many people in France have asked about the current political crisis. Here is an attempt to answer six of them.,https://www.lemonde.fr/en/les-decodeurs/article/2025/10/15/confused-by-french-politics-our-answers-to-the-questions-you-were-afraid-to-ask_6746446_8.html,Adel Miliani,False,https://img.lemde.fr/2025/10/14/0/0/4951/3300/664/442/75/0/575e5e2_ftp-import-images-1-bqffcdvomvyo-5165334-01-06.jpg,In Depth
35,France's new budget plan is ambitious but highly fragile,no description,https://www.lemonde.fr/en/politics/article/2025/10/15/france-s-new-budget-plan-is-ambitious-but-highly-fragile_6746453_5.html,,True,https://img.lemde.fr/2025/10/14/0/0/2500/1666/198/132/95/0/a9638d9_upload-1-sp2poifd0t2a-jmug251014048.jpg,
36,Pardoned French-Malagasy officer criticizes France's position on Madagascar,no description,https://www.lemonde.fr/en/le-monde-africa/article/2025/10/15/pardoned-french-malagasy-officer-criticizes-france-s-position-on-madagascar_6746458_124.html,,True,https://img.lemde.fr/2025/01/09/215/0/780/520/198/132/95/0/6233870_sirius-fs-upload-1-1y4t77u9npox-1736427131056-paul-maillot.jpg,
37,California plans on protecting minors and preventing self-destructive content by regulating AI,no description,https://www.lemonde.fr/en/economy/article/2025/10/15/california-plans-on-protecting-minors-and-preventing-self-destructive-content-by-regulating-ai_6746443_19.html,,True,https://img.lemde.fr/2025/10/13/0/0/8256/5504/198/132/95/0/5642975_upload-1-astlb0ko57a8-000-33zd88h.jpg,
38,How France's PM caved on the retirement age to save his government,no description,https://www.lemonde.fr/en/politics/article/2025/10/15/how-the-french-pm-managed-to-win-socialist-support_6746451_5.html,,True,https://img.lemde.fr/2025/10/15/0/0/5899/3933/198/132/95/0/16cfb96_upload-1-bc316t8bkjck-jmug251014080.jpg,
39,Kenyan opposition leader Raila Odinga dies at 80,no description,https://www.lemonde.fr/en/le-monde-africa/article/2025/10/15/former-kenyan-prime-minister-raila-odinga-dies-at-80_6746450_124.html,,False,,
40,Madagascar: The hours that led the military to overthrow Andry Rajoelina,no description,https://www.lemonde.fr/en/le-monde-africa/article/2025/10/15/in-madagascar-the-hours-that-led-the-military-to-overthrow-andry-rajoelina_6746448_124.html,,True,,
41,Cameroon authorities say main opposition candidate 'did not win' presidential election,no description,https://www.lemonde.fr/en/le-monde-africa/article/2025/10/15/cameroonian-authorities-say-main-opposition-candidate-did-not-win-the-presidential-election_6746441_124.html,,True,,
42,Trump warns of Argentina aid cut if Milei loses election,no description,https://www.lemonde.fr/en/international/article/2025/10/15/trump-warns-of-argentina-aid-cut-if-milei-loses-election_6746440_4.html,,False,,
43,Israel rejoices in the return of hostages and looks toward an uncertain future: 'Our hearts are forever broken',no description,https://www.lemonde.fr/en/international/article/2025/10/15/israel-rejoices-at-hostage-returns-awaits-more-bodies-and-doubts-about-future-our-hearts-are-forever-broken_6746455_4.html,,True,,
44,French authorities fear mounting 'MAGA sphere' intrusions into domestic politics,no description,https://www.lemonde.fr/en/international/article/2025/10/14/french-authorities-fear-mounting-maga-sphere-intrusions-into-domestic-politics_6746437_4.html,,True,,
45,Zelensky strips Odesa mayor of Ukrainian citizenship,no description,https://www.lemonde.fr/en/international/article/2025/10/14/zelensky-strips-odesa-mayor-of-ukrainian-citizenship_6746438_4.html,,False,,
46,"US kills six on board suspected drug-smuggling vessel near Venezuela, Trump says",no description,https://www.lemonde.fr/en/international/article/2025/10/15/us-kills-6-people-in-strike-on-boat-accused-of-carrying-drugs-near-venezuela-trump-says_6746444_4.html,,False,,
47,"Berthe Weill at the Musée de l'Orangerie, the treasures of an eclectic gallerist","The institution shines a light on the art dealer (1865-1951) who exhibited works by Matisse and Picasso from 1900 onward, as well as on many artists from the different movements of her era.",https://www.lemonde.fr/en/culture/article/2025/10/14/the-treasures-of-berthe-weill-the-eclectic-gallerist-at-the-paris-musee-de-l-orangerie_6746402_30.html,Philippe Dagen,True,https://img.lemde.fr/2025/10/07/111/0/3565/2376/664/442/75/0/dd81ebd_upload-1-hiab7gipqhtt-10-pierre-girieud-portrait-de-la-artiste-peintre-ei-milie-charmy.jpg,Review
48,"Philippe Aghion, 2025 Nobel in economics laureate: 'The key factor of economic power is technological leadership'","The French economist was part of a trio that won the 2025 Economics Nobel Prize. In an interview, he argued that France and Europe must invest in innovation to maintain their status as economic powers.",https://www.lemonde.fr/en/international/article/2025/10/13/2025-nobel-winner-philippe-aghion-the-key-factor-of-economic-power-is-technological-leadership_6746390_4.html,Pascal Riché,True,https://img.lemde.fr/2025/10/13/0/0/6000/4000/664/442/75/0/6a9e83b_ftp-import-images-1-nsnclbpkcsr4-a386ace156a646b9975f541441f5e353-0-82e206b79e5a4835a97561cc425ee9f9.jpg,Interview
49,"First Wap, a discreet cyber-surveillance firm tracking journalists, public figures and corporate executives","Little known to the public, this long-standing player in the surveillance industry has been selling phone-tracking technology for more than 20 years, including to authoritarian regimes. Among its targets: a journalist investigating the Vatican, an Airbus employee, and Hollywood actor Jared Leto.",https://www.lemonde.fr/en/pixels/article/2025/10/14/first-wap-a-discreet-cyber-surveillance-firm-tracking-journalists-public-figures-and-corporate-executives_6746433_13.html,,True,https://img.lemde.fr/2025/10/13/0/0/3000/2000/664/442/75/0/6e2450f_upload-1-ej75xjyqn5ll-firstwap2.jpg,Investigation
50,Finding a path out of France's crisis,no description,https://www.lemonde.fr/en/opinion/article/2025/10/15/finding-a-path-out-of-france-s-crisis_6746461_23.html,Le Monde,False,,Editorial
51,Trump's plan for Gaza and the requirements of lasting peace,no description,https://www.lemonde.fr/en/opinion/article/2025/10/15/trump-s-plan-for-gaza-and-the-requirements-of-lasting-peace_6746454_23.html,Le Monde,False,,Editorial
52,Alain Dieckhoff: 'Israel's postwar period will put Netanyahu and his government in the hot seat',no description,https://www.lemonde.fr/en/opinion/article/2025/10/13/alain-dieckhoff-israel-s-postwar-period-will-put-netanyahu-and-his-government-in-the-hot-seat_6746369_23.html,Alain Dieckhoff,,,Op-Ed
