,headline,description,url,byline,premium,image_url,article type
0,"Federica Mogherini, former EU foreign policy chief, taken into police custody over suspected fraud",no description,https://www.lemonde.fr/en/international/article/2025/12/02/federica-mogherini-former-eu-foreign-policy-chief-taken-into-police-custody-over-suspected-fraud_6748087_4.html,,True,,
1,Zelensky urged to reform his leadership amid ongoing peace talks,no description,https://www.lemonde.fr/en/international/article/2025/12/02/zelensky-urged-to-reform-his-leadership-amid-ongoing-peace-talks_6748086_4.html,,True,,
2,Macron travels to China with slim hopes of swaying Beijing on Ukraine and trade,no description,https://www.lemonde.fr/en/international/article/2025/12/02/macron-travels-to-china-with-slim-hopes-of-swaying-beijing-on-ukraine-and-trade_6748081_4.html,,True,,
3,Russia claims capture of key city Pokrovsk as Ukraine says fighting continues,no description,https://www.lemonde.fr/en/international/video/2025/12/02/russia-claims-capture-of-key-city-pokrovsk-as-ukraine-says-fighting-continues_6748076_4.html,,False,,
4,Bosnia and Herzegovina's Serb entity elects ally of  former leader Dodik,no description,https://www.lemonde.fr/en/international/article/2025/11/24/bosnia-and-herzegovina-s-serb-entity-elects-ally-of-former-leader-dodik_6747765_4.html,,True,,
5,"In France's Somme, bagpipers keep the memory of the Great War alive",no description,https://www.lemonde.fr/en/history/article/2025/11/11/in-france-s-somme-bagpipers-keep-the-memory-of-the-great-war-alive_6747347_157.html,,True,,
6,Latvia: Public mobilization grows in support of treaty for preventing violence against women,no description,https://www.lemonde.fr/en/international/article/2025/11/06/in-latvia-public-mobilization-continues-to-grow-in-support-of-the-istanbul-convention-for-preventing-violence-against-women_6747156_4.html,,True,,
7,"After Charlie Kirk's murder, Europe's far right swears allegiance to Trump's politics",no description,https://www.lemonde.fr/en/les-decodeurs/article/2025/10/20/the-murder-of-charlie-kirk-how-europe-s-far-right-swore-allegiance-to-trump-s-politics_6746586_8.html,,True,,
8,Marseille grapples with drug trafficking: 'They are so many and they have so much money',no description,https://www.lemonde.fr/en/france/article/2025/12/02/marseille-grapples-with-drug-trafficking-they-are-so-many-and-they-have-so-much-money_6748047_7.html,,True,,
9,Foreign interference: Why France is raising its voice and turning to the courts,no description,https://www.lemonde.fr/en/france/article/2025/12/01/foreign-interference-why-france-is-raising-its-voice-and-turning-to-the-courts_6748034_7.html,,True,,
10,French mayor convicted and set to be incarcerated in sex-tape blackmail case,no description,https://www.lemonde.fr/en/france/article/2025/12/01/french-mayor-convicted-and-set-to-be-incarcerated-in-sex-tape-blackmail-case_6748032_7.html,,True,,
11,France adopts new interception rules for migrants crossing Channel,no description,https://www.lemonde.fr/en/france/article/2025/12/01/france-adopts-new-interception-rules-for-migrants-crossing-channel_6748031_7.html,,True,,
12,"Israel's D9 bulldozer, a tool of destruction in Gaza",no description,https://www.lemonde.fr/en/videos/video/2025/11/27/israel-s-d9-bulldozer-a-tool-of-destruction-in-gaza_6747870_108.html,,True,,
13,"Ukraine's Pokrovsk faces fierce fighting, footage analyzed by Le Monde reveals",no description,https://www.lemonde.fr/en/videos/video/2025/11/21/ukraine-s-pokrovsk-faces-fierce-fighting-footage-analyzed-by-le-monde-reveals_6747708_108.html,,True,,
14,Afghanistan: Relentless repression continues over four years into Taliban's rule,no description,https://www.lemonde.fr/en/videos/video/2025/10/04/afghanistan-relentless-repression-continues-over-four-years-into-taliban-s-rule_6746092_108.html,,False,,
15,Watch: Hundreds of thousands march in France against budget cuts,no description,https://www.lemonde.fr/en/videos/video/2025/09/19/french-strikes-watch-what-happened-as-hundreds-of-thousands-marched-against-budget-cuts_6745548_108.html,,False,,
16,Donald Trump and the spread of impunity,no description,https://www.lemonde.fr/en/opinion/article/2025/12/02/donald-trump-and-the-spread-of-impunity_6748066_23.html,,False,,
17,French PM Lecornu's budget strategy is put to the test of Parliament,no description,https://www.lemonde.fr/en/opinion/article/2025/12/02/french-pm-lecornu-s-budget-strategy-is-put-to-the-test-of-parliament_6748072_23.html,,True,,
18,"'Through his first trip, Pope Leo XIV asserts a diplomatic style that gives him the stature of an arbiter'",no description,https://www.lemonde.fr/en/opinion/article/2025/12/02/francois-mabille-political-scientist-through-his-first-trip-pope-leo-xiv-asserts-a-diplomatic-style-that-gives-him-the-stature-of-an-arbiter_6748051_23.html,,True,,
19,"'For Europe, catching up in the digital sector should not mean deregulating at every turn'",no description,https://www.lemonde.fr/en/opinion/article/2025/12/01/for-europe-catching-up-in-the-digital-sector-should-not-mean-deregulating-at-every-turn_6748039_23.html,,True,,
20,The first time Le Monde wrote about Jeffrey Epstein,no description,https://www.lemonde.fr/en/m-le-mag/article/2025/12/01/the-first-time-le-monde-wrote-about-jeffrey-epstein_6748001_117.html,,True,,
21,The last-minute fight to save Gaza's ancient archaeological treasures,no description,https://www.lemonde.fr/en/m-le-mag/article/2025/11/30/the-last-minute-fight-to-save-gaza-s-ancient-archaeological-treasures_6747984_117.html,,True,,
22,The art of being Oscar Wilde's grandson,no description,https://www.lemonde.fr/en/m-le-mag/article/2025/11/30/the-art-of-being-oscar-wilde-s-grandson_6747977_117.html,,True,,
23,"Gay Talese, the last titan of the American press",no description,https://www.lemonde.fr/en/m-le-mag/article/2025/11/29/gay-talese-the-last-titan-of-the-american-press_6747954_117.html,,True,,
24,"Bayonne's 'Little Louvre,' the Bonnat-Helleu Museum, reopens after 14 years",no description,https://www.lemonde.fr/en/culture/article/2025/11/28/bayonne-s-little-louvre-the-bonnat-helleu-museum-reopens-after-14-years_6747913_30.html,,True,,
25,Victor Hugo's interior architecture on display in Paris,no description,https://www.lemonde.fr/en/lifestyle/article/2025/11/23/victor-hugo-s-interior-architecture-on-display-in-paris_6747753_37.html,,True,,
26,A stroll through Cachan: From a royal aqueduct to a panoramic garden,no description,https://www.lemonde.fr/en/lifestyle/article/2025/11/22/a-stroll-through-cachan-from-a-royal-aqueduct-to-a-panoramic-garden_6747720_37.html,,True,,
27,Azzedine Alaïa's Dior collection on view in Paris,no description,https://www.lemonde.fr/en/lifestyle/article/2025/11/21/azzedine-alaia-s-dior-collection-on-view-in-paris_6747679_37.html,,True,,
28,Zelensky urged to reform his leadership amid ongoing peace talks,"The resignation of his trusted aide and two of his ministers over corruption allegations has ignited debate over the Ukrainian president's leadership style, as calls grow for greater openness and transparency.",https://www.lemonde.fr/en/international/article/2025/12/02/zelensky-urged-to-reform-his-leadership-amid-ongoing-peace-talks_6748086_4.html,,True,https://img.lemde.fr/2025/12/01/0/0/6000/4000/400/266/75/0/999511e_upload-1-jtax8mbfyxgc-cbi1292048.jpg,
29,Macron travels to China with slim hopes of swaying Beijing on Ukraine and trade,no description,https://www.lemonde.fr/en/international/article/2025/12/02/macron-travels-to-china-with-slim-hopes-of-swaying-beijing-on-ukraine-and-trade_6748081_4.html,,True,https://img.lemde.fr/2025/12/01/0/0/3000/2000/398/265/75/0/19a8896_upload-1-fovbvv0t9evm-cbir0817.jpg,
30,Francis Ford Coppola auctions his watches after  'Megalopolis' disaster,no description,https://www.lemonde.fr/en/culture/article/2025/12/02/francis-ford-coppola-auctions-his-watches-after-megalopolis-disaster_6748080_30.html,,True,https://img.lemde.fr/2024/05/17/0/0/4669/3113/398/265/75/0/ee35285_2024-05-17t115747z-329981055-up1ek5h0x88xs-rtrmadp-3-filmfestival-cannes-megalopolis.JPG,
31,"Trump administration targets foreigners, beyond undocumented migrants","Following the attack on two National Guard soldiers in Washington, US authorities have stepped up announcements aimed at immigrants, raising the prospect of a possible 'remigration.'",https://www.lemonde.fr/en/international/article/2025/12/02/trump-administration-targets-foreigners-beyond-undocumented-migrants_6748059_4.html,,True,https://img.lemde.fr/2025/12/01/0/0/4198/2799/398/265/75/0/9a5f4b9_upload-1-kcrflnxj87vc-063-2246877237.jpg,
32,Christophe Gleizes: The life on hold of a French journalist imprisoned in Algeria,"Aged 36, Christophe Gleizes has been held in Tizi Ouzou for more than five months. Arrested in Kabylie while reporting on a football club, he was sentenced in June to seven years in prison for 'glorifying terrorism.' His appeal trial opens on December 3.",https://www.lemonde.fr/en/le-monde-africa/article/2025/12/02/christophe-gleizes-the-life-on-hold-of-a-french-journalist-imprisoned-in-algeria_6748078_124.html,,True,https://img.lemde.fr/2025/12/01/0/0/7984/5323/398/265/75/0/8a91afd_upload-1-hefauvygub5b-000-66vy6qx.jpg,
33,Rare Fabergé 'Winter Egg' sells for record-breaking $30.2 million,"Crafted for Russia's imperial family in 1913, this crystal and diamond egg was described as 'the Mona Lisa for decorative arts' before it sold at auction in London on Tuesday.",https://www.lemonde.fr/en/culture/article/2025/12/02/rare-faberge-winter-egg-sells-for-record-breaking-30-2-million_6748085_30.html,,False,https://img.lemde.fr/2025/11/27/0/0/7903/5268/398/265/75/0/1ec74e1_ftp-import-images-1-g2vdqiytx55q-b615b433cb034d4b9210323d944f1cd6-0-2769abf0a1db4710b839ee22f009f781.jpg,
34,Leonardo DiCaprio and Paul Thomas Anderson: Two Hollywood stars in Paris after the battle,"Absent during the European promotion of the film 'One Battle After Another,' the American actor and director reunited in France to talk about Hollywood and their 30-year friendship.",https://www.lemonde.fr/en/culture/article/2025/12/02/leonardo-dicaprio-and-paul-thomas-anderson-two-hollywood-stars-in-paris-after-the-battle_6748084_30.html,Mathieu Macheret,True,https://img.lemde.fr/2025/11/25/0/0/5344/3563/664/442/75/0/c3b70b0_upload-1-8rft6owpgi9j-obaa-mm-dsf5645g.jpg,Conversation
35,French PM Lecornu's budget strategy is put to the test of Parliament,no description,https://www.lemonde.fr/en/opinion/article/2025/12/02/french-pm-lecornu-s-budget-strategy-is-put-to-the-test-of-parliament_6748072_23.html,,True,https://img.lemde.fr/2025/11/26/0/0/5899/3933/198/132/95/0/7c667b0_upload-1-xvmxm1j2enb7-jmug251125019.jpg,
36,"Federica Mogherini, former EU foreign policy chief, taken into police custody over suspected fraud",no description,https://www.lemonde.fr/en/international/article/2025/12/02/federica-mogherini-former-eu-foreign-policy-chief-taken-into-police-custody-over-suspected-fraud_6748087_4.html,,True,https://img.lemde.fr/2018/02/26/0/105/3870/2580/198/132/95/0/573eb54_cb222ca48f224c7bafbe5a61d6eeb1c1-cb222ca48f224c7bafbe5a61d6eeb1c1-0.jpg,
37,Pope Leo calls for end to hostilities in Lebanon as he closes first foreign trip,no description,https://www.lemonde.fr/en/international/article/2025/12/02/pope-leo-calls-for-end-to-hostilities-in-lebanon-as-he-ends-first-foreign-trip_6748074_4.html,,False,https://img.lemde.fr/2025/12/02/0/0/6000/4000/198/132/95/0/315abde_ftp-1-6otf0eo7ey4g-23671b4c23614ee196c11549b4de3af7-0-bcfef2c74cf24f2d80ef181681da91c7.jpg,
38,Cyclone Ditwah devastates all of Sri Lanka in unprecedented disaster,no description,https://www.lemonde.fr/en/environment/article/2025/12/02/cyclone-ditwah-devastates-all-of-sri-lanka-in-unprecedented-disaster_6748062_114.html,,True,https://img.lemde.fr/2025/11/30/0/0/7666/5111/198/132/95/0/d89188e_ftp-import-images-1-4ne9omc8pzgx-5562928-01-06.jpg,
39,Macron denies 'ministry of truth' plan after attacks from far right,no description,https://www.lemonde.fr/en/politics/article/2025/12/02/macron-denies-ministry-of-truth-plan-after-attacks-from-far-right_6748075_5.html,,False,,
40,Honduran ex-president pardoned by Trump is released from US prison,no description,https://www.lemonde.fr/en/international/article/2025/12/02/honduran-ex-president-receives-surprise-pardon-by-trump-released-from-us-prison_6748073_4.html,,False,,
41,French authorities open investigation into 'aggravated assault' involving Nice football squad,no description,https://www.lemonde.fr/en/sports/article/2025/12/02/french-authorities-open-investigation-into-aggravated-assault-involving-nice-football-squad_6748082_9.html,,False,,
42,Torrential rains in Indonesia destroy villages and leave more than 600 dead,no description,https://www.lemonde.fr/en/environment/article/2025/12/02/torrential-rains-in-indonesia-destroy-villages-and-leave-more-than-600-dead_6748061_114.html,,True,,
43,Raphaël Varane: 'Showing vulnerability does not mean you're weak',no description,https://www.lemonde.fr/en/sports/article/2025/12/02/raphael-varane-showing-vulnerability-does-not-mean-you-re-weak_6748050_9.html,,False,,
44,Trump increases pressure on Maduro but stops short of action,no description,https://www.lemonde.fr/en/international/article/2025/12/02/trump-increases-pressure-on-nicolas-maduro-but-stops-short-of-action_6748068_4.html,,True,,
45,"Luigi Mangione, accused of killing a health insurance executive, leaves Americans divided",no description,https://www.lemonde.fr/en/international/article/2025/12/02/luigi-mangione-accused-of-killing-a-health-insurance-executive-in-new-york-in-2024-leaves-americans-divided_6748045_4.html,,True,,
46,German army reports ammunition shipment stolen from delivery truck,no description,https://www.lemonde.fr/en/international/article/2025/12/02/german-army-reports-ammunition-shipment-stolen-from-delivery-truck_6748077_4.html,,False,,
47,Marseille grapples with drug trafficking: 'They are so many and they have so much money',"After the murder of Mehdi Kessaci, the brother of an activist against drug trafficking, Le Monde spoke with residents of housing projects, social workers, judges and police officers. They described a growing sense of powerlessness and danger.",https://www.lemonde.fr/en/france/article/2025/12/02/marseille-grapples-with-drug-trafficking-they-are-so-many-and-they-have-so-much-money_6748047_7.html,Gilles Rof and  Grégoire Biseau,True,https://img.lemde.fr/2025/11/28/7/0/4724/3149/664/442/75/0/b75fdcb_upload-1-pwi9cpbgvpg5-vdsl9719-a-11-25.jpg,Long Read
48,"Gay Talese, the last titan of the American press","He was a pioneer of New Journalism, a movement that transformed American journalism with a literary writing style. At 93, the author of the landmark 1966 profile 'Frank Sinatra Has a Cold,' finds his daily life increasingly constrained by old age.",https://www.lemonde.fr/en/m-le-mag/article/2025/11/29/gay-talese-the-last-titan-of-the-american-press_6747954_117.html,Clémentine Goldszal,True,https://img.lemde.fr/2025/10/31/715/0/1680/1120/664/442/75/0/d28ec17_upload-1-xv3zu0rtu4c9-yoshi-gaytalese-02.jpg,Profile
49,The art of being Oscar Wilde's grandson,"As Ireland prepares to mark the 125th anniversary of Oscar Wilde's death, Merlin Holland, his only living descendant, works in France to protect the memory of a man who was long viewed as scandalous.",https://www.lemonde.fr/en/m-le-mag/article/2025/11/30/the-art-of-being-oscar-wilde-s-grandson_6747977_117.html,Clémentine Goldszal,True,https://img.lemde.fr/2025/11/17/1300/0/3546/2364/664/442/75/0/7fa7f61_upload-1-cozrw22i7i8g-740-sem-wilde-001.jpg,Conversation
50,Donald Trump and the spread of impunity,no description,https://www.lemonde.fr/en/opinion/article/2025/12/02/donald-trump-and-the-spread-of-impunity_6748066_23.html,Le Monde,False,,Editorial
51,"'Through his first trip, Pope Leo XIV asserts a diplomatic style that gives him the stature of an arbiter'",no description,https://www.lemonde.fr/en/opinion/article/2025/12/02/francois-mabille-political-scientist-through-his-first-trip-pope-leo-xiv-asserts-a-diplomatic-style-that-gives-him-the-stature-of-an-arbiter_6748051_23.html,François Mabille,,,Op-Ed
52,Trump's interference and contradictions across Latin America,no description,https://www.lemonde.fr/en/opinion/article/2025/12/01/trump-s-interference-and-contradictions-across-latin-america_6748016_23.html,Le Monde,False,,Editorial
