,headline,description,url,byline,premium,image_url,article type
0,"In Lebanon, a fragile cease-fire between Israel and Hezbollah begins","The Lebanese army accused Israel of repeated truce violations, while Hezbollah said it retaliated against Israeli troops. Talks between the two sides mark a shift, but core disputes remain, including the withdrawal of the Israeli army and Hezbollah's disarmament.",https://www.lemonde.fr/en/international/article/2026/04/17/in-lebanon-a-fragile-cease-fire-between-israel-and-hezbollah-begins_6752528_4.html,,True,https://img.lemde.fr/2026/04/17/0/0/6810/4540/400/266/75/0/c8b8a6f_upload-1-xrxemkz4n6oh-as108201.jpeg,
1,How the tech lobby made secrecy part of EU law on data centers,no description,https://www.lemonde.fr/en/les-decodeurs/article/2026/04/17/how-the-tech-lobby-made-secrecy-part-of-eu-law-on-data-centers_6752527_8.html,,True,https://img.lemde.fr/2025/12/10/0/0/5521/3680/398/265/75/0/0f5c3f8_upload-1-m8ya26f5j4dm-000-8x49y8.jpg,
2,"Andrew Puzder, a Trump loyalist amid European diplomats",no description,https://www.lemonde.fr/en/international/article/2026/04/17/andrew-puzder-a-trump-loyalist-in-the-land-of-european-diplomats_6752518_4.html,,True,https://img.lemde.fr/2026/04/16/0/0/7999/5332/398/265/75/0/5ae87f5_upload-1-abfjiqddabci-000-a7926nq.jpg,
3,Why the Hormuz 'mission' led by France and the UK is largely symbolic,"Wanting to avoid being drawn into the US's blockade of the key shipping route, Macron and Starmer aim to establish a multilateral and 'strictly defensive' plan to secure the Strait of Hormuz.",https://www.lemonde.fr/en/international/article/2026/04/15/why-the-hormuz-mission-led-by-france-and-the-uk-is-largely-symbolic_6752445_4.html,,True,https://img.lemde.fr/2026/04/14/0/0/5836/3891/398/265/75/0/8677dc1_upload-1-4pgnlq9cfrek-000-89u76jz.jpg,
4,"'Dansons,' Céline Dion's new single, already feels outdated","The superstar's new song, written by Jean-Jacques Goldman and launched with great fanfare on Friday, seems to belong to another era. It is far from the hits that the French singer-songwriter created for the Québécois diva in the 1990s.",https://www.lemonde.fr/en/culture/article/2026/04/17/dansons-celine-dion-s-new-single-already-feels-outdated_6752522_30.html,,True,https://img.lemde.fr/2026/04/16/53/0/5868/3912/398/265/75/0/7493680_upload-1-b8dh4ww3r6qw-celinedion-publicitypicture2026-g300.jpg,
5,"'Romeo and Juliet,' choreographed by Rudolf Nureyev, returns to Paris",The spectacular production at the Opéra Bastille gives the new generation of dancers a chance to showcase their talents.,https://www.lemonde.fr/en/culture/article/2026/04/17/rudolf-nureyev-s-ballet-romeo-et-juliette-returns-to-the-opera-national-de-paris_6752519_30.html,,True,https://img.lemde.fr/2026/04/15/133/0/5600/3733/398/265/75/0/03bb4ea_upload-1-lsutni9opnfj-30395-maria-helena-buckley-romeo-et-juliette-rudolf-noureev-roxane-stojanov-lorenzo-lelli-maria-helena-buckley-onp-8754.JPG,
6,Suspense and pretense: The RN prepares for life after Le Pen,"Pending the July 7 court decision that will determine whether Marine Le Pen can stand in elections, the far-right party must prepare for the 2027 presidential campaign without knowing whether she or Jordan Bardella will be its candidate.",https://www.lemonde.fr/en/politics/article/2026/04/17/suspense-and-pretense-the-rn-prepares-for-life-after-le-pen_6752523_5.html,Clément Guillou and  Corentin Lesueur,True,https://img.lemde.fr/2026/04/15/0/0/5842/3894/664/442/75/0/7b6f574_upload-1-rpoq96hjkhu2-sipa-01254859-000003.jpg,In Depth
7,Viktor Orban's defeat in Hungary rocks Poland's ultraconservative PiS,no description,https://www.lemonde.fr/en/international/article/2026/04/17/viktor-orban-s-defeat-in-hungary-rocks-poland-s-ultraconservative-pis_6752517_4.html,,True,https://img.lemde.fr/2026/03/28/0/0/9504/6336/198/132/95/0/c773602_ftp-1-1p4h6wwnrccy-c6de762e72d74762927482e9328d37df-0-f7f90a8e9a3045fd834c66853858659d.jpg,
8,"Todd Lyons, acting head of ICE, to step down",no description,https://www.lemonde.fr/en/international/article/2026/04/17/todd-lyons-acting-head-of-immigration-and-customs-enforcement-ice-to-step-down_6752524_4.html,,False,https://img.lemde.fr/2026/04/17/0/0/5506/3671/198/132/95/0/60fc8b7_ftp-1-l6yyylfbmods-5793504-01-06.jpg,
9,Senior UK official steps down after Mandelson vetting scandal,no description,https://www.lemonde.fr/en/international/article/2026/04/17/uk-opposition-call-on-starmer-to-resign-following-new-revelations-around-epstein-associate-peter-mandelson_6752520_4.html,,False,https://img.lemde.fr/2026/04/16/3/0/1312/874/198/132/95/0/ea5d198_ftp-1-bhptus0pr3lp-2026-04-16t163851z-2057724725-rc2ptjad4qes-rtrmadp-3-britain-politics-mandelson.JPG,
10,Pope Leo XIV denounces 'a handful of tyrants' destroying the world during visit to Cameroon,no description,https://www.lemonde.fr/en/international/article/2026/04/17/pope-leo-xiv-denounces-a-handful-of-tyrants-destroying-the-world-during-visit-to-cameroon_6752516_4.html,,True,https://img.lemde.fr/2026/04/16/0/0/5500/3666/198/132/95/0/a878474_ftp-1-12qyvrqe4y6g-2026-04-16t143330z-522095060-rc2dqkadrsk9-rtrmadp-3-pope-africa-cameroon-bamenda.JPG,
11,'Senegal's anti-homosexuality law relies on historical and health claims that are false',no description,https://www.lemonde.fr/en/opinion/article/2026/04/17/senegal-s-anti-homosexuality-law-relies-on-historical-and-health-claims-that-are-false_6752525_23.html,,True,,
12,Palestinian Authority extradites suspect in 1982 Paris attack,no description,https://www.lemonde.fr/en/international/article/2026/04/16/palestinian-authority-extradites-suspect-in-1982-paris-attack_6752514_4.html,,False,,
13,France to reimburse reusable period products for some women,no description,https://www.lemonde.fr/en/health/article/2026/04/16/france-to-reimburse-reusable-period-products-for-some-women_6752512_14.html,,False,,
14,"The body of Sophie Marne, a potential victim of Dominique Pelicot, exhumed",no description,https://www.lemonde.fr/en/france/article/2026/04/16/the-body-of-sophie-marne-a-potential-victim-of-dominique-pelicot-exhumed_6752513_7.html,,False,,
15,Gérard Depardieu drops lawsuit against French broadcaster over report with sexual comments,no description,https://www.lemonde.fr/en/france/article/2026/04/17/gerard-depardieu-drops-lawsuit-against-french-broadcaster_6752533_7.html,,False,,
16,'Do you really think it's Satoshi?' Speculation over bitcoin founder swirls at Paris Blockchain Week,no description,https://www.lemonde.fr/en/pixels/article/2026/04/16/do-you-really-think-it-s-satoshi-speculation-over-bitcoin-founder-swirls-at-paris-blockchain-week_6752500_13.html,,True,,
17,French telecom operators return with higher bid for SFR mobile,no description,https://www.lemonde.fr/en/france/article/2026/04/17/french-telecom-operators-return-with-higher-bid-for-sfr-mobile_6752530_7.html,,False,,
18,France reports over 40 cryptocurrency kidnappings so far this year,no description,https://www.lemonde.fr/en/police-and-justice/article/2026/04/16/france-reports-over-40-cryptocurrency-kidnappings-so-far-this-year_6752508_105.html,,False,,
19,"'After Greenland and Iran, the Hungarian election marks a new step in the transatlantic rift'","The crushing electoral defeat of Hungarian Prime Minister Viktor Orban, despite massive support from Washington, underscores the failure of Donald Trump's ideological campaign in Europe. The gap is widening inexorably, writes Le Monde columnist Sylvie Kauffmann.",https://www.lemonde.fr/en/opinion/article/2026/04/16/after-greenland-and-iran-the-hungarian-election-marks-a-new-step-in-the-transatlantic-rift_6752501_23.html,Sylvie Kauffmann,True,https://img.lemde.fr/2026/04/14/0/0/1665/1110/664/442/75/0/eddaad9_ftp-1-9jkzndybikou-2026-04-14t110232z-1898715734-rc2hkkadr4ej-rtrmadp-3-hungary-election-europe-far-right.JPG,Column
20,Virginie Despentes and over 130 writers quit publishing house after Bolloré fires CEO,"More than 130 writers said they would be leaving the Hachette Livre group after billionaire Vincent Bolloré fired Olivier Nora, the publisher of the Grasset house.",https://www.lemonde.fr/en/france/article/2026/04/16/virginie-despentes-and-over-130-writers-quit-publishing-house-after-bollore-fires-ceo_6752489_7.html,Nicole Vulser,True,https://img.lemde.fr/2026/04/16/0/0/4252/2834/664/442/75/0/927ef84_upload-1-ruoqvr83bubh-maxpeoplefrfour966629.jpg,News
21,How Algeria tried to erase the two suicide attacks during Pope Leo's visit,"Two men blew themselves up on Monday about 40 kilometers from Algiers, without causing any casualties other than themselves. Authorities sought to impose silence on the failed terrorist attack from the official narrative of the historic visit.",https://www.lemonde.fr/en/le-monde-africa/article/2026/04/15/how-algeria-tried-to-erase-the-two-suicide-attacks-during-pope-leo-s-visit_6752443_124.html,Frédéric Bobin and  Simon Roger,True,https://img.lemde.fr/2026/04/14/0/0/8640/5760/664/442/75/0/98f2f9e_ftp-1-wwda1evyadj1-2026-04-14t115227z-164156955-rc2zokaxbpwe-rtrmadp-3-pope-africa-algeria.JPG,In Depth
22,Vincent Bolloré's troubling grip on French publishing,no description,https://www.lemonde.fr/en/opinion/article/2026/04/17/vincent-bollore-s-troubling-grip-on-french-publishing_6752536_23.html,Le Monde,False,,Editorial
23,'Cesar Chavez was no friend to the undocumented whom ICE now persecutes',no description,https://www.lemonde.fr/en/opinion/article/2026/04/16/cesar-chavez-was-no-friend-to-the-undocumented-whom-ice-now-persecutes_6752505_23.html,Sarah M. Quesada,,,Op-Ed
24,'Why not try to remobilize a France that has faith in its future?',no description,https://www.lemonde.fr/en/opinion/article/2026/04/16/2027-french-presidential-election-why-not-try-to-remobilize-a-france-that-has-faith-in-its-future_6752487_23.html,François Godard,,,Op-Ed
