,headline,description,url,byline,premium,image_url,article type
0,Macron and Merz try to revive challenging French-German partnership in Berlin,no description,https://www.lemonde.fr/en/international/article/2025/07/24/macron-and-merz-try-to-revive-challenging-french-german-partnership-in-berlin_6743666_4.html,,True,,
1,Syrian commission of inquiry releases report on mass killings in Alawite regions,no description,https://www.lemonde.fr/en/international/article/2025/07/24/syrian-commission-of-inquiry-releases-report-on-mass-killings-in-alawite-regions_6743665_4.html,,True,,
2,Jihadists are intensifying drone attacks in the Sahel,no description,https://www.lemonde.fr/en/international/article/2025/07/24/jihadists-are-intensifying-drone-attacks-in-the-sahel_6743662_4.html,,True,,
3,Dutch far-right voters waver between doubt and conviction ahead of October elections,no description,https://www.lemonde.fr/en/international/article/2025/07/23/dutch-far-right-voters-waver-between-doubt-and-conviction-ahead-of-october-elections_6743653_4.html,,True,,
4,Early and intense wildfire season has arrived around the Mediterranean,no description,https://www.lemonde.fr/en/europe/article/2025/07/17/wildfire-season-arrives-early-and-intense-around-the-mediterranean_6743466_143.html,,True,,
5,"Srebrenica massacre commemoration: 30 years later, the enduring bitterness of grieving families",no description,https://www.lemonde.fr/en/international/article/2025/07/12/srebrenica-massacre-commemoration-30-years-later-the-enduring-bitterness-of-grieving-families_6743301_4.html,,True,,
6,International justice confronts the genocide of Srebrenica,no description,https://www.lemonde.fr/en/international/article/2025/07/11/international-justice-confronts-the-genocide-of-srebrenica_6743275_4.html,,True,,
7,"In Srebrenica, 30 years after the genocide, the 'vicious circle' of denial continues",no description,https://www.lemonde.fr/en/international/article/2025/07/11/in-srebrenica-30-years-after-the-genocide-the-vicious-circle-of-denial-continues_6743270_4.html,,True,,
8,French culture minister and former Renault CEO will be tried for corruption,no description,https://www.lemonde.fr/en/france/article/2025/07/22/french-culture-minister-and-former-renault-ceo-will-be-tried-for-corruption_6743616_7.html,,True,,
9,A day off or not? Making sense of France's public holidays,no description,https://www.lemonde.fr/en/france/article/2025/07/19/a-day-off-or-not-making-sense-of-france-s-public-holidays_6743515_7.html,,True,,
10,Lebanese militant Georges Ibrahim Abdallah to be released after 40 years in French prison,no description,https://www.lemonde.fr/en/france/article/2025/07/17/lebanese-militant-georges-ibrahim-abdallah-to-be-released-after-40-years-in-french-prison_6743454_7.html,,True,,
11,France's 2026 budget plan includes €5 billion in healthcare cuts,no description,https://www.lemonde.fr/en/france/article/2025/07/16/the-2026-controversial-french-budget-includes-5-billion-in-healthcare-cuts_6743415_7.html,,True,,
12,What is France's 'Black code' and why hasn't it been repealed?,no description,https://www.lemonde.fr/en/videos/video/2025/05/31/what-is-france-s-black-code-and-why-hasn-t-it-been-repealed_6741860_108.html,,False,,
13,How was the European Union created?,no description,https://www.lemonde.fr/en/videos/video/2025/05/29/how-was-the-european-union-created_6741795_108.html,,False,,
14,Glide bombs: Russia's secret to making cheap weapons,no description,https://www.lemonde.fr/en/videos/video/2025/05/25/glide-bombs-russia-s-secret-to-making-cheap-weapons_6741646_108.html,,True,,
15,How does the conclave pick the new pope?,no description,https://www.lemonde.fr/en/videos/video/2025/05/07/how-does-the-conclave-pick-the-new-pope_6741005_108.html,,False,,
16,"In the US, the relentless engine of conspiracy theories",no description,https://www.lemonde.fr/en/opinion/article/2025/07/23/in-the-us-the-relentless-engine-of-conspiracy-theories_6743637_23.html,,False,,
17,"'We, Russian political prisoners, have not lost our voice'",no description,https://www.lemonde.fr/en/opinion/article/2025/07/23/we-russian-political-prisoners-have-not-lost-our-voice_6743626_23.html,,True,,
18,'The passage of Trump's budget bill highlights persistent  political tensions within the American right',no description,https://www.lemonde.fr/en/opinion/article/2025/07/22/the-passage-of-trump-s-budget-bill-highlights-persistent-political-tensions-within-the-american-right_6743606_23.html,,True,,
19,Anti-pesticide petition: An unprecedented grassroots movement,no description,https://www.lemonde.fr/en/opinion/article/2025/07/22/anti-pesticide-petition-an-unprecedented-grassroots-movement_6743605_23.html,,False,,
20,Three erotic experiences inspired by… your wardrobe,no description,https://www.lemonde.fr/en/m-le-mag/article/2025/07/22/three-erotic-experiences-inspired-by-your-wardrobe_6743593_117.html,,True,,
21,The unshakable friendship of Nan Goldin and David Armstrong,no description,https://www.lemonde.fr/en/m-le-mag/article/2025/07/20/the-unshakable-friendship-of-nan-goldin-and-david-armstrong_6743545_117.html,,True,,
22,"Lucy Duff Gordon, a free-spirited couturière erased by history",no description,https://www.lemonde.fr/en/m-le-mag/article/2025/07/20/lucy-duff-gordon-a-free-spirited-couturiere-erased-by-history_6743543_117.html,,True,,
23,"At Paris Museum of Decorative Arts, fashion designer Paul Poiret is king of the image",no description,https://www.lemonde.fr/en/m-le-mag/article/2025/07/20/at-paris-museum-of-decorative-arts-fashion-designer-paul-poiret-is-crowned-king-of-the-image_6743540_117.html,,True,,
24,The challenge of surtitling at the Avignon Festival,no description,https://www.lemonde.fr/en/culture/article/2025/07/20/the-challenge-of-surtitling-at-the-avignon-festival_6743560_30.html,,True,,
25,"In Arles, Fragonard's Museum of Fashion and Costume gracefully unveils treasures",no description,https://www.lemonde.fr/en/m-le-mag/article/2025/07/17/in-arles-fragonard-s-museum-of-fashion-and-costume-gracefully-unveils-treasures_6743450_117.html,,True,,
26,'Paris l'Eté': Summer performing arts festival explores new venues around French capital,no description,https://www.lemonde.fr/en/culture/article/2025/07/16/paris-l-ete-summer-performing-arts-festival-explores-new-venues-around-french-capital_6743418_30.html,,True,,
27,"Avignon Festival: 'When I Saw the Sea', Ali Chahrour's peaceful and political work",no description,https://www.lemonde.fr/en/culture/article/2025/07/10/avignon-festival-when-i-saw-the-sea-ali-chahrour-s-peaceful-and-political-work_6743233_30.html,,True,,
28,EU-US trade war looms as an uneven agreement takes shape,"With one week left before Donald Trump's deadline for a deal, with threats to impose 30% tariffs on European imports, Brussels scrambles to avert a trade war. A partial agreement is emerging, but it remains uncertain given Trump's unpredictability.",https://www.lemonde.fr/en/economy/article/2025/07/24/eu-us-trade-war-looms-as-an-uneven-agreement-takes-shape_6743671_19.html,,True,https://img.lemde.fr/2025/07/23/0/0/6511/4340/400/266/75/0/378d313_upload-1-qqtoyspqgv5s-000-669c9qu.jpg,
29,Macron and Merz try to revive challenging French-German partnership in Berlin,no description,https://www.lemonde.fr/en/international/article/2025/07/24/macron-and-merz-try-to-revive-challenging-french-german-partnership-in-berlin_6743666_4.html,,True,https://img.lemde.fr/2025/07/24/0/0/6000/4000/398/265/75/0/53af9a8_upload-1-kdn4nlhjobve-cbi1267040.jpg,
30,Gaza's population is tormented by thirst in the scorching summer heat,no description,https://www.lemonde.fr/en/international/article/2025/07/24/gaza-s-population-is-tormented-by-thirst-in-the-scorching-summer-heat_6743674_4.html,,True,https://img.lemde.fr/2025/07/23/0/0/5301/3534/398/265/75/0/eb2ecf4_upload-1-ivevem82c3eu-507076.jpg,
31,French ski coach suspended after sexual assault complaints,"The French Ski Federation, which had referred the case to its ethics committee after Le Monde's initial revelations, announced on Wednesday that it had launched a disciplinary procedure and would join the case as a plaintiff.",https://www.lemonde.fr/en/sports/article/2025/07/24/french-ski-coach-suspended-after-sexual-assault-complaints_6743667_9.html,,False,https://img.lemde.fr/2025/07/23/0/4/4248/2832/398/265/75/0/97c29b6_ftp-import-images-1-n41jmfgyuzaf-5478971-01-06.jpg,
32,Syrian commission of inquiry releases report on mass killings in Alawite regions,"The identities of 1,426 victims of the massacres committed in March have been confirmed, and a 'provisional' list of 298 suspects has been drawn up. Yet NGOs fear that the absence of any charges brought against military leaders will lead to a cycle of vengeance and impunity.",https://www.lemonde.fr/en/international/article/2025/07/24/syrian-commission-of-inquiry-releases-report-on-mass-killings-in-alawite-regions_6743665_4.html,,True,https://img.lemde.fr/2025/07/22/0/0/5500/3666/398/265/75/0/b95068e_ftp-import-images-1-k6ma6wo7udrb-2025-07-22t112749z-458675960-rc2nrfan1md6-rtrmadp-3-syria-security-coastal-killings-report.JPG,
33,Jihadists are intensifying drone attacks in the Sahel,"The Sahelian branch of Al-Qaeda, primarily active in Mali and Burkina Faso, has acquired the capacity to arm low-cost devices. This recent expertise has inflicted heavy losses on national armies.",https://www.lemonde.fr/en/international/article/2025/07/24/jihadists-are-intensifying-drone-attacks-in-the-sahel_6743662_4.html,,True,https://img.lemde.fr/2025/07/23/0/0/4999/3333/398/265/75/0/f0ede06_upload-1-mim0zf05aagx-000-1kn50b.jpg,
34,Harry's Bar: A taste of America in Paris,"A Parisian temple to the cocktail, Harry's New York Bar has continued, since its founding in 1911, to attract both Americans on the move and French patrons looking to quench their thirst for all things American. Visitors come to savor perfectly executed classics as well as elegant new creations.",https://www.lemonde.fr/en/lifestyle/article/2025/07/24/harry-s-bar-a-taste-of-america-in-paris_6743672_37.html,Laure Gasparotto,True,https://img.lemde.fr/2025/07/03/0/0/1500/1000/664/442/75/0/b8426b3_ftp-import-images-1-skyfcxa0neig-389212-3429005.jpg,News
35,Plane with 49 people crashes over Russia's Far East,no description,https://www.lemonde.fr/en/international/article/2025/07/24/plane-with-49-people-crashes-over-russia-s-far-east_6743668_4.html,,False,https://img.lemde.fr/2025/07/24/1/0/1000/666/198/132/95/0/811fe37_ftp-import-images-1-7nanlenrn3dm-5484551-01-06.jpg,
36,House subcommittee votes to subpoena Justice Department for Epstein files,no description,https://www.lemonde.fr/en/international/article/2025/07/24/house-subcommittee-votes-to-subpoena-justice-department-for-epstein-files_6743656_4.html,,False,https://img.lemde.fr/2025/07/23/0/0/8193/5462/198/132/95/0/013b113_ftp-import-images-1-uuxlnutzahpn-5482344-01-06.jpg,
37,World's top court paves way for climate reparations,no description,https://www.lemonde.fr/en/international/article/2025/07/23/icj-opinion-says-states-are-legally-obligated-to-tackle-climate-change_6743648_4.html,,False,https://img.lemde.fr/2025/07/23/0/0/8545/5696/198/132/95/0/db58874_ftp-import-images-1-vjqod1kn651d-fc808185d06f426782549ff359f9fbb4-0-bc5e5b3670a84661ab313a7b1a2c7550.jpg,
38,Russia and Ukraine hold third round of talks in Istanbul,no description,https://www.lemonde.fr/en/international/article/2025/07/24/russia-ukraine-begin-third-round-of-talks-in-istanbul_6743654_4.html,,False,https://img.lemde.fr/2025/07/23/0/0/4500/3000/198/132/95/0/e63733f_ftp-import-images-1-fslk4jznmdaq-5481230-01-06.jpg,
39,"'Sorry, Baby,' Eva Victor's fragmented portrait of a young woman grappling with trauma",no description,https://www.lemonde.fr/en/culture/article/2025/07/24/in-sorry-baby-actor-and-director-eva-victor-puts-herself-center-stage-with-a-fragmented-portrait-of-a-young-woman-grappling-with-trauma_6743657_30.html,,True,,
40,Thailand and Cambodia exchange air strikes in escalating border dispute,no description,https://www.lemonde.fr/en/international/article/2025/07/24/thailand-and-cambodia-exchange-air-strikes-in-escalating-border-dispute_6743664_4.html,,False,,
41,Columbia University to pay $200 million in settlement with Trump administration,no description,https://www.lemonde.fr/en/international/article/2025/07/24/columbia-university-to-pay-200-mn-in-clash-with-trump_6743660_4.html,,False,,
42,Why Japan is accepting a 15% tax rate with the US,no description,https://www.lemonde.fr/en/economy/article/2025/07/24/why-japan-is-accepting-a-15-tax-rate-with-the-us_6743655_19.html,,True,,
43,Hamas confirms it has responded to Israel's latest Gaza truce proposal,no description,https://www.lemonde.fr/en/international/article/2025/07/24/hamas-confirms-it-has-responded-to-israel-s-latest-gaza-truce-proposal_6743659_4.html,,False,,
44,Macrons file defamation suit against right-wing US podcaster,no description,https://www.lemonde.fr/en/international/article/2025/07/24/macrons-file-defamation-suit-against-right-wing-us-podcaster_6743658_4.html,,False,,
45,'We're dying in front of the world': Palestinian journalist describes daily famine in Gaza to Le Monde,no description,https://www.lemonde.fr/en/international/video/2025/07/23/we-re-dying-in-front-of-the-world-palestinian-journalist-describes-daily-famine-in-gaza-to-le-monde_6743640_4.html,,False,,
46,"At the Avignon 'Off' Festival, Taiwanese artists give voice to their island",no description,https://www.lemonde.fr/en/culture/article/2025/07/23/at-the-avignon-off-festival-taiwanese-artists-give-voice-to-their-island_6743646_30.html,,True,,
47,How China has relocated its most polluting mines to war-torn Myanmar,"Rare earth elements, essential to various industries, are a growing source of tension between Beijing and the EU, which are set to hold a summit on Thursday, July 24. For decades, their extraction polluted the soil of Jiangxi, a province in southern China. Now, China is exploiting mines in neighboring Myanmar.",https://www.lemonde.fr/en/economy/article/2025/07/23/how-china-has-relocated-its-most-polluting-mines-to-war-torn-myanmar_6743650_19.html,Harold Thibault,True,https://img.lemde.fr/2025/07/21/192/0/4608/3072/664/442/75/0/9047357_upload-1-dvradbbgp2oe-rs10152-header1.png,Feature
48,Dutch far-right voters waver between doubt and conviction ahead of October elections,"In Spijkenisse, a city near Rotterdam, residents who once largely backed the far-right Party for Freedom now waver between disillusionment over the party's promises and anger at right- and left-wing politicians who have failed to meet their expectations.",https://www.lemonde.fr/en/international/article/2025/07/23/dutch-far-right-voters-waver-between-doubt-and-conviction-ahead-of-october-elections_6743653_4.html,Jean-Pierre Stroobants,True,https://img.lemde.fr/2025/07/21/2245/0/6192/4128/664/442/75/0/889c8c7_upload-1-oggqlxmr4njx-jros-spijkenisse-3.jpg,News
49,French ski coach faces sexual assault complaint involving a minor and new accusations,"Following Le Monde's initial revelations about allegations of sexual harassment of minors against Joël Chenal, a former Olympic ski silver medalist, five young women have come forward with new accounts.",https://www.lemonde.fr/en/sports/article/2025/07/23/french-ski-coach-faces-sexual-assault-complaint-involving-a-minor-and-new-accusations_6743633_9.html,Patricia Oudit,True,https://img.lemde.fr/2025/07/22/0/0/1728/1152/664/442/75/0/5373395_upload-1-ae2quqrytqul-000-app1999102945125.jpg,Investigation
50,"In the US, the relentless engine of conspiracy theories",no description,https://www.lemonde.fr/en/opinion/article/2025/07/23/in-the-us-the-relentless-engine-of-conspiracy-theories_6743637_23.html,Le Monde,False,,Editorial
51,French defense industry faces challenge of ramping up production,no description,https://www.lemonde.fr/en/opinion/article/2025/07/21/french-defense-industry-faces-challenge-of-ramping-up-production_6743575_23.html,Le Monde,False,,Editorial
52,'The Epstein case is a new version of the classic conspiracy against authentic America',no description,https://www.lemonde.fr/en/opinion/article/2025/07/20/the-epstein-case-is-a-new-version-of-the-classic-conspiracy-against-authentic-america_6743544_23.html,Julien Giry,,,Op-Ed
