,headline,description,url,byline,premium,image_url,article type
0,Xi and Putin's strategic friendship,no description,https://www.lemonde.fr/en/international/article/2025/09/02/xi-and-putin-s-strategic-friendship_6744954_4.html,,True,,
1,Russia suspected of jamming GPS signal on plane carrying EU head von der Leyen,no description,https://www.lemonde.fr/en/international/article/2025/09/02/russia-suspected-of-jamming-gps-signal-on-plane-carrying-eu-head-von-der-leyen_6744952_4.html,,True,,
2,Ukrainian forces turn to unmanned ground vehicles to counter drones,no description,https://www.lemonde.fr/en/international/article/2025/09/01/ukrainian-forces-turn-to-unmanned-ground-vehicles-to-counter-drones_6744929_4.html,,True,,
3,"With Tianjin summit, Xi puts China at the center of a new anti-Western world order",no description,https://www.lemonde.fr/en/international/article/2025/09/01/with-tianjin-summit-xi-puts-china-at-the-center-of-a-new-anti-western-world-order_6744924_4.html,,True,,
4,France's political instability puts Franco-German alliance to the test,no description,https://www.lemonde.fr/en/opinion/article/2025/08/30/france-s-political-instability-puts-franco-german-alliance-to-the-test_6744873_23.html,,False,,
5,France faces prospect of paying higher borrowing costs than Italy,no description,https://www.lemonde.fr/en/economy/article/2025/08/19/france-faces-prospect-of-paying-higher-borrowing-costs-than-italy_6744519_19.html,,True,,
6,French man arrested in Slovenia for crimes committed in Croatia during 1991 war,no description,https://www.lemonde.fr/en/international/article/2025/08/06/french-man-arrested-in-slovenia-for-crimes-committed-in-croatia-during-1991-war_6744113_4.html,,True,,
7,"30 years after the Bosnian War, its refugees still cannot return home",no description,https://www.lemonde.fr/en/international/article/2025/08/03/thirty-years-after-the-bosnian-war-its-refugees-still-cannot-return-home_6744026_4.html,,True,,
8,"For France's teachers, a back-to-school season marked by growing weariness",no description,https://www.lemonde.fr/en/france/article/2025/09/02/for-france-s-teachers-a-back-to-school-season-marked-by-growing-weariness_6744949_7.html,,True,,
9,Ouahiba Bouzyane's first days in France after arriving from Morocco: 'I never dreamed of leaving my country. Things just turned out that way',no description,https://www.lemonde.fr/en/france/article/2025/09/01/ouahiba-bouzyane-s-first-days-in-france-after-arriving-from-morocco-i-never-dreamed-of-leaving-my-country-things-just-turned-out-that-way_6744912_7.html,,True,,
10,"After the Seine, French swimming activists strive to follow the Parisian example",no description,https://www.lemonde.fr/en/france/article/2025/09/01/after-the-seine-french-swimming-activists-strive-to-follow-the-parisian-example_6744908_7.html,,True,,
11,"France's Socialists declare they are 'ready to govern,' eyeing Bayrou's exit",no description,https://www.lemonde.fr/en/france/article/2025/08/31/france-s-socialists-declare-they-are-ready-to-govern-eyeing-bayrou-s-exit_6744902_7.html,,True,,
12,Watch: Tsunami warnings sound in Japan after 8.8 magnitude quake off Russian coast,no description,https://www.lemonde.fr/en/videos/video/2025/07/30/watch-tsunami-warnings-sound-in-japan-after-8-8-magnitude-quake-off-russian-coast_6743900_108.html,,False,,
13,What is France's 'Black code' and why hasn't it been repealed?,no description,https://www.lemonde.fr/en/videos/video/2025/05/31/what-is-france-s-black-code-and-why-hasn-t-it-been-repealed_6741860_108.html,,False,,
14,How was the European Union created?,no description,https://www.lemonde.fr/en/videos/video/2025/05/29/how-was-the-european-union-created_6741795_108.html,,False,,
15,Glide bombs: Russia's secret to making cheap weapons,no description,https://www.lemonde.fr/en/videos/video/2025/05/25/glide-bombs-russia-s-secret-to-making-cheap-weapons_6741646_108.html,,True,,
16,"'By challenging the Fed's independence, Donald Trump is taking a dangerous gamble'",no description,https://www.lemonde.fr/en/opinion/article/2025/09/02/by-challenging-the-fed-s-independence-donald-trump-embarks-on-a-dangerous-gamble_6744943_23.html,,True,,
17,What is Israel trying to hide by imposing a media blackout on Gaza?,no description,https://www.lemonde.fr/en/opinion/article/2025/09/01/what-is-israel-trying-to-hide-by-imposing-a-media-blackout-on-gaza_6744922_23.html,,False,,
18,'How can the US justify sanctioning ICC judges for their judicial activity?',no description,https://www.lemonde.fr/en/opinion/article/2025/09/01/how-can-the-us-justify-sanctioning-icc-judges-for-their-judicial-activity_6744920_23.html,,True,,
19,Hamas bears overwhelming responsibility for the Palestinian catastrophe,no description,https://www.lemonde.fr/en/opinion/article/2025/08/31/hamas-bears-overwhelming-responsibility-for-the-palestinian-catastrophe_6744897_23.html,,True,,
20,"Lorde, New Zealand electropop sensation: 'With 'Virgin,' I wanted to document my femininity'",no description,https://www.lemonde.fr/en/m-le-mag/article/2025/08/31/lorde-new-zealand-electropop-sensation-with-virgin-i-wanted-to-document-my-femininity_6744888_117.html,,True,,
21,The letters from two Ukrainian sisters: 'I'm almost grateful I experienced the attacks. Now I know what my loved ones go through',no description,https://www.lemonde.fr/en/m-le-mag/article/2025/08/30/the-letters-from-two-ukrainian-sisters-i-m-almost-grateful-to-have-experienced-the-attacks-now-i-know-what-my-loved-ones-go-through_6744874_117.html,,True,,
22,"Vanessa Paradis, a French icon",no description,https://www.lemonde.fr/en/m-le-mag/article/2025/08/30/vanessa-paradis-a-french-icon_6744859_117.html,,True,,
23,Argentina falls in love with a poetic livestream from the ocean: 'Patrick Star is Argentinian!',no description,https://www.lemonde.fr/en/m-le-mag/article/2025/08/29/how-argentina-fell-in-love-with-a-poetic-live-stream-from-the-depths-of-the-ocean-patrick-the-starfish-is-argentinian_6744822_117.html,,True,,
24,"At Musée d'Orsay, a Courbet painting gets a new life before visitors' eyes",no description,https://www.lemonde.fr/en/culture/article/2025/07/26/at-musee-d-orsay-a-courbet-painting-gets-a-new-life-before-visitors-eyes_6743744_30.html,,True,,
25,Avignon Festival 2025: An edition marked by emotion and fragility,no description,https://www.lemonde.fr/en/culture/article/2025/07/26/avignon-festival-2025-an-edition-marked-by-emotion-and-fragility_6743733_30.html,,True,,
26,The challenge of surtitling at the Avignon Festival,no description,https://www.lemonde.fr/en/culture/article/2025/07/20/the-challenge-of-surtitling-at-the-avignon-festival_6743560_30.html,,True,,
27,"In Arles, Fragonard's Museum of Fashion and Costume gracefully unveils treasures",no description,https://www.lemonde.fr/en/m-le-mag/article/2025/07/17/in-arles-fragonard-s-museum-of-fashion-and-costume-gracefully-unveils-treasures_6743450_117.html,,True,,
28,French budget minister: 'France cannot go an entire year without a budget',"With the French government at risk of collapsing, Amélie de Montchalin says in an interview that the deadline to submit a draft budget to the Assemblée Nationale is October 13. Any later and a special law would be required to avoid a shutdown, which she sees as a problematic last resort.",https://www.lemonde.fr/en/politics/article/2025/09/02/french-budget-minister-france-cannot-go-an-entire-year-without-a-budget_6744966_5.html,,True,https://img.lemde.fr/2025/09/01/1849/0/4000/2666/400/266/75/0/34340f1_upload-1-7sorpc47zyyk-kzihnioglu-montchalin-entretien-01092025-04.JPG,
29,Xi and Putin's strategic friendship,no description,https://www.lemonde.fr/en/international/article/2025/09/02/xi-and-putin-s-strategic-friendship_6744954_4.html,,True,https://img.lemde.fr/2025/09/02/30/0/5677/3784/398/265/75/0/7a51e47_ftp-import-images-1-kjaz0t2t8mjt-5774072-01-06.jpg,
30,French court issues arrest warrant for Assad over journalists' deaths in Syria,no description,https://www.lemonde.fr/en/international/article/2025/09/02/french-court-issues-arrest-warrants-for-assad-over-journalists-deaths-in-syria_6744967_4.html,,False,https://img.lemde.fr/2025/09/02/0/0/4216/2810/398/265/75/0/3fc7c61_upload-1-yp8n473je20k-3fc7c61-upload-1-8pobx6x3ou1o-000-33p83y2.jpg,
31,Afghanistan earthquake rescue efforts slowed by lack of resources,"The earthquake that struck near Jalalabad, in eastern Afghanistan, overnight from Sunday to Monday has left more than 1,400 people dead and 3,000 injured. The difficulty in accessing some remote valleys and the shortcomings of the Taliban regime have raised fears of an even higher death toll.",https://www.lemonde.fr/en/environment/article/2025/09/02/scant-resources-delay-rescue-efforts-after-afghanistan-earthquake_6744964_114.html,,True,https://img.lemde.fr/2025/09/01/0/6/6036/4024/398/265/75/0/45696d5_ftp-import-images-1-kltywutmrr6r-5770497-01-06.jpg,
32,Italy retorts after 'fiscal dumping' remarks by French MP Bayrou revive tensions,"The French prime minister's comments regarding Italian tax policy for the ultra-wealthy sparked outrage in Italy on Sunday, including from Prime Minister Giorgia Meloni, who emphasized the stability of her government.",https://www.lemonde.fr/en/economy/article/2025/09/02/italy-retorts-after-fiscal-dumping-remarks-by-french-mp-bayrou-revive-tensions_6744959_19.html,,True,https://img.lemde.fr/2025/09/02/0/0/7853/5235/398/265/75/0/70b22fc_upload-1-zd56mtgkzt8y-000-63qr97l.jpg,
33,Venice Film Festival: Julia Roberts shines in Luca Guadagnino's 'After the Hunt',"The American actress plays a woman torn between ambition and principle in this film, presented out of competition, which examines morality and ethics in the wake of #MeToo.",https://www.lemonde.fr/en/culture/article/2025/09/02/venice-film-festival-julia-roberts-shines-in-luca-guadagnino-s-after-the-hunt_6744957_30.html,,True,https://img.lemde.fr/2025/08/29/0/2/5388/3592/398/265/75/0/987479b_ftp-import-images-1-1kcmj7whxafy-5745502-01-06.jpg,
34,"Thomas Piketty: 'To succeed in the climate transition, we must redistribute wealth differently'","In an interview with Le Monde, the French economist explains that protecting the planet from climate change cannot be achieved without reducing inequality.",https://www.lemonde.fr/en/economy/article/2025/09/02/thomas-piketty-to-succeed-in-the-climate-transition-we-must-redistribute-wealth-differently_6744947_19.html,Cécile Cazenave and  Nabil Wakim,True,https://img.lemde.fr/2025/07/31/0/44/3277/2185/664/442/75/0/f20120f_upload-1-0uy2httchsz0-img-3724.jpg,Interview
35,Gérard Depardieu ordered to stand trial for rape,no description,https://www.lemonde.fr/en/france/article/2025/09/02/gerard-depardieu-ordered-to-stand-trial-for-rape_6744962_7.html,,False,https://img.lemde.fr/2025/09/02/0/0/6158/4105/198/132/95/0/7b13ac8_ftp-import-images-1-wq3f4hziokdo-5775453-01-06.jpg,
36,Afghanistan earthquake rescue efforts slowed by lack of resources,no description,https://www.lemonde.fr/en/environment/article/2025/09/02/scant-resources-delay-rescue-efforts-after-afghanistan-earthquake_6744964_114.html,,True,https://img.lemde.fr/2025/09/01/0/6/6036/4024/198/132/95/0/45696d5_ftp-import-images-1-kltywutmrr6r-5770497-01-06.jpg,
37,"Heavy rains and 'massive' landslide kill more than 1,000 in Sudan, rebel group says",no description,https://www.lemonde.fr/en/le-monde-africa/article/2025/09/02/heavy-rains-and-massive-landslide-kill-over-1-000-in-darfur-says-rebel-group-controlling-the-area_6744948_124.html,,False,https://img.lemde.fr/2025/09/02/0/160/1728/1152/198/132/95/0/5ffe5db_ftp-import-images-1-p3wtr6ro0qsw-5774479-01-06.jpg,
38,Belgium to recognize Palestinian state at UN General Assembly,no description,https://www.lemonde.fr/en/international/article/2025/09/02/belgium-to-recognize-palestinian-state-at-un-general-assembly_6744950_4.html,,False,https://img.lemde.fr/2025/09/02/0/63/2683/1789/198/132/95/0/b4bd745_ftp-import-images-1-w29jpem74aln-2025-09-02t065323z-1553299967-rc2hjgax8jgb-rtrmadp-3-israel-palestinians-gaza.JPG,
39,Nestlé sacks CEO over 'undisclosed romantic relationship' in the office,no description,https://www.lemonde.fr/en/economy/article/2025/09/01/nestle-sacks-ceo-over-undisclosed-romantic-office-relationship_6744936_19.html,,False,,
40,Louvre says 'game over' to its Nintendo 3DS visitor guide,no description,https://www.lemonde.fr/en/pixels/article/2025/09/02/louvre-says-game-over-to-its-nintendo-3ds-visitor-guide_6744946_13.html,,True,,
41,French bond yield reaches 14-year high amid political turmoil,no description,https://www.lemonde.fr/en/france/article/2025/09/02/french-bond-yield-reaches-14-year-high-amid-political-turmoil_6744958_7.html,,False,,
42,COP30: Exorbitant housing prices in Belém threaten to derail climate summit,no description,https://www.lemonde.fr/en/environment/article/2025/09/02/cop30-exorbitant-housing-prices-in-belem-threaten-to-derail-climate-summit_6744945_114.html,,True,,
43,Russia suspected of jamming GPS signal on plane carrying EU head von der Leyen,no description,https://www.lemonde.fr/en/international/article/2025/09/02/russia-suspected-of-jamming-gps-signal-on-plane-carrying-eu-head-von-der-leyen_6744952_4.html,,True,,
44,"For France's teachers, a back-to-school season marked by growing weariness",no description,https://www.lemonde.fr/en/france/article/2025/09/02/for-france-s-teachers-a-back-to-school-season-marked-by-growing-weariness_6744949_7.html,,True,,
45,"In Saint-Louis, the Fondation Fernet-Branca swaps stills for contemporary art",no description,https://www.lemonde.fr/en/summer-reads/article/2025/09/02/in-saint-louis-eastern-france-the-fondation-fernet-branca-swaps-stills-for-contemporary-art_6744941_183.html,,True,,
46,France returns skull of beheaded king to Madagascar,no description,https://www.lemonde.fr/en/international/article/2025/09/02/france-returns-skull-of-beheaded-king-to-madagascar_6744961_4.html,,False,,
47,"'By challenging the Fed's independence, Donald Trump is taking a dangerous gamble'","Repeated attacks on the central bank, meant to force it to lower interest rates, in defiance of economic data, threaten financial stability. Disregarding reality for political convenience can have dramatic consequences, writes Le Monde columnist Stéphane Lauer.",https://www.lemonde.fr/en/opinion/article/2025/09/02/by-challenging-the-fed-s-independence-donald-trump-embarks-on-a-dangerous-gamble_6744943_23.html,Stéphane Lauer,True,https://img.lemde.fr/2025/08/31/0/0/6000/4000/664/442/75/0/28e9cd3_ftp-import-images-1-y3ypwhgvuljk-5fcf67922ed94296b53f786c09535658-1-06814fa593c14c599b96fa5c06704ea0.jpg,Column
48,The discreet rise of facial recognition around the world,"Driven by artificial intelligence and backed by some political leaders as well as private companies, this highly sensitive technology is becoming commonplace in many countries and is making inroads across Europe.",https://www.lemonde.fr/en/pixels/article/2025/09/01/the-discreet-rise-of-facial-recognition-around-the-world_6744911_13.html,"Floriane Picard,  Benjamin Martinez and  Marjorie Cessac",True,https://img.lemde.fr/2025/06/27/0/0/6000/4000/664/442/75/0/18fddf7_upload-1-wg2adhz2i0bl-000-362l8t6.jpg,Investigation
49,Ukrainian forces turn to unmanned ground vehicles to counter drones,Specialized Ukrainian units using unmanned ground vehicles are emerging across all brigades. These machines already carry out most supply runs and evacuations on the front lines.,https://www.lemonde.fr/en/international/article/2025/09/01/ukrainian-forces-turn-to-unmanned-ground-vehicles-to-counter-drones_6744929_4.html,Emmanuel Grynszpan,True,https://img.lemde.fr/2025/08/31/0/0/4300/2866/664/442/75/0/1e1b5bd_upload-1-q53yurflsf9d-hl-vnguyenhoang-sujet-crt-nrk-026.jpg,Feature
50,What is Israel trying to hide by imposing a media blackout on Gaza?,no description,https://www.lemonde.fr/en/opinion/article/2025/09/01/what-is-israel-trying-to-hide-by-imposing-a-media-blackout-on-gaza_6744922_23.html,Le Monde,False,,Editorial
51,France: Compromising on a budget is necessary to avoid spiraling debt,no description,https://www.lemonde.fr/en/opinion/article/2025/08/29/france-compromising-on-a-budget-is-necessary-to-avoid-spiraling-debt_6744839_23.html,Le Monde,False,,Editorial
52,'How can the US justify sanctioning ICC judges for their judicial activity?',no description,https://www.lemonde.fr/en/opinion/article/2025/09/01/how-can-the-us-justify-sanctioning-icc-judges-for-their-judicial-activity_6744920_23.html,"Bruno Cotte, Claude Jorda  and  Jean-Pierre Getti",,,Op-Ed
