,headline,description,url,byline,premium,image_url,article type
0,Nestlé says chairman Paul Bulcke to step down,no description,https://www.lemonde.fr/en/international/article/2025/09/16/nestle-says-chairman-paul-bulcke-to-step-down_6745461_4.html,,False,,
1,"Francesca Albanese, a critical Western voice on Gaza",no description,https://www.lemonde.fr/en/international/article/2025/09/16/francesca-albanese-a-critical-western-voice-on-gaza_6745458_4.html,,True,,
2,"Israel has committed genocide in Gaza, according to a UN commission",no description,https://www.lemonde.fr/en/international/article/2025/09/16/war-in-gaza-israel-has-committed-genocide-according-to-a-un-commission_6745456_4.html,,True,,
3,"After Kirk assassination, Trump administration promises crackdown on 'radical left'",no description,https://www.lemonde.fr/en/international/article/2025/09/16/after-kirk-assassination-trump-administration-promises-crackdown-on-radical-left_6745449_4.html,,True,,
4,Sanctions against Russia spark rift between US and Europe over China,no description,https://www.lemonde.fr/en/international/article/2025/09/15/sanctions-against-russia-spark-rift-between-us-and-europe-over-china_6745411_4.html,,True,,
5,France's political instability puts Franco-German alliance to the test,no description,https://www.lemonde.fr/en/opinion/article/2025/08/30/france-s-political-instability-puts-franco-german-alliance-to-the-test_6744873_23.html,,False,,
6,France faces prospect of paying higher borrowing costs than Italy,no description,https://www.lemonde.fr/en/economy/article/2025/08/19/france-faces-prospect-of-paying-higher-borrowing-costs-than-italy_6744519_19.html,,True,,
7,French man arrested in Slovenia for crimes committed in Croatia during 1991 war,no description,https://www.lemonde.fr/en/international/article/2025/08/06/french-man-arrested-in-slovenia-for-crimes-committed-in-croatia-during-1991-war_6744113_4.html,,True,,
8,UK-France migrant return agreement expected to be implemented in coming days,no description,https://www.lemonde.fr/en/france/article/2025/09/16/uk-france-migrant-return-agreement-expected-to-be-implemented-in-coming-days_6745443_7.html,,True,,
9,French border police accused of causing shipwrecks and deaths of migrants from Comoros,no description,https://www.lemonde.fr/en/france/article/2025/09/16/french-border-police-accused-of-causing-shipwrecks-and-deaths-of-migrants-from-comoros_6745457_7.html,,True,,
10,French authorities shift interception strategy in English Channel,no description,https://www.lemonde.fr/en/france/article/2025/09/16/french-authorities-shift-interception-strategy-in-english-channel_6745450_7.html,,True,,
11,The women of the Clain family: A story of ordinary jihadism,no description,https://www.lemonde.fr/en/france/article/2025/09/16/the-women-of-the-clain-family-a-story-of-ordinary-jihadism_6745436_7.html,,True,,
12,Emmys 2025: 'Adolescence' star Owen Cooper becomes youngest winner for best supporting actor,no description,https://www.lemonde.fr/en/videos/video/2025/09/15/emmys-2025-adolescence-star-owen-cooper-becomes-youngest-winner-for-best-supporting-actor_6745427_108.html,,False,,
13,"From 'influence peddling' to 'corruption,' what is French Culture Minister Rachida Dati accused of?",no description,https://www.lemonde.fr/en/videos/video/2025/09/06/from-influence-peddling-to-corruption-what-is-french-culture-minister-rachida-dati-accused-of_6745094_108.html,,False,,
14,Watch: Tsunami warnings sound in Japan after 8.8 magnitude quake off Russian coast,no description,https://www.lemonde.fr/en/videos/video/2025/07/30/watch-tsunami-warnings-sound-in-japan-after-8-8-magnitude-quake-off-russian-coast_6743900_108.html,,False,,
15,What is France's 'Black code' and why hasn't it been repealed?,no description,https://www.lemonde.fr/en/videos/video/2025/05/31/what-is-france-s-black-code-and-why-hasn-t-it-been-repealed_6741860_108.html,,False,,
16,'Monopoly capitalism in the US leads to underinvestment and to the concentration of wealth',no description,https://www.lemonde.fr/en/opinion/article/2025/09/16/in-the-united-states-monopoly-capitalism-leads-to-underinvestment-and-to-the-concentration-of-wealth_6745435_23.html,,True,,
17,"Nathalie Loiseau, MEP: 'After the assassination of Charlie Kirk, silence speaks louder than words'",no description,https://www.lemonde.fr/en/opinion/article/2025/09/16/nathalie-loiseau-mep-after-the-assassination-of-charlie-kirk-silence-speaks-louder-than-words_6745455_23.html,,True,,
18,"The Bayeux Tapestry, a barometer of Franco-British relations",no description,https://www.lemonde.fr/en/opinion/article/2025/09/16/the-bayeux-tapestry-a-barometer-of-franco-british-relations_6745451_23.html,,True,,
19,Russian drones put NATO to the test,no description,https://www.lemonde.fr/en/opinion/article/2025/09/16/russian-drones-put-nato-to-the-test_6745444_23.html,,False,,
20,"Hôtel California, a family passion",no description,https://www.lemonde.fr/en/m-le-mag/article/2025/09/14/hotel-california-a-family-passion_6745373_117.html,,True,,
21,'They want us to be big but without any fat': Plus-size models face return of thinness in the fashion industry,no description,https://www.lemonde.fr/en/m-le-mag/article/2025/09/13/they-want-us-to-be-big-but-without-any-fat-plus-size-models-face-return-of-thinness-in-the-fashion-industry_6745350_117.html,,True,,
22,Blessed with fortune: India's Hare Krishna mega-temple backed by a Ford heir,no description,https://www.lemonde.fr/en/m-le-mag/article/2025/09/10/blessed-with-fortune-india-s-hare-krishna-mega-temple-backed-by-a-ford-heir_6745215_117.html,,True,,
23,Serbian women are leading the frontlines of country's anti-corruption movement,no description,https://www.lemonde.fr/en/m-le-mag/article/2025/09/07/serbian-women-are-leading-the-frontlines-of-country-s-anti-corruption-movement_6745131_117.html,,True,,
24,Tradition done right: Five Paris restaurants reimagining the classics,no description,https://www.lemonde.fr/en/lifestyle/article/2025/09/08/tradition-done-right-five-paris-restaurants-reimagining-the-classics_6745133_37.html,,True,,
25,Paris Design Week: A 15th edition marked by abundance,no description,https://www.lemonde.fr/en/lifestyle/article/2025/09/05/paris-design-week-a-15th-edition-marked-by-abundance_6745060_37.html,,True,,
26,It's pain suisse time! Five places in and around Paris to find this treat,no description,https://www.lemonde.fr/en/lifestyle/article/2025/09/04/it-s-pain-suisse-time-five-places-in-the-paris-region-to-find-this-treat_6745022_37.html,,True,,
27,"At Musée d'Orsay, a Courbet painting gets a new life before visitors' eyes",no description,https://www.lemonde.fr/en/culture/article/2025/07/26/at-musee-d-orsay-a-courbet-painting-gets-a-new-life-before-visitors-eyes_6743744_30.html,,True,,
28,French border police accused of causing shipwrecks and deaths of migrants from Comoros,"Since 2010, several hundred Comorians have died at sea while trying to reach the French overseas territory of Mayotte. A joint investigation by Le Monde and Lighthouse Reports shows that police maneuvers are implicated in several of these shipwrecks.",https://www.lemonde.fr/en/france/article/2025/09/16/french-border-police-accused-of-causing-shipwrecks-and-deaths-of-migrants-from-comoros_6745457_7.html,,True,https://img.lemde.fr/2025/09/10/1336/0/4500/3000/400/266/75/0/b5705bd_upload-1-6dhqw4sp4gsg-mfache-26122024-le-monde-portait-de-farid-djassadi-mayotte-010.jpg,
29,"Israel has committed genocide in Gaza, according to a UN commission",no description,https://www.lemonde.fr/en/international/article/2025/09/16/war-in-gaza-israel-has-committed-genocide-according-to-a-un-commission_6745456_4.html,,True,https://img.lemde.fr/2025/09/14/0/0/6000/4000/398/265/75/0/032f723_ftp-import-images-1-6ttzexazb7h2-5885372-01-06.jpg,
30,"Robert Redford, legend of American cinema, dies at 89",no description,https://www.lemonde.fr/en/obituaries/article/2025/09/16/robert-redford-legend-of-american-cinema-dies-at-89_6745453_15.html,,True,https://img.lemde.fr/2025/09/16/1512/0/3545/2363/398/265/75/0/28a63d9_upload-1-6i9qophgpgwl-28a63d9-upload-1-ysjzt77ovm5f-nyc33907.jpg,
31,Nestlé says chairman Paul Bulcke to step down,"Bulcke, who has been scheduled to remain in his position until next April, said in a statement on Tuesday that he had 'full trust in Nestlé's new leadership' after Nespresso CEO Philipp Navratil was appointed to take over by his fellow board members.",https://www.lemonde.fr/en/international/article/2025/09/16/nestle-says-chairman-paul-bulcke-to-step-down_6745461_4.html,,False,https://img.lemde.fr/2025/09/05/0/0/5184/3456/398/265/75/0/1c21002_ftp-import-images-1-zxmotb1blsay-2025-09-05t060022z-763609915-rc2hlgaadguf-rtrmadp-3-nestle-ceo.JPG,
32,"Suspect in Charlie Kirk killing charged with murder, Utah seeks death penalty","Authorities said Tyler Robinson, 22, used a rifle to shoot the conservative political activist with a single bullet to the neck from a rooftop on September 10. Robinson is facing six other charges, including obstruction of justice and witness tampering. Utah County Attorney Jeff Gray told a press conference that he is seeking the death penalty.",https://www.lemonde.fr/en/international/article/2025/09/16/suspect-in-charlie-kirk-killing-charged-with-murder_6745460_4.html,,False,https://img.lemde.fr/2025/09/16/0/0/2400/1600/398/265/75/0/8aa30bf_ftp-import-images-1-2le8nflkculp-2025-09-16t190717z-881210525-rc2eqga95ric-rtrmadp-3-usa-shooting-kirk.JPG,
33,"The Bayeux Tapestry, a barometer of Franco-British relations","France's decision to lend the nearly 1,000-year-old tapestry to the United Kingdom represents part of the long and tumultuous relationship between the two countries; Brexit supporters had even turned the tapestry into a symbol of national humiliation.",https://www.lemonde.fr/en/opinion/article/2025/09/16/the-bayeux-tapestry-a-barometer-of-franco-british-relations_6745451_23.html,,True,https://img.lemde.fr/2025/08/19/0/0/7830/5220/398/265/75/0/71b1495_ftp-import-images-1-mmidlliew9oc-2025-08-19t114447z-1562547645-rc24jfajm00t-rtrmadp-3-britain-france-bayeux-tapestry.JPG,
34,"Francesca Albanese, a critical Western voice on Gaza","At a conference at a left-wing festival near Paris, the UN special rapporteur on the occupied Palestinian territories received a standing ovation after denouncing European governments' inaction over Israel's destruction of Gaza. Her stance has drawn accusations of antisemitism and activism from critics.",https://www.lemonde.fr/en/international/article/2025/09/16/francesca-albanese-a-critical-western-voice-on-gaza_6745458_4.html,"Allan Kaval,  Benjamin Barthe and  Madjid Zerrouky",True,https://img.lemde.fr/2025/09/12/1472/0/4016/2677/664/442/75/0/3c57dd1_upload-1-b3rgpuq3t7cl-francesca-alabanese-le-monde-12.jpg,Profile
35,Israel attacks Gaza City as Netanyahu casts himself as a victim amid risk of isolation,no description,https://www.lemonde.fr/en/international/article/2025/09/16/israel-attacks-gaza-city-as-netanyahu-casts-himself-as-a-victim-amid-risk-of-isolation_6745442_4.html,,True,https://img.lemde.fr/2025/09/16/0/0/5088/3392/198/132/95/0/2404a61_ftp-import-images-1-lsq7rzwhyzgw-5902739-01-06.jpg,
36,Luigi Mangione to stand trial December 1 in CEO assassination case,no description,https://www.lemonde.fr/en/international/article/2025/09/16/luigi-mangione-to-stand-trial-december-1-in-ceo-assassination-case_6745459_4.html,,False,https://img.lemde.fr/2025/09/16/0/0/3000/2000/198/132/95/0/d4716de_ftp-import-images-1-0qc59yapltcb-e6425241834242658350c04d6f25f982-0-38e5f59ef3984ea99aa36c1b36cdd70a.jpg,
37,An abbey in southern France rescued by contemporary art,no description,https://www.lemonde.fr/en/summer-reads/article/2025/09/16/an-abbey-in-southern-france-rescued-by-contemporary-art_6745448_183.html,,True,https://img.lemde.fr/2025/08/19/0/2/5460/3640/198/132/95/0/6f3be0b_upload-1-3ozik6u4et9x-abbaye-notre-dame-de-beaulieu-en-rouergue-coi-tei-sud-vue-aei-rienne-a-cmn.jpg,
38,"Nathalie Loiseau, MEP: 'After the assassination of Charlie Kirk, silence speaks louder than words'",no description,https://www.lemonde.fr/en/opinion/article/2025/09/16/nathalie-loiseau-mep-after-the-assassination-of-charlie-kirk-silence-speaks-louder-than-words_6745455_23.html,,True,https://img.lemde.fr/2025/09/10/0/0/6924/4616/198/132/95/0/e816112_ftp-import-images-1-ogp1x7b8c8dq-5847447-01-06.jpg,
39,French culture minister investigated over luxury jewelry,no description,https://www.lemonde.fr/en/france/article/2025/09/16/french-culture-minister-investigated-over-luxury-jewelry_6745454_7.html,,False,,
40,Luxembourg says it will recognize State of Palestine at UN summit,no description,https://www.lemonde.fr/en/international/article/2025/09/16/luxembourg-says-it-will-recognize-state-of-palestine-at-un-summit_6745447_4.html,,False,,
41,"Jerome Powell, the US economy's compass",no description,https://www.lemonde.fr/en/economy/article/2025/09/15/jerome-powell-the-us-economy-s-compass_6745430_19.html,,True,,
42,Gaza's students sit final exams amid bombs and famine,no description,https://www.lemonde.fr/en/international/article/2025/09/16/gaza-s-students-sit-final-exams-amid-bombs-and-famine_6745438_4.html,,True,,
43,"After Kirk assassination, Trump administration promises crackdown on 'radical left'",no description,https://www.lemonde.fr/en/international/article/2025/09/16/after-kirk-assassination-trump-administration-promises-crackdown-on-radical-left_6745449_4.html,,True,,
44,"'French workers face not a Great Resignation, but a great disappointment'",no description,https://www.lemonde.fr/en/opinion/article/2025/09/16/french-workers-face-not-a-great-resignation-but-a-great-disappointment_6745439_23.html,,True,,
45,European textile industry urges EU to take action against Chinese platforms like Shein,no description,https://www.lemonde.fr/en/economy/article/2025/09/16/european-textile-industry-urges-eu-to-take-action-against-chinese-platforms-like-shein_6745445_19.html,,True,,
46,"EU scales back its plan to ban PFAS 'forever chemicals,' sparking outrage among NGOs",no description,https://www.lemonde.fr/en/environment/article/2025/09/15/pfas-eu-scales-back-its-plan-to-ban-forever-chemicals-sparking-outrage-among-ngos_6745423_114.html,,True,,
47,The Paris district where Parisians are priced out,"In 50 years, the 8th arrondissement of the French capital, home to the Champs-Elysées and the 'Golden Triangle,' has lost nearly half its population. The mass acquisition of real estate by ultra-wealthy foreigners has driven locals out.",https://www.lemonde.fr/en/france/article/2025/09/15/the-paris-district-where-parisians-are-priced-out_6745404_7.html,Manon Romain and  Véronique Chocron,True,https://img.lemde.fr/2025/09/13/2/0/6000/4000/664/442/75/0/5fca777_upload-1-qh2pw7j6zdh0-rea10510489.jpg,In Depth
48,"France's best art exhibitions this fall, in Paris and beyond","Here is Le Monde's selection of must-see art exhibitions, from painter John Singer Sargent to medieval forgeries to contemporary Nigerian artist Otobong Nkanga, which will go on display through the end of the year.",https://www.lemonde.fr/en/culture/article/2025/09/06/france-s-best-art-exhibitions-this-fall-in-paris-and-beyond_6745083_30.html,,True,https://img.lemde.fr/2025/08/28/0/165/7347/4898/664/442/75/0/c4966ff_upload-1-iqnyqnwoglxn-vassily-kandinsky-gelb-rot-blau-jaune-rouge-bleu-1925-a-a-centre-pompidou-mnam-cci-adam-rzepka-dist-grandpalaisrmn.jpg,Selection
49,Qatar owns 20% of property on Paris' Champs-Elysées,"By reviewing land registry records, Le Monde determined that one-fifth of the facades on Paris's prestigious avenue are owned by the small Gulf monarchy.",https://www.lemonde.fr/en/france/article/2025/09/15/qatar-owns-20-of-property-on-paris-champs-elysees_6745416_7.html,Manon Romain and  Véronique Chocron,True,https://img.lemde.fr/2025/09/14/0/1/4030/2687/664/442/75/0/1d23ab4_upload-1-gh2xhgeaommn-2022-05-23t103749z-790085221-rc2xcu9rkbw5-rtrmadp-3-france-security-qatar.JPG,News
50,Russian drones put NATO to the test,no description,https://www.lemonde.fr/en/opinion/article/2025/09/16/russian-drones-put-nato-to-the-test_6745444_23.html,Le Monde,False,,Editorial
51,'Trump's battle against activist art is part of a fierce debate already playing out in museums around the world',no description,https://www.lemonde.fr/en/opinion/article/2025/09/15/trump-s-battle-against-activist-art-is-part-of-a-fierce-debate-already-playing-out-in-museums-around-the-world_6745402_23.html,Michel Guerrin,,https://img.lemde.fr/2025/02/13/0/0/0/0/100/100/60/0/582cc7b_sirius-fs-upload-1-s35ik04v2mji-1739442860260-capture-da-a-cran-2025-02-13-113357.png,Column
52,The US-Israeli war against Gaza,no description,https://www.lemonde.fr/en/international/article/2025/09/14/the-us-israeli-war-against-gaza_6745377_4.html,Jean-Pierre Filiu,,https://img.lemde.fr/2023/07/31/0/0/0/0/100/100/60/0/d45bb07_1690791602941-eac5c14-1647333440018-jean-pierre-filiu-2019.jpg,Column
