,headline,description,url,byline,premium,image_url,article type
0,The US Supreme Court hands Trump a sweeping victory by limiting the power of federal judges,no description,https://www.lemonde.fr/en/international/article/2025/06/28/the-us-supreme-court-hands-trump-a-sweeping-victory-by-limiting-the-power-of-federal-judges_6742814_4.html,,True,,
1,"The young women enlisting in Ukraine's army: 'In the army, you have to show you've got balls!'",no description,https://www.lemonde.fr/en/international/article/2025/06/28/the-young-women-enlisting-in-ukraine-s-army-in-the-army-you-have-to-show-you-ve-got-balls_6742813_4.html,,True,,
2,"By banning the Budapest Pride march, Orban is trying to divide his opposition",no description,https://www.lemonde.fr/en/international/article/2025/06/28/by-banning-the-budapest-pride-march-viktor-orban-is-trying-to-divide-his-opposition_6742804_4.html,,True,,
3,Ukraine fears US arms deliveries will be diverted to Israel,no description,https://www.lemonde.fr/en/international/article/2025/06/27/ukraine-fears-us-arms-deliveries-will-be-diverted-to-israel_6742778_4.html,,True,,
4,Europe in an untenable position after US bombings of Iran,no description,https://www.lemonde.fr/en/europe/article/2025/06/23/europe-in-an-untenable-position-after-us-bombings-of-iran_6742626_143.html,,True,,
5,EU lawmakers seek to end statute of limitations for child sex abuse cases,no description,https://www.lemonde.fr/en/europe/article/2025/06/17/eu-lawmakers-seek-to-end-statute-of-limitations-for-child-sex-abuse-cases_6742434_143.html,,False,,
6,"Criticism is mounting in the Netherlands against Geert Wilders, who brought down the government",no description,https://www.lemonde.fr/en/international/article/2025/06/04/in-the-netherlands-criticism-is-mounting-against-geert-wilders-who-triggered-the-fall-of-the-government_6741987_4.html,,True,,
7,"Five years after Brexit, UK and EU aim for a fresh start",no description,https://www.lemonde.fr/en/international/article/2025/05/19/five-years-after-brexit-uk-and-eu-aim-for-a-fresh-start_6741415_4.html,,True,,
8,"A fake wedding at Disneyland, but a real pedophile fantasy",no description,https://www.lemonde.fr/en/france/article/2025/06/27/a-fake-wedding-at-disneyland-but-a-real-pedophile-fantasy_6742790_7.html,,True,,
9,Medical deserts: France takes new step in 'solidarity mission' to increase doctors in 151 red zones,no description,https://www.lemonde.fr/en/france/article/2025/06/27/medical-deserts-france-takes-new-step-in-solidarity-mission-to-increase-doctors-in-151-red-zones_6742775_7.html,,True,,
10,"Le Pen, Bardella and the slow poison of competition",no description,https://www.lemonde.fr/en/france/article/2025/06/25/le-pen-bardella-and-the-slow-poison-of-competition_6742714_7.html,,True,,
11,France's new flag war: The Israeli and Palestinian banners on town halls,no description,https://www.lemonde.fr/en/france/article/2025/06/25/france-s-new-flag-war-the-israeli-and-palestinian-banners-on-town-halls_6742694_7.html,,True,,
12,What is France's 'Black code' and why hasn't it been repealed?,no description,https://www.lemonde.fr/en/videos/video/2025/05/31/what-is-france-s-black-code-and-why-hasn-t-it-been-repealed_6741860_108.html,,False,,
13,How was the European Union created?,no description,https://www.lemonde.fr/en/videos/video/2025/05/29/how-was-the-european-union-created_6741795_108.html,,False,,
14,Glide bombs: Russia's secret to making cheap weapons,no description,https://www.lemonde.fr/en/videos/video/2025/05/25/glide-bombs-russia-s-secret-to-making-cheap-weapons_6741646_108.html,,True,,
15,How does the conclave pick the new pope?,no description,https://www.lemonde.fr/en/videos/video/2025/05/07/how-does-the-conclave-pick-the-new-pope_6741005_108.html,,False,,
16,"Supreme Court boosts Trump over federal judges, raising fears of an unchecked presidency",no description,https://www.lemonde.fr/en/opinion/article/2025/06/28/supreme-court-boosts-trump-over-federal-judges-raising-fears-of-an-unchecked-presidency_6742809_23.html,,False,,
17,"'Iran's nuclear program, along with combative language and calls for Israel's elimination, symbolized resistance to the West'",no description,https://www.lemonde.fr/en/opinion/article/2025/06/28/iran-s-nuclear-program-along-with-combative-language-and-calls-for-israel-s-elimination-symbolized-resistance-to-the-west_6742811_23.html,,True,,
18,'Being Jewish in France today means being alone',no description,https://www.lemonde.fr/en/opinion/article/2025/06/28/being-jewish-in-france-today-means-being-alone_6742810_23.html,,True,,
19,Social democracy: PM Bayrou's proclamations are not enough,no description,https://www.lemonde.fr/en/opinion/article/2025/06/27/social-democracy-pm-bayrou-s-proclamations-are-not-enough_6742784_23.html,,False,,
20,"Four Syrian weddings, a symbol of reconciliation",no description,https://www.lemonde.fr/en/m-le-mag/article/2025/06/27/four-syrian-weddings-a-symbol-of-reconciliation_6742788_117.html,,True,,
21,"Georgian winemakers wish to end dependency on Russian market: 'Otherwise, we risk losing our identity'",no description,https://www.lemonde.fr/en/m-le-mag/article/2025/06/27/georgian-winemakers-wish-to-end-dependency-on-russian-market-otherwise-we-risk-losing-our-identity_6742764_117.html,,True,,
22,Finding inspiration for photography in the kitchen,no description,https://www.lemonde.fr/en/m-le-mag/article/2025/06/23/finding-inspiration-for-photography-in-the-kitchen_6742616_117.html,,True,,
23,The Heritage Foundation sets its sights on Europe,no description,https://www.lemonde.fr/en/m-le-mag/article/2025/06/22/the-heritage-foundation-sets-its-sights-on-europe_6742608_117.html,,True,,
24,"Dubuffet, Hokusai, Giacometti: 20 must-see exhibitions this summer, in Paris and beyond",no description,https://www.lemonde.fr/en/culture/article/2025/06/28/20-must-see-exhibitions-this-summer-in-paris-and-beyond_6742801_30.html,,True,,
25,Five cultural outings to enjoy with a baby in Paris,no description,https://www.lemonde.fr/en/intimacy/article/2025/06/27/five-cultural-outings-to-enjoy-in-paris-with-a-baby_6742762_310.html,,True,,
26,New museum will honor Art Nouveau genius Hector Guimard in Paris,no description,https://www.lemonde.fr/en/culture/article/2025/06/25/new-museum-will-honor-art-nouveau-genius-hector-guimard-in-paris_6742701_30.html,,True,,
27,"Why Paris's Centre Pompidou, not even 50 years old, must close for five years",no description,https://www.lemonde.fr/en/opinion/article/2025/06/19/why-the-centre-pompidou-not-even-50-years-old-must-close-for-five-years_6742490_23.html,,True,,
28,The US Supreme Court hands Trump a sweeping victory by limiting the power of federal judges,"The high court has restricted the use of nationwide injunctions issued by federal judges. As a result, it leaves in effect the presidential order limiting jus soli (birthright citizenship) in the 28 states that had not challenged it in court.",https://www.lemonde.fr/en/international/article/2025/06/28/the-us-supreme-court-hands-trump-a-sweeping-victory-by-limiting-the-power-of-federal-judges_6742814_4.html,,True,https://img.lemde.fr/2025/06/28/0/0/5253/3502/400/266/75/0/5224392_upload-1-bjua38kji2s6-547713.jpg,
29,Tens of thousands defy Orban's ban in Budapest Pride march,no description,https://www.lemonde.fr/en/hungary/article/2025/06/28/tens-of-thousands-defy-orban-s-ban-in-budapest-pride-march_6742812_220.html,,False,https://img.lemde.fr/2025/06/28/0/0/5500/3666/398/265/75/0/05f8882_ftp-import-images-1-9hrgwbvjr1hv-2025-06-28t145058z-864422281-rc2qbfam50gr-rtrmadp-3-hungary-lgbt-pride.JPG,
30,"'Iran's nuclear program, along with combative language and calls for Israel's elimination, symbolized resistance to the West'",no description,https://www.lemonde.fr/en/opinion/article/2025/06/28/iran-s-nuclear-program-along-with-combative-language-and-calls-for-israel-s-elimination-symbolized-resistance-to-the-west_6742811_23.html,,True,https://img.lemde.fr/2025/06/24/0/0/7729/5152/398/265/75/0/21fcca3_ftp-import-images-1-xsldadwiupdn-5239411-01-06.jpg,
31,"The young women enlisting in Ukraine's army: 'In the army, you have to show you've got balls!'","Lialia, Veronika and Alina are three women aged 19-24 who have signed up to defend their country. They told Le Monde about their daily lives, what motivates them and the challenges they sometimes face working in such a male-dominated environment.",https://www.lemonde.fr/en/international/article/2025/06/28/the-young-women-enlisting-in-ukraine-s-army-in-the-army-you-have-to-show-you-ve-got-balls_6742813_4.html,,True,https://img.lemde.fr/2025/06/19/0/0/4300/2866/398/265/75/0/0e81ccb_upload-1-3k8wjak112es-vnguyenhoang-womensoldiers-038.jpg,
32,Trump forces the rest of the world to exempt US companies from global tax on multinationals,"Faced with the threat of a tax war from the US government, which considered imposing steep additional taxes on foreign companies operating in the US, the G7 countries agreed to strip much of the substance from the 15% global minimum corporate tax agreement.",https://www.lemonde.fr/en/economy/article/2025/06/28/trump-forces-the-rest-of-the-world-to-exempt-us-companies-from-global-tax-on-multinationals_6742805_19.html,,True,https://img.lemde.fr/2025/06/17/0/4/5892/3928/398/265/75/0/b7c6c88_ftp-import-images-1-ocxczjlllqqs-2025-06-17t092023z-587348406-rc294fawb9aa-rtrmadp-3-usa-trump.JPG,
33,France's ban on public smoking takes effect Sunday,"Smoking will be prohibited in parks, beaches, bus shelters and near schools, as the government prioritizes protecting children from secondhand smoke.",https://www.lemonde.fr/en/health/article/2025/06/28/france-s-ban-on-public-smoking-takes-effect-sunday_6742806_14.html,,False,https://img.lemde.fr/2025/06/26/0/0/5538/3692/398/265/75/0/699304f_ftp-import-images-1-hb3llscobhiz-2025-06-26t135840z-1206381362-rc2p9faw0lsp-rtrmadp-3-france-smoking.JPG,
34,'Being Jewish in France today means being alone',"Senior civil servant Paul Bernard shares the struggles faced by French Jews, a community to which he belongs, in an op-ed. In particular, he attempts to explain the confusion between Israel and its government, which he says does not mean 'endorsing, even through silence, the way it is conducting the war.'",https://www.lemonde.fr/en/opinion/article/2025/06/28/being-jewish-in-france-today-means-being-alone_6742810_23.html,Paul Bernard,True,https://img.lemde.fr/2025/05/29/0/0/3000/2000/664/442/75/0/8f9a9f6_sirius-fs-upload-1-a8rksbmr8nml-1748529972106-frame-168.jpg,Op-Ed
35,"A heat dome will settle over France for several days, with temperatures reaching up to 40°C",no description,https://www.lemonde.fr/en/environment/article/2025/06/28/a-heat-dome-will-settle-over-france-for-several-days-with-temperatures-reaching-up-to-40-c_6742796_114.html,,True,https://img.lemde.fr/2025/06/27/261/0/4929/3286/198/132/95/0/505906b_upload-1-5njo4rvkhdlk-28-canicule.jpg,
36,"In China, coins and banknotes have all but disappeared",no description,https://www.lemonde.fr/en/economy/article/2025/06/28/in-china-coins-and-banknotes-have-all-but-disappeared_6742800_19.html,,True,https://img.lemde.fr/2025/06/26/0/0/8256/5504/198/132/95/0/1f98de6_upload-1-ynni0v36yohn-000-39gp9kf.jpg,
37,Iran condemns Trump's 'disrespectful and unacceptable' comments on Khamenei,no description,https://www.lemonde.fr/en/international/article/2025/06/28/iran-condemns-trump-s-disrespectful-and-unacceptable-comments-on-khamenei_6742797_4.html,,False,https://img.lemde.fr/2025/06/23/0/0/5698/3799/198/132/95/0/a2cec65_ftp-import-images-1-xztgainvxlly-5227051-01-06.jpg,
38,Jesse Jenkins' courgette caviar and whipped ricotta on toast,no description,https://www.lemonde.fr/en/recipes/article/2025/06/28/jesse-jenkins-courgette-caviar-and-whipped-ricotta-on-toast_6742803_44.html,,False,https://img.lemde.fr/2025/06/10/0/0/1500/1000/198/132/95/0/1145900_sirius-fs-upload-1-0qojjolvurzv-1749549709175-6492bf9-ftp-import-images-1-susghnpdl4sm-385166-3423964.jpg,
39,Syringe attacks at France-wide music event: How panic spread on social media,no description,https://www.lemonde.fr/en/pixels/article/2025/06/27/syringe-attacks-at-france-wide-music-event-how-panic-spread-on-social-media_6742787_13.html,,True,,
40,"By banning the Budapest Pride march, Orban is trying to divide his opposition",no description,https://www.lemonde.fr/en/international/article/2025/06/28/by-banning-the-budapest-pride-march-viktor-orban-is-trying-to-divide-his-opposition_6742804_4.html,,True,,
41,Thousands of protestors demand Thai prime minister's resignation,no description,https://www.lemonde.fr/en/asia-and-pacific/article/2025/06/28/thousands-of-protestors-demand-thai-prime-minister-s-resignation_6742808_153.html,,False,,
42,"To fight rhino poaching, nothing works better than cutting off their horns",no description,https://www.lemonde.fr/en/science/article/2025/06/28/to-fight-rhino-poaching-nothing-works-better-than-cutting-off-their-horns_6742798_10.html,,True,,
43,Congo and Rwanda sign a US-mediated peace deal aimed at ending decades of bloody conflict,no description,https://www.lemonde.fr/en/international/article/2025/06/27/congo-and-rwanda-sign-a-us-mediated-peace-deal-aimed-at-ending-decades-of-bloody-conflict_6742791_4.html,,False,,
44,"A fake wedding at Disneyland, but a real pedophile fantasy",no description,https://www.lemonde.fr/en/france/article/2025/06/27/a-fake-wedding-at-disneyland-but-a-real-pedophile-fantasy_6742790_7.html,,True,,
45,"Dubuffet, Hokusai, Giacometti: 20 must-see exhibitions this summer, in Paris and beyond","Museums, foundations and art centers are vying to attract vacationers with a wealth of offerings, giving them the chance to make exciting discoveries.",https://www.lemonde.fr/en/culture/article/2025/06/28/20-must-see-exhibitions-this-summer-in-paris-and-beyond_6742801_30.html,,True,https://img.lemde.fr/2025/06/18/0/125/1350/900/664/442/75/0/1faa350_upload-1-rzf48btrpw0e-expo-mickalene-thomas-2025-1600x0-c-default.jpg,Selection
46,Louvre: 'We want to find a lasting solution to overcrowding',"The museum's director, Laurence des Cars, and the chief architect of France's historic monuments, François Chatillon, speak to Le Monde about the architectural competition to renovate the world's most-visited museum.",https://www.lemonde.fr/en/culture/article/2025/06/28/louvre-we-want-to-find-a-lasting-solution-to-overcrowding_6742802_30.html,Roxana Azimi,True,https://img.lemde.fr/2025/06/26/0/8/9504/6336/664/442/75/0/3b7a9e8_upload-1-5grbeiebyggm-080-hl-ebroncard-2772807.jpg,Interview
47,Former French PM Gabriel Attal: 'I do not see a shared vision for society' with conservatives,"Economically liberal, tough on state authority and progressive on social issues... The former French prime minister, now leading Macron's party Renaissance, lays out for Le Monde the political direction he hopes to champion for 2027.",https://www.lemonde.fr/en/politics/article/2025/06/27/former-french-pm-gabriel-attal-i-do-not-see-a-shared-vision-for-society-today-between-les-republicains-and-us_6742763_5.html,Mariama Darame and  Nathalie Segaunes,True,https://img.lemde.fr/2025/06/26/300/0/4500/3000/664/442/75/0/c619814_upload-1-arnp7vfwfp8d-3-mathias-benguigui-dsc-1168.jpg,Interview
48,Social democracy: PM Bayrou's proclamations are not enough,no description,https://www.lemonde.fr/en/opinion/article/2025/06/27/social-democracy-pm-bayrou-s-proclamations-are-not-enough_6742784_23.html,Le Monde,False,,Editorial
49,"Supreme Court boosts Trump over federal judges, raising fears of an unchecked presidency",no description,https://www.lemonde.fr/en/opinion/article/2025/06/28/supreme-court-boosts-trump-over-federal-judges-raising-fears-of-an-unchecked-presidency_6742809_23.html,Le Monde,False,,Editorial
50,'To topple the Bayrou government today is to risk making France ungovernable',no description,https://www.lemonde.fr/en/opinion/article/2025/06/26/to-topple-the-bayrou-government-today-is-to-risk-making-france-ungovernable_6742748_23.html,Françoise Fressoz,,https://img.lemde.fr/2023/07/06/0/0/0/0/100/100/60/0/bee4e6c_1688634540522-73f3cca-40.jpg,Column
