,headline,description,url,byline,premium,image_url,article type
0,New Saint-Denis mayor seeks to turn racist insults against him into 'a foundation for building things',"Bally Bagayoko, the new hard-left mayor of the northern Paris suburb, filed a complaint for 'public insults' of a racist nature on Thursday, after having been targeted by racist insults on the CNews channel since being elected. He has called for a large anti-racist rally to be held in his city on Saturday.",https://www.lemonde.fr/en/politics/article/2026/04/04/new-saint-denis-mayor-seeks-to-turn-racist-insults-against-him-into-a-foundation-for-building-things_6752105_5.html,,True,https://img.lemde.fr/2026/04/02/1491/0/3651/2434/400/266/75/0/fc4bf15_upload-1-s11uelkvxew4-034-5h9a2564-millerand.jpg,
1,Israel launches new strikes on Beirut after destroying bridge in eastern Lebanon,no description,https://www.lemonde.fr/en/international/article/2026/04/04/israel-launches-new-strikes-on-beirut-after-destroying-bridge-in-eastern-lebanon_6752103_4.html,,False,https://img.lemde.fr/2026/04/03/0/0/3922/2614/398/265/75/0/c58edbb_ftp-1-nyylv0cx7yto-5669580-01-06.jpg,
2,Venezuela and the US normalize relations three months after the abduction of Nicolas Maduro,no description,https://www.lemonde.fr/en/international/article/2026/04/04/venezuela-and-the-us-normalize-relations-three-months-after-the-abduction-of-nicolas-maduro_6752102_4.html,,True,https://img.lemde.fr/2026/03/20/0/147/4276/2851/398/265/75/0/965cf83_ftp-1-16t4vu5zo9fr-5538067-01-06.jpg,
3,US fighter jet shot down in Iran,"A US warplane went down over Iran on Friday. US forces rescued one of the crew. Shortly after, Iran's military said it had downed a second US jet in the Gulf.",https://www.lemonde.fr/en/international/article/2026/04/03/us-fighter-jet-shot-down-in-iran_6752096_4.html,,False,https://img.lemde.fr/2026/04/03/3/0/6016/4010/398/265/75/0/1f10fc0_ftp-1-ch3hiqctrnj4-5672302-01-06.jpg,
4,"'Donald Trump unwittingly, but significantly, advances the energy transition'","In the wake of the global oil and gas shock triggered by the American strike on Iran, the president of the United States has turned into something of a climate doctor, accelerating the shift of major economies toward decarbonized energy, writes economist Patrice Geoffron in this op-ed for Le Monde.",https://www.lemonde.fr/en/opinion/article/2026/04/04/donald-trump-unwittingly-but-significantly-advances-the-energy-transition_6752098_23.html,,True,https://img.lemde.fr/2026/02/25/0/0/1500/1000/398/265/75/0/b5d0f0c_upload-1-wblpilq2k4mw-frame-806.jpg,
5,Dinosaur egg trove discovered in Hérault,"The Musée des dinosaures de Mèze has announced the discovery of about 100 dinosaur eggs dating back approximately 72 million years, making this deposit one of the most significant in the world.",https://www.lemonde.fr/en/science/article/2026/04/04/dinosaur-egg-trove-discovered-in-herault_6752100_10.html,,True,https://img.lemde.fr/2026/04/03/0/311/3378/2252/398/265/75/0/b3e87d3_upload-1-6vvrbstyegro-20260324-114144.jpg,
6,Discovery of 18th-century sailing logbook sheds new light on first French navigations,"Unearthed by a bookseller from the Brittany region, a mysterious logbook is reviving the story of the first French around-the-world sea journeys. Page after page, it narrates a maritime and commercial epic that took place 50 years before the great scientific expeditions.",https://www.lemonde.fr/en/history/article/2026/04/04/discovery-of-18th-century-sailing-logbook-sheds-new-light-on-first-french-navigations_6752106_157.html,Anna Corlay,True,https://img.lemde.fr/2026/04/02/0/246/5383/3589/664/442/75/0/593036d_upload-1-fdvwdjbmzjfg-dsc08625.jpg,News
7,French-Palestinian MEP Rima Hassan denounces 'judicial harassment' as court case looms over social media post,no description,https://www.lemonde.fr/en/france/article/2026/04/04/french-palestinian-mep-rima-hassan-denounces-judicial-harassment-as-court-case-looms-over-social-media-post_6752107_7.html,,False,https://img.lemde.fr/2026/04/03/1/0/6500/4333/198/132/95/0/6e9aedc_ftp-1-ebhsatbibuip-2026-04-03t164710z-1160319038-rc2shkabg83j-rtrmadp-3-france-politics-hassan.JPG,
8,Remote work for Canada's civil servants is being called into question,no description,https://www.lemonde.fr/en/economy/article/2026/04/04/remote-work-for-canada-s-civil-servants-is-being-called-into-question_6752104_19.html,,True,https://img.lemde.fr/2026/03/28/0/0/4999/3333/198/132/95/0/84fac28_upload-1-67srcsunbc3h-hanslucas-hl-mbertrand-2427585.jpg,
9,"In the Democratic Republic of Congo, a US company secures a 'huge' deal by acquiring copper and cobalt mines",no description,https://www.lemonde.fr/en/le-monde-africa/article/2026/04/04/in-the-democratic-republic-of-congo-a-us-company-secures-a-huge-deal-by-acquiring-copper-and-cobalt-mines_6752101_124.html,,True,https://img.lemde.fr/2026/04/03/167/0/4000/2666/198/132/95/0/20d6a9b_upload-1-0fmxy7wia1sd-000-32mj2xu.jpg,
10,"Pedro Sanchez: strong on the world stage, but vulnerable at home",no description,https://www.lemonde.fr/en/opinion/article/2026/04/04/pedro-sanchez-strong-on-the-world-stage-but-vulnerable-at-home_6752099_23.html,,True,https://img.lemde.fr/2026/03/15/0/0/3408/2272/198/132/95/0/4398952_ftp-1-kacm2ek4m563-2026-03-15t131039z-916280574-rc2y4ka879nj-rtrmadp-3-spain-culture-fallas.JPG,
11,Artemis II astronauts blast towards the Moon after spending the day in Earth's orbit,no description,https://www.lemonde.fr/en/science/article/2026/04/03/artemis-ii-astronauts-blast-towards-the-moon-after-spending-the-day-in-earth-s-orbit_6752068_10.html,,False,,
12,White House asks for massive $1.5 trillion defense budget – a 40% increase,no description,https://www.lemonde.fr/en/international/article/2026/04/03/white-house-asks-for-massive-1-5-trillion-defense-budget-a-40-increase_6752097_4.html,,False,,
13,"Ten years after the Panama Papers, major advances in the fight against tax evasion",no description,https://www.lemonde.fr/en/les-decodeurs/article/2026/04/03/ten-years-after-the-panama-papers-major-advances-in-the-fight-against-tax-evasion_6752095_8.html,,True,,
14,Iran's radicalized regime fuels threat of nuclear bomb,no description,https://www.lemonde.fr/en/international/article/2026/04/03/iran-s-radicalized-regime-fuels-threat-of-nuclear-bomb_6752093_4.html,,True,,
15,French and South Korean presidents say will work together on Strait of Hormuz,no description,https://www.lemonde.fr/en/international/article/2026/04/03/french-and-south-korean-presidents-say-will-work-together-on-strait-of-hormuz_6752073_4.html,,False,,
16,US registers strong job growth in March,no description,https://www.lemonde.fr/en/economy/article/2026/04/03/us-registers-strong-job-growth-in-march_6752092_19.html,,False,,
17,Five Paris design exhibitions not to miss this spring,no description,https://www.lemonde.fr/en/lifestyle/article/2026/04/03/five-paris-design-exhibitions-not-to-miss-this-spring_6752094_37.html,,True,,
18,Cuban prisoners freed after mass pardon,no description,https://www.lemonde.fr/en/international/article/2026/04/03/cuban-prisoners-freed-after-mass-pardon_6752091_4.html,,False,,
19,'Refusing to divide French society into the racialized and the non-racialized does not mean denying the existence of racism',"Sociologist Stéphane Beaud and historian Gérard Noiriel analyze why people who have experienced racism – such as Bally Bagayoko, Saint-Denis's new mayor – may reject the label 'racialized.'",https://www.lemonde.fr/en/opinion/article/2026/04/02/refusing-to-divide-french-society-into-the-racialized-and-the-non-racialized-does-not-mean-denying-the-existence-of-racism_6752060_23.html,Gérard Noiriel and  Stéphane Beaud,True,https://img.lemde.fr/2026/02/25/0/0/1500/1000/664/442/75/0/95a46ba_upload-1-e0rq6orqsnrg-frame-861.jpg,Op-Ed
20,Sarkozy appeal trial hears moving testimonies from families of UTA flight bombing victims,"On Wednesday, 13 relatives of victims killed in the 1989 plane bombing took to the witness stand to express their anger at former French president Nicolas Sarkozy. He is accused of making a pact with the Libyan masterminds of the bombing to receive campaign funding.",https://www.lemonde.fr/en/france/article/2026/04/02/sarkozy-appeal-trial-hears-moving-testimonies-from-families-of-uta-flight-bombing-victims_6752046_7.html,Franck Johannès,True,https://img.lemde.fr/2026/03/16/0/0/5146/3430/664/442/75/0/2677e8b_ftp-1-0l7e0hirpctb-2026-03-16t134544z-383788888-rc2o5ka1ylnv-rtrmadp-3-france-politics-sarkozy-trial.JPG,News
21,The mystery of the Green River's 'uphill flow' in the American West has been solved after 150 years,A young researcher from the University of Glasgow has offered an explanation for a geological anomaly that has puzzled scientists since the 19th century.,https://www.lemonde.fr/en/environment/article/2026/04/02/the-mystery-of-the-green-river-s-uphill-flow-in-the-american-west-is-solved-after-150-years_6752036_114.html,Maryline Baumard,True,https://img.lemde.fr/2026/03/24/0/0/5472/3648/664/442/75/0/16e9ce1_upload-1-dqbz3wcr4erv-ap24041712989785.jpg,News
22,The EU must respond to the challenges posed by Viktor Orban,no description,https://www.lemonde.fr/en/opinion/article/2026/04/03/the-eu-must-respond-to-the-challenges-posed-by-viktor-orban_6752081_23.html,Le Monde,False,,Editorial
23,Death penalty for Palestinians accused of 'terrorist' murder continues Israeli government's downward spiral,no description,https://www.lemonde.fr/en/opinion/article/2026/04/02/death-penalty-for-palestinians-accused-of-terrorist-murder-continues-israeli-government-s-downward-spiral_6752048_23.html,Le Monde,False,,Editorial
24,Racist backlash against newly elected French officials,no description,https://www.lemonde.fr/en/opinion/article/2026/04/01/racist-backlash-against-newly-elected-french-officials_6752014_23.html,Le Monde,False,,Editorial
