,headline,description,url,byline,premium,image_url,article type
0,Russia's phantom gains in Ukraine,no description,https://www.lemonde.fr/en/international/article/2025/12/12/russia-s-phantom-advances-in-ukraine_6748441_4.html,,True,,
1,West Bank Palestinian granted refugee status in France due to violence in occupied territory,no description,https://www.lemonde.fr/en/international/article/2025/12/12/west-bank-palestinian-granted-refugee-status-in-france-due-to-violence-in-occupied-territory_6748426_4.html,,True,,
2,The poignant testimonies of Russian soldiers returning from Ukraine,no description,https://www.lemonde.fr/en/international/article/2025/12/12/the-poignant-testimonies-of-russian-soldiers-returning-from-ukraine_6748412_4.html,,True,,
3,Syria's new army confronts the legacy of civil war,no description,https://www.lemonde.fr/en/international/article/2025/12/12/in-syria-the-new-army-confronts-the-legacy-of-civil-war_6748403_4.html,,True,,
4,'Trump's ideological challenge to Europe is more dangerous than the security one',no description,https://www.lemonde.fr/en/opinion/article/2025/12/11/trump-s-ideological-challenge-to-europe-is-more-dangerous-than-the-security-one_6748393_23.html,,True,,
5,"Attacked by Trump, Europe wavers between denial and fear of reprisals",no description,https://www.lemonde.fr/en/international/article/2025/12/11/attacked-by-trump-europe-wavers-between-denial-and-fear-of-reprisals_6748382_4.html,,True,,
6,Bosnia and Herzegovina's Serb entity elects ally of  former leader Dodik,no description,https://www.lemonde.fr/en/international/article/2025/11/24/bosnia-and-herzegovina-s-serb-entity-elects-ally-of-former-leader-dodik_6747765_4.html,,True,,
7,"In France's Somme, bagpipers keep the memory of the Great War alive",no description,https://www.lemonde.fr/en/history/article/2025/11/11/in-france-s-somme-bagpipers-keep-the-memory-of-the-great-war-alive_6747347_157.html,,True,,
8,The mysterious 'knocker' scaring elderly women in a Brittany town,no description,https://www.lemonde.fr/en/france/article/2025/12/12/the-mysterious-knocker-scaring-elderly-women-in-a-brittany-town_6748408_7.html,,True,,
9,The actor and rape accusations behind Brigitte Macron's 'stupid bitches' remark,no description,https://www.lemonde.fr/en/france/article/2025/12/11/the-actor-and-rape-accusations-behind-brigitte-macron-s-stupid-bitches-remark_6748396_7.html,,True,,
10,Top French court reviews France-UK migrant agreement,no description,https://www.lemonde.fr/en/france/article/2025/12/11/top-french-court-reviews-france-uk-migrant-agreement_6748392_7.html,,True,,
11,"French students have become better informed about secularism, but also more critical",no description,https://www.lemonde.fr/en/france/article/2025/12/09/french-students-have-become-better-informed-about-secularism-but-also-more-critical_6748318_7.html,,True,,
12,The French studio behind a viral Christmas ad,no description,https://www.lemonde.fr/en/videos/video/2025/12/12/the-french-studio-behind-a-viral-christmas-ad_6748436_108.html,,False,,
13,"Israel's D9 bulldozer, a tool of destruction in Gaza",no description,https://www.lemonde.fr/en/videos/video/2025/11/27/israel-s-d9-bulldozer-a-tool-of-destruction-in-gaza_6747870_108.html,,True,,
14,"Ukraine's Pokrovsk faces fierce fighting, footage analyzed by Le Monde reveals",no description,https://www.lemonde.fr/en/videos/video/2025/11/21/ukraine-s-pokrovsk-faces-fierce-fighting-footage-analyzed-by-le-monde-reveals_6747708_108.html,,True,,
15,Afghanistan: Relentless repression continues over four years into Taliban's rule,no description,https://www.lemonde.fr/en/videos/video/2025/10/04/afghanistan-relentless-repression-continues-over-four-years-into-taliban-s-rule_6746092_108.html,,False,,
16,How the Trumpist world is projecting its own obsession with decline onto Europe,no description,https://www.lemonde.fr/en/opinion/article/2025/12/12/how-the-trumpist-world-is-projecting-its-own-obsession-with-decline-onto-europe_6748411_23.html,,True,,
17,Who will dare to condemn the terror imposed by Israel in the West Bank?,no description,https://www.lemonde.fr/en/opinion/article/2025/12/12/who-will-dare-to-condemn-the-terror-imposed-by-israel-in-the-west-bank_6748420_23.html,,False,,
18,Sarkozy casts himself as new Dreyfus in prison memoir,no description,https://www.lemonde.fr/en/opinion/article/2025/12/12/sarkozy-casts-himself-as-new-dreyfus-in-prison-memoir_6748419_23.html,,True,,
19,'Trump's ideological challenge to Europe is more dangerous than the security one',no description,https://www.lemonde.fr/en/opinion/article/2025/12/11/trump-s-ideological-challenge-to-europe-is-more-dangerous-than-the-security-one_6748393_23.html,,True,,
20,The lawyer suing far-right French mayors for setting up Nativity scenes,no description,https://www.lemonde.fr/en/m-le-mag/article/2025/12/07/the-woman-suing-french-far-right-mayors-for-setting-up-nativity-scenes_6748246_117.html,,True,,
21,100 years of the photobooth: Meet the people keeping them alive,no description,https://www.lemonde.fr/en/m-le-mag/article/2025/12/07/100-years-of-the-photobooth-meet-the-people-keeping-them-alive_6748232_117.html,,False,,
22,"Iran's independent cinema in full revolt: 'With Woman, Life, Freedom, a major barrier was broken'",no description,https://www.lemonde.fr/en/m-le-mag/article/2025/12/04/iran-s-independent-cinema-in-full-revolt-with-woman-life-freedom-a-major-barrier-was-broken_6748162_117.html,,True,,
23,The first time Le Monde wrote about Jeffrey Epstein,no description,https://www.lemonde.fr/en/m-le-mag/article/2025/12/01/the-first-time-le-monde-wrote-about-jeffrey-epstein_6748001_117.html,,True,,
24,Jewels of power go on display in Paris,no description,https://www.lemonde.fr/en/culture/article/2025/12/11/the-power-gems-on-display-in-paris_6748374_30.html,,False,,
25,Five spots in Paris to enjoy a (great) plant-based sandwich,no description,https://www.lemonde.fr/en/lifestyle/article/2025/12/04/in-paris-five-spots-to-enjoy-a-great-plant-based-sandwich_6748131_37.html,,True,,
26,"Bayonne's 'Little Louvre,' the Bonnat-Helleu Museum, reopens after 14 years",no description,https://www.lemonde.fr/en/culture/article/2025/11/28/bayonne-s-little-louvre-the-bonnat-helleu-museum-reopens-after-14-years_6747913_30.html,,True,,
27,Victor Hugo's interior architecture on display in Paris,no description,https://www.lemonde.fr/en/lifestyle/article/2025/11/23/victor-hugo-s-interior-architecture-on-display-in-paris_6747753_37.html,,True,,
28,Russia's phantom gains in Ukraine,"As peace talks with Washington continue, the Kremlin is trying to convince the world that a Russian victory is inevitable, even though its army is advancing slowly and suffering heavy losses.",https://www.lemonde.fr/en/international/article/2025/12/12/russia-s-phantom-advances-in-ukraine_6748441_4.html,,True,https://img.lemde.fr/2025/12/11/25/0/1501/1000/400/266/75/0/7340a5d_upload-1-yqhxe3iqt777-media-appel-ukraine-3x.png,
29,How the Trumpist world is projecting its own obsession with decline onto Europe,no description,https://www.lemonde.fr/en/opinion/article/2025/12/12/how-the-trumpist-world-is-projecting-its-own-obsession-with-decline-onto-europe_6748411_23.html,,True,https://img.lemde.fr/2025/12/11/0/0/6240/4160/398/265/75/0/7c6220d_upload-1-vmeuz1zjzqto-000-74dr8ep.jpg,
30,France updates its 2050 carbon neutrality roadmap,no description,https://www.lemonde.fr/en/environment/article/2025/12/12/france-updates-its-2050-carbon-neutrality-roadmap_6748435_114.html,,False,https://img.lemde.fr/2025/12/09/0/54/5776/3851/398/265/75/0/66e9d1b_ftp-1-1mgoy2kccxvc-2025-12-09t112708z-1980772444-rc2amw9tl2g6-rtrmadp-3-france-electricity-rte.JPG,
31,Sarkozy casts himself as new Dreyfus in prison memoir,The former president claims in his new book that he is an innocent victim of a political trial. His testimony also reveals the extraordinary privileges he received during his time in prison.,https://www.lemonde.fr/en/opinion/article/2025/12/12/sarkozy-casts-himself-as-new-dreyfus-in-prison-memoir_6748419_23.html,,True,https://img.lemde.fr/2025/12/10/0/0/6470/4313/398/265/75/0/b092923_ftp-1-f0avxzvt1vnp-5648345-01-06.jpg,
32,EU decides to impose €3 tax on small parcels to tackle Chinese imports,"The European Union will impose a temporary €3 tax on small parcels entering the bloc starting in July of next year, finance ministers agreed Friday. The move is designed to counter Chinese platforms AliExpress, Temu and Shein, which European retailers say do not comply with EU rules.",https://www.lemonde.fr/en/economy/article/2025/12/12/eu-decides-to-impose-3-tax-on-small-parcels-from-china_6748427_19.html,,False,https://img.lemde.fr/2025/12/12/0/0/8256/5504/398/265/75/0/abb3574_ftp-1-0ypty9hx8vsp-5663431-01-06.jpg,
33,The French studio behind a viral Christmas ad,A Christmas commercial created by the French animation studio Illogic Studios for the Intermarché supermarket chain has racked up tens of millions of views on social media.,https://www.lemonde.fr/en/videos/video/2025/12/12/the-french-studio-behind-a-viral-christmas-ad_6748436_108.html,,False,https://img.lemde.fr/2025/12/12/0/150/1620/1080/398/265/75/0/3b3fbc8_upload-1-ox0o8ogeshlq-media-d-appel.jpeg,
34,"Paris Agreement: Ten years later, key players look back on 'incredible alignment of stars'","Le Monde takes a look back at the the signing of the Paris Agreement in the French capital on December 12, 2015, a major geopolitical agreement reached after two weeks of intense negotiations that aimed to limit global warming to 'well below' 2°C and at 'pursuing efforts' to keep the temperature increase to 1.5°C.",https://www.lemonde.fr/en/environment/article/2025/12/12/paris-agreement-ten-years-later-key-players-look-back-on-incredible-alignment-of-stars_6748434_114.html,Matthieu Goar,True,https://img.lemde.fr/2025/12/11/0/0/3600/2400/664/442/75/0/3ae338f_upload-1-dpjcsuix9iyg-cop-21-20151212-13.jpg,News
35,French veterinarians cull cows after police use tear gas to disperse protesters,no description,https://www.lemonde.fr/en/france/article/2025/12/12/french-forces-use-tear-gas-to-disperse-protesters-protecting-condemned-cows_6748418_7.html,,False,https://img.lemde.fr/2025/12/12/0/0/5247/3498/198/132/95/0/e153bc5_ftp-1-pot4w2jcsjk6-5662867-01-06.jpg,
36,US points finger at Rwanda over clashes a week after DRC peace deal,no description,https://www.lemonde.fr/en/international/article/2025/12/12/us-points-finger-at-rwanda-over-clashes-a-week-after-drc-peace-deal_6748437_4.html,,False,https://img.lemde.fr/2025/12/04/86/0/3604/2402/198/132/95/0/553b265_ftp-1-k9ckkbbi76ym-2025-12-04t194057z-1054839056-rc2u9ia6zj2s-rtrmadp-3-usa-trump-rwanda-congo.JPG,
37,Nobel Peace laureate Narges Mohammadi arrested in Iran,no description,https://www.lemonde.fr/en/international/article/2025/12/12/nobel-peace-laureate-narges-mohammadi-arrested-in-iran_6748430_4.html,,False,https://img.lemde.fr/2023/10/07/268/0/1707/1138/198/132/95/0/9ee1b6d_1696662435425-060007.jpg,
38,"At the Grand Palais, a full house for Eva Jospin and Claire Tabouret",no description,https://www.lemonde.fr/en/culture/article/2025/12/12/at-the-grand-palais-a-full-house-for-eva-jospin-and-claire-tabouret_6748407_30.html,,True,https://img.lemde.fr/2025/12/09/0/0/2953/1968/198/132/95/0/c9eb1b7_upload-1-7htd5ybhyghd-2-panorama-2016-eva-jospin-c-flufoto-bar-s-aras-elif-c-ak-rlar-courtesy-noirmontartproduction.JPG,
39,Germany accuses Russia of cyberattack on air controllers and election interference,no description,https://www.lemonde.fr/en/international/article/2025/12/12/germany-accuses-russia-of-cyberattack-on-air-controllers-and-election-interference_6748439_4.html,,False,,
40,'Clair Obscur: Expedition 33' sweeps nine Game Awards,no description,https://www.lemonde.fr/en/pixels/article/2025/12/12/clair-obscur-expedition-33-sweeps-nine-game-awards_6748414_13.html,,True,,
41,Iran frees former child bride sentenced to death over husband's killing,no description,https://www.lemonde.fr/en/international/article/2025/12/12/iran-frees-former-child-bride-sentenced-to-death-over-husband-s-killing_6748440_4.html,,False,,
42,West Bank Palestinian granted refugee status in France due to violence in occupied territory,no description,https://www.lemonde.fr/en/international/article/2025/12/12/west-bank-palestinian-granted-refugee-status-in-france-due-to-violence-in-occupied-territory_6748426_4.html,,True,,
43,EU rules for at least 25% recycled plastic in cars,no description,https://www.lemonde.fr/en/economy/article/2025/12/12/eu-rules-for-at-least-25-recycled-plastic-in-cars_6748423_19.html,,False,,
44,The poignant testimonies of Russian soldiers returning from Ukraine,no description,https://www.lemonde.fr/en/international/article/2025/12/12/the-poignant-testimonies-of-russian-soldiers-returning-from-ukraine_6748412_4.html,,True,,
45,Former Iraqi president Salih appointed new UN refugee agency chief,no description,https://www.lemonde.fr/en/international/article/2025/12/12/former-iraqi-president-salih-appointed-new-un-refugee-agency-chief_6748421_4.html,,False,,
46,Jewels of power go on display in Paris,no description,https://www.lemonde.fr/en/culture/article/2025/12/11/the-power-gems-on-display-in-paris_6748374_30.html,,False,,
47,The mysterious 'knocker' scaring elderly women in a Brittany town,"For more than two years, a prowler has been knocking on doors and shutters during the night in a village in Brittany, France, creating a climate of fear among his preferred targets: elderly women. Authorities were slow to take the case seriously.",https://www.lemonde.fr/en/france/article/2025/12/12/the-mysterious-knocker-scaring-elderly-women-in-a-brittany-town_6748408_7.html,Florence Aubenas,True,https://img.lemde.fr/2025/12/08/0/0/6048/4032/664/442/75/0/77fe432_upload-1-hwcuar4pnrd8-dsc7573.jpg,Feature
48,Ukraine ready to consider Donbas demilitarized zone in concession to end war,"Mykhailo Podolyak, an advisor to Ukrainian President Volodymyr Zelensky, tells Le Monde that the zone would require Ukrainian and Russian forces to both pull back from the front line.",https://www.lemonde.fr/en/international/article/2025/12/11/ukraine-ready-to-accept-donbas-demilitarized-zone-in-concession-to-end-war_6748397_4.html,Claire Gatinois and  Philippe Ricard,True,https://img.lemde.fr/2025/12/11/3/0/5152/3434/664/442/75/0/daa5a95_upload-1-kxul8vagu0ym-451887.jpg,News
49,How the Israeli army is razing the part of Gaza it is supposed to withdraw from,"Despite the ceasefire that was declared on October 10, Israel has continued to raze many buildings east of the 'yellow line' in the Gaza Strip, according to local residents and satellite images of the enclave.",https://www.lemonde.fr/en/international/visuel/2025/12/11/how-the-israeli-army-is-razing-the-part-of-gaza-it-is-supposed-to-withdraw-from_6748372_4.html,"Elsa Delmas,  Marie Jo Sader and  Mellit Derre",True,https://img.lemde.fr/2025/12/04/0/0/1920/1280/664/442/75/0/4e3e985_upload-1-czl7q5gq4lzx-m-a.jpg,Visual Story
50,Who will dare to condemn the terror imposed by Israel in the West Bank?,no description,https://www.lemonde.fr/en/opinion/article/2025/12/12/who-will-dare-to-condemn-the-terror-imposed-by-israel-in-the-west-bank_6748420_23.html,Le Monde,False,,Editorial
51,Sarkozy's astonishing about-face on the far right,no description,https://www.lemonde.fr/en/opinion/article/2025/12/09/sarkozy-suggests-alliance-with-far-right-is-inevitable_6748307_23.html,Le Monde,False,,Editorial
52,The shockwaves of the Trump administration's strategic vision,no description,https://www.lemonde.fr/en/opinion/article/2025/12/11/the-shockwaves-of-the-trump-administration-s-strategic-vision_6748383_23.html,Le Monde,False,,Editorial
