,headline,description,url,byline,premium,image_url,article type
0,"Hamas, severely weakened but not broken, vows a 'war of attrition' against Israel",no description,https://www.lemonde.fr/en/international/article/2025/09/11/hamas-severely-weakened-but-not-broken-vows-a-war-of-attrition-against-israel_6745294_4.html,,True,,
1,Charlie Kirk's assassination shocks the US and triggers a surge of political hatred,no description,https://www.lemonde.fr/en/international/article/2025/09/11/charlie-kirk-s-assassination-shocks-the-us-and-triggers-a-surge-of-political-hatred_6745291_4.html,,True,,
2,Israel's strikes in Qatar have jolted the Gulf states into unity,no description,https://www.lemonde.fr/en/international/article/2025/09/11/israel-s-strikes-in-qatar-have-jolted-the-gulf-states-into-unity_6745287_4.html,,True,,
3,Trump looks on as a powerless spectator at events in Ukraine and Gaza,no description,https://www.lemonde.fr/en/international/article/2025/09/11/trump-looks-on-as-a-powerless-spectator-at-events-in-ukraine-and-gaza_6745282_4.html,,True,,
4,France's political instability puts Franco-German alliance to the test,no description,https://www.lemonde.fr/en/opinion/article/2025/08/30/france-s-political-instability-puts-franco-german-alliance-to-the-test_6744873_23.html,,False,,
5,France faces prospect of paying higher borrowing costs than Italy,no description,https://www.lemonde.fr/en/economy/article/2025/08/19/france-faces-prospect-of-paying-higher-borrowing-costs-than-italy_6744519_19.html,,True,,
6,French man arrested in Slovenia for crimes committed in Croatia during 1991 war,no description,https://www.lemonde.fr/en/international/article/2025/08/06/french-man-arrested-in-slovenia-for-crimes-committed-in-croatia-during-1991-war_6744113_4.html,,True,,
7,"30 years after the Bosnian War, its refugees still cannot return home",no description,https://www.lemonde.fr/en/international/article/2025/08/03/thirty-years-after-the-bosnian-war-its-refugees-still-cannot-return-home_6744026_4.html,,True,,
8,From a Thai holiday to a Turkish prison: How two women were trapped by drug traffickers,no description,https://www.lemonde.fr/en/france/article/2025/09/11/from-a-thai-holiday-to-a-turkish-prison-how-two-women-were-trapped-by-drug-traffickers_6745296_7.html,,True,,
9,"Pig heads left outside several mosques, 'a new and sad milestone in the rise of anti-Muslim hatred'",no description,https://www.lemonde.fr/en/france/article/2025/09/10/pig-heads-left-outside-several-mosques-a-new-and-sad-milestone-in-the-rise-of-anti-muslim-hatred_6745224_7.html,,True,,
10,François Bayrou's nine months of crises as French PM,no description,https://www.lemonde.fr/en/france/article/2025/09/08/francois-bayrou-s-nine-months-of-crises-as-french-pm_6745167_7.html,,True,,
11,Bayrou's fall,no description,https://www.lemonde.fr/en/politics/article/2025/09/08/francois-bayrou-ousted-as-french-pm-after-losing-confidence-vote_6745163_5.html,,False,,
12,"From 'influence peddling' to 'corruption,' what is French Culture Minister Rachida Dati accused of?",no description,https://www.lemonde.fr/en/videos/video/2025/09/06/from-influence-peddling-to-corruption-what-is-french-culture-minister-rachida-dati-accused-of_6745094_108.html,,False,,
13,Watch: Tsunami warnings sound in Japan after 8.8 magnitude quake off Russian coast,no description,https://www.lemonde.fr/en/videos/video/2025/07/30/watch-tsunami-warnings-sound-in-japan-after-8-8-magnitude-quake-off-russian-coast_6743900_108.html,,False,,
14,What is France's 'Black code' and why hasn't it been repealed?,no description,https://www.lemonde.fr/en/videos/video/2025/05/31/what-is-france-s-black-code-and-why-hasn-t-it-been-repealed_6741860_108.html,,False,,
15,How was the European Union created?,no description,https://www.lemonde.fr/en/videos/video/2025/05/29/how-was-the-european-union-created_6741795_108.html,,False,,
16,"'While Putin rains fire down on Ukraine, Trump rants and grumbles'",no description,https://www.lemonde.fr/en/opinion/article/2025/09/11/while-putin-rains-fire-down-on-ukraine-trump-rants-and-grumbles_6745288_23.html,,True,,
17,'AI companies cannot avoid debates on regulating their tools',no description,https://www.lemonde.fr/en/opinion/article/2025/09/12/ai-companies-cannot-avoid-debates-on-regulating-their-tools_6745303_23.html,,True,,
18,"In Trump's America, 'loyalty counts for more than expertise'",no description,https://www.lemonde.fr/en/opinion/article/2025/09/11/in-trump-s-america-loyalty-counts-for-more-than-expertise_6745293_23.html,,True,,
19,New French PM Sébastien Lecornu walks a tightrope,no description,https://www.lemonde.fr/en/opinion/article/2025/09/11/new-french-pm-sebastien-lecornu-walks-a-tightrope_6745285_23.html,,False,,
20,Blessed with fortune: India's Hare Krishna mega-temple backed by a Ford heir,no description,https://www.lemonde.fr/en/m-le-mag/article/2025/09/10/blessed-with-fortune-india-s-hare-krishna-mega-temple-backed-by-a-ford-heir_6745215_117.html,,True,,
21,Serbian women are leading the frontlines of country's anti-corruption movement,no description,https://www.lemonde.fr/en/m-le-mag/article/2025/09/07/serbian-women-are-leading-the-frontlines-of-country-s-anti-corruption-movement_6745131_117.html,,True,,
22,Fashion retreats from diversity: 'We are again being openly asked for Caucasian models',no description,https://www.lemonde.fr/en/m-le-mag/article/2025/09/07/fashion-retreats-from-diversity-we-are-again-being-openly-asked-for-caucasian-models_6745111_117.html,,True,,
23,"Lorde, New Zealand electropop sensation: 'With 'Virgin,' I wanted to document my femininity'",no description,https://www.lemonde.fr/en/m-le-mag/article/2025/08/31/lorde-new-zealand-electropop-sensation-with-virgin-i-wanted-to-document-my-femininity_6744888_117.html,,True,,
24,Tradition done right: Five Paris restaurants reimagining the classics,no description,https://www.lemonde.fr/en/lifestyle/article/2025/09/08/tradition-done-right-five-paris-restaurants-reimagining-the-classics_6745133_37.html,,True,,
25,Paris Design Week: A 15th edition marked by abundance,no description,https://www.lemonde.fr/en/lifestyle/article/2025/09/05/paris-design-week-a-15th-edition-marked-by-abundance_6745060_37.html,,True,,
26,It's pain suisse time! Five places in and around Paris to find this treat,no description,https://www.lemonde.fr/en/lifestyle/article/2025/09/04/it-s-pain-suisse-time-five-places-in-the-paris-region-to-find-this-treat_6745022_37.html,,True,,
27,"At Musée d'Orsay, a Courbet painting gets a new life before visitors' eyes",no description,https://www.lemonde.fr/en/culture/article/2025/07/26/at-musee-d-orsay-a-courbet-painting-gets-a-new-life-before-visitors-eyes_6743744_30.html,,True,,
28,Brazil's Supreme Court sentences Bolsonaro to more than 27 years in prison for coup attempt,"A majority of four judges found the 70-year-old guilty of plotting to claw back power after his defeat in October 2022 elections by leftist Lula. Washington, who supports Bolsonaro, slammed the Brazilian Court's ruling saying the US 'will respond accordingly' to the conviction.",https://www.lemonde.fr/en/international/article/2025/09/11/majority-on-brazil-s-supreme-court-convicts-bolsonaro-of-attempted-coup_6745300_4.html,,True,https://img.lemde.fr/2025/09/11/0/0/5887/3924/400/266/75/0/a640d78_ftp-import-images-1-xy9qnhrszrml-5856976-01-06.jpg,
29,Charlie Kirk's assassination shocks the US and triggers a surge of political hatred,no description,https://www.lemonde.fr/en/international/article/2025/09/11/charlie-kirk-s-assassination-shocks-the-us-and-triggers-a-surge-of-political-hatred_6745291_4.html,,True,https://img.lemde.fr/2025/09/11/0/0/3000/2000/398/265/75/0/053206b_upload-1-scdwzjywsoeb-627796.jpg,
30,French growth expected to reach 0.8% in 2025 as political uncertainty weighs,no description,https://www.lemonde.fr/en/economy/article/2025/09/11/french-growth-expected-to-reach-0-8-in-2025-as-political-uncertainty-weighs_6745302_19.html,,True,https://img.lemde.fr/2025/09/10/0/0/7181/4787/398/265/75/0/d97a49d_ftp-import-images-1-24tdeq7qemun-5850187-01-06.jpg,
31,Iran FM says prisoner swap deal with France nearing completion,"The proposed swap involves Mahdieh Esfandiari, an Iranian woman arrested in France in February on charges of promoting terrorism through social media.",https://www.lemonde.fr/en/international/article/2025/09/11/iran-fm-says-prisoner-swap-deal-with-france-nearing-completion_6745301_4.html,,False,https://img.lemde.fr/2025/09/09/84/0/5500/3666/398/265/75/0/1237d94_ftp-import-images-1-dwfuln6tl8ge-2025-09-09t132718z-1677133664-rc2cogab5zz9-rtrmadp-3-egypt-iran.JPG,
32,'AI companies cannot avoid debates on regulating their tools',"The Trump administration opposes the regulation of artificial intelligence (AI) content, invoking freedom of expression. However, debate has intensified over the content of services like ChatGPT, particularly regarding minors, observes Le Monde's Alexandre Piquard in his column.",https://www.lemonde.fr/en/opinion/article/2025/09/12/ai-companies-cannot-avoid-debates-on-regulating-their-tools_6745303_23.html,,True,https://img.lemde.fr/2025/08/25/0/1/3900/2600/398/265/75/0/58b5289_ftp-import-images-1-ynpom6posmdg-5712363-01-06.jpg,
33,Paris's Notre-Dame breaks attendance records nine months after reopening,"Notre-Dame is now the most visited monument in France. Projections anticipate a total of 12 million to 13 million visitors by December 8, one year after reopening.",https://www.lemonde.fr/en/economy/article/2025/09/11/paris-s-notre-dame-breaks-attendance-records-nine-months-after-reopening_6745283_19.html,,True,https://img.lemde.fr/2025/08/21/0/0/5472/3648/398/265/75/0/b0616e7_ftp-import-images-1-s3idlr8h4f2w-ec977b5f01864d239b3be6ab4c320e37-0-2a09343a569447748dc536e88cef4755.jpg,
34,From a Thai holiday to a Turkish prison: How two women were trapped by drug traffickers,"The two 20-year-old women from the Paris region enjoyed an all-expenses-paid holiday in Thailand, then given suitcases packed with cannabis before their flight home. Their lawyers argued it was a case of 'great naivety.'",https://www.lemonde.fr/en/france/article/2025/09/11/from-a-thai-holiday-to-a-turkish-prison-how-two-women-were-trapped-by-drug-traffickers_6745296_7.html,Thomas Saintourens,True,https://img.lemde.fr/2025/01/23/0/0/3000/2000/664/442/75/0/2e192e2_sirius-fs-upload-1-zj8ahjn4xts8-1737644153857-illustration-sans-titre-8.jpg,News
35,FBI releases photos of wanted man in Charlie Kirk assassination,no description,https://www.lemonde.fr/en/united-states/article/2025/09/11/fbi-releases-photos-of-wanted-man-in-charlie-kirk-assassination_6745295_133.html,,False,https://img.lemde.fr/2025/09/11/0/0/5251/3501/198/132/95/0/6228a9e_ftp-import-images-1-aon4aej7swk5-5859190-01-06.jpg,
36,Macron says France will deploy three jets to 'help protect Polish airspace',no description,https://www.lemonde.fr/en/international/article/2025/09/11/macron-says-france-will-deploy-three-jets-to-help-protect-polish-airspace_6745297_4.html,,False,https://img.lemde.fr/2025/09/11/0/0/7462/4974/198/132/95/0/e39bce2_upload-1-ixwg5cvalcsl-e39bce2-ftp-import-images-1-crs7i6c50cfr-5739709-01-06.jpg,
37,Belarus frees 52 political prisoners in US-mediated release,no description,https://www.lemonde.fr/en/international/article/2025/09/11/belarus-frees-52-political-prisoners-in-us-mediated-release_6745298_4.html,,False,https://img.lemde.fr/2025/09/11/0/0/5353/3568/198/132/95/0/6180699_ftp-import-images-1-hyrlikbll0de-2025-09-11t184758z-1748345069-rc2tpgahfw8p-rtrmadp-3-usa-belarus-prisoners.JPG,
38,"On first day, French PM promises 'rupture' and moves toward new pension talks",no description,https://www.lemonde.fr/en/politics/article/2025/09/11/on-first-day-french-pm-promises-rupture-and-moves-toward-new-pension-talks_6745290_5.html,,True,https://img.lemde.fr/2025/09/10/0/0/5899/3933/198/132/95/0/e409d5f_upload-1-adczvwssc1pe-jmug250910016.jpg,
39,Gaza’s archaeological finds rescued ahead of Israeli strike,no description,https://www.lemonde.fr/en/international/article/2025/09/11/gaza-s-archaeological-finds-rescued-ahead-of-israeli-strike_6745299_4.html,,False,,
40,UK ambassador to Washington Peter Mandelson fired over links to Epstein,no description,https://www.lemonde.fr/en/international/article/2025/09/11/british-ambassador-to-the-us-peter-mandelson-fired-over-links-to-epstein_6745284_4.html,,False,,
41,"Hamas, severely weakened but not broken, vows a 'war of attrition' against Israel",no description,https://www.lemonde.fr/en/international/article/2025/09/11/hamas-severely-weakened-but-not-broken-vows-a-war-of-attrition-against-israel_6745294_4.html,,True,,
42,Trump looks on as a powerless spectator at events in Ukraine and Gaza,no description,https://www.lemonde.fr/en/international/article/2025/09/11/trump-looks-on-as-a-powerless-spectator-at-events-in-ukraine-and-gaza_6745282_4.html,,True,,
43,Von der Leyen struggles to convince European Parliament of her policies' coherence,no description,https://www.lemonde.fr/en/international/article/2025/09/11/ursula-von-der-leyen-struggles-to-convince-european-parliament-of-her-policies-coherence_6745276_4.html,,True,,
44,Israel's strikes in Qatar have jolted the Gulf states into unity,no description,https://www.lemonde.fr/en/international/article/2025/09/11/israel-s-strikes-in-qatar-have-jolted-the-gulf-states-into-unity_6745287_4.html,,True,,
45,"Charlie Kirk, one of the most prominent MAGA figures, is assassinated on a university campus",no description,https://www.lemonde.fr/en/international/article/2025/09/11/charlie-kirk-one-of-the-most-prominent-maga-figures-is-assassinated-on-a-university-campus_6745271_4.html,,True,,
46,European House of Photography dismisses its director,no description,https://www.lemonde.fr/en/culture/article/2025/09/11/european-house-of-photography-dismisses-its-director_6745286_30.html,,True,,
47,Hyundai and LG's giant US plant in shock after massive immigration raid,"The South Korean companies' metaplant in Georgia was the target of a vast federal immigration raid on September 4, during which 475 people were detained.",https://www.lemonde.fr/en/economy/article/2025/09/10/hyundai-and-lg-s-giant-us-plant-in-shock-after-massive-immigration-police-raid_6745248_19.html,Nicolas Chapuis,True,https://img.lemde.fr/2025/09/09/0/0/2454/1636/664/442/75/0/a167b07_upload-1-simahhwnobye-616828.jpg,Feature
48,France's 'Block Everything' protests converge around ousting Macron,"Although France did not come to a standstill or grind to a halt on Wednesday, numerous protests took place throughout the day across the country with large gatherings in certain cities – with headcounts between 197,000 and 250,000 people – amid the firm presence of law enforcement.",https://www.lemonde.fr/en/politics/article/2025/09/11/france-s-september-10-protests-in-france-converge-around-ousting-macron_6745278_5.html,Thibaud Métais,True,https://img.lemde.fr/2025/09/10/1/0/2997/1998/664/442/75/0/9c7baa2_upload-1-mtwb7bblwsfc-le-monde-10-25.jpg,News
49,Behind the 'Block Everything' movement: Tight budgets and fear about the future,"The surge in inflation in recent years is still being felt, fueling frustration among France's 'just-getting-by' population. Falling unemployment has not stopped the poverty rate from rising.",https://www.lemonde.fr/en/economy/article/2025/09/10/behind-the-block-everything-movement-tight-budgets-and-fear-about-the-future_6745227_19.html,Béatrice Madeline and  Cécile Prudhomme,True,https://img.lemde.fr/2025/09/09/0/0/7999/5333/664/442/75/0/e949913_ftp-import-images-1-sohvxfpoqcoi-5840440-01-06.jpg,In Depth
50,New French PM Sébastien Lecornu walks a tightrope,no description,https://www.lemonde.fr/en/opinion/article/2025/09/11/new-french-pm-sebastien-lecornu-walks-a-tightrope_6745285_23.html,Le Monde,False,,Editorial
51,"In Trump's America, 'loyalty counts for more than expertise'",no description,https://www.lemonde.fr/en/opinion/article/2025/09/11/in-trump-s-america-loyalty-counts-for-more-than-expertise_6745293_23.html,Alain Frachon,,https://img.lemde.fr/2025/02/13/0/0/0/0/100/100/60/0/012c520_sirius-fs-upload-1-siebgildln9p-1739442624103-capture-da-a-cran-2025-02-13-112806.png,Column
52,"'The proposed tax on France's highest net worths could reduce the deficit by €5 billion, not €20 billion'",no description,https://www.lemonde.fr/en/opinion/article/2025/09/09/the-proposed-tax-on-france-s-highest-net-worths-could-reduce-the-deficit-by-5-billion-not-20-billion_6745190_23.html,7 economists,,,Op-Ed
