,headline,description,url,byline,premium,image_url,article type
0,US Federal Reserve cuts rates amid division among governors over the state of the US economy,no description,https://www.lemonde.fr/en/international/article/2025/12/11/us-federal-reserve-cuts-rates-amid-division-among-governors-over-the-state-of-the-us-economy_6748375_4.html,,True,,
1,How the Israeli army is razing the part of Gaza it is supposed to withdraw from,no description,https://www.lemonde.fr/en/international/visuel/2025/12/11/how-the-israeli-army-is-razing-the-part-of-gaza-it-is-supposed-to-withdraw-from_6748372_4.html,,True,,
2,Russian asylum seekers expelled by the US end up on the Ukrainian front line,no description,https://www.lemonde.fr/en/international/article/2025/12/11/russian-asylum-seekers-expelled-by-the-us-end-up-on-the-ukrainian-front-line_6748371_4.html,,True,,
3,"'If they want to destroy our houses, they'll have to do it over our heads': In Syria, the arduous task of reconstruction",no description,https://www.lemonde.fr/en/international/article/2025/12/11/if-they-want-to-destroy-our-houses-they-ll-have-to-do-it-over-our-heads-in-syria-the-arduous-task-of-reconstruction_6748368_4.html,,True,,
4,Bosnia and Herzegovina's Serb entity elects ally of  former leader Dodik,no description,https://www.lemonde.fr/en/international/article/2025/11/24/bosnia-and-herzegovina-s-serb-entity-elects-ally-of-former-leader-dodik_6747765_4.html,,True,,
5,"In France's Somme, bagpipers keep the memory of the Great War alive",no description,https://www.lemonde.fr/en/history/article/2025/11/11/in-france-s-somme-bagpipers-keep-the-memory-of-the-great-war-alive_6747347_157.html,,True,,
6,Latvia: Public mobilization grows in support of treaty for preventing violence against women,no description,https://www.lemonde.fr/en/international/article/2025/11/06/in-latvia-public-mobilization-continues-to-grow-in-support-of-the-istanbul-convention-for-preventing-violence-against-women_6747156_4.html,,True,,
7,"After Charlie Kirk's murder, Europe's far right swears allegiance to Trump's politics",no description,https://www.lemonde.fr/en/les-decodeurs/article/2025/10/20/the-murder-of-charlie-kirk-how-europe-s-far-right-swore-allegiance-to-trump-s-politics_6746586_8.html,,True,,
8,"Louvre thieves escaped with just 30 seconds to spare, probe reveals",no description,https://www.lemonde.fr/en/france/article/2025/12/10/louvre-heist-thieves-escaped-with-just-30-seconds-to-spare-senat-probe-reveals_6748342_7.html,,False,,
9,"French students have become better informed about secularism, but also more critical",no description,https://www.lemonde.fr/en/france/article/2025/12/09/french-students-have-become-better-informed-about-secularism-but-also-more-critical_6748318_7.html,,True,,
10,Illegal crosses in French public spaces reignite debates over church-state separation,no description,https://www.lemonde.fr/en/france/article/2025/12/09/illegal-crosses-in-french-public-spaces-reignite-debates-over-church-state-separation_6748297_7.html,,True,,
11,Cocaine overtakes cannabis as France's most sold drug,no description,https://www.lemonde.fr/en/france/article/2025/12/08/cocaine-overtakes-cannabis-as-france-s-most-sold-drug_6748286_7.html,,True,,
12,"Israel's D9 bulldozer, a tool of destruction in Gaza",no description,https://www.lemonde.fr/en/videos/video/2025/11/27/israel-s-d9-bulldozer-a-tool-of-destruction-in-gaza_6747870_108.html,,True,,
13,"Ukraine's Pokrovsk faces fierce fighting, footage analyzed by Le Monde reveals",no description,https://www.lemonde.fr/en/videos/video/2025/11/21/ukraine-s-pokrovsk-faces-fierce-fighting-footage-analyzed-by-le-monde-reveals_6747708_108.html,,True,,
14,Afghanistan: Relentless repression continues over four years into Taliban's rule,no description,https://www.lemonde.fr/en/videos/video/2025/10/04/afghanistan-relentless-repression-continues-over-four-years-into-taliban-s-rule_6746092_108.html,,False,,
15,Watch: Hundreds of thousands march in France against budget cuts,no description,https://www.lemonde.fr/en/videos/video/2025/09/19/french-strikes-watch-what-happened-as-hundreds-of-thousands-marched-against-budget-cuts_6745548_108.html,,False,,
16,"'By appeasing Russia and accommodating China, the Trump administration is carving up the world into spheres of influence'",no description,https://www.lemonde.fr/en/opinion/article/2025/12/10/by-appeasing-russia-and-accommodating-china-the-trump-administration-is-carving-up-the-world-into-spheres-of-influence_6748362_23.html,,True,,
17,France's Assemblée Nationale painfully learns to compromise,no description,https://www.lemonde.fr/en/opinion/article/2025/12/10/france-s-assemblee-nationale-painfully-learns-to-compromise_6748351_23.html,,False,,
18,'American-style capitalism is inseparable from its philanthropic side',no description,https://www.lemonde.fr/en/opinion/article/2025/12/10/american-style-capitalism-is-inseparable-from-its-philanthropic-side_6748334_23.html,,True,,
19,"Le Monde's cartoon of the day, by Ramsés",no description,https://www.lemonde.fr/en/opinion/article/2025/12/09/le-monde-s-cartoon-of-the-day-by-ramses_6748317_23.html,,False,,
20,The lawyer suing far-right French mayors for setting up Nativity scenes,no description,https://www.lemonde.fr/en/m-le-mag/article/2025/12/07/the-woman-suing-french-far-right-mayors-for-setting-up-nativity-scenes_6748246_117.html,,True,,
21,100 years of the photobooth: Meet the people keeping them alive,no description,https://www.lemonde.fr/en/m-le-mag/article/2025/12/07/100-years-of-the-photobooth-meet-the-people-keeping-them-alive_6748232_117.html,,False,,
22,"Iran's independent cinema in full revolt: 'With Woman, Life, Freedom, a major barrier was broken'",no description,https://www.lemonde.fr/en/m-le-mag/article/2025/12/04/iran-s-independent-cinema-in-full-revolt-with-woman-life-freedom-a-major-barrier-was-broken_6748162_117.html,,True,,
23,The first time Le Monde wrote about Jeffrey Epstein,no description,https://www.lemonde.fr/en/m-le-mag/article/2025/12/01/the-first-time-le-monde-wrote-about-jeffrey-epstein_6748001_117.html,,True,,
24,Five spots in Paris to enjoy a (great) plant-based sandwich,no description,https://www.lemonde.fr/en/lifestyle/article/2025/12/04/in-paris-five-spots-to-enjoy-a-great-plant-based-sandwich_6748131_37.html,,True,,
25,"Bayonne's 'Little Louvre,' the Bonnat-Helleu Museum, reopens after 14 years",no description,https://www.lemonde.fr/en/culture/article/2025/11/28/bayonne-s-little-louvre-the-bonnat-helleu-museum-reopens-after-14-years_6747913_30.html,,True,,
26,Victor Hugo's interior architecture on display in Paris,no description,https://www.lemonde.fr/en/lifestyle/article/2025/11/23/victor-hugo-s-interior-architecture-on-display-in-paris_6747753_37.html,,True,,
27,A stroll through Cachan: From a royal aqueduct to a panoramic garden,no description,https://www.lemonde.fr/en/lifestyle/article/2025/11/22/a-stroll-through-cachan-from-a-royal-aqueduct-to-a-panoramic-garden_6747720_37.html,,True,,
28,How the Israeli army is razing the part of Gaza it is supposed to withdraw from,"Despite the ceasefire that was declared on October 10, Israel has continued to raze many buildings east of the 'yellow line' in the Gaza Strip, according to local residents and satellite images of the enclave.",https://www.lemonde.fr/en/international/visuel/2025/12/11/how-the-israeli-army-is-razing-the-part-of-gaza-it-is-supposed-to-withdraw-from_6748372_4.html,,True,https://img.lemde.fr/2025/12/04/0/0/1920/1280/400/266/75/0/4e3e985_upload-1-czl7q5gq4lzx-m-a.jpg,
29,To yield or not to yield the Donbas to Russia is at the heart of Zelensky's dilemma,no description,https://www.lemonde.fr/en/international/article/2025/12/11/to-yield-or-not-to-yield-the-donbas-to-russia-is-at-the-heart-of-zelensky-s-dilemma_6748367_4.html,,True,https://img.lemde.fr/2025/12/09/215/0/4725/3150/398/265/75/0/00655ec_upload-1-bgz7lybbxsur-227392.jpg,
30,"'If they want to destroy our houses, they'll have to do it over our heads': In Syria, the arduous task of reconstruction",no description,https://www.lemonde.fr/en/international/article/2025/12/11/if-they-want-to-destroy-our-houses-they-ll-have-to-do-it-over-our-heads-in-syria-the-arduous-task-of-reconstruction_6748368_4.html,,True,https://img.lemde.fr/2025/12/07/0/0/4500/3000/398/265/75/0/48402d5_upload-1-1xkgw4pjw2qe-lgeai-reconstruction-alep-11.jpg,
31,Russian asylum seekers expelled by the US end up on the Ukrainian front line,"Amid a wave of anti-migrant sentiment in the US and growing ties between Moscow and Washington, 64 Russians were sent back to their country from Arizona. Upon arrival in Moscow, the men quickly received military draft notices.",https://www.lemonde.fr/en/international/article/2025/12/11/russian-asylum-seekers-expelled-by-the-us-end-up-on-the-ukrainian-front-line_6748371_4.html,,True,https://img.lemde.fr/2025/12/10/0/3/4921/3281/398/265/75/0/dbd4a91_upload-1-5g5zbgcjdiue-000-339g2n3.jpg,
32,US Federal Reserve cuts rates amid division among governors over the state of the US economy,"On December 10, the US central bank reduced its rates by a quarter point. Donald Trump is expected to name the successor to its chair, Jerome Powell, in the coming days.",https://www.lemonde.fr/en/international/article/2025/12/11/us-federal-reserve-cuts-rates-amid-division-among-governors-over-the-state-of-the-us-economy_6748375_4.html,,True,https://img.lemde.fr/2025/12/10/0/0/6349/4232/398/265/75/0/57cbe74_ftp-1-9m0u0nsqoaw8-2025-12-10t203559z-33598655-rc2wdialrap4-rtrmadp-3-usa-fed.JPG,
33,The power gems on display in Paris,"Opals and cameos of Empress Josephine, an emerald tiara once worn by Queen Victoria, diamond aigrettes of maharajas:  At the Hôtel de la Marine, the exhibition 'Dynastic Jewels' offers a rare glimpse into the jewelry collections of historical figures.",https://www.lemonde.fr/en/culture/article/2025/12/11/the-power-gems-on-display-in-paris_6748374_30.html,,False,https://img.lemde.fr/2025/12/09/0/0/6603/4402/398/265/75/0/bb4ef03_upload-1-on35arazv3jh-9208-1.jpg,
34,"PSG mulls locations for new home, pending local elections","After several years of unsuccessful talks with City Hall regarding the purchase of the Parc des Princes, the club is conducting in-depth studies in Massy and Poissy, two cities in the Paris region, for the construction of a new home ground.",https://www.lemonde.fr/en/sports/article/2025/12/11/psg-mulls-locations-for-new-home-pending-local-elections_6748373_9.html,Alexandre Lemarié,True,https://img.lemde.fr/2025/11/27/0/0/6400/4266/664/442/75/0/190adaf_upload-1-qbos3fkzw1y9-iconsport-259587-0422.jpg,News
35,Israel's reign of terror over the West Bank,no description,https://www.lemonde.fr/en/international/article/2025/12/10/israel-imposes-reign-of-terror-on-the-west-bank_6748359_4.html,,True,https://img.lemde.fr/2025/12/10/0/0/8640/5760/198/132/95/0/f8c1f93_upload-1-eqkb3adrxrwo-ap25122440679898.jpg,
36,Louvre heist: Report points blame at museum management and culture ministry,no description,https://www.lemonde.fr/en/culture/article/2025/12/10/louvre-heist-report-points-blame-at-museum-management-and-culture-ministry_6748360_30.html,,True,https://img.lemde.fr/2025/11/25/0/0/8640/5760/198/132/95/0/28dcfae_ftp-import-images-1-l2vektrtnm1s-5523316-01-06.jpg,
37,Amnesty International accuses Hamas of crimes against humanity during and after the October 7 attack,no description,https://www.lemonde.fr/en/international/article/2025/12/11/amnesty-international-accuses-hamas-of-crimes-against-humanity-during-and-after-the-october-7-attack_6748369_4.html,,False,https://img.lemde.fr/2025/12/09/0/0/8640/5760/198/132/95/0/4506654_ftp-1-hhiuqd2zuipn-3fd234ffa2bb4637bb1d1c5f7be84fc7-4-b3223f5bdc0d4454bd4001744e3a6ee3.jpg,
38,"'By appeasing Russia and accommodating China, the Trump administration is carving up the world into spheres of influence'",no description,https://www.lemonde.fr/en/opinion/article/2025/12/10/by-appeasing-russia-and-accommodating-china-the-trump-administration-is-carving-up-the-world-into-spheres-of-influence_6748362_23.html,,True,https://img.lemde.fr/2025/12/07/0/0/4779/3186/198/132/95/0/57e6b52_ftp-1-yx6oz2n3fcxm-5621210-01-06.jpg,
39,French PM Lecornu's budget bet starts to pay off,no description,https://www.lemonde.fr/en/politics/article/2025/12/10/french-pm-lecornu-s-budget-bet-starts-to-pay-off_6748350_5.html,,True,,
40,Brigitte Macron's 'stupid bitches' remark toward feminist activists sparks outrage,no description,https://www.lemonde.fr/en/france/article/2025/12/10/brigitte-macron-s-stupid-bitches-remark-toward-feminist-activists-sparks-outrage_6748363_7.html,,False,,
41,Public auditors criticize Louvre's Society of Friends,no description,https://www.lemonde.fr/en/culture/article/2025/12/10/public-auditors-criticize-louvre-s-society-of-friends_6748361_30.html,,True,,
42,"Conflict rages on in eastern DRC, one week after Washington peace deal",no description,https://www.lemonde.fr/en/le-monde-africa/article/2025/12/10/conflict-rages-on-in-eastern-drc-one-week-after-washington-peace-deal_6748341_124.html,,True,,
43,Trump exchanges 'pretty strong words' with European leaders over Ukraine,no description,https://www.lemonde.fr/en/international/article/2025/12/11/trump-exchanges-pretty-strong-words-with-european-leaders-over-ukraine_6748365_4.html,,False,,
44,"Sophie Kinsella, British 'Shopaholic' author, dies aged 55",no description,https://www.lemonde.fr/en/books/article/2025/12/10/british-shopaholic-author-sophie-kinsella-dies-aged-55_6748354_33.html,,False,,
45,US lawmakers rebuke Trump's foreign policy with a sweeping defense bill to strengthen European security,no description,https://www.lemonde.fr/en/international/article/2025/12/11/us-lawmakers-rebuke-trump-s-foreign-policy-with-a-sweeping-defense-bill-to-strengthen-european-security_6748366_4.html,,False,,
46,Trump says US seized 'very large' tanker near Venezuela,no description,https://www.lemonde.fr/en/international/article/2025/12/10/trump-says-us-seized-very-large-tanker-near-venezuela_6748364_4.html,,False,,
47,"Achille Mbembe, philosopher: 'We will see more coups d'état in Africa'","Following the attempted coup in Benin on December 7, the Cameroonian philosopher and political scientist Achille Mbembe believes that Africa is now a continent where 'force and power are stripped down to the essentials.'",https://www.lemonde.fr/en/le-monde-africa/article/2025/12/11/achille-mbembe-philosopher-we-will-see-more-coups-d-etat-in-africa_6748370_124.html,Anna Sylvestre-Treiner,True,https://img.lemde.fr/2025/12/07/2/0/6500/4333/664/442/75/0/f4f7560_ftp-1-mmy9wjwqdipo-2025-12-07t215653z-355609330-rc2sbiachrso-rtrmadp-3-benin-security.JPG,Interview
48,The ultra-rich are claiming an increasing share of global wealth,"The wealth of the ultra-rich is undergoing a historic surge, according to the third report of the World Inequality Lab co-directed by French economist Thomas Piketty. Political choices can reverse these trends, the authors say.",https://www.lemonde.fr/en/economy/article/2025/12/10/the-ultra-rich-are-claiming-an-increasing-share-of-global-wealth-report-shows_6748335_19.html,Eric Albert,True,https://img.lemde.fr/2025/12/08/2/0/6215/4143/664/442/75/0/97f0533_upload-1-fig7kzhqoewa-000-36ur87x.jpg,In Depth
49,France's far-right Rassemblement National wants to reopen brothels,"MP Jean-Philippe Tanguy, who is preparing a bill to create cooperatives managed by sex workers themselves, says penalizing customers has worsened the situation of sex workers.",https://www.lemonde.fr/en/politics/article/2025/12/08/the-rassemblement-national-wants-to-reopen-brothels_6748290_5.html,Clément Guillou and  Denis Cosnard,True,https://img.lemde.fr/2025/11/22/0/0/5899/3933/664/442/75/0/c669550_upload-1-vhydqluivkkn-jmug251122059.jpg,News
50,France's Assemblée Nationale painfully learns to compromise,no description,https://www.lemonde.fr/en/opinion/article/2025/12/10/france-s-assemblee-nationale-painfully-learns-to-compromise_6748351_23.html,Le Monde,False,,Editorial
51,"'French secularism, once a means to protect individual freedom, has become a tool to defend a supposed national identity'",no description,https://www.lemonde.fr/en/opinion/article/2025/12/09/french-secularism-once-a-means-to-protect-individual-freedom-has-become-a-tool-to-defend-a-supposed-national-identity_6748298_23.html,Collective,,,Op-Ed
52,The challenge for Europe in making itself heard by Xi's China,no description,https://www.lemonde.fr/en/opinion/article/2025/12/06/the-challenge-for-europe-in-making-itself-heard-by-xi-s-china_6748218_23.html,Le Monde,False,,Editorial
