,headline,description,url,byline,premium,image_url,article type
0,Southern Yemen separatists push for secession,no description,https://www.lemonde.fr/en/international/article/2026/01/03/southern-yemen-separatists-push-for-secession_6749039_4.html,,True,,
1,Iran crackdown intensifies as Trump threatens to intervene,no description,https://www.lemonde.fr/en/international/article/2026/01/03/iran-crackdown-intensifies-as-trump-threatens-to-intervene_6749036_4.html,,True,,
2,Questions linger two days after Swiss resort bar fire,no description,https://www.lemonde.fr/en/international/article/2026/01/03/questions-linger-two-days-after-swiss-resort-bar-fire_6749034_4.html,,True,,
3,"Kyrylo Budanov, master spy and Zelensky's new right hand",no description,https://www.lemonde.fr/en/international/article/2026/01/03/kyrylo-budanov-master-spy-to-support-president-zelensky_6749032_4.html,,True,,
4,"Bulgaria joins the euro divided, in political crisis and without a budget",no description,https://www.lemonde.fr/en/economy/article/2026/01/01/bulgaria-joins-the-euro-divided-in-political-crisis-and-without-a-budget_6748989_19.html,,True,,
5,'Trump's ideological challenge to Europe is more dangerous than the security one',no description,https://www.lemonde.fr/en/opinion/article/2025/12/11/trump-s-ideological-challenge-to-europe-is-more-dangerous-than-the-security-one_6748393_23.html,,True,,
6,"Attacked by Trump, Europe wavers between denial and fear of reprisals",no description,https://www.lemonde.fr/en/international/article/2025/12/11/attacked-by-trump-europe-wavers-between-denial-and-fear-of-reprisals_6748382_4.html,,True,,
7,Bosnia and Herzegovina's Serb entity elects ally of  former leader Dodik,no description,https://www.lemonde.fr/en/international/article/2025/11/24/bosnia-and-herzegovina-s-serb-entity-elects-ally-of-former-leader-dodik_6747765_4.html,,True,,
8,Several femicides mark the end of 2025 in France,no description,https://www.lemonde.fr/en/france/article/2026/01/03/several-femicides-mark-the-end-of-2025-in-france_6749024_7.html,,True,,
9,"'I did it for the money, but I wasn't proud': Parties that hire 'dwarves' for entertainment",no description,https://www.lemonde.fr/en/france/article/2026/01/01/i-did-it-for-the-money-but-i-wasn-t-proud-parties-that-hire-dwarves-for-entertainment_6748983_7.html,,True,,
10,Online gambling companies zero in on France's disadvantaged neighborhoods,no description,https://www.lemonde.fr/en/france/article/2025/12/31/online-gambling-companies-zero-in-on-france-s-disadvantaged-neighborhoods_6748957_7.html,,True,,
11,'We have to know a lot of things that the French don't': Migrants face new residence permit tests,no description,https://www.lemonde.fr/en/france/article/2025/12/27/we-have-to-know-a-lot-of-things-that-the-french-don-t-migrants-face-new-residence-permit-tests_6748863_7.html,,True,,
12,The French studio behind a viral Christmas ad,no description,https://www.lemonde.fr/en/videos/video/2025/12/12/the-french-studio-behind-a-viral-christmas-ad_6748436_108.html,,False,,
13,"Israel's D9 bulldozer, a tool of destruction in Gaza",no description,https://www.lemonde.fr/en/videos/video/2025/11/27/israel-s-d9-bulldozer-a-tool-of-destruction-in-gaza_6747870_108.html,,True,,
14,"Ukraine's Pokrovsk faces fierce fighting, footage analyzed by Le Monde reveals",no description,https://www.lemonde.fr/en/videos/video/2025/11/21/ukraine-s-pokrovsk-faces-fierce-fighting-footage-analyzed-by-le-monde-reveals_6747708_108.html,,True,,
15,Afghanistan: Relentless repression continues over four years into Taliban's rule,no description,https://www.lemonde.fr/en/videos/video/2025/10/04/afghanistan-relentless-repression-continues-over-four-years-into-taliban-s-rule_6746092_108.html,,False,,
16,Israel's new battleground: Humanitarian aid in Gaza,no description,https://www.lemonde.fr/en/opinion/article/2026/01/03/israel-s-new-battleground-humanitarian-aid-in-gaza_6749037_23.html,,False,,
17,Macron's resignation-tinged New Year's address,no description,https://www.lemonde.fr/en/opinion/article/2026/01/02/macron-s-resignation-tinged-new-year-s-address_6749008_23.html,,False,,
18,"'The Democratic Party is waiting for Trump's departure, praying his successors fail to revive Trumpism'",no description,https://www.lemonde.fr/en/opinion/article/2026/01/02/the-democratic-party-waits-for-trump-s-departure-hoping-his-successors-fail-to-revive-trumpism_6749002_23.html,,True,,
19,Trump's attacks reopen South Africa's wounds,no description,https://www.lemonde.fr/en/opinion/article/2026/01/01/donald-trump-s-attacks-reopen-south-africa-s-wounds_6748984_23.html,,True,,
20,Dining at the Centre Pompidou-Metz,no description,https://www.lemonde.fr/en/m-le-mag/article/2025/12/30/dining-at-the-centre-pompidou-metz_6748951_117.html,,True,,
21,"Fight, the innovative agency behind Zohran Mamdani's New York victory",no description,https://www.lemonde.fr/en/m-le-mag/article/2025/12/30/fight-the-innovative-agency-behind-zohran-mamdani-s-new-york-victory_6748931_117.html,,True,,
22,The flights of fancy of the French entrepreneur who brought Shein to Paris,no description,https://www.lemonde.fr/en/m-le-mag/article/2025/12/28/the-flights-of-fancy-of-the-french-entrepreneur-who-brought-shein-to-paris_6748883_117.html,,True,,
23,"At Marseille's MuCEM, an exhibition explores the sunken island of Ferdinandea",no description,https://www.lemonde.fr/en/m-le-mag/article/2025/12/27/at-marseille-s-mucem-an-exhibition-explores-the-sunken-island-of-ferdinandea_6748860_117.html,,True,,
24,Five creative craft workshops to enjoy doing in Paris with your child,no description,https://www.lemonde.fr/en/intimacy/article/2025/12/13/in-paris-five-creative-craft-workshops-to-enjoy-doing-with-your-child_6748451_310.html,,True,,
25,Jewels of power go on display in Paris,no description,https://www.lemonde.fr/en/culture/article/2025/12/11/the-power-gems-on-display-in-paris_6748374_30.html,,False,,
26,Five spots in Paris to enjoy a (great) plant-based sandwich,no description,https://www.lemonde.fr/en/lifestyle/article/2025/12/04/in-paris-five-spots-to-enjoy-a-great-plant-based-sandwich_6748131_37.html,,True,,
27,"Bayonne's 'Little Louvre,' the Bonnat-Helleu Museum, reopens after 14 years",no description,https://www.lemonde.fr/en/culture/article/2025/11/28/bayonne-s-little-louvre-the-bonnat-helleu-museum-reopens-after-14-years_6747913_30.html,,True,,
28,"US captures Venezuelan leader Maduro, Trump says",The US president said that the US military had launched a large-scale operation in Caracas and that President Nicolas Maduro and his wife had been flown out of the country. The US attorney general announced charges against them.,https://www.lemonde.fr/en/international/article/2026/01/03/us-captures-venezuelan-president-maduro-trump-says_6749033_5.html,,False,https://img.lemde.fr/2026/01/03/0/0/6483/4322/400/266/75/0/0043d6c_ftp-1-fyxrrgbsfpvv-5cd34274e9fb4946a3faf5c7b21e027a-0-2f0d1c0b2c2341068363e513b171ece7.jpg,
29,Questions linger two days after Swiss resort bar fire,no description,https://www.lemonde.fr/en/international/article/2026/01/03/questions-linger-two-days-after-swiss-resort-bar-fire_6749034_4.html,,True,https://img.lemde.fr/2026/01/02/0/0/8640/5760/398/265/75/0/54732c5_ftp-1-gtow3t4vajcg-5786490-01-06.jpg,
30,"Kyrylo Budanov, master spy and Zelensky's new right hand",no description,https://www.lemonde.fr/en/international/article/2026/01/03/kyrylo-budanov-master-spy-to-support-president-zelensky_6749032_4.html,,True,https://img.lemde.fr/2026/01/02/182/0/7650/5100/398/265/75/0/f207785_upload-1-rkymiewnvq5z-raf-ukr-gov-003.JPG,
31,Iran crackdown intensifies as Trump threatens to intervene,"At least eight protesters have been killed, 119 arrested and 33 injured since the protest movement began on December 28, 2025, according to human rights organizations. Security forces have stepped up operations in the provinces of Fars, Lorestan, Isfahan and Chaharmahal and Bakhtiari.",https://www.lemonde.fr/en/international/article/2026/01/03/iran-crackdown-intensifies-as-trump-threatens-to-intervene_6749036_4.html,,True,https://img.lemde.fr/2026/01/02/0/90/2700/1800/398/265/75/0/16aecab_upload-1-cv39occqlax0-capture-d-e-cran-2026-01-02-a-17-58-05.png,
32,"In Khartoum, the faces of a martyred capital: 'War cannot kill ideas, nor love'","War in Sudan: A Trapped Nation (3/6). Le Monde's reporters traveled through the Sudanese capital, which for two years was the epicenter of the conflict. They met with residents, who recounted how they survived despite fear and violence.",https://www.lemonde.fr/en/international/article/2026/01/03/in-khartoum-the-faces-of-a-martyred-capital-war-cannot-kill-ideas-nor-love_6749029_4.html,,True,https://img.lemde.fr/2025/12/29/0/0/8256/5504/398/265/75/0/9fe5873_upload-1-sekdtkp8hmqo-abd5472.jpg,
33,"At the Louvre, tension builds over creation of new 'Mona Lisa' gallery","The Louvre-Nouvelle Renaissance architecture competition aims to create a room for Leonardo da Vinci's iconic painting and a new entrance for the Paris museum, which has seen a surge in visitors. Five teams have been shortlisted, none of which are French.",https://www.lemonde.fr/en/culture/article/2026/01/02/at-the-louvre-tension-builds-over-creation-of-new-mona-lisa-gallery_6749018_30.html,,True,https://img.lemde.fr/2025/12/29/0/0/6000/4000/398/265/75/0/bfd2fda_upload-1-z6hkb02l28wl-000-36vj484.jpg,
34,"They cook organic, distrust science and oppose vaccines: America's 'crunchy moms' shift toward Trump","In the 1960s, the 'crunchy mom' was typically an American hippie trying to stay connected to nature. Today, she claims total freedom over health decisions, sometimes flirting with conspiracy theories.",https://www.lemonde.fr/en/intimacy/article/2026/01/03/they-cook-organic-distrust-science-and-oppose-vaccines-america-s-crunchy-moms-shift-toward-trump_6749031_310.html,Clément Verstraete,True,https://img.lemde.fr/2025/12/12/0/0/6378/4252/664/442/75/0/6235009_upload-1-vva5alyddpph-daronsdailleurs-usa-crunchymomsv1.JPG,Feature
35,Several femicides mark the end of 2025 in France,no description,https://www.lemonde.fr/en/france/article/2026/01/03/several-femicides-mark-the-end-of-2025-in-france_6749024_7.html,,True,https://img.lemde.fr/2026/01/02/0/0/5548/3698/198/132/95/0/d3eb989_upload-1-fw6io9nznanq-000-84ug8kf.jpg,
36,Social media ban for under-15s: What we know about the French government's plan,no description,https://www.lemonde.fr/en/pixels/article/2026/01/02/ban-on-social-media-for-under-15s-what-we-know-about-the-government-s-plan_6749022_13.html,,True,https://img.lemde.fr/2025/12/31/0/0/6000/4000/198/132/95/0/f3bb87c_upload-1-6qoqvzlw3870-000-82kw3gl.jpg,
37,"Between the US and China, the battle of hydrocarbons versus electrons",no description,https://www.lemonde.fr/en/economy/article/2026/01/03/between-the-us-and-china-the-battle-of-hydrocarbons-versus-electrons_6749025_19.html,,True,https://img.lemde.fr/2025/12/31/0/0/5472/3648/198/132/95/0/8c6aba3_upload-1-2gts7i2lljp3-091-i1755471373490.jpg,
38,Dry January's lasting benefits win over more and more participants,no description,https://www.lemonde.fr/en/science/article/2026/01/02/dry-january-s-lasting-benefits-win-over-more-and-more-participants_6749003_10.html,,True,https://img.lemde.fr/2025/12/31/1/0/7488/4992/198/132/95/0/7ede844_upload-1-g1n2inqkn3nz-000-344g686.jpg,
39,Egyptians become leading African nationality to migrate to Europe,no description,https://www.lemonde.fr/en/le-monde-africa/article/2026/01/03/egyptians-become-the-leading-african-nationality-to-migrate-to-europe_6749023_124.html,,True,,
40,BYD overtakes Tesla as world's top electric vehicle maker,no description,https://www.lemonde.fr/en/economy/article/2026/01/02/byd-overtakes-tesla-as-world-s-top-electric-vehicle-maker_6749021_19.html,,False,,
41,Poland's iconic 1989 round table consigned to museum,no description,https://www.lemonde.fr/en/international/article/2026/01/02/poland-s-iconic-1989-round-table-consigned-to-museum_6749016_4.html,,True,,
42,"In Rio de Janeiro, New Year's Eve celebration sparks debate over secularism",no description,https://www.lemonde.fr/en/international/article/2026/01/03/in-rio-de-janeiro-new-year-s-eve-celebration-sparks-debate-over-secularism_6749028_4.html,,True,,
43,14 killed in DR Congo attack by a militia linked to the Islamic State group,no description,https://www.lemonde.fr/en/le-monde-africa/article/2026/01/03/14-killed-in-dr-congo-attack-by-a-militia-linked-to-the-islamic-state-group_6749026_124.html,,False,,
44,China's plan for London mega-embassy stokes controversy,no description,https://www.lemonde.fr/en/international/article/2026/01/02/china-s-plan-for-london-mega-embassy-stokes-controversy_6749019_4.html,,True,,
45,Small boat migrants reached UK in near record numbers in 2025,no description,https://www.lemonde.fr/en/international/article/2026/01/02/small-boat-migrants-reached-uk-in-near-record-numbers-in-2025_6749012_4.html,,False,,
46,Early Christian fresco depicting Jesus as the Good Shepherd discovered in Turkey,"One month after Pope Leo XIV's visit, Turkish authorities announced the discovery in Iznik, Anatolia, of a depiction of Christ in a well-preserved burial chamber.",https://www.lemonde.fr/en/science/article/2026/01/01/early-christian-fresco-depicting-jesus-as-the-good-shepherd-discovered-in-turkey_6748985_10.html,Nicolas Bourcier,True,https://img.lemde.fr/2025/12/12/0/0/5616/3744/664/442/75/0/a170bfb_ftp-1-s7hfoco6umyc-d9519adba64e45eebd8773ee2e54e7e2-0-a2c39aa391c5476d8ef3da2999aab9ea.jpg,Feature
47,"Switzerland in shock after tragic bar fire: 'It was a war zone. Burned hair, faces and hands'",The upscale French-speaking Alpine resort of Crans-Montana is in mourning after a fire in a bar claimed the lives of around 40 people and left 115 others seriously injured. Heart-wrenching testimonies and unanswered questions are pouring in.,https://www.lemonde.fr/en/international/article/2026/01/02/switzerland-in-shock-after-tragic-bar-fire-it-was-a-war-zone-burned-hair-faces-and-hands_6749009_4.html,Serge Enderlin,True,https://img.lemde.fr/2026/01/01/0/0/5274/3516/664/442/75/0/3c89489_ftp-1-moexkutxfzco-2026-01-01t195947z-2042995424-rc2jsia6ti48-rtrmadp-3-switzerland-blast.JPG,In Depth
48,"'I did it for the money, but I wasn't proud': Parties that hire 'dwarves' for entertainment",Hiring women or men of short stature to 'spice up' parties has become increasingly common in Europe in recent years. These practices raise both moral and legal questions.,https://www.lemonde.fr/en/france/article/2026/01/01/i-did-it-for-the-money-but-i-wasn-t-proud-parties-that-hire-dwarves-for-entertainment_6748983_7.html,Valérie Lépine,True,https://img.lemde.fr/2025/12/25/863/0/3543/2362/664/442/75/0/793bc7b_upload-1-wf630bhjz9by-nains-def.jpg,Investigation
49,Israel's new battleground: Humanitarian aid in Gaza,no description,https://www.lemonde.fr/en/opinion/article/2026/01/03/israel-s-new-battleground-humanitarian-aid-in-gaza_6749037_23.html,Le Monde,False,,Editorial
50,"The death of Brigitte Bardot: One icon, many faces",no description,https://www.lemonde.fr/en/opinion/article/2025/12/29/the-death-of-brigitte-bardot-one-icon-many-faces_6748914_23.html,Le Monde,False,,Editorial
51,One year of Trump and of growing disorder,no description,https://www.lemonde.fr/en/opinion/article/2025/12/31/one-year-of-trump-and-of-growing-disorder_6748971_23.html,Le Monde,False,,Editorial
