,headline,description,url,byline,premium,image_url,article type
0,"Trump orders strikes on 'terrorists' in Nigeria, bolstering cooperation with Abuja",no description,https://www.lemonde.fr/en/international/article/2025/12/26/trump-orders-strikes-on-terrorists-in-nigeria-bolstering-cooperation-with-abuja_6748854_4.html,,True,,
1,Where have all the New York City children gone?,no description,https://www.lemonde.fr/en/international/article/2025/12/26/where-have-all-the-new-york-city-children-gone_6748853_4.html,,True,,
2,"In Belarus, the shadow political prisoners",no description,https://www.lemonde.fr/en/international/article/2025/12/26/in-belarus-the-shadow-political-prisoners_6748846_4.html,,True,,
3,Russians are evading sanctions with fake Romanian documents,no description,https://www.lemonde.fr/en/international/article/2025/12/26/russians-are-evading-sanctions-with-fake-romanian-documents_6748839_4.html,,True,,
4,'Trump's ideological challenge to Europe is more dangerous than the security one',no description,https://www.lemonde.fr/en/opinion/article/2025/12/11/trump-s-ideological-challenge-to-europe-is-more-dangerous-than-the-security-one_6748393_23.html,,True,,
5,"Attacked by Trump, Europe wavers between denial and fear of reprisals",no description,https://www.lemonde.fr/en/international/article/2025/12/11/attacked-by-trump-europe-wavers-between-denial-and-fear-of-reprisals_6748382_4.html,,True,,
6,Bosnia and Herzegovina's Serb entity elects ally of  former leader Dodik,no description,https://www.lemonde.fr/en/international/article/2025/11/24/bosnia-and-herzegovina-s-serb-entity-elects-ally-of-former-leader-dodik_6747765_4.html,,True,,
7,"In France's Somme, bagpipers keep the memory of the Great War alive",no description,https://www.lemonde.fr/en/history/article/2025/11/11/in-france-s-somme-bagpipers-keep-the-memory-of-the-great-war-alive_6747347_157.html,,True,,
8,Why more young people are turning to religion,no description,https://www.lemonde.fr/en/france/article/2025/12/25/why-more-young-people-are-turning-to-religion_6748827_7.html,,True,,
9,French biathlon team races ahead on the unpredictable road to the Olympics,no description,https://www.lemonde.fr/en/sports/article/2025/12/25/french-biathlon-team-races-ahead-on-the-unpredictable-road-to-the-olympics_6748823_9.html,,True,,
10,"'Knowing they will all be together without me is hard': Christmas, a lonely time for many struggling students",no description,https://www.lemonde.fr/en/france/article/2025/12/24/knowing-they-will-all-be-together-without-me-is-hard-christmas-a-time-of-loneliness-for-many-struggling-students_6748800_7.html,,True,,
11,French anesthesiologist sentenced to life imprisonment after poisoning 30 patients,no description,https://www.lemonde.fr/en/france/article/2025/12/24/french-anesthesiologist-sentenced-to-life-imprisonment-after-poisoning-30-patients_6748795_7.html,,True,,
12,The French studio behind a viral Christmas ad,no description,https://www.lemonde.fr/en/videos/video/2025/12/12/the-french-studio-behind-a-viral-christmas-ad_6748436_108.html,,False,,
13,"Israel's D9 bulldozer, a tool of destruction in Gaza",no description,https://www.lemonde.fr/en/videos/video/2025/11/27/israel-s-d9-bulldozer-a-tool-of-destruction-in-gaza_6747870_108.html,,True,,
14,"Ukraine's Pokrovsk faces fierce fighting, footage analyzed by Le Monde reveals",no description,https://www.lemonde.fr/en/videos/video/2025/11/21/ukraine-s-pokrovsk-faces-fierce-fighting-footage-analyzed-by-le-monde-reveals_6747708_108.html,,True,,
15,Afghanistan: Relentless repression continues over four years into Taliban's rule,no description,https://www.lemonde.fr/en/videos/video/2025/10/04/afghanistan-relentless-repression-continues-over-four-years-into-taliban-s-rule_6746092_108.html,,False,,
16,'Trump is coming to terms with his own planned obsolescence',no description,https://www.lemonde.fr/en/opinion/article/2025/12/26/trump-is-coming-to-terms-with-his-own-planned-obsolescence_6748840_23.html,,True,,
17,Trump's uncertain peace in Africa's Great Lakes region,no description,https://www.lemonde.fr/en/opinion/article/2025/12/26/trump-s-uncertain-peace-in-africa-s-great-lakes-region_6748851_23.html,,False,,
18,2026 budget: The risk of deadlock,no description,https://www.lemonde.fr/en/opinion/article/2025/12/24/2026-budget-the-risk-of-deadlock_6748812_23.html,,False,,
19,Cambodia-Thailand conflict: The poison of nationalism,no description,https://www.lemonde.fr/en/opinion/article/2025/12/23/cambodia-thailand-conflict-the-poison-of-nationalism_6748780_23.html,,False,,
20,Disneyland Paris at 40: When Mickey Mouse said 'bonjour' to Paris,no description,https://www.lemonde.fr/en/m-le-mag/article/2025/12/22/disneyland-paris-at-40-when-mickey-mouse-said-bonjour-to-paris_6748740_117.html,,True,,
21,Madagascar's metalheads lead charge of anger: 'It's easier to make yourself heard when you scream',no description,https://www.lemonde.fr/en/m-le-mag/article/2025/12/21/madagascar-s-metalheads-lead-charge-of-anger-it-s-easier-to-make-yourself-heard-when-you-scream_6748730_117.html,,True,,
22,Da Vinci's secret tunnels at Milan's Sforza Castle appear to be nothing more than sewers,no description,https://www.lemonde.fr/en/m-le-mag/article/2025/12/21/da-vinci-s-secret-tunnels-at-milan-s-sforza-castle-appear-to-be-nothing-more-than-sewers_6748712_117.html,,True,,
23,Trump and the 'derangement syndrome' driving people crazy,no description,https://www.lemonde.fr/en/m-le-mag/article/2025/12/20/trump-and-the-derangement-syndrome-driving-people-crazy_6748696_117.html,,True,,
24,Five creative craft workshops to enjoy doing in Paris with your child,no description,https://www.lemonde.fr/en/intimacy/article/2025/12/13/in-paris-five-creative-craft-workshops-to-enjoy-doing-with-your-child_6748451_310.html,,True,,
25,Jewels of power go on display in Paris,no description,https://www.lemonde.fr/en/culture/article/2025/12/11/the-power-gems-on-display-in-paris_6748374_30.html,,False,,
26,Five spots in Paris to enjoy a (great) plant-based sandwich,no description,https://www.lemonde.fr/en/lifestyle/article/2025/12/04/in-paris-five-spots-to-enjoy-a-great-plant-based-sandwich_6748131_37.html,,True,,
27,"Bayonne's 'Little Louvre,' the Bonnat-Helleu Museum, reopens after 14 years",no description,https://www.lemonde.fr/en/culture/article/2025/11/28/bayonne-s-little-louvre-the-bonnat-helleu-museum-reopens-after-14-years_6747913_30.html,,True,,
28,"In Belarus, the shadow political prisoners","Beyond the roughly 1,000 political prisoners who have been officially identified, hundreds more languish in prison without being recorded. The regime of Alexander Lukashenko has done everything it can to keep them hidden and ensure they are forgotten.",https://www.lemonde.fr/en/international/article/2025/12/26/in-belarus-the-shadow-political-prisoners_6748846_4.html,,True,https://img.lemde.fr/2025/12/23/1136/0/3500/2333/400/266/75/0/548a4e2_upload-1-8j4r4lseqqhl-00066-belarus-political-prisoners-16dec2025-vilnius.jpg,
29,"Trump orders strikes on 'terrorists' in Nigeria, bolstering cooperation with Abuja",no description,https://www.lemonde.fr/en/international/article/2025/12/26/trump-orders-strikes-on-terrorists-in-nigeria-bolstering-cooperation-with-abuja_6748854_4.html,,True,https://img.lemde.fr/2025/12/26/0/268/2898/1932/398/265/75/0/db52eea_ftp-1-ilm9uphuv2gz-2025-12-26t065446z-1838506797-rc26oiaipi5m-rtrmadp-3-usa-trump-nigeria.JPG,
30,Russians are evading sanctions with fake Romanian documents,no description,https://www.lemonde.fr/en/international/article/2025/12/26/russians-are-evading-sanctions-with-fake-romanian-documents_6748839_4.html,,True,https://img.lemde.fr/2025/12/22/0/0/8024/5349/398/265/75/0/825ef1c_upload-1-ruexxmmbk064-000-34tr872.jpg,
31,"Semiconductors: ASML, the tech giant at the center of the US-China conflict in the race for AI","'Microchips: The Oil of the 21st Century' (4/5). ASML's ultra-advanced lithography machines are used to etch the most cutting-edge microprocessors, which are crucial for artificial intelligence – a major strategic issue.",https://www.lemonde.fr/en/economy/article/2025/12/26/semiconductors-asml-the-tech-giant-at-the-center-of-the-us-china-conflict-in-the-race-for-ai_6748844_19.html,,True,https://img.lemde.fr/2025/12/23/0/0/5146/3431/398/265/75/0/0924ea7_upload-1-oacsngq6m9fl-2023-07-07t101423z-1002194652-rc2ck1aq7zho-rtrmadp-3-netherlands-economy-asml.JPG,
32,Where have all the New York City children gone?,"'My Christmas under Trump' (5/5). Journalist Georgia Husson settled in New York right in the middle of the holiday season preparations. Today, she recounts her impossible quest to find a gift for her young goddaughter. It would be easier if it were for a dog.",https://www.lemonde.fr/en/international/article/2025/12/26/where-have-all-the-new-york-city-children-gone_6748853_4.html,,True,https://img.lemde.fr/2025/12/18/69/0/3971/2647/398/265/75/0/c18bc1e_upload-1-uaj5bbxttrsb-dsc4395.jpeg,
33,Pop goes the cocktail! Five champagne cocktail recipes for the end-of-year festivities,"While the idea may offend some purists, champagne features prominently in many cocktail recipes. Five bartenders share their personal creations, all featuring prestigious and sublime bubbly.",https://www.lemonde.fr/en/lifestyle/article/2025/12/26/pop-goes-the-cocktail-five-champagne-cocktail-recipes-for-the-end-of-year-festivities_6748836_37.html,,True,https://img.lemde.fr/2025/10/30/0/0/1500/1000/398/265/75/0/485d80b_ftp-import-images-1-kkg6pxazwtnb-403328-3443029.jpg,
34,"Arthur Hadade, the chameleon who launched the 'Spotify of contemporary art'","With Cur8, his app dedicated to navigating the contemporary art world, the 35-year-old entrepreneur aims to challenge stereotypes surrounding a field often perceived as highly codified and inaccessible.",https://www.lemonde.fr/en/campus/article/2025/12/26/arthur-hadade-the-chameleon-who-launched-the-spotify-of-contemporary-art_6748841_11.html,Elisabeth Pineau,True,https://img.lemde.fr/2025/12/02/1136/0/4480/2986/664/442/75/0/e54099f_upload-1-7aa0jyxuj8yo-cur8.jpg,Profile
35,Turkey detains dozens of IS suspects planning attacks on Christmas and New Year's celebrations,no description,https://www.lemonde.fr/en/international/article/2025/12/26/turkey-detains-dozens-of-is-suspects-planning-attacks-on-christmas-and-new-year-s-celebrations_6748834_4.html,,False,https://img.lemde.fr/2025/12/21/0/0/6000/4000/198/132/95/0/1afc7d8_ftp-1-ar4s4udegqsk-2025-12-21t191054z-788683185-rc25lia5o0u6-rtrmadp-3-christmas-season-turkey.JPG,
36,'Tyranny is booming': Kimmel warns of rising fascism in Christmas message to UK viewers,no description,https://www.lemonde.fr/en/culture/article/2025/12/26/tyranny-is-booming-kimmel-warns-of-rising-fascism-in-christmas-message-to-uk-viewers_6748835_30.html,,False,https://img.lemde.fr/2025/09/24/0/1/3604/2403/198/132/95/0/89100be_ftp-import-images-1-p3caxaoha030-dad94b0388e840b0a86522bdf8d15431-0-b06c2d07cb834d95a36aaa3b4263330f.jpg,
37,Prosecutors seek 10-year sentence for ousted South Korea president over martial law bid,no description,https://www.lemonde.fr/en/international/article/2025/12/26/prosecutors-seek-10-year-sentence-for-ousted-south-korea-president-over-martial-law-bid_6748847_4.html,,False,https://img.lemde.fr/2025/12/26/0/0/6009/4006/198/132/95/0/84788b1_ftp-1-kmtxdsfxiex7-a9ec77188e524d6ca8441693d06c0aea-0-39e66f0214d34a6bbba1e5cdd4af9515.jpg,
38,North Korea's Kim Jong Un orders factories to make more missiles in 2026,no description,https://www.lemonde.fr/en/international/article/2025/12/26/north-korea-s-kim-jong-un-orders-factories-to-make-more-missiles-in-2026_6748838_4.html,,False,https://img.lemde.fr/2025/12/26/0/0/5727/3818/198/132/95/0/e19b085_ftp-1-otdyudwc2ngg-5750693-01-06.jpg,
39,Escaping New York's winter and its 'communist' mayor for Miami,no description,https://www.lemonde.fr/en/international/article/2025/12/25/escaping-new-york-s-winter-and-its-communist-mayor-for-miami_6748833_4.html,,True,,
40,Bethlehem celebrates Christmas in climate of 'fear and uncertainty',no description,https://www.lemonde.fr/en/international/article/2025/12/25/bethlehem-celebrates-christmas-in-climate-of-fear-and-uncertainty_6748826_4.html,,True,,
41,Former Malaysian PM Najib Razak convicted in corruption scandal,no description,https://www.lemonde.fr/en/international/article/2025/12/26/former-malaysian-pm-najib-razak-convicted-in-corruption-scandal_6748845_4.html,,False,,
42,Europe's relentless semiconductor decline,no description,https://www.lemonde.fr/en/economy/article/2025/12/25/europe-s-relentless-semiconductor-decline_6748832_19.html,,True,,
43,"Pope urges Russia, Ukraine dialogue in Christmas blessing",no description,https://www.lemonde.fr/en/international/article/2025/12/25/pope-urges-russia-ukraine-dialogue-in-christmas-blessing_6748829_4.html,,False,,
44,French biathlon team races ahead on the unpredictable road to the Olympics,no description,https://www.lemonde.fr/en/sports/article/2025/12/25/french-biathlon-team-races-ahead-on-the-unpredictable-road-to-the-olympics_6748823_9.html,,True,,
45,"In Turkey, the fall of a star television presenter exposes internal power struggles",no description,https://www.lemonde.fr/en/international/article/2025/12/25/in-turkey-the-fall-of-a-star-television-presenter-exposes-internal-power-struggles_6748825_4.html,,True,,
46,'Taylor Swift: The End of an Era' on Disney+: Behind the scenes of a record-breaking tour,no description,https://www.lemonde.fr/en/culture/article/2025/12/25/taylor-swift-the-end-of-an-era-on-disney-behind-the-scenes-of-a-record-breaking-tour_6748824_30.html,,True,,
47,Why more young people are turning to religion,"Many researchers have observed a resurgence of religious commitment among young people in France, often accompanied by a certain rigorism. This renewed spiritual quest is linked both to the anxieties of our era and, at times, a search for identity.",https://www.lemonde.fr/en/france/article/2025/12/25/why-more-young-people-are-turning-to-religion_6748827_7.html,Sarah Belouezzane,True,https://img.lemde.fr/2025/12/22/0/0/3543/2362/664/442/75/0/57386fe_upload-1-7ibjm61ya1sj-jeunesreligion.jpg,In Depth
48,Algeria demands 'apologies' and 'reparations' from France for its colonial past,"Algerian MPs passed a law on Wednesday, December 24, to 'criminalize French colonization,' amid ongoing diplomatic tensions between Algiers and Paris.",https://www.lemonde.fr/en/international/article/2025/12/24/algeria-demands-apologies-and-reparations-from-france-for-its-colonial-past_6748813_4.html,Frédéric Bobin and  Hamid Nasri,True,https://img.lemde.fr/2025/12/24/0/1/2406/1604/664/442/75/0/1f8d27b_upload-1-gzosvwpiw0as-000-8pn4wr.jpg,News
49,"'Drone overflights are testing our defense capabilities,' says French military intelligence and security chief","Despite heightened vigilance from his teams, General Aymeric Bonnemaison, director of the French military security agency, admits that it remains difficult to identify the culprits of suspicious incidents. Since September, there has been a sharp increase in drone overflights of military installations.",https://www.lemonde.fr/en/international/article/2025/12/24/drone-overflights-are-testing-our-defense-capabilities-says-french-military-intelligence-and-security-chief_6748801_4.html,Chloé Hoorman and  Elise Vincent,True,https://img.lemde.fr/2025/12/16/603/0/6176/4117/664/442/75/0/e04d7ec_upload-1-jye7n2gugbda-photo-officielle-ge-n-bonnemaison.jpg,Interview
50,Trump's uncertain peace in Africa's Great Lakes region,no description,https://www.lemonde.fr/en/opinion/article/2025/12/26/trump-s-uncertain-peace-in-africa-s-great-lakes-region_6748851_23.html,Le Monde,False,,Editorial
51,2026 budget: The risk of deadlock,no description,https://www.lemonde.fr/en/opinion/article/2025/12/24/2026-budget-the-risk-of-deadlock_6748812_23.html,Le Monde,False,,Editorial
52,'Trump is coming to terms with his own planned obsolescence',no description,https://www.lemonde.fr/en/opinion/article/2025/12/26/trump-is-coming-to-terms-with-his-own-planned-obsolescence_6748840_23.html,Gilles Paris,,https://img.lemde.fr/2022/03/18/0/0/0/0/100/100/60/0/bfe4dc9_1647595527633-f2df5fa-237.jpeg,Column
